[
  {
    "question": "What was the percentage of data center energy emissions reduction achieved by Google in 2024?",
    "ground_truth": "12%",
    "answer": "12%",
    "contexts": [
      "th increasing the energy efficiency of our data centers to help minimize our electricity demand. In \n\nth increasing the energy efficiency of our data centers to help minimize our electricity demand. In \n2024, the average annual PUE for our global fleet of data centers was 1.09, compared with the industry average of 1.56, meaning that Google data centers \nused 84% less overhead energy than the industry average.\n\u2009129  We\u2019ll continue to build on this progress by driving additional energy efficiency and flexibility \nmeasures in our data centers\u2014with a focus on our machine learning fleet. \nAfter efficiency, our next focus is on scaling our clean energy procurement across all regions: In 2024, we signed contracts to purchase over 8 GW of \nadditional clean energy generation130\u2014more than in any prior year. We\u2019re also using Google\u2019s engineering expertise and purchasing demand to  accelerate  \nthe commercialization of advanced CFE technologies and scale their climate impact, and advocating for energy policies that can unlock access to cost-",
      "er energy emissions by  \n12%, even with growing energy demands. \n  \n \n \n \n \n \n \n \n \n \n \n \n \n \n  \n \n \n\ner energy emissions by  \n12%, even with growing energy demands. \n  \n \n \n \n \n \n \n \n \n \n \n \n \n \n  \n \n \nReliable and abundant energy can help power global prosperity and expand economic opportunity. This \nrequires bringing more energy online, optimizing how we use it, advancing new energy solutions, and partnering \nwith suppliers as they make progress toward clean energy. At Google, through a combination of these efforts, \nwe\n reduced our data center energy emissions 1 by 12% in 2024\u2014even in the face of increased energy demands\u2014 \nw\nhile building fo r t he fu ture t hrough new  advanced energy innovations and dee per s u pplier e ngagement. \nWe added new clean energy generation by signing contracts for 8 GW and bringing 2.5 GW online in \n2024 alone. \nGoogle\u2019s work to accelerate clean energy began in 2010 when we signed our first power purchase agreement \n(PPA). Since then, from 2010 to 2024, we\u2019ve signed more than 170 agreements to purchase over 22 GW of clean \nen",
      " we used a \none month sample of observed machine power data from our entire TPU fleet, applying \n116\n\nGoogle\u2019s 2023 average fleetwide carbon intensity. To estimate embodied emissions from \nmanufacturing, transportation, and retirement, we performed a life-cycle assessment \nof the hardware. Data center construction emissions were estimated based on Google\u2019s \ndisclosed 2023 carbon footprint. These findings do not represent model-level emissions, \nnor are they a complete quantification of Google\u2019s AI emissions. Based on the TPU \nlocation of a specific workload, Compute Carbon Intensity (CCI) results of specific \nworkloads may vary.\n45 The figure represents the average percentage of Google\u2019s global compute resources that \nwere identified as recoverable and reallocated for more efficient use over this period as a \nresult of using AlphaEvolve.\n46 We estimated the expected annual generation based on our contracted clean energy, \napplying an average capacity factor. Actual generation may vary from the signed amounts \nbased on changes during construction or project terminations.",
      "agement and partnership \n98 Environmental data \n115 Certifications and recognitions \n116 Endnotes \n3\n\nIntroduction \nForeword \nAt Google, we\u2019re applying AI to transform how people engage with information across our core products and  \nplatforms, to enhance business and economic growth, to enable  scientific  breakthroughs, and to drive sustainable  \ninnovation for society. We\u2019re proud to release our tenth annual Environmental Report, which details how we\u2019re  \nworking to address the increased energy demands of AI to enable this positive impact, while also showcasing  \nhow AI can be used to build a more energy-efficient and resilient world. These three topics\u2014energy, AI, and  \nresilience\u2014are the key themes of this year\u2019s report. Within these pages, we detail our 2024 progress, offering  \nour perspective and insights from a year marked by unprecedented global change driven by AI, energy  \ndemand, policy, and more. \nEnergy \nWe reduced our data center energy emissions by  \n12%, even with growing energy demands. \n  \n \n \n \n \n \n \n \n \n \n \n \n \n \n  \n \n ",
      " and offices, we increased \nour Google CFE percentage from 64% in 2022 and 2023 to 66% in 2024\n117\u2014 \n\n and offices, we increased \nour Google CFE percentage from 64% in 2022 and 2023 to 66% in 2024\n117\u2014 \ndespite significant growth in electricity demand over this period (which was \ndriven, in part, by AI). This was a result of increases in Contracted CFE and \noverall increases in global Grid CFE, specifically in North America where our \nenergy consumption is highest. \nOverall, we increased our Google CFE in over half of our grid regions that \ncontain Google-owned and -operated data centers, and achieved at least \n80% CFE in nine out of 20 of these grid regions in 2024. \nDetails  \nWe set this ambition in 2020. The load-weighted average of carbon-free \nenergy percentages across Google\u2019s global portfolio of data centers and \noffices is referred to as \u201cGoogle CFE.\u201d This metric is inclusive of third-party \ndata centers, and it represents the clean energy purchased to meet our \nelectricity needs at every hour of every day, and within every grid where we ",
      "by 27% in 2024, compared to 17% growth in the prior year. However, it\u2019s important to note that our  \n\nby 27% in 2024, compared to 17% growth in the prior year. However, it\u2019s important to note that our  \ngrowing electricity needs aren\u2019t solely driven by AI. The accelerating growth of Google Cloud, continued \ninvestments in Search, the expanding reach of YouTube, and more, have also contributed to this overall growth. \nWe remain committed to maximizing AI\u2019s potential to advance scientific discovery, accelerate human  \nprogress, and improve lives for people everywhere. To achieve this responsibly, we\u2019ll continue to pursue model  \noptimization, efficient infrastructure, and clean energy procurement to further drive efficiencies across AI and  \nminimize its overall resource demands. \nWind turbines spin near our data center in Eemshaven, Netherlands. \n16\n\nEnergy for  \nour data centers",
      "iled \ninformation on our operations, our products, and our progress. We invite you to learn more. \n6\n\n2024 highlights \nThis section provides a snapshot of our highlights as of the end of 2024 and select highlights from the first \nhalf of 2025. \nReduced data center energy  \nemissions by 12% \nWe reduced our data center energy emissions by  \n12%, compared to 2023. We achieved this important \naccomplishment despite a 27% increase in our  \nelectricity consumption, demonstrating that our  \noperational decarbonization efforts are bearing fruit. \nThe Google solar field at our data center \nin St. Ghislain, Belgium. \nProcured over 8 GW of clean \nenergy \nWe signed contracts to purchase over 8 gigawatts \n(GW) of additional clean energy generation \u200923\u2014more \nthan in any prior year. \nDelfzijl wind farm in the Netherlands \n(63 MW for Google). \nPartnered to enable 1 GW of solar \nin Taiwan \nWe announced a partnership  with BlackRock\u2019s \nClimate Infrastructure business that will enable 1 GW  \nof new solar energy in Taiwan, advancing clean \nenergy for both the local electricity grid and our  ",
      "an electricity \nreduction activities are the drivers of reductions in this scope 3 category because \n\nan electricity \nreduction activities are the drivers of reductions in this scope 3 category because \nany reduction in fossil fuel-based electricity use will translate into a reduction in these \nupstream electricity emissions.\n132 Refer to endnote 10 above.\n133 We calculated the reduction in embodied carbon emissions intensity by comparing \nGoogle\u2019s 2019 baseline standard data center design to our revised standardized data \ncenter designs which incorporate design updates to server hall hot air containment \nsystems, electrical distribution systems, and cooling tower units.\n134 Based on an internal life cycle assessment of Google\u2019s 2019 standard data center design.\n135 Refer to endnote 5 above.\n136 Refer to endnote 5 above.\n137 We recalculated data center waste diversion metrics. For additional details, refer to the \n118",
      "s. To learn more, refer to our \ndata center locations and our office  locations. \nAbout this report \n\ns. To learn more, refer to our \ndata center locations and our office  locations. \nAbout this report \nGoogle\u2019s 2025 Environmental Report highlights how our technologies\u2014including cutting-edge AI and emerging research\u2014are driving progress for both \npeople and the planet. Throughout this report, we use the term \u201csustainability\u201d to refer to environmental sustainability. This report features data from our \n2024 fiscal year (January 1 to December 31, 2024), and mentions some notable achievements from 2025 to date. \nAdditional resources \n\u2022 Explore our 2025 Environmental Report\n\u2022 Sustainability.google\n\u2022 Sustainability reports\n\u2022 Sustainability blog \n\u2022 About Google \n\u2022 Google\u2019s commitments \n\u2022 Alphabet additional information: Environmental \n\u2022 Alphabet SASB and TCFD Index \n77",
      "en Building &  \nCommunity Award \nHonored \nin Health and Wellbeing category for \nGradient Canopy \n115\n\nEndnotes\n1 We use the term data center energy emissions to describe scope 1 and 2 (market-based) \nemissions that result from our Google data center operations.\n2 The total GW figure represents primarily PPAs, and includes some generation from \ntargeted clean energy investments where we also receive EACs. Actual generation \nmay vary from the signed amounts based on changes during construction or project \nterminations.\n3 The comparison is based on data from Portugal\u2019s Directorate-General for Energy and \nGeology from December 2024: Total renewable energy installed in 2024 was 20,777 MW.\n4 Refer to endnote 2 above.\n5 For details about the calculation, refer to the Methodology section in the Appendix.\n6 Refer to endnote 5 above.\n7 According to Google\u2019s platform-neutral measurement analyzed over a five-year period \nfrom 2019\u20132024.\n8 These calculations are based on internal data, as of March 2025. Google\u2019s TPU power ",
      "shore wind farm in Belgium (92 MW for Google). \n R\u00f8dby solar farm in Denmark (55 MW for Google). \n18\n\nScaling smarter \nSuccessfully reducing our data center energy emissions \nIn 2024, the world\u2019s appetite for energy grew substantially faster than the average growth from the previous \ndecade.\u200947 This surge highlights the increasing energy demands of our modern infrastructure, from powering  \nhomes and industries to supporting the expanding digital world and emerging technologies. \nIn 2024, we reduced our data center energy emissions by 12% compared to 2023 (Figure 2). We \nachieved this reduction despite our data center electricity consumption increasing 27% year-on-year due to  \nthe growth of our business and increasing product adoption, including AI. \nThat may sound counterintuitive, but we\u2019ve long known that reducing the emissions from our data center \nenergy use is about scaling smarter. For us, it\u2019s the result of more than a decade of work\u2014and a strategy \nthat continues to deliver real-world results. ",
      "generated in \n2024. The estimated annual emissions reduction takes into account projects enabled by \n\ngenerated in \n2024. The estimated annual emissions reduction takes into account projects enabled by \nGoogle Earth prior to 2024 (dating back to 2020) to calculate the total impact in 2024 \nalone. Enabled emissions reductions estimates include inherent uncertainty due to factors \nthat include the lack of primary data and precise information about real-world actions \nand their effects to date, as well as forward-looking projections. Google is relying on \nits own substantiation of the enabled emissions-reduction impact, in consultation with \nmultiple third-party partners that have reviewed and support the methodology discussed \nherein. The data and claims have not been verified by an independent third-party. We will \ncontinue to work to refine our methodologies and inputs for these estimates.\n90 Estimated energy savings are calculated based on the average percentages for heating \nand cooling savings found in real-world studies of the Nest Learning Thermostat in the "
    ]
  },
  {
    "question": "What year did Google sign its first clean energy power purchase agreement?",
    "ground_truth": "2010",
    "answer": "2010",
    "contexts": [
      "er energy emissions by  \n12%, even with growing energy demands. \n  \n \n \n \n \n \n \n \n \n \n \n \n \n \n  \n \n \n\ner energy emissions by  \n12%, even with growing energy demands. \n  \n \n \n \n \n \n \n \n \n \n \n \n \n \n  \n \n \nReliable and abundant energy can help power global prosperity and expand economic opportunity. This \nrequires bringing more energy online, optimizing how we use it, advancing new energy solutions, and partnering \nwith suppliers as they make progress toward clean energy. At Google, through a combination of these efforts, \nwe\n reduced our data center energy emissions 1 by 12% in 2024\u2014even in the face of increased energy demands\u2014 \nw\nhile building fo r t he fu ture t hrough new  advanced energy innovations and dee per s u pplier e ngagement. \nWe added new clean energy generation by signing contracts for 8 GW and bringing 2.5 GW online in \n2024 alone. \nGoogle\u2019s work to accelerate clean energy began in 2010 when we signed our first power purchase agreement \n(PPA). Since then, from 2010 to 2024, we\u2019ve signed more than 170 agreements to purchase over 22 GW of clean \nen",
      "deployment, and model new ways of doing business that others can follow. \n22 gigawatts and counting \n\ndeployment, and model new ways of doing business that others can follow. \n22 gigawatts and counting \nGoogle is one of the largest corporate purchasers of clean energy, and from 2010 to 2024, we signed \nmore than 170 agreements to purchase over 22 GW of clean energy generation,\n\u200955 similar to Portugal\u2019s \ntotal renewable energy in 2024.\u200956 These purchases include agreements for over 17.3 GW in North America, \nover 4.5 GW in Europe, over 400 MW in Latin America, and over 300 MW in Asia Pacific. \nIn the United States, we signed new deals in Arizona, Nebraska, and across the PJM grid region in the Mid-\nAtlantic. In Europe, we expanded our offshore wind portfolio in the Netherlands, signed new PPAs in Italy,  \nPoland, and Belgium, and are helping bring new onshore wind farms online across the region. In Asia Pacific,  \nwe advanced clean energy projects in Taiwan, Japan, Singapore, and India\u2014with  contract  structures  tailored  ",
      "e then, from 2010 to 2024, we\u2019ve signed more than 170 agreements to purchase over 22 GW of clean \nen\n\ne then, from 2010 to 2024, we\u2019ve signed more than 170 agreements to purchase over 22 GW of clean \nen\nergy generation,2 similar to Portugal\u2019s total renewable energy in 2024.3 In 2024 alone, Google signed \ncontracts to purchase over 8 GW of additional clean energy generation 4\u2014the largest annual total in our history \nand twice the volume we contracted for the prior year. We\u2019ve maintained a 100% renewable energy match on a \nglobal basis every year since 2017, 5 and are going even further by pursuing our 24/7 carbon-free energy (CFE) \nambition (one of our climate moonshots). In 2024, we increased our 24/7 CFE percentage from 64% to 66%, 6 \na\nnd nine out of 20 grid regions with Google-owned and -operated data centers achieved at least 80% CFE. \nW\ne innovated across hardware and software to enable our data centers to deliver six times more \ncomputing power per unit of electricity than they did just five years ago. ",
      " and offices, we increased \nour Google CFE percentage from 64% in 2022 and 2023 to 66% in 2024\n117\u2014 \n\n and offices, we increased \nour Google CFE percentage from 64% in 2022 and 2023 to 66% in 2024\n117\u2014 \ndespite significant growth in electricity demand over this period (which was \ndriven, in part, by AI). This was a result of increases in Contracted CFE and \noverall increases in global Grid CFE, specifically in North America where our \nenergy consumption is highest. \nOverall, we increased our Google CFE in over half of our grid regions that \ncontain Google-owned and -operated data centers, and achieved at least \n80% CFE in nine out of 20 of these grid regions in 2024. \nDetails  \nWe set this ambition in 2020. The load-weighted average of carbon-free \nenergy percentages across Google\u2019s global portfolio of data centers and \noffices is referred to as \u201cGoogle CFE.\u201d This metric is inclusive of third-party \ndata centers, and it represents the clean energy purchased to meet our \nelectricity needs at every hour of every day, and within every grid where we ",
      "f AI-driven growth of electricity demand. Additionally, ECA formally submitted comments  advocating \n\nf AI-driven growth of electricity demand. Additionally, ECA formally submitted comments  advocating \nfor the implementation of grid-enhancing technologies at FERC and  collaborated with other organizations \u2014including Clean Energy Buyers Association (CEBA),  \nData Center Coalition (DCC), and Electricity Consumers Resource Council (ELCON)\u2014to advocate for colocation approach consistent with Google\u2019s position. \nU.S. state engagement \nClean Transition Tariff (utility rate): Google announced a  new, first-of-its kind clean energy partnership with NV Energy called a \u201cClean Transition Tariff\u201d \n(CTT) that enables Google and other energy users to meet growing power demand cleanly and reliably. The CTT brings utilities and customers together into a  \nlong-term energy agreement that can facilitate investments into new projects that deliver clean firm energy to the grid. ",
      "ned \nour first \nPPA \n2012 2013 2014 2015 2016 \nGoogle \nfirst achieved \n100% renewable \nenergy match \n\nned \nour first \nPPA \n2012 2013 2014 2015 2016 \nGoogle \nfirst achieved \n100% renewable \nenergy match \n2017 2018 2019 2020 2021 2022 2023 2024 \nYe a r \nTotal electricity consumption Global renewable energy matching Legend \n29",
      "rom renewable sources (%) on an annual basis by dividing the MWhs of renewable electricity procured \n\nrom renewable sources (%) on an annual basis by dividing the MWhs of renewable electricity procured \n(i.e., through contractual instruments, on-site renewable electricity generation, and renewable electricity in the electric grids where \nfacilities are located) by the total MWhs of electricity consumed by Alphabet\u2019s global operations. Contractual instruments may include \n14 Alphabet is the parent holding company of Google. \n15 Flagship consumer devices are products that can provide their main functionality without connection to another product. For example, this \ngenerally doesn\u2019t include accessories such as cases. \n16 Network and end-user devices used to access web-based software are not considered to be direct-use phase emissions and are not within the \nreporting boundary for use of sold products. \n113",
      " the last eight years, since 2017, we\u2019ve matched 100% of our global electricity use with renewable  \n\n the last eight years, since 2017, we\u2019ve matched 100% of our global electricity use with renewable  \nenergy purchases\u200960\u2014a pursuit that seemed almost impossible when we set out on it back in 2012 (Figure 5). \nThis milestone was an important step\u2014but annual matching only tells part of the story. The reality is that \nmost grids today still rely on fossil fuels for portions of the day, especially during evenings or times when \nrenewable sources aren\u2019t producing electricity. Even if a company buys clean energy in bulk and applies \nit to match its total usage over the course of the year, its real-time energy mix likely includes electricity \ngenerated from fossil fuels. \nFigure 5. Clean energy purchases compared to total electricity use \n35 \n30 \n25 \n20 \n15 \n10 \n5 \n0 \nTerawatt-hours \n2011 2010 \nGoogle \nannounced pursuit \nof 100% renewable \nenergy match \nGoogle \nsigned \nour first \nPPA \n2012 2013 2014 2015 2016 \nGoogle \nfirst achieved \n100% renewable \nenergy match ",
      "s in. \nIn 2023, we began rolling out the Google Clean Energy Addendum (CEA) \u2014an  agreement  asking  \n\ns in. \nIn 2023, we began rolling out the Google Clean Energy Addendum (CEA) \u2014an  agreement  asking  \nsuppliers to commit to achieving a 100% clean electricity match by the end of 2029 for the electricity \nthey use to manufacture Google products.\n\u200965 We see this as a cornerstone of our strategy\u2014not just a \nrecommendation, but a shared agreement to market change. It\u2019s already become a central part of how we \nwork with our key suppliers\u2014especially those with the highest energy use. By the end of 2024, many key \nsuppliers signed our CEA, and we plan to continue driving clean energy progress within our supply chain \nthrough our CEA, clean energy investments, and other initiatives. \nWe know this takes time, which is why we\u2019re working directly with suppliers to identify practical next steps, \noffer hands-on support, and share tools that make the transition more manageable\u2014from navigating  \nclean energy procurement to tracking progress\u2014all of which ultimately strengthen the resilience of our ",
      "tion with AI: Accelerating Climate Action with AI \n\u2022  Device repairability:  Google & Repairability \n\ntion with AI: Accelerating Climate Action with AI \n\u2022  Device repairability:  Google & Repairability \nThe following table includes a detailed list of our sustainability policy engagements in 2024: \nGlobal and cross-cutting initiatives \nAdvanced   clean  electricity   technologies:  In 2023, Google published a  paper outlining how corporate clean energy buyers can accelerate clean energy  \ntechnologies by supporting favorable policies, signing long-term purchase agreements, and providing early-stage project funding. In 2024, we published an \nupdated version of this paper to include our detailed procurement criteria for carbon-free energy technologies. \nUnited Nations Framework Convention on Climate Change (UNFCCC) 29th Conference of the Parties (COP-29): Google participated in COP-29, in \nBaku, Azerbaijan, in over 150 engagements with officials and sustainability industry leaders, partners, and priority stakeholders. ",
      " of the 2017 amendment of Taiwan\u2019s Electricity Act, which opened up the market to allow non-utility \n\n of the 2017 amendment of Taiwan\u2019s Electricity Act, which opened up the market to allow non-utility \ncompanies to directly purchase renewable energy. This effort led to us becoming the first   corporate  buyer  \nto sign a PPA in the market. \nLooking beyond Taiwan, we continue to drive progress throughout the Asia-Pacific region\u2014marked by \nannouncements in  Australia, India, Japan, and Singapore. These examples show meaningful strides in our \nongoing journey, yet they also serve as a reminder that a far greater collective effort is needed\u2014both within \nthe dynamic landscape of Asia Pacific and around the world\u2014to truly tackle this challenge. \nOur data center in Changhua County, Taiwan, is a center of community building and innovation. \n36"
    ]
  },
  {
    "question": "How many gigawatts of additional clean energy generation did Google sign contracts to purchase in 2024?",
    "ground_truth": "Over 8 GW",
    "answer": "over 8 GW",
    "contexts": [
      "th increasing the energy efficiency of our data centers to help minimize our electricity demand. In \n\nth increasing the energy efficiency of our data centers to help minimize our electricity demand. In \n2024, the average annual PUE for our global fleet of data centers was 1.09, compared with the industry average of 1.56, meaning that Google data centers \nused 84% less overhead energy than the industry average.\n\u2009129  We\u2019ll continue to build on this progress by driving additional energy efficiency and flexibility \nmeasures in our data centers\u2014with a focus on our machine learning fleet. \nAfter efficiency, our next focus is on scaling our clean energy procurement across all regions: In 2024, we signed contracts to purchase over 8 GW of \nadditional clean energy generation130\u2014more than in any prior year. We\u2019re also using Google\u2019s engineering expertise and purchasing demand to  accelerate  \nthe commercialization of advanced CFE technologies and scale their climate impact, and advocating for energy policies that can unlock access to cost-",
      "deployment, and model new ways of doing business that others can follow. \n22 gigawatts and counting \n\ndeployment, and model new ways of doing business that others can follow. \n22 gigawatts and counting \nGoogle is one of the largest corporate purchasers of clean energy, and from 2010 to 2024, we signed \nmore than 170 agreements to purchase over 22 GW of clean energy generation,\n\u200955 similar to Portugal\u2019s \ntotal renewable energy in 2024.\u200956 These purchases include agreements for over 17.3 GW in North America, \nover 4.5 GW in Europe, over 400 MW in Latin America, and over 300 MW in Asia Pacific. \nIn the United States, we signed new deals in Arizona, Nebraska, and across the PJM grid region in the Mid-\nAtlantic. In Europe, we expanded our offshore wind portfolio in the Netherlands, signed new PPAs in Italy,  \nPoland, and Belgium, and are helping bring new onshore wind farms online across the region. In Asia Pacific,  \nwe advanced clean energy projects in Taiwan, Japan, Singapore, and India\u2014with  contract  structures  tailored  ",
      "er energy emissions by  \n12%, even with growing energy demands. \n  \n \n \n \n \n \n \n \n \n \n \n \n \n \n  \n \n \n\ner energy emissions by  \n12%, even with growing energy demands. \n  \n \n \n \n \n \n \n \n \n \n \n \n \n \n  \n \n \nReliable and abundant energy can help power global prosperity and expand economic opportunity. This \nrequires bringing more energy online, optimizing how we use it, advancing new energy solutions, and partnering \nwith suppliers as they make progress toward clean energy. At Google, through a combination of these efforts, \nwe\n reduced our data center energy emissions 1 by 12% in 2024\u2014even in the face of increased energy demands\u2014 \nw\nhile building fo r t he fu ture t hrough new  advanced energy innovations and dee per s u pplier e ngagement. \nWe added new clean energy generation by signing contracts for 8 GW and bringing 2.5 GW online in \n2024 alone. \nGoogle\u2019s work to accelerate clean energy began in 2010 when we signed our first power purchase agreement \n(PPA). Since then, from 2010 to 2024, we\u2019ve signed more than 170 agreements to purchase over 22 GW of clean \nen",
      "e then, from 2010 to 2024, we\u2019ve signed more than 170 agreements to purchase over 22 GW of clean \nen\n\ne then, from 2010 to 2024, we\u2019ve signed more than 170 agreements to purchase over 22 GW of clean \nen\nergy generation,2 similar to Portugal\u2019s total renewable energy in 2024.3 In 2024 alone, Google signed \ncontracts to purchase over 8 GW of additional clean energy generation 4\u2014the largest annual total in our history \nand twice the volume we contracted for the prior year. We\u2019ve maintained a 100% renewable energy match on a \nglobal basis every year since 2017, 5 and are going even further by pursuing our 24/7 carbon-free energy (CFE) \nambition (one of our climate moonshots). In 2024, we increased our 24/7 CFE percentage from 64% to 66%, 6 \na\nnd nine out of 20 grid regions with Google-owned and -operated data centers achieved at least 80% CFE. \nW\ne innovated across hardware and software to enable our data centers to deliver six times more \ncomputing power per unit of electricity than they did just five years ago. ",
      "iled \ninformation on our operations, our products, and our progress. We invite you to learn more. \n6\n\n2024 highlights \nThis section provides a snapshot of our highlights as of the end of 2024 and select highlights from the first \nhalf of 2025. \nReduced data center energy  \nemissions by 12% \nWe reduced our data center energy emissions by  \n12%, compared to 2023. We achieved this important \naccomplishment despite a 27% increase in our  \nelectricity consumption, demonstrating that our  \noperational decarbonization efforts are bearing fruit. \nThe Google solar field at our data center \nin St. Ghislain, Belgium. \nProcured over 8 GW of clean \nenergy \nWe signed contracts to purchase over 8 gigawatts \n(GW) of additional clean energy generation \u200923\u2014more \nthan in any prior year. \nDelfzijl wind farm in the Netherlands \n(63 MW for Google). \nPartnered to enable 1 GW of solar \nin Taiwan \nWe announced a partnership  with BlackRock\u2019s \nClimate Infrastructure business that will enable 1 GW  \nof new solar energy in Taiwan, advancing clean \nenergy for both the local electricity grid and our  ",
      " and offices, we increased \nour Google CFE percentage from 64% in 2022 and 2023 to 66% in 2024\n117\u2014 \n\n and offices, we increased \nour Google CFE percentage from 64% in 2022 and 2023 to 66% in 2024\n117\u2014 \ndespite significant growth in electricity demand over this period (which was \ndriven, in part, by AI). This was a result of increases in Contracted CFE and \noverall increases in global Grid CFE, specifically in North America where our \nenergy consumption is highest. \nOverall, we increased our Google CFE in over half of our grid regions that \ncontain Google-owned and -operated data centers, and achieved at least \n80% CFE in nine out of 20 of these grid regions in 2024. \nDetails  \nWe set this ambition in 2020. The load-weighted average of carbon-free \nenergy percentages across Google\u2019s global portfolio of data centers and \noffices is referred to as \u201cGoogle CFE.\u201d This metric is inclusive of third-party \ndata centers, and it represents the clean energy purchased to meet our \nelectricity needs at every hour of every day, and within every grid where we ",
      "by 27% in 2024, compared to 17% growth in the prior year. However, it\u2019s important to note that our  \n\nby 27% in 2024, compared to 17% growth in the prior year. However, it\u2019s important to note that our  \ngrowing electricity needs aren\u2019t solely driven by AI. The accelerating growth of Google Cloud, continued \ninvestments in Search, the expanding reach of YouTube, and more, have also contributed to this overall growth. \nWe remain committed to maximizing AI\u2019s potential to advance scientific discovery, accelerate human  \nprogress, and improve lives for people everywhere. To achieve this responsibly, we\u2019ll continue to pursue model  \noptimization, efficient infrastructure, and clean energy procurement to further drive efficiencies across AI and  \nminimize its overall resource demands. \nWind turbines spin near our data center in Eemshaven, Netherlands. \n16\n\nEnergy for  \nour data centers",
      "ned \nour first \nPPA \n2012 2013 2014 2015 2016 \nGoogle \nfirst achieved \n100% renewable \nenergy match \n\nned \nour first \nPPA \n2012 2013 2014 2015 2016 \nGoogle \nfirst achieved \n100% renewable \nenergy match \n2017 2018 2019 2020 2021 2022 2023 2024 \nYe a r \nTotal electricity consumption Global renewable energy matching Legend \n29",
      "f AI-driven growth of electricity demand. Additionally, ECA formally submitted comments  advocating \n\nf AI-driven growth of electricity demand. Additionally, ECA formally submitted comments  advocating \nfor the implementation of grid-enhancing technologies at FERC and  collaborated with other organizations \u2014including Clean Energy Buyers Association (CEBA),  \nData Center Coalition (DCC), and Electricity Consumers Resource Council (ELCON)\u2014to advocate for colocation approach consistent with Google\u2019s position. \nU.S. state engagement \nClean Transition Tariff (utility rate): Google announced a  new, first-of-its kind clean energy partnership with NV Energy called a \u201cClean Transition Tariff\u201d \n(CTT) that enables Google and other energy users to meet growing power demand cleanly and reliably. The CTT brings utilities and customers together into a  \nlong-term energy agreement that can facilitate investments into new projects that deliver clean firm energy to the grid. ",
      "21 2022 2023 2024 \nYe a r \nTotal electricity consumption Global renewable energy matching Legend \n29",
      "n 2024, more than 25 clean energy projects we\u2019d contracted over the past several years\u2014some as far  \n\nn 2024, more than 25 clean energy projects we\u2019d contracted over the past several years\u2014some as far  \nback as 2019\u2014came online. Together, they added 2.5 GW of new clean energy to the grids that serve  \nour operations. \n19",
      "s in. \nIn 2023, we began rolling out the Google Clean Energy Addendum (CEA) \u2014an  agreement  asking  \n\ns in. \nIn 2023, we began rolling out the Google Clean Energy Addendum (CEA) \u2014an  agreement  asking  \nsuppliers to commit to achieving a 100% clean electricity match by the end of 2029 for the electricity \nthey use to manufacture Google products.\n\u200965 We see this as a cornerstone of our strategy\u2014not just a \nrecommendation, but a shared agreement to market change. It\u2019s already become a central part of how we \nwork with our key suppliers\u2014especially those with the highest energy use. By the end of 2024, many key \nsuppliers signed our CEA, and we plan to continue driving clean energy progress within our supply chain \nthrough our CEA, clean energy investments, and other initiatives. \nWe know this takes time, which is why we\u2019re working directly with suppliers to identify practical next steps, \noffer hands-on support, and share tools that make the transition more manageable\u2014from navigating  \nclean energy procurement to tracking progress\u2014all of which ultimately strengthen the resilience of our ",
      "tion with AI: Accelerating Climate Action with AI \n\u2022  Device repairability:  Google & Repairability \n\ntion with AI: Accelerating Climate Action with AI \n\u2022  Device repairability:  Google & Repairability \nThe following table includes a detailed list of our sustainability policy engagements in 2024: \nGlobal and cross-cutting initiatives \nAdvanced   clean  electricity   technologies:  In 2023, Google published a  paper outlining how corporate clean energy buyers can accelerate clean energy  \ntechnologies by supporting favorable policies, signing long-term purchase agreements, and providing early-stage project funding. In 2024, we published an \nupdated version of this paper to include our detailed procurement criteria for carbon-free energy technologies. \nUnited Nations Framework Convention on Climate Change (UNFCCC) 29th Conference of the Parties (COP-29): Google participated in COP-29, in \nBaku, Azerbaijan, in over 150 engagements with officials and sustainability industry leaders, partners, and priority stakeholders. "
    ]
  },
  {
    "question": "What is the name of Google's seventh-generation Tensor Processing Unit?",
    "ground_truth": "Ironwood",
    "answer": "Ironwood",
    "contexts": [
      "ficiency by 39% on Cloud TPU v5e .\n\u200935 Gemini 2.5 Flash is our first fully hybrid reasoning model , \n\nficiency by 39% on Cloud TPU v5e .\n\u200935 Gemini 2.5 Flash is our first fully hybrid reasoning model , \ngiving developers the ability to turn thinking on or off. The model also allows developers to set thinking \nbudgets to find the right tradeoff between quality, cost, and latency. \nFor model deployment and usage, we\u2019ve improved underlying ML efficiency through pioneering \ntechniques like blockwise parallel decoding , improved  confidence-based  deferral, and speculative  \ndecoding that reduce the inference times of LLMs, allowing them to generate responses more quickly. \nThese improvements are used across Google products and set a standard throughout the industry. \nInitiatives like these have led to generational model efficiency gains. For example, Google\u2019s Gemini 1.5 Pro  \ndelivers  dramatic improvements and achieves comparable quality to Gemini 1.0 Ultra while using less compute.\u200936 \nTPUs ",
      " we used a \none month sample of observed machine power data from our entire TPU fleet, applying \n116\n\nGoogle\u2019s 2023 average fleetwide carbon intensity. To estimate embodied emissions from \nmanufacturing, transportation, and retirement, we performed a life-cycle assessment \nof the hardware. Data center construction emissions were estimated based on Google\u2019s \ndisclosed 2023 carbon footprint. These findings do not represent model-level emissions, \nnor are they a complete quantification of Google\u2019s AI emissions. Based on the TPU \nlocation of a specific workload, Compute Carbon Intensity (CCI) results of specific \nworkloads may vary.\n45 The figure represents the average percentage of Google\u2019s global compute resources that \nwere identified as recoverable and reallocated for more efficient use over this period as a \nresult of using AlphaEvolve.\n46 We estimated the expected annual generation based on our contracted clean energy, \napplying an average capacity factor. Actual generation may vary from the signed amounts \nbased on changes during construction or project terminations.",
      " January 2024 to \nDecember 2024 in this analysis. These findings are a point-in-time measurement of \n\n January 2024 to \nDecember 2024 in this analysis. These findings are a point-in-time measurement of \nthe annual emissions of the Solar API, and may vary as the Solar API model continues \ndeployment. This analysis has not been third-party verified or validated.\n35 This estimate is based on our internal analysis comparing the BFLOAT16 / INT8 model step \ntime ratio measured on the MLPerf 3.1 GPT-3 175B model. The results (11,798ms / 8,431ms \n= 139%) can be interpreted as a 39% speed improvement and, in turn, training efficiency.\n36 \u201c Gemini 1.5: Unlocking Multimodal Understanding Across Millions of Tokens of Context,\u201d \nGoogle, 2024.\n37 Refer to endnote 8 above.\n38 This calculation is based on internal data, as of May 2024.\n39 Refer to endnote 8 above.\n40 This calculation is based on internal data, as of April 2025.\n41 According to \u201cWhat NVIDIA\u2019s New Blackwell Chip Says About AI\u2019s Carbon Footprint \nProblem,\u201d NVIDIA compared the total power needed to train the latest ultra-large AI ",
      " and offices, we increased \nour Google CFE percentage from 64% in 2022 and 2023 to 66% in 2024\n117\u2014 \n\n and offices, we increased \nour Google CFE percentage from 64% in 2022 and 2023 to 66% in 2024\n117\u2014 \ndespite significant growth in electricity demand over this period (which was \ndriven, in part, by AI). This was a result of increases in Contracted CFE and \noverall increases in global Grid CFE, specifically in North America where our \nenergy consumption is highest. \nOverall, we increased our Google CFE in over half of our grid regions that \ncontain Google-owned and -operated data centers, and achieved at least \n80% CFE in nine out of 20 of these grid regions in 2024. \nDetails  \nWe set this ambition in 2020. The load-weighted average of carbon-free \nenergy percentages across Google\u2019s global portfolio of data centers and \noffices is referred to as \u201cGoogle CFE.\u201d This metric is inclusive of third-party \ndata centers, and it represents the clean energy purchased to meet our \nelectricity needs at every hour of every day, and within every grid where we ",
      "troduction: Street View image of Redwood State and National Park, used with permission. \u00a92025 Google\n\ntroduction: Street View image of Redwood State and National Park, used with permission. \u00a92025 Google\nAge of AI: Street View image of the International Space Station, used with permission. \u00a92025 Google\nEnergy for our data centers: El Romero solar farm in Chile (80 MW for Google).\nEnergy for our supply chain: A technician scans hardware components, a critical step for tracking parts through every stage of the production process.\nResource efficiency: Clear waters reflect the beauty of our data center in Eemshaven, Netherlands.\nNew AI research solutions: The Solar API generates detailed rooftop data based on Google\u2019s extensive geospatial data and computing resources in order to evaluate rooftop solar energy potential.\nAI for extreme events and disaster response: A wide river basin during low water levels illustrates the type of flood-prone environment where flood forecasting is critical.",
      "rbon Footprint \nProblem,\u201d NVIDIA compared the total power needed to train the latest ultra-large AI \n\nrbon Footprint \nProblem,\u201d NVIDIA compared the total power needed to train the latest ultra-large AI \nmodels using the new Blackwell GPUs (4 megawatts) to the power required with older \nGPUs (15 megawatts) and found the new GPUs use roughly 25% of the power (or 75% \nless) of the older ones.\n42 \u201cNVIDIA Blackwell Platform Arrives to Power a New Era of Computing,\u201d NVIDIA, March \n2024.\n43 To measure emissions relative to computational performance and enable apples-to-\napples comparisons between chips, we developed a new metric\u2014Compute Carbon \nIntensity (CCI)\u2014that we believe can enable greater transparency and innovation across \nthe industry. CCI quantifies an AI accelerator chip\u2019s carbon emissions per unit of \ncomputation (measured in grams of CO2e per Exa-FLOP). Lower CCI scores mean lower \nemissions from the AI hardware platform for a given AI workload\u2014for example training an \nAI model. CCI includes both estimates of lifetime embodied and operational emissions ",
      "cally for inference, Ironwood performance per watt is double that of Trillium, our sixth-generation \n\ncally for inference, Ironwood performance per watt is double that of Trillium, our sixth-generation \nTPU announced last year. In fact,  Ironwood is nearly 30 times more power efficient than our first Cloud \nTPU from 2018.\n\u200937 \nTrillium already delivers impressive performance\u201467% more energy efficient than the previous TPU v5e, \u200938  \nand it delivers 14 times more compute per watt of power compared to the first generation of Cloud TPUs. \u200939  \nAnd Google Axion Processors , our first custom Central Processing Unit (CPU) designed for the data \ncenter, are up to 60% more energy efficient than comparable current-generation x86-based instances. \u200940  \nAdditionally, we now offer NVIDIA\u2019s next-generation Blackwell Graphics Processing Unit  (GPU) to Cloud \ncustomers, which NVIDIA estimates will train large models using 75% less power than older GPUs to \ncomplete the same task\n\u200941 and are 25 times as energy efficient compared to NVIDIA H100. \u200942 \n14",
      "improvements and achieves comparable quality to Gemini 1.0 Ultra while using less compute.\u200936 \nTPUs \n\nimprovements and achieves comparable quality to Gemini 1.0 Ultra while using less compute.\u200936 \nTPUs \nFor a decade, Google\u2019s AI innovations have been powered by a range of AI accelerator options, including \nour own custom-built TPUs (Tensor Processing Units). They\u2019ve come a long way since their first generation \nin 2015, evolving each generation to deliver better performance while improving their carbon compute \nefficiency. In early 2025, we continued this trend by building even more powerful TPUs, ensuring that our AI \nsystems keep pushing forward\u2014faster, smarter, and more efficient. \nWhen it comes to powering AI, efficiency isn\u2019t just about performance\u2014it\u2019s about using less energy to \ndo more. Announced in April 2025, Ironwood, our seventh-generation TPU, is a game-changer. Built \nspecifically for inference, Ironwood performance per watt is double that of Trillium, our sixth-generation ",
      " deliver six times more \ncomputing power per unit of electricity than they did just five years ago. \n\n deliver six times more \ncomputing power per unit of electricity than they did just five years ago. \nWe want to use energy in the most efficient way possible\u2014which is good for both our business and the \np\nlanet. Google data centers\u2014which power all of our products including Search, YouTube, Google Cloud, \nGemini, and more\u2014are some of the most efficient in the world. They deliver over six times more computing \np\nower per unit of electricity than they did just five years ago. 7 T his is in part thanks to pioneering hardware \ninnovations. As just one example, Google\u2019s seventh-generation Tensor Processing Unit (TPU), Ironwood, is \nnearly 30 times more power efficient than our first Cloud TPU from 2018.8 \nW\ne pushed the frontiers of advanced energ y development and grid optimization to ensure reliable, \nabundant power for everyone, and to fuel the next wave of innovation and economic growth. ",
      "om 2019\u20132024.\n8 These calculations are based on internal data, as of March 2025. Google\u2019s TPU power \n\nom 2019\u20132024.\n8 These calculations are based on internal data, as of March 2025. Google\u2019s TPU power \nefficiency relative to the earliest generation Cloud TPU v2 is measured by peak FP8 flops \ndelivered per watt of thermal design power per chip package.\n9 When we use the term \u201csupply chain\u201d or \u201csupply chain emissions,\u201d we're referring to \nthe indirect emissions that happen outside of our direct operations. This includes both \nupstream and downstream emissions, also referred to as \u201cvalue chain emissions.\u201d\n10 The Google Clean Energy Addendum applies to the electricity consumed by suppliers in \nthe manufacturing of Google technical infrastructure and consumer hardware products. \n11 To estimate aggregate enabled emissions reductions, we first estimated annual \nreductions for five products individually (Google Earth Pro, Solar API, Nest thermostats, \nfuel-efficient routing, and Green Light) and then combined the totals. For details ",
      "nsumption metrics\u2014including purchased steam, purchased cooling, and total energy consumption\u2014due to \n\nnsumption metrics\u2014including purchased steam, purchased cooling, and total energy consumption\u2014due to \nthe correction of a calculation error. \n\u2022  We recalculated our 2020 \u201cTotal electricity consumption\u201d metric to source more accurate energy data. \n\u2022  We recalculated our 2021 \u201cCFE across Google data centers (hourly)\u201d metric to include CFE data from third-party data center consumption. \nCFE data from third-party data centers was already included in our previously reported 2022 and 2023 metrics. \n\u2022  We recalculated 2019\u20132023 waste metrics\u2014including data center waste diversion rate, total waste generated, and total waste diversion rate\u2014 \ndue to data improvements for data center recycled e-waste and packaging and refinement of the metric boundary to exclude low quality data \nfrom warehouses and third-party data centers. \nDefinition of key terms \n\u2022  Business-as-usual (BAU) emissions  represent our projected emissions without new carbon reduction efforts. Our BAU emissions forecast ",
      "to \ncomplete the same task\n\u200941 and are 25 times as energy efficient compared to NVIDIA H100. \u200942 \n14\n\nIn 2025, we published a first-of-its-kind  study on the lifetime emissions of our TPU hardware \u2014from raw \nmaterial extraction and manufacturing to energy consumption during operation. The results?  A threefold  \nimprovement in the Compute Carbon Intensity \u200943  of our TPU chips over four years, from TPU v4 to \nTrillium\u200944  (Figure 1). Newer generations of TPUs like Trillium provide cutting-edge performance while \ngenerating fewer carbon emissions for the same AI workload. \nFigure 1. Generational trends of AI hardware life-cycle emissions intensity show a threefold  \nimprovement over four years \nv4i v4 v5e v5p Trillium \n2020 2022 2023 2024 \n500 \n400 \n300 \n200 \n100 \n0 \nCompute carbon intensity (g CO2 /EFLOP) \n3x \nimprovement \nIndirect emissions from manufacturing \nIndirect emissions from energy use \nIndirect emissions from transportation Indirect emissions from data center construction \nDirect emissions from energy use Legend \nInfrastructure "
    ]
  },
  {
    "question": "What was Google's global carbon-free energy percentage across its data centers and offices in 2024?",
    "ground_truth": "66%",
    "answer": "66%",
    "contexts": [
      "th increasing the energy efficiency of our data centers to help minimize our electricity demand. In \n\nth increasing the energy efficiency of our data centers to help minimize our electricity demand. In \n2024, the average annual PUE for our global fleet of data centers was 1.09, compared with the industry average of 1.56, meaning that Google data centers \nused 84% less overhead energy than the industry average.\n\u2009129  We\u2019ll continue to build on this progress by driving additional energy efficiency and flexibility \nmeasures in our data centers\u2014with a focus on our machine learning fleet. \nAfter efficiency, our next focus is on scaling our clean energy procurement across all regions: In 2024, we signed contracts to purchase over 8 GW of \nadditional clean energy generation130\u2014more than in any prior year. We\u2019re also using Google\u2019s engineering expertise and purchasing demand to  accelerate  \nthe commercialization of advanced CFE technologies and scale their climate impact, and advocating for energy policies that can unlock access to cost-",
      "er energy emissions by  \n12%, even with growing energy demands. \n  \n \n \n \n \n \n \n \n \n \n \n \n \n \n  \n \n \n\ner energy emissions by  \n12%, even with growing energy demands. \n  \n \n \n \n \n \n \n \n \n \n \n \n \n \n  \n \n \nReliable and abundant energy can help power global prosperity and expand economic opportunity. This \nrequires bringing more energy online, optimizing how we use it, advancing new energy solutions, and partnering \nwith suppliers as they make progress toward clean energy. At Google, through a combination of these efforts, \nwe\n reduced our data center energy emissions 1 by 12% in 2024\u2014even in the face of increased energy demands\u2014 \nw\nhile building fo r t he fu ture t hrough new  advanced energy innovations and dee per s u pplier e ngagement. \nWe added new clean energy generation by signing contracts for 8 GW and bringing 2.5 GW online in \n2024 alone. \nGoogle\u2019s work to accelerate clean energy began in 2010 when we signed our first power purchase agreement \n(PPA). Since then, from 2010 to 2024, we\u2019ve signed more than 170 agreements to purchase over 22 GW of clean \nen",
      "-owned and \n-operated data centers in 2024. In previous reports, we included Google CFE percentages \n\n-owned and \n-operated data centers in 2024. In previous reports, we included Google CFE percentages \nfor all grid regions where we had data center operations, including third-party-operated \nfacilities. All our data center operations, including third-party-operated facilities, are still \nincluded in our global and regional Google CFE metrics.\n65 Refer to endnote 10 above.\n66 Based on the average annual irrigation of golf courses in the southwest U.S. of 459 acre-ft  \nor around 150 million gallons. Source: \u201cHow Much Water Does Golf Use and Where Does It \nCome From?\u201d U.S. Golf Association, November 2012.\n67 Refer to endnote 5 above.\n68 Refer to endnote 5 above.\n69 \u201cCalifornia\u2019s Central Valley,\u201d U.S. Geological Survey, accessed March 2025.\n70 For Google-managed server assembly and maintenance, there was a year-on-year \nincrease in the quantity of reused components in 2024 compared to 2023. This \npercentage excludes components used to build servers through original equipment ",
      " we used a \none month sample of observed machine power data from our entire TPU fleet, applying \n116\n\nGoogle\u2019s 2023 average fleetwide carbon intensity. To estimate embodied emissions from \nmanufacturing, transportation, and retirement, we performed a life-cycle assessment \nof the hardware. Data center construction emissions were estimated based on Google\u2019s \ndisclosed 2023 carbon footprint. These findings do not represent model-level emissions, \nnor are they a complete quantification of Google\u2019s AI emissions. Based on the TPU \nlocation of a specific workload, Compute Carbon Intensity (CCI) results of specific \nworkloads may vary.\n45 The figure represents the average percentage of Google\u2019s global compute resources that \nwere identified as recoverable and reallocated for more efficient use over this period as a \nresult of using AlphaEvolve.\n46 We estimated the expected annual generation based on our contracted clean energy, \napplying an average capacity factor. Actual generation may vary from the signed amounts \nbased on changes during construction or project terminations.",
      "agement and partnership \n98 Environmental data \n115 Certifications and recognitions \n116 Endnotes \n3\n\nIntroduction \nForeword \nAt Google, we\u2019re applying AI to transform how people engage with information across our core products and  \nplatforms, to enhance business and economic growth, to enable  scientific  breakthroughs, and to drive sustainable  \ninnovation for society. We\u2019re proud to release our tenth annual Environmental Report, which details how we\u2019re  \nworking to address the increased energy demands of AI to enable this positive impact, while also showcasing  \nhow AI can be used to build a more energy-efficient and resilient world. These three topics\u2014energy, AI, and  \nresilience\u2014are the key themes of this year\u2019s report. Within these pages, we detail our 2024 progress, offering  \nour perspective and insights from a year marked by unprecedented global change driven by AI, energy  \ndemand, policy, and more. \nEnergy \nWe reduced our data center energy emissions by  \n12%, even with growing energy demands. \n  \n \n \n \n \n \n \n \n \n \n \n \n \n \n  \n \n ",
      " and offices, we increased \nour Google CFE percentage from 64% in 2022 and 2023 to 66% in 2024\n117\u2014 \n\n and offices, we increased \nour Google CFE percentage from 64% in 2022 and 2023 to 66% in 2024\n117\u2014 \ndespite significant growth in electricity demand over this period (which was \ndriven, in part, by AI). This was a result of increases in Contracted CFE and \noverall increases in global Grid CFE, specifically in North America where our \nenergy consumption is highest. \nOverall, we increased our Google CFE in over half of our grid regions that \ncontain Google-owned and -operated data centers, and achieved at least \n80% CFE in nine out of 20 of these grid regions in 2024. \nDetails  \nWe set this ambition in 2020. The load-weighted average of carbon-free \nenergy percentages across Google\u2019s global portfolio of data centers and \noffices is referred to as \u201cGoogle CFE.\u201d This metric is inclusive of third-party \ndata centers, and it represents the clean energy purchased to meet our \nelectricity needs at every hour of every day, and within every grid where we ",
      "iled \ninformation on our operations, our products, and our progress. We invite you to learn more. \n6\n\n2024 highlights \nThis section provides a snapshot of our highlights as of the end of 2024 and select highlights from the first \nhalf of 2025. \nReduced data center energy  \nemissions by 12% \nWe reduced our data center energy emissions by  \n12%, compared to 2023. We achieved this important \naccomplishment despite a 27% increase in our  \nelectricity consumption, demonstrating that our  \noperational decarbonization efforts are bearing fruit. \nThe Google solar field at our data center \nin St. Ghislain, Belgium. \nProcured over 8 GW of clean \nenergy \nWe signed contracts to purchase over 8 gigawatts \n(GW) of additional clean energy generation \u200923\u2014more \nthan in any prior year. \nDelfzijl wind farm in the Netherlands \n(63 MW for Google). \nPartnered to enable 1 GW of solar \nin Taiwan \nWe announced a partnership  with BlackRock\u2019s \nClimate Infrastructure business that will enable 1 GW  \nof new solar energy in Taiwan, advancing clean \nenergy for both the local electricity grid and our  ",
      "ned \nour first \nPPA \n2012 2013 2014 2015 2016 \nGoogle \nfirst achieved \n100% renewable \nenergy match \n\nned \nour first \nPPA \n2012 2013 2014 2015 2016 \nGoogle \nfirst achieved \n100% renewable \nenergy match \n2017 2018 2019 2020 2021 2022 2023 2024 \nYe a r \nTotal electricity consumption Global renewable energy matching Legend \n29",
      " 2024, we continued to navigate a complex global energy landscape. We achieved significant progress \n\n 2024, we continued to navigate a complex global energy landscape. We achieved significant progress \nby increasing our global  carbon-free energy percentage across our data centers and offices to 66% . \n\u200961  \nThis 2% increase compared to last year is particularly noteworthy given the 27% increase in our electricity \nconsumption to support our growing business, including AI. While this global average reflects strong \nprogress, our journey varied by region. In Asia Pacific, for instance, our regional average Google CFE was \n12%\u2014well below that of other regions, like 70% in North America and 92% in Latin America.\n\u200962 In response, \nwe\u2019re  advancing new paths for clean energy in Asia Pacific specifically, like solar aggregation and piloting \ninvestments in new clean energy projects. \nThis regional variability is a reminder of what makes 24/7 CFE so powerful, and so complex: it doesn\u2019t hide \nthe gaps. It shines a light on them. \nAccelerating new tools like T-EACs ",
      "s. To learn more, refer to our \ndata center locations and our office  locations. \nAbout this report \n\ns. To learn more, refer to our \ndata center locations and our office  locations. \nAbout this report \nGoogle\u2019s 2025 Environmental Report highlights how our technologies\u2014including cutting-edge AI and emerging research\u2014are driving progress for both \npeople and the planet. Throughout this report, we use the term \u201csustainability\u201d to refer to environmental sustainability. This report features data from our \n2024 fiscal year (January 1 to December 31, 2024), and mentions some notable achievements from 2025 to date. \nAdditional resources \n\u2022 Explore our 2025 Environmental Report\n\u2022 Sustainability.google\n\u2022 Sustainability reports\n\u2022 Sustainability blog \n\u2022 About Google \n\u2022 Google\u2019s commitments \n\u2022 Alphabet additional information: Environmental \n\u2022 Alphabet SASB and TCFD Index \n77",
      "ogle-owned and -operated data centers (refer to the Environmental metrics data tables for details). \n\nogle-owned and -operated data centers (refer to the Environmental metrics data tables for details). \nWhat\u2019s most important is forward progress. \nAnd while we\u2019re making meaningful strides toward this moonshot, progress is uneven across regions. As the table below illustrates, North America, \nEurope, and Latin America are showing improvements, but the Asia-Pacific region largely remains undersupplied with carbon-free energy. \nYear-on-year progress \nRegional average Google CFE across Google data center grid regions Unit 2022 2023 2024 \nNorth America % 69 68 70 \nUnited States % 69 68 70 \n Canada & Mexico \u2009116 % 96 96 88 \nEurope, Middle East, & Africa % 76 83 83 \nEurope % 76 84 84 \nMiddle East & Africa % 3 4 5 \nLatin America % 90 91 92 \nAsia Pacific % 11 12 12 \nGlobal CFE across Google data centers % 64 64 66 \nTrend \nFor our global average across our data centers and offices, we increased \nour Google CFE percentage from 64% in 2022 and 2023 to 66% in 2024\n117\u2014 ",
      "tion of the CFE already on the grids where we operate. If Google\u2019s total Contracted CFE exceeds our \n\ntion of the CFE already on the grids where we operate. If Google\u2019s total Contracted CFE exceeds our \nelectricity consumption in a given hour and region, the contracted CFE consumed by Google is capped at the total electricity consumption; this means \nthe CFE percentage in this hour would be 100% and that \u201cconsumed\u201d Contracted CFE can never exceed 100%. The \u201cexcess CFE\u201d from the projects under \ncontract that generate MWhs of clean electricity above what Google consumes in a particular hour is not counted toward our Google CFE percentage, \nhowever it still contributes to decarbonization of the broader grid. \nWe calculate Consumed Grid CFE as a percentage of our electricity consumption in a given market that\u2019s matched with CFE from the grid after the \napplication of Contracted CFE. For hours when Contracted CFE is equal to or exceeds our electricity consumption, Consumed Grid CFE is equal to zero. ",
      "or more details, refer to the  Recalculation of previous environmental metrics  section. \n25,307,000\n\nRegional average Google CFE across Google data center grid regions Unit 2022 2023 2024 \nNorth America % 69 68 70 \nUnited States % 69 68 70 \nCanada & Mexico \u2009158 % 96 96 88 \nEurope, Middle East, & Africa % 76 83 83 \nEurope % 76 84 84 \nMiddle East & Africa % 3 4 5 \nLatin America % 90 91 92 \nAsia Pacific % 11 12 12 \nGlobal CFE across Google data centers % 64 64 66 \nData center grid region CFE\u2009159  2024 \nConsumed Country Regional grid Unit Google CFE Contracted CFE Grid CFE Grid CFE \nEurope, Middle East, & Africa \nBelgium Elia % 84 32 52 78 \nDe\nnmark Energinet % 91 35 56 88 \nFinland Fingrid % 98 73 25 94 \nGermany Germany % 68 8 60 66 \nIreland EirGr id % 47 5 42 44 \nNetherlands Tennet % 83 70 13 56 \nAsia Pacific \nJapan TEPCO Power Grid (TEPCO) % 17 17 17 \nSingapore Energy Market Authority of Singapore % 4 0 4 4 \nTaiwan Taiwan Power Company % 17 1 16 16 \nLatin America \nChile Sistema Interconectado Central % 92 79 13 67\nNorth America ",
      "tion with AI: Accelerating Climate Action with AI \n\u2022  Device repairability:  Google & Repairability \n\ntion with AI: Accelerating Climate Action with AI \n\u2022  Device repairability:  Google & Repairability \nThe following table includes a detailed list of our sustainability policy engagements in 2024: \nGlobal and cross-cutting initiatives \nAdvanced   clean  electricity   technologies:  In 2023, Google published a  paper outlining how corporate clean energy buyers can accelerate clean energy  \ntechnologies by supporting favorable policies, signing long-term purchase agreements, and providing early-stage project funding. In 2024, we published an \nupdated version of this paper to include our detailed procurement criteria for carbon-free energy technologies. \nUnited Nations Framework Convention on Climate Change (UNFCCC) 29th Conference of the Parties (COP-29): Google participated in COP-29, in \nBaku, Azerbaijan, in over 150 engagements with officials and sustainability industry leaders, partners, and priority stakeholders. "
    ]
  },
  {
    "question": "What percentage of packaging for new Google products launched and manufactured in 2024 was plastic-free?",
    "ground_truth": "100%",
    "answer": "100%",
    "contexts": [
      "circuit boards, labels, cables, connectors, \nelectronic components and modules, optical components, \n\ncircuit boards, labels, cables, connectors, \nelectronic components and modules, optical components, \nelectrostatic discharge components, electromagnetic \ninterference components, films, coatings, and adhesives. \nRenewable content consists of plastic made  from bio-based  \nmaterial. This ambition doesn\u2019t include third-party products \nsuch as the Nest x Yale Lock. \nGraph \n0\n36% \n41% \n34% \n40% \n2021 2022 2023 2024 \nYe a r \nLegend Percentage of recycled or renewable material in plastic \nused across our consumer hardware product portfolio \n40 \n30 \nPercentage \n20 \n10 \nPlastic-free packaging \nWe aimed to make product packaging 100% plastic-free by 2025. \nWe reached our ambition early: Packaging for new Google products launched and manufactured in 2024 was 100% plastic-free. \u2009141 \nTrend  \nThe increase from at least 99% plastic-free packaging in 2023 \nto 100% in 2024 was primarily due to packaging innovations, \nincluding implementing fiber-based solutions in our packaging \nmaterial catalog.",
      "of new solar energy in Taiwan, advancing clean \nenergy for both the local electricity grid and our  \n\nof new solar energy in Taiwan, advancing clean \nenergy for both the local electricity grid and our  \nown operations. \nEliminated plastic from our \nproduct packaging \nPackaging for new Google products launched and  \nmanufactured in 2024 was 100% plastic-free .\u200922 \nTo help other companies create more sustainable  \npackaging, we published our  Plastic-Free Packaging  \nDesign Guide . \n7 \n -    \nA fiber-based unglued packaging set.  \nReached 1 billion users to inform \nmore sustainable choices \nFor the past three years, we\u2019ve provided information  \nto over 1 billion users to help them make more \nsustainable choices annually through our products. \u200924",
      "aging innovations, \nincluding implementing fiber-based solutions in our packaging \nmaterial catalog.\n\naging innovations, \nincluding implementing fiber-based solutions in our packaging \nmaterial catalog.\n142 \nDetails  \nWe set this ambition in 2020, and it is based on the total weight \nof new Google Pixel, Nest, and Fitbit retail packaging globally \n(excluding adhesive materials and required plastic stickers) \nfor products launched and manufactured in a given year, as \nshipped by Google. \n88 \nGraph \nAmbition achieved \nahead of schedule \n100\n25 \n0 \n2021 2022 2023 2024 \n97% 100%96% 99% \nYear \nLegend Percentage of product packaging that was plastic-free for \nnew Google products launched and manufactured each year \n75\nPercentage \n50",
      "85% 85% 82% \nYe a r \nLegend Percentage of food waste diverted from landfill \nPercentage \n50\n25 \nYear\n\nRecycled plastic \nWe aim to use recycled or renewable material in at least 50% of plastic used across our consumer hardware \nproduct portfolio by 2025. \n40% of the plastic Google used in products manufactured in 2024 was recycled content. 138 \nTrend  \nThe percentage of plastic used in our manufactured consumer \nhardware products that was recycled content increased from \n34% 139 in 2023 to 40%140 in 2024, due to changes in our product \nmix, primarily driven by a decrease in the manufacturing of \nGoogle products with low recycled content in 2024. \nDetails  \nWe set this ambition in 2020, and it includes the minimum \npercentage of recycled or renewable plastic content calculated \nas a percentage of total plastic (by weight) in Google\u2019s \nconsumer hardware portfolio for products manufactured in a \ngiven year. The following may be excluded from the calculation \nof percentage: printed circuit boards, labels, cables, connectors, \nelectronic components and modules, optical components, ",
      "em as such, so we redesigned packaging structures and ditched glossy coatings in favor of uncoated, \n\nem as such, so we redesigned packaging structures and ditched glossy coatings in favor of uncoated, \nspeckled textures that looked\u2014and felt\u2014recyclable for consumers. \nThe result: the packaging for new Google products launched and manufactured in 2024 was   \n100% plastic free.\n\u200978 Packaging isn\u2019t just what holds the product, it\u2019s part of the product experience. And \nrethinking how it\u2019s made can make sustainability feel more tangible from the start. Our Plastic-Free  \nPackaging Design Guide  shares design, engineering, and operational insights from our new packaging  \ndesign and encourages other companies to share their innovations too. \nGoogle consumer hardware devices in their product packaging. \n51",
      "hat was plastic-free for \nnew Google products launched and manufactured each year \n75\nPercentage \n50",
      "Environmental \nReport \n2025"
    ]
  },
  {
    "question": "Which tool launched its first satellite in March 2025 to detect and track wildfires?",
    "ground_truth": "FireSat",
    "answer": "FireSat",
    "contexts": [
      "\nOur innovative research is bolstering resilience  \nto protect communities, save lives, and reduce  \n\n\nOur innovative research is bolstering resilience  \nto protect communities, save lives, and reduce  \ndamage-related costs. \nOver the last ten years (2015\u20132024), the United States alone experienced 190 separate billion-dollar weather  \nand climate disasters totaling $1.4 trillion in damage.\u200920 At Google, we\u2019re developing advanced AI-powered  \ntools to help people prepare, adapt, recover, and build resilience in these critical moments. This means  \npowerful and accurate forecasting of extreme events like wildfires with FireSat and floods through Google\u2019s  \nFlood Hub, and improving global weather prediction through WeatherNext. \nFireSat, with its first satellite launched in March 2025, will enhance wildfire detection and response. \nFireSat is a partner-driven constellation of high-resolution multispectral satellite imagery and AI that will  \nprovide near real-time insights on wildfires, enabling faster detection and giving first responders a better  ",
      "at is the first satellite constellation to focus on early detection in high resolution  \nimagery \n66\n\nThe first satellite launched  in early 2025,  with plans for more than 50  to follow in the years to come, \nled by the Earth Fire Alliance coalition. Once fully operational, the FireSat program will provide near real-\ntime data on the location, size, and intensity of all wildfires on Earth every 20 minutes or less. This means \nemergency crews will be able to act quickly\u2014often before a small fire has the chance to escalate. The ability \nto detect fires early in their life cycle could significantly reduce the damage they cause, making firefighting \nefforts more effective and ultimately saving more lives, homes, and communities. \nWildfire mapping \nWildfires spread rapidly, change direction unpredictably, and often begin in remote areas where early \nsigns could go unnoticed. Once a fire ignites, it can engulf large areas in a matter of hours, devastating \ncommunities and ecosystems, so the window of time between detection and response is narrow. ",
      "onmental damages from  \ncatastrophic wildfires and building long-term resilience to such disasters. \n\nonmental damages from  \ncatastrophic wildfires and building long-term resilience to such disasters. \nFigure 11. FireSat is the first satellite constellation to focus on early detection in high resolution  \nimagery \n66",
      "ols globally\u2014especially \nfor the most vulnerable communities, so they can protect what matters most.\n\nBattling the blaze \nHow AI, satellites, and maps are helping us fight fire faster \nIn January 2025, wildfires swept across the hills outside Los Angeles . Working in tandem with satellite data \nand mapping technology, Google Search and Maps provided information to help manage the wildfire, \nsuch as road closures and nearby hotels that were offering free or discounted accommodations to anyone \ndisplaced by the wildfires. It was a clear example of how technology is transforming disaster response\u2014and \nbuilding resilience to such events\u2014thanks to AI, satellites, and a whole lot of data. \nFireSat, a system to identify wildfires earlier \nImagine being able to detect a wildfire as small as the size of a garage anywhere on Earth (Figure 11). \nThat\u2019s the promise behind FireSat. Born from an idea at Google Research, the FireSat initiative officially \nlaunched its first wildfire-detecting satellite in March 2025. This pioneering effort leverages technology to ",
      "tating \ncommunities and ecosystems, so the window of time between detection and response is narrow. \n\ntating \ncommunities and ecosystems, so the window of time between detection and response is narrow. \nOne of our most visible tools is AI-powered wildfire   boundary  tracking, which uses satellite data to refresh \nfire maps every 15 to 20 minutes, offering a near real-time picture of the fire\u2019s spread. These updates appear \nin Google Search, Google Maps, and even in location-based push notifications. In 2024, our c risis alerts  \nprovided timely wildfire information to over 26 million users across more than 480 wildfire events \naround the world\u2014including  the  devastating fires in the Attica region  of Greece in August 2024. \nThis work not only helps emergency responders assess where the fire is currently, but also assists in \ncreating evacuation routes and alerting nearby residents to evacuate or take protective measures. By \nproviding timely and accurate information, this technology aids community resilience in the face of these ",
      "ts first wildfire-detecting satellite in March 2025. This pioneering effort leverages technology to \n\nts first wildfire-detecting satellite in March 2025. This pioneering effort leverages technology to \ngather high-resolution and frequent data, and employs AI to analyze it\u2014providing critical, rapid insights to \nfirefighters. The idea became a reality through key partnerships across philanthropy, scientists, industries, \nand the establishment of the Earth Fire Alliance in 2024. \nFireSat satellites were developed by Muon Space in collaboration with Earth Fire Alliance, with leadership \nand support from Google, the Gordon and Betty Moore Foundation, Environmental Defense Fund, and \nothers. Funding for the first satellite in the FireSat constellation came in part from Google.org (Google\u2019s \nphilanthropic arm), which provided $13 million as part of the AI   Collaborative:  Wildfires, an initiative \nto harness AI\u2019s potential in reducing the economic, humanitarian, and environmental damages from  \ncatastrophic wildfires and building long-term resilience to such disasters. ",
      " over 1 billion users to help them make more \nsustainable choices annually through our products. \u200924\n\nLaunched the first FireSat \nsatellite to detect wildfires \nThe first satellite for the FireSat constellation  launched  \nand officially made contact with Earth. This satellite is  \none of more than 50 in a first-of-its-kind constellation  \ndesigned to use AI to detect and track wildfires as \nsmall as a garage (roughly 5x5 meters). \n8 \nThe launch of the first satellite for the \nFireSat constellation. \nImproved TPU power efficiency \nby 30x from 2018 \nIronwood\u2014the first Google TPU designed to power \nthinking, inferential AI models at scale\u2014is nearly 30 \ntimes more power efficient than our first Cloud TPU \nfrom 2018.\n\u200927 \nIronwood: The first Google TPU for the \nage of inference. \nReplenished 64% of our  \nfreshwater consumption,   \nup from 18% \nOur water stewardship projects replenished  \napproximately 4.5 billion gallons of water (17 billion \nliters or 17 million cubic meters) in 2024 alone, \nroughly 64% of our freshwater consumption.\n\u200925"
    ]
  },
  {
    "question": "What is Google's global water replenishment target for 2030?",
    "ground_truth": "To replenish 120% of the freshwater volume it consumes, on average, across its offices and data centers",
    "answer": "Google aims to replenish 120% of the freshwater volume it consumes, on average, across its offices and data centers by 2030.",
    "contexts": [
      "e then, from 2010 to 2024, we\u2019ve signed more than 170 agreements to purchase over 22 GW of clean \nen\n\ne then, from 2010 to 2024, we\u2019ve signed more than 170 agreements to purchase over 22 GW of clean \nen\nergy generation,2 similar to Portugal\u2019s total renewable energy in 2024.3 In 2024 alone, Google signed \ncontracts to purchase over 8 GW of additional clean energy generation 4\u2014the largest annual total in our history \nand twice the volume we contracted for the prior year. We\u2019ve maintained a 100% renewable energy match on a \nglobal basis every year since 2017, 5 and are going even further by pursuing our 24/7 carbon-free energy (CFE) \nambition (one of our climate moonshots). In 2024, we increased our 24/7 CFE percentage from 64% to 66%, 6 \na\nnd nine out of 20 grid regions with Google-owned and -operated data centers achieved at least 80% CFE. \nW\ne innovated across hardware and software to enable our data centers to deliver six times more \ncomputing power per unit of electricity than they did just five years ago. ",
      "r the future. \nA logistics program manager at our data center in Singapore. \n38\n\nResource efficiency\n\nWater stewardship \nContents \n40 Advancing responsible water use: Our approach to climate-conscious data center cooling \n42 Replenishing water: A local approach to water stewardship \nWater is one of the most essential resources on Earth. And though water risk varies by location and isn\u2019t \npresent everywhere, growing concerns in many regions mean managing this precious resource is no longer  \njust a responsibility, but a necessity. We\u2019re working to do just that through a strategy centered on advancing  \nresponsible water use at Google, benefiting watersheds and communities, and supporting water security \nwith technology. \nAdvancing responsible water use \nOur approach to climate-conscious data center cooling \nGoogle\u2019s data centers are the engine of our company, powering products like Google Workspace (which \nincludes Gmail, Drive, Docs, and more), Google Cloud, Search, and YouTube for billions of people around the  ",
      " for water stewardship action and risk mitigation. Indicators from available risk assessment tools, \n\n for water stewardship action and risk mitigation. Indicators from available risk assessment tools, \nincluding the WRI\u2019s Aqueduct Water Risk Atlas 3.0 and the World Wildlife Fund (WWF) Water Risk Filter 6.0, are blended with other metrics to evaluate risks \nrelated to scarcity, flooding, water quality, sanitation and hygiene, reputation, and regulatory stressors. \nWe also apply our data center water risk framework to measure and evaluate site-level water risks and the potential watershed impact to inform our \ndecision-making process for new site selection, cooling system design, and ongoing operations. We apply this framework to every new data center site \n(including new sites before acquisition and future developments on existing campuses) and aim to repeat these assessments across our existing Google-\nowned and -operated data center portfolio every three to five years to evaluate water risks that may require mitigation. We also use this framework to ",
      "n \nliters or 17 million cubic meters) in 2024 alone, \nroughly 64% of our freshwater consumption.\n\u200925\n\nn \nliters or 17 million cubic meters) in 2024 alone, \nroughly 64% of our freshwater consumption.\n\u200925\nMulti --benefit   floodplain   restoration  along  the  \nTuolumne and San Joaquin rivers in California. \nEnabled 26 million tCO2e \nemissions reductions through  \nfive  products \nFive of our products (Nest thermostats,  Google  \nEarth Pro, Solar API, fuel-efficient routing in Google \nMaps, and Green Light, which represent only a \nsubset of our efforts) enabled individuals, cities, \n \nand other partners to collectively reduce an \ne\nstimated 26 million metric tons of GHG emissions. \u200926 \nExpanded fuel-efficient routing \nworldwide \nAs of January 2025, fuel-efficient routing in Google \nMaps is available g lobally. \n-\nFuel-efficient routing in Google Maps.",
      "tion with AI: Accelerating Climate Action with AI \n\u2022  Device repairability:  Google & Repairability \n\ntion with AI: Accelerating Climate Action with AI \n\u2022  Device repairability:  Google & Repairability \nThe following table includes a detailed list of our sustainability policy engagements in 2024: \nGlobal and cross-cutting initiatives \nAdvanced   clean  electricity   technologies:  In 2023, Google published a  paper outlining how corporate clean energy buyers can accelerate clean energy  \ntechnologies by supporting favorable policies, signing long-term purchase agreements, and providing early-stage project funding. In 2024, we published an \nupdated version of this paper to include our detailed procurement criteria for carbon-free energy technologies. \nUnited Nations Framework Convention on Climate Change (UNFCCC) 29th Conference of the Parties (COP-29): Google participated in COP-29, in \nBaku, Azerbaijan, in over 150 engagements with officials and sustainability industry leaders, partners, and priority stakeholders. ",
      "ta centers \nCapacity of all contracted water replenishment \nprojects once fully implemented \nTrend  \n\nta centers \nCapacity of all contracted water replenishment \nprojects once fully implemented \nTrend  \nOur water stewardship projects replenished approximately 4.5 billion \ngallons of water (17 billion liters or 17 million cubic meters) in 2024 \nalone, increasing replenishment of our freshwater consumption from \n18% in 2023 to 64% in 2024.\n136  This was the result of both the continued \nsuccess of our existing projects and the implementation of new projects \nthat have further expanded our replenishment portfolio. \nDetails  \nWe set this ambition in 2021, and it covers water that\u2019s replenished as \na percentage of the amount of freshwater we consume each year at \nour offices and data centers (i.e., excluding seawater and reclaimed \nwastewater). We count replenishment benefits from projects that are \nactive within the watersheds that our operations rely on and that have \nconfirmed volumetric benefits from the reporting year. \n86",
      "ers near-real-time \nupdates on reservoir levels. \nAnd with $2.5 million in funding from Google.org, \n\ners near-real-time \nupdates on reservoir levels. \nAnd with $2.5 million in funding from Google.org, \nwe\u2019re supporting new AI-powered platforms to \nimprove water reuse in drought-prone regions like \nMexico and the Middle East. Because clean water \nisn\u2019t just about what you save\u2014it\u2019s also about what \nyou can safely use again. \nThe Global Water Watch tool. \n74",
      "13 21 29 44 \nComponents resold into the secondary market Million components 8.2 4.9 5.0 7.0 6.7 \n109\n\nWater \nGlobal \noperational Unit 2020 2021 2022 2023 2024 \nwater use \nMillion  Water  withdrawal 5,689 6,297 7,600 8,653 11,011 gallons \n   \n   \nMillion  Water dischar\nge 1,940 1,735 2,035 2,301 2,876 gallons \nWater  Million  3,749 4,562 5,565 6,352 8,135 consumption gallons \nFreshwater withdrawal from sources  \n\u2009163 Unit 2024 at risk of water depletion or scarcity\nLow risk of water depletion or scarcity % 72 \nMedium risk of water depletion or scarcity % 14 \nHigh risk of water depletion or scarcity % 14 \n2024 \nWater use by Water Water  W\nater data centers Unit withdrawal discharge consumption and offices \nMillion  Data centers 9,866 2,079 7,787 gallons \nOffices and Million  1,145 797 348 other facilities gallons \nMillion  Total 11,011 2,876 8,135 gallons \nFreshwater replenishment Unit 2022 2023 2024 \nFreshwater consumption Million gallons 4,770 5,601 7, 210 \nWater replenished Million gallons 271 1,036 4,590 \nWater replenished % 6 18 64 ",
      "s. To learn more, refer to our \ndata center locations and our office  locations. \nAbout this report \n\ns. To learn more, refer to our \ndata center locations and our office  locations. \nAbout this report \nGoogle\u2019s 2025 Environmental Report highlights how our technologies\u2014including cutting-edge AI and emerging research\u2014are driving progress for both \npeople and the planet. Throughout this report, we use the term \u201csustainability\u201d to refer to environmental sustainability. This report features data from our \n2024 fiscal year (January 1 to December 31, 2024), and mentions some notable achievements from 2025 to date. \nAdditional resources \n\u2022 Explore our 2025 Environmental Report\n\u2022 Sustainability.google\n\u2022 Sustainability reports\n\u2022 Sustainability blog \n\u2022 About Google \n\u2022 Google\u2019s commitments \n\u2022 Alphabet additional information: Environmental \n\u2022 Alphabet SASB and TCFD Index \n77",
      "pact by rigorously assessing factors like additionality, leakage, permanence, and verifiability. \n85\n\nWater and waste \nBeyond climate, we\u2019ve also set ambitions across other operational areas like water and waste. Many of the challenges and uncertainties described above \nalso relate to these ambitions, particularly for water replenishment and data center Zero Waste to Landfill, which are both connected to our data center \ncapacity delivery. \nWater replenishment \nWe aim to replenish 120% of the freshwater volume we consume, on average, across our offices and data \ncenters by 2030. \nIn 2024, our water stewardship projects replenished approximately 4.5 billion gallons of water (17 billion liters or 17 million cubic meters), or \nroughly 64% of our freshwater consumption. 135 \nGraph \nMillion gallons \n7 ,500 \n5,000 \n2,500 \n0 \n6% \n18% \n64% \n2022 2023 2024 \nLegend \nYear \nEstimated water replenished Total freshwater consumption for offices and \nGoogle-owned and -operated data centers \nCapacity of all contracted water replenishment \nprojects once fully implemented \nTrend  ",
      "mmission Joint Research Centre, Google launched  the Freshwater Ecosystems Explorer . This platform \n\nmmission Joint Research Centre, Google launched  the Freshwater Ecosystems Explorer . This platform \n Programme (UNEP)  enables all countries to freely measure and monitor freshwater resources (toward Sustainable Development Goal 6.6.1 ) as well as learn when and where \nsurface water is changing. In 2023, Google.org supported the UNEP International Methane Emissions Observatory  in developing a new AI-based automated \nmethane emission detection, alerting, and notification system. \n World Business Council for A member of the WBCSD since 2019, Google actively participates in initiatives related to improving well-being for both people and the planet\u2014including \n Sustainable Development (WBCSD) shifting diets, accelerating climate change standards and policy progress, and supporting regenerative agriculture. \nWorld Economic Forum  (WEF)  Google partners with WEF on various initiatives, including: the First Movers Coalition , the Chief Sustainability Leaders Community , Tech for Climate ",
      "Gmail, Drive, Docs, and more), Google Cloud, Search, and YouTube for billions of people around the  \n\nGmail, Drive, Docs, and more), Google Cloud, Search, and YouTube for billions of people around the  \nworld. And as we grow to serve more users globally, building new data center infrastructure is essential. \nTo operate smoothly, these facilities rely on cooling systems that frequently use water due to its energy  \nefficiency. This dependency highlights a critical balance between technological needs and responsible  \nenvironmental stewardship. In 2024, we consumed a total of approximately 8.1 billion gallons (31 billion liters \nor 31 million cubic meters) of water across our data centers (excluding those operated by third parties)  \nand offices. To put that consumption into perspective, that\u2019s about what it takes to irrigate 54 golf courses  \nannually, on average, in the southwestern United States.\n\u200966 Crucially, the majority of this consumption occurred \nin regions where water resources are abundant:  in 2024, 72% of our freshwater withdrawals came from  ",
      " \nA rainwater retention pond outside one of our data centers in \nthe Lowcountry, South Carolina. \n41\n\nReplenishing water \nA local approach to water stewardship \nWater stewardship isn\u2019t just about managing our consumption. It\u2019s also about ensuring that we give back \nmore than we take\u2014especially in regions that have a higher risk of water scarcity or depletion. That\u2019s why \nour water replenishment strategy focuses not only on replenishing more water than we consume, but also  \non improving water quality and ecosystem health in the communities where we operate. \nIn 2024, our water stewardship projects replenished approximately 4.5 billion gallons of water (17 \nbillion liters or 17 million cubic meters), roughly  64% of our 2024 freshwater consumption.\n\u200968  We added \n38 new water stewardship projects, increasing our total portfolio to 112 projects spanning 68 watersheds in \n2024 (Figure 7). Many of these projects go beyond replenishing water to also support watershed health by \nimproving water quality, biodiversity, and community co-benefits. "
    ]
  },
  {
    "question": "What was Google's total ambition-based carbon footprint in 2024?",
    "ground_truth": "11.5 million tCO2e",
    "answer": "I do not know",
    "contexts": [
      "Total electricity consumption across our data centers and offices \nGlobal average CFE percentage \n20\n\nCarbon reduction moonshot \nWe aim to reduce absolute, combined scope 1, 2 (market-based), and 3 emissions by 50% from a 2019 base \nyear by 2030. \nAmbition-based carbon footprint \nIn February 2025, the SBTi (Science Based Targets initiative) validated Alphabet\u2019s near-term science-based emissions reduction ambition based on our \ndata, company structure, and activities at that time, ensuring our ambition meets the most rigorous standards for emissions reductions and contributes to \nlimiting climate change.\n118 \nIn 2025, we adjusted the boundary for our carbon reduction and net-zero ambitions to exclude certain scope 3 emissions activities that are peripheral to \nour core operations or where our ability to influence emissions reductions is limited (Figure 13). Accordingly, we use the term \u201cambition-based\u201d to describe \nthe subset of emissions from our total carbon footprint that are within the boundaries we\u2019ve set for our climate ambitions. The boundary of our ambition-",
      " we used a \none month sample of observed machine power data from our entire TPU fleet, applying \n116\n\nGoogle\u2019s 2023 average fleetwide carbon intensity. To estimate embodied emissions from \nmanufacturing, transportation, and retirement, we performed a life-cycle assessment \nof the hardware. Data center construction emissions were estimated based on Google\u2019s \ndisclosed 2023 carbon footprint. These findings do not represent model-level emissions, \nnor are they a complete quantification of Google\u2019s AI emissions. Based on the TPU \nlocation of a specific workload, Compute Carbon Intensity (CCI) results of specific \nworkloads may vary.\n45 The figure represents the average percentage of Google\u2019s global compute resources that \nwere identified as recoverable and reallocated for more efficient use over this period as a \nresult of using AlphaEvolve.\n46 We estimated the expected annual generation based on our contracted clean energy, \napplying an average capacity factor. Actual generation may vary from the signed amounts \nbased on changes during construction or project terminations.",
      "agement and partnership \n98 Environmental data \n115 Certifications and recognitions \n116 Endnotes \n3\n\nIntroduction \nForeword \nAt Google, we\u2019re applying AI to transform how people engage with information across our core products and  \nplatforms, to enhance business and economic growth, to enable  scientific  breakthroughs, and to drive sustainable  \ninnovation for society. We\u2019re proud to release our tenth annual Environmental Report, which details how we\u2019re  \nworking to address the increased energy demands of AI to enable this positive impact, while also showcasing  \nhow AI can be used to build a more energy-efficient and resilient world. These three topics\u2014energy, AI, and  \nresilience\u2014are the key themes of this year\u2019s report. Within these pages, we detail our 2024 progress, offering  \nour perspective and insights from a year marked by unprecedented global change driven by AI, energy  \ndemand, policy, and more. \nEnergy \nWe reduced our data center energy emissions by  \n12%, even with growing energy demands. \n  \n \n \n \n \n \n \n \n \n \n \n \n \n \n  \n \n ",
      "iled \ninformation on our operations, our products, and our progress. We invite you to learn more. \n6\n\n2024 highlights \nThis section provides a snapshot of our highlights as of the end of 2024 and select highlights from the first \nhalf of 2025. \nReduced data center energy  \nemissions by 12% \nWe reduced our data center energy emissions by  \n12%, compared to 2023. We achieved this important \naccomplishment despite a 27% increase in our  \nelectricity consumption, demonstrating that our  \noperational decarbonization efforts are bearing fruit. \nThe Google solar field at our data center \nin St. Ghislain, Belgium. \nProcured over 8 GW of clean \nenergy \nWe signed contracts to purchase over 8 gigawatts \n(GW) of additional clean energy generation \u200923\u2014more \nthan in any prior year. \nDelfzijl wind farm in the Netherlands \n(63 MW for Google). \nPartnered to enable 1 GW of solar \nin Taiwan \nWe announced a partnership  with BlackRock\u2019s \nClimate Infrastructure business that will enable 1 GW  \nof new solar energy in Taiwan, advancing clean \nenergy for both the local electricity grid and our  ",
      " and offices, we increased \nour Google CFE percentage from 64% in 2022 and 2023 to 66% in 2024\n117\u2014 \n\n and offices, we increased \nour Google CFE percentage from 64% in 2022 and 2023 to 66% in 2024\n117\u2014 \ndespite significant growth in electricity demand over this period (which was \ndriven, in part, by AI). This was a result of increases in Contracted CFE and \noverall increases in global Grid CFE, specifically in North America where our \nenergy consumption is highest. \nOverall, we increased our Google CFE in over half of our grid regions that \ncontain Google-owned and -operated data centers, and achieved at least \n80% CFE in nine out of 20 of these grid regions in 2024. \nDetails  \nWe set this ambition in 2020. The load-weighted average of carbon-free \nenergy percentages across Google\u2019s global portfolio of data centers and \noffices is referred to as \u201cGoogle CFE.\u201d This metric is inclusive of third-party \ndata centers, and it represents the clean energy purchased to meet our \nelectricity needs at every hour of every day, and within every grid where we ",
      "ng transparent and comprehensive emissions reporting for our customers. \nCustomer carbon footprints \n\nng transparent and comprehensive emissions reporting for our customers. \nCustomer carbon footprints \nIn addition to equipping Cloud customers, we also provide tools to empower Google Workspace and Google Ads customers to measure, understand, and \nmanage the environmental impact of using our products: \n\u2022  Google  Workspace:  Our Google Workspace  carbon footprint report provides data on total and monthly carbon emissions based on the use \nof various Google Workspace applications. \n\u2022  Google  Ads: To help advertising customers measure their emissions from using Google advertising products, we now offer Carbon Footprint  \nfor Google Ads . This provides comprehensive carbon emissions reporting data aligned with the Greenhouse Gas Protocol and developed in \naccordance with the Global Media Sustainability Framework . The reports provide detailed breakouts  of scope 1, scope 2 (both market- and \nlocation-based), and scope 3 emissions\u2014allocated at the account level. \nResearchers and academics ",
      "y\u2014to help the banking sector harness the power of \ngeospatial analytics to support climate finance. \n\ny\u2014to help the banking sector harness the power of \ngeospatial analytics to support climate finance. \n\u2022  Build: We help developers take action to reduce the carbon footprint and cost of their applications in their use of Cloud. For example, we\u2019ve \ncreated a Carbon Sense suite so customers can accurately measure, report, and reduce their cloud carbon emissions (through Carbon  \nFootprint) with recommendations for carbon reduction actions (through  Region Picker, Carbon-free energy disclosure , and Active Assist ).  \nThe Carbon Sense suite has experienced significant adoption, with customers monitoring over 65% of total Google Cloud emissions as of the \nend of 2024. Enhancements to the suite included the addition of s cope 2 market-based emissions data, complementing the existing location-\nbased data, which underscores Google\u2019s aim of providing transparent and comprehensive emissions reporting for our customers. \nCustomer carbon footprints ",
      " 2024, we continued to navigate a complex global energy landscape. We achieved significant progress \n\n 2024, we continued to navigate a complex global energy landscape. We achieved significant progress \nby increasing our global  carbon-free energy percentage across our data centers and offices to 66% . \n\u200961  \nThis 2% increase compared to last year is particularly noteworthy given the 27% increase in our electricity \nconsumption to support our growing business, including AI. While this global average reflects strong \nprogress, our journey varied by region. In Asia Pacific, for instance, our regional average Google CFE was \n12%\u2014well below that of other regions, like 70% in North America and 92% in Latin America.\n\u200962 In response, \nwe\u2019re  advancing new paths for clean energy in Asia Pacific specifically, like solar aggregation and piloting \ninvestments in new clean energy projects. \nThis regional variability is a reminder of what makes 24/7 CFE so powerful, and so complex: it doesn\u2019t hide \nthe gaps. It shines a light on them. \nAccelerating new tools like T-EACs ",
      "2024 \nSolar API \nFuel-efficient routing \nGoogle Earth Pro \nNest thermostats Green Light \nLegend \n56 \n\n2024 \nSolar API \nFuel-efficient routing \nGoogle Earth Pro \nNest thermostats Green Light \nLegend \n56 \nRead more about the role each of these products  \nplayed in 2024 below: \n\u2022 Fuel-efficient routing: In 2024, we\nestimate that fuel-efficient routing enabled\nmore than 2.7 million metric tons of GHG\nemissions reductions\n\u200984\u2014equivalent to taking\napproximately 630,000 gasoline-powered  \ncars off the road for a year.\u200985 Want to dive\ndeeper into how this product feature is making\na tangible difference for drivers and the\nplanet? Explore the full story in  Fuel-efficient \nrouting: Driving smarter while saving more .\n-\nFuel-efficient routing",
      "s. To learn more, refer to our \ndata center locations and our office  locations. \nAbout this report \n\ns. To learn more, refer to our \ndata center locations and our office  locations. \nAbout this report \nGoogle\u2019s 2025 Environmental Report highlights how our technologies\u2014including cutting-edge AI and emerging research\u2014are driving progress for both \npeople and the planet. Throughout this report, we use the term \u201csustainability\u201d to refer to environmental sustainability. This report features data from our \n2024 fiscal year (January 1 to December 31, 2024), and mentions some notable achievements from 2025 to date. \nAdditional resources \n\u2022 Explore our 2025 Environmental Report\n\u2022 Sustainability.google\n\u2022 Sustainability reports\n\u2022 Sustainability blog \n\u2022 About Google \n\u2022 Google\u2019s commitments \n\u2022 Alphabet additional information: Environmental \n\u2022 Alphabet SASB and TCFD Index \n77",
      "en Building &  \nCommunity Award \nHonored \nin Health and Wellbeing category for \nGradient Canopy \n115\n\nEndnotes\n1 We use the term data center energy emissions to describe scope 1 and 2 (market-based) \nemissions that result from our Google data center operations.\n2 The total GW figure represents primarily PPAs, and includes some generation from \ntargeted clean energy investments where we also receive EACs. Actual generation \nmay vary from the signed amounts based on changes during construction or project \nterminations.\n3 The comparison is based on data from Portugal\u2019s Directorate-General for Energy and \nGeology from December 2024: Total renewable energy installed in 2024 was 20,777 MW.\n4 Refer to endnote 2 above.\n5 For details about the calculation, refer to the Methodology section in the Appendix.\n6 Refer to endnote 5 above.\n7 According to Google\u2019s platform-neutral measurement analyzed over a five-year period \nfrom 2019\u20132024.\n8 These calculations are based on internal data, as of March 2025. Google\u2019s TPU power ",
      "31  2024 \n(metric tons per gas type \nGHG emissions by type \nCH4 \nScope 1 \n5 \nScope 2 (market-based) \n\n31  2024 \n(metric tons per gas type \nGHG emissions by type \nCH4 \nScope 1 \n5 \nScope 2 (market-based) \n100 \nScope 2 (location-based) \n800 \nN2O \nHFCs \n1 \n14 \n32 \n13 \n100 \n13 \nScope 3 GHG emissions \n\u201cScope 3 GHG emissions\u201d are indirect emissions from other sources in Alphabet\u2019s value chain. Alphabet calculates the reported values \nin the Schedule of Select Environmental Metrics using methodologies from the Scope 3 Technical Guidance for the following categories \nidentified as relevant: \n\u25cf Category 1: Purchased goods and services \n\u25cf Category 2: Capital goods \n\u25cf Category 3: Fuel- and energy-related activities (not included in scope 1 or scope 2) \n\u25cf Category 4: Upstream transportation and distribution \n\u25cf Category 5: Waste generated in operations \n\u25cf Category 6: Business travel \n\u25cf Category 7: Employee commuting \n\u25cf Category 11: Use of sold products \nAlphabet evaluated the remaining categories using the Scope 3 Standard\u2019s relevance criteria and determined the following categories to ",
      "epresents  \none of the most consequential environmental  \ncontributions we can make for the planet. \n\nepresents  \none of the most consequential environmental  \ncontributions we can make for the planet. \nWhile we still have a long way to go toward our  \n1 GT aspiration, we\u2019re motivated by our progress  \nto date and the opportunity for real-world \nimpact at scale: In 2024 alone, just five of our \nproducts\u2014Nest thermostats, Google Earth \nPro, Solar API, fuel-efficient routing in Google \nMaps, and Green Light (which represent only \na subset of our efforts)\u2014enabled individuals, \ncities, and other partners to collectively \nreduce an estimated 26 million metric tons of \nGHG emissions\n\u200981 (Figure 9), roughly equivalent to \nthe emissions from the annual energy use of over \n3.5 million U.S. homes.\n\u200982 For context, Google\u2019s  \ntotal emissions in 2024 were 11.5 million tCO e.\u200983 \n2 \nFigure 9. Emissions reductions enabled by  \nfive Google products in 2024 \n30 \n20 \n10 \n0 \nMillion tCO2e \nYear \n2024 \nSolar API \nFuel-efficient routing \nGoogle Earth Pro \nNest thermostats Green Light \nLegend \n56 ",
      "Environmental \nReport \n2025",
      "tion with AI: Accelerating Climate Action with AI \n\u2022  Device repairability:  Google & Repairability \n\ntion with AI: Accelerating Climate Action with AI \n\u2022  Device repairability:  Google & Repairability \nThe following table includes a detailed list of our sustainability policy engagements in 2024: \nGlobal and cross-cutting initiatives \nAdvanced   clean  electricity   technologies:  In 2023, Google published a  paper outlining how corporate clean energy buyers can accelerate clean energy  \ntechnologies by supporting favorable policies, signing long-term purchase agreements, and providing early-stage project funding. In 2024, we published an \nupdated version of this paper to include our detailed procurement criteria for carbon-free energy technologies. \nUnited Nations Framework Convention on Climate Change (UNFCCC) 29th Conference of the Parties (COP-29): Google participated in COP-29, in \nBaku, Azerbaijan, in over 150 engagements with officials and sustainability industry leaders, partners, and priority stakeholders. ",
      "generated in \n2024. The estimated annual emissions reduction takes into account projects enabled by \n\ngenerated in \n2024. The estimated annual emissions reduction takes into account projects enabled by \nGoogle Earth prior to 2024 (dating back to 2020) to calculate the total impact in 2024 \nalone. Enabled emissions reductions estimates include inherent uncertainty due to factors \nthat include the lack of primary data and precise information about real-world actions \nand their effects to date, as well as forward-looking projections. Google is relying on \nits own substantiation of the enabled emissions-reduction impact, in consultation with \nmultiple third-party partners that have reviewed and support the methodology discussed \nherein. The data and claims have not been verified by an independent third-party. We will \ncontinue to work to refine our methodologies and inputs for these estimates.\n90 Estimated energy savings are calculated based on the average percentages for heating \nand cooling savings found in real-world studies of the Nest Learning Thermostat in the "
    ]
  },
  {
    "question": "Which AI-powered tool helps city traffic engineers optimize the timing of traffic lights?",
    "ground_truth": "Green Light",
    "answer": "Green Light",
    "contexts": [
      " \u201cScalable   Learning  of  Segment-Level  Traffic  Congestion   Functions ,\u201d arXiv, September 2024. \n\n \u201cScalable   Learning  of  Segment-Level  Traffic  Congestion   Functions ,\u201d arXiv, September 2024. \n\u2022  \u201cOn the Relationship of Speed Limit and CO 2 Emissions in Urban Traffic,\u201d SSRN, March 2024. \nNature \u2022  \u201cPatterns in Bird and Pollinator Occupancy and Richness in a Mosaic of Urban Office Parks Across Scales and Seasons ,\u201d  \nEcology and Evolution, March 2024.  \n\u2022  \u201cTo Crop or Not to Crop: Comparing Whole-Image and Cropped Classification on a Large Dataset of Camera Trap Images ,\u201d   \nThe Institution of Engineering and Technology, November 2024. \nPolicymakers \nPublic policy and advocacy \nPolicy measures and corporate commitments will continue to play an important role in driving emissions reductions in the next decade. \nWe\u2019ve shared sustainability policy positions on the following topics: \n\u2022  Carbon-free energy:  A Policy Roadmap for 24/7 Carbon-Free Energy \n\u2022  Climate action with AI: Accelerating Climate Action with AI \n\u2022  Device repairability:  Google & Repairability ",
      "ntial, reducing aviation\u2019s overall climate impact. \n63\n\nAI for extreme events \nand disaster response",
      "te more sustainable choices in everyone\u2019s daily lives. \n58 \n-\nFuel-efficient routing in Google Maps.\n\nGreen Light \nAI for more efficient city streets \nAnyone who\u2019s spent time in a major city knows the feeling: long periods sitting in traffic, bumper to bumper, \nwaiting for that light to turn green. But beyond the inconvenience, stop-and-go traffic has an environmental \ntoll. Emissions from idling cars, constant acceleration, and braking contribute to air pollution and fuel \nwaste\u2014and city intersections are a hotspot for this problem. \nWhile some amount of stop-and-go traffic is unavoidable, part of it is preventable through the optimization \nof traffic light timing. To improve this timing, cities need to either install costly hardware or run manual \nvehicle counts. Both of these solutions are expensive, and neither provides all the necessary information. \nSo what can cities do? The solution: Green Light , Google\u2019s AI-powered traffic optimization tool. \nGreen Light by Google \nGreen Light uses AI and Google Maps driving trends to optimize traffic light timing , ensuring that cars ",
      "ng to smarter shipping routes. \nAssembly in progress in a warehouse. \n53\n\nNew AI research \nsolutions",
      "ng to smarter shipping routes. \nAssembly in progress in a warehouse. \n53\n\nNew AI research \nsolutions\n\nNew AI research solutions \nContents \n56 1 gigaton aspiration: Unlocking climate action at scale \n58 Fuel-efficient routing: Driving smarter while saving more \n59 Green Light: AI for more efficient city streets \n60 Solar API: How we\u2019re democratizing solar power from rooftops to the grid \n62 Contrails: How AI can help mitigate the warming effects of aviation \nWe believe technology\u2014specifically AI\u2014has the potential to accelerate the changes we need to protect \npeople and the planet, and we\u2019re focusing on some surprising areas where AI is already making a real \ndifference today. \nSome of the most exciting innovations are happening in places you might never notice\u2014in the clouds \nformed behind airplanes, the timing of a traffic light at a busy city intersection, the route of your local \ncommute, and the untapped solar potential of your neighbor\u2019s rooftop. \nThe cutting-edge solutions we\u2019re developing and deploying in these areas represent enormous ",
      " Light uses AI and Google Maps driving trends to optimize traffic light timing , ensuring that cars \n\n Light uses AI and Google Maps driving trends to optimize traffic light timing , ensuring that cars \nspend less time idling and more time moving. It works by analyzing traffic flow at intersections, using data \nto recommend timing adjustments for red and green lights to reduce fuel-wasting stop-and-go traffic. The \nAI model looks at factors like traffic volume, vehicle speed, and intersection congestion to find the most \nefficient  traffic  light  schedules. \nIn cities where Green Light has been implemented, the results have been promising. Our analysis from  \nintersections implementing Green Light recommendations indicates the potential to reduce stops at  \nintersections by up to 30% and reduce emissions at intersections by an average of over 10%.\n\u200996 It\u2019s like giving \nthe city a smoother flow, without the need for costly infrastructure overhauls. \nReal-world results \nRecommendations from Green Light have been implemented across many intersections, helping to save  ",
      "is more  \nthan the total annual electricity consumption of\nPoland in 2023.\n\u200993 \n Nest thermostat \n57\n\nFuel-efficient routing \nDriving smarter while saving more \nLooking for information about how to reduce your environmental footprint when in transit, from heading to \nwork to picking up groceries? What if you learned that you could easily do just that\u2014while also optimizing \nyour fuel or energy use and saving money\u2014every time you drive? Thanks to AI-powered fuel-efficient   \nrouting in Google Maps, you can. \nWe\u2019ve taken the guesswork out of how to drive more efficiently by suggesting the route that gets you to \nyour destination in roughly the same time. Here\u2019s how it works: our AI models analyze factors like your \nvehicle\u2019s engine type, real-time traffic, and road conditions to pick the most fuel-efficient path. For example, \na diesel vehicle\u2019s efficiency is generally greatest in highway driving, while hybrid and electric vehicles tend \nto provide progressively greater efficiency in stop-and-go city driving and hilly driving where they benefit ",
      "full story in  Fuel-efficient \nrouting: Driving smarter while saving more .\n-\nFuel-efficient routing",
      "apable and energy efficient TPU yet, designed to power thinking, inferential AI models at scale. \n37",
      "ating potential sites and streamlining site design and construction estimates. And, on an annual  \n5\n\naccounting basis, we estimate that 0.6 million metric tons of GHG emissions reductions were enabled by \nsolar panels installed by our partners using the Solar API  in the United States in 2024.\u200916 \nIn transportation, two products enabled others to reduce over 2 million tCO 2e emissions. \nWe estimate that our AI-powered  fuel-efficient routing in Google Maps saved users fuel and cumulatively \nenabled more than 2.7 million metric tons of GHG emissions reductions in 2024 alone\u200917\u2014that\u2019s equivalent to  \ntaking approximately 630,000 gasoline-powered cars off the road for a year.\u200918 Google researchers also built \nGreen Light, an AI-based tool that helps city traffic engineers optimize the timing of traffic lights, which has  \nshown the potential to reduce stops at intersections by up to 30% and reduce emissions at intersections by an  \naverage of over 10%.\u200919 \nResilience \nOur innovative research is bolstering resilience  \nto protect communities, save lives, and reduce  "
    ]
  },
  {
    "question": "Which company did Google sign an agreement with to purchase nuclear energy from small modular reactors?",
    "ground_truth": "Kairos Power",
    "answer": "Kairos Power",
    "contexts": [
      "th increasing the energy efficiency of our data centers to help minimize our electricity demand. In \n\nth increasing the energy efficiency of our data centers to help minimize our electricity demand. In \n2024, the average annual PUE for our global fleet of data centers was 1.09, compared with the industry average of 1.56, meaning that Google data centers \nused 84% less overhead energy than the industry average.\n\u2009129  We\u2019ll continue to build on this progress by driving additional energy efficiency and flexibility \nmeasures in our data centers\u2014with a focus on our machine learning fleet. \nAfter efficiency, our next focus is on scaling our clean energy procurement across all regions: In 2024, we signed contracts to purchase over 8 GW of \nadditional clean energy generation130\u2014more than in any prior year. We\u2019re also using Google\u2019s engineering expertise and purchasing demand to  accelerate  \nthe commercialization of advanced CFE technologies and scale their climate impact, and advocating for energy policies that can unlock access to cost-",
      " learning and improvement, \nultimately leading to a more reliable and cost-effective technology. \n25\n\nThis agreement is important for several reasons: \n\u2022  Providing  \u201calways-on\u201d  energy: Nuclear solutions offer a clean, round-the-clock power source \nthat can help reliably meet electricity demands with carbon-free energy every hour of every day. \nAdvancing these power sources in close partnership with supportive local communities will help \nrapidly drive the decarbonization of electricity grids around the world. \n\u2022  Supporting AI demand: The grid needs new electricity sources to support AI technologies that are \npowering major scientific advances, improving services for businesses and customers, and driving \nnational competitiveness and economic growth. This agreement helps accelerate a new technology  \nto meet energy needs cleanly and reliably, and it unlocks the full potential of AI for everyone. \n\u2022  Benefiting  the  economy: Investing in advanced nuclear technology can provide direct economic  ",
      "deployment, and model new ways of doing business that others can follow. \n22 gigawatts and counting \n\ndeployment, and model new ways of doing business that others can follow. \n22 gigawatts and counting \nGoogle is one of the largest corporate purchasers of clean energy, and from 2010 to 2024, we signed \nmore than 170 agreements to purchase over 22 GW of clean energy generation,\n\u200955 similar to Portugal\u2019s \ntotal renewable energy in 2024.\u200956 These purchases include agreements for over 17.3 GW in North America, \nover 4.5 GW in Europe, over 400 MW in Latin America, and over 300 MW in Asia Pacific. \nIn the United States, we signed new deals in Arizona, Nebraska, and across the PJM grid region in the Mid-\nAtlantic. In Europe, we expanded our offshore wind portfolio in the Netherlands, signed new PPAs in Italy,  \nPoland, and Belgium, and are helping bring new onshore wind farms online across the region. In Asia Pacific,  \nwe advanced clean energy projects in Taiwan, Japan, Singapore, and India\u2014with  contract  structures  tailored  ",
      "particularly unique because they can't be achieved by us in isolation. Instead, they demand broader \n\nparticularly unique because they can't be achieved by us in isolation. Instead, they demand broader \necosystem-level change, which requires close collaboration with partners and other stakeholders to reach these crucial outcomes for the planet. \nClimate moonshots \nWe\u2019re at the halfway point of the decade, and we\u2019ve made meaningful progress. In 2024, we reduced our data center energy emissions by 12% due \nto new clean energy we brought online \u2014successfully decoupling our operational energy growth from its associated carbon emissions. We achieved \nat least 80% carbon-free energy on an hourly basis across nine out of 20 grid regions with Google-owned and -operated data centers. We\u2019ve \nsigned the world\u2019s first corporate agreements to purchase advanced geothermal and advanced nuclear energy from small modular reactors (SMRs), used \nAI to accelerate grid interconnections, created new rate structures  for large energy users to buy reliable power, shifted some compute tasks to reduce ",
      "urky signals into clear, actionable tools\u2014and helping communities \nprotect the planet. \n75\n\nAppendix\n\nAppendix \nContents \n77 About Google \n77 About this report \n78 Ambitions \n78 Climate moonshots \n86 Water and waste \n89 Governance and risk management \n90 Stakeholder engagement and partnership \n98 Environmental data \n115 Certifications and recognitions \n116 Endnotes \nAbout Google \nAs our founders explained in their first letter to shareholders, Google\u2019s goal is to \u201cdevelop services that significantly improve the lives of as many people  \nas possible.\u201d \nWe believe in the potential of technology to have a positive impact on the world. That unconventional spirit has been a driving force throughout our history, \ninspiring us to tackle big problems and invest in moonshots, such as our long-term opportunities in AI. We continue this work under the leadership of \nAlphabet and Google CEO Sundar Pichai. \nAlphabet is a collection of businesses\u2014the largest of which is Google. Google comprises two segments: Google Services and Google Cloud, and all ",
      "ngthen the resilience of our \nsupply chain. \nMinco II wind farm in Oklahoma (102 MW for Google). \n35\n\nAPAC\u2019s brighter future \nA solar solution in Taiwan \nOf course, even the most motivated suppliers can\u2019t switch to clean energy if it\u2019s not available. That\u2019s why \nGoogle isn\u2019t just supporting clean energy procurement\u2014we\u2019re helping create it. \nIn 2024, we announced an investment  to support the development of a 1 GW pipeline of new solar \nenergy in Taiwan, an investment that focuses on a region that plays a prominent role in global technology \nsupply chains. We expect to procure solar energy from these projects, and we may offer a portion of this \nclean energy to our semiconductor suppliers and manufacturers in the region so they can advance their \nown sustainability ambitions while helping reduce emissions in our shared supply chain. It\u2019s a model that \ngoes beyond carbon accounting to enable broader action\u2014removing barriers so others in our supply chain \ncan make better and cleaner choices too. ",
      "e then, from 2010 to 2024, we\u2019ve signed more than 170 agreements to purchase over 22 GW of clean \nen\n\ne then, from 2010 to 2024, we\u2019ve signed more than 170 agreements to purchase over 22 GW of clean \nen\nergy generation,2 similar to Portugal\u2019s total renewable energy in 2024.3 In 2024 alone, Google signed \ncontracts to purchase over 8 GW of additional clean energy generation 4\u2014the largest annual total in our history \nand twice the volume we contracted for the prior year. We\u2019ve maintained a 100% renewable energy match on a \nglobal basis every year since 2017, 5 and are going even further by pursuing our 24/7 carbon-free energy (CFE) \nambition (one of our climate moonshots). In 2024, we increased our 24/7 CFE percentage from 64% to 66%, 6 \na\nnd nine out of 20 grid regions with Google-owned and -operated data centers achieved at least 80% CFE. \nW\ne innovated across hardware and software to enable our data centers to deliver six times more \ncomputing power per unit of electricity than they did just five years ago. ",
      " for grid regions with Google-owned and -operated data  \ncenters64 \n32\n\nEnergy for our \nsupply chain",
      "troduction: Street View image of Redwood State and National Park, used with permission. \u00a92025 Google\n\ntroduction: Street View image of Redwood State and National Park, used with permission. \u00a92025 Google\nAge of AI: Street View image of the International Space Station, used with permission. \u00a92025 Google\nEnergy for our data centers: El Romero solar farm in Chile (80 MW for Google).\nEnergy for our supply chain: A technician scans hardware components, a critical step for tracking parts through every stage of the production process.\nResource efficiency: Clear waters reflect the beauty of our data center in Eemshaven, Netherlands.\nNew AI research solutions: The Solar API generates detailed rooftop data based on Google\u2019s extensive geospatial data and computing resources in order to evaluate rooftop solar energy potential.\nAI for extreme events and disaster response: A wide river basin during low water levels illustrates the type of flood-prone environment where flood forecasting is critical.",
      "a first-of-a-kind partnership to unlock new, clean power from a series of small modular nu clear  \n4\n\nreactors, which will be developed by Kairos Power. We also partnered with a clean energy startup to develop  \na geothermal power project in Nevada that\u2019s now contributing carbon-free energy to the electric grid. And a  \ncollaboration between Google,  Tapestry, and grid operator PJM aims to develop AI-driven data capabilities  \nfor a smarter, more reliable electricity system. It\u2019ll also speed up grid interconnection\u2014with the goal of making  \nelectricity more reliable and affordable for the 67 million people PJM serves in the United States. \nWe worked with our suppliers to accelerate their path to 100% clean electricity. \nWhile we\u2019re encouraged by our operational progress, obstacles to decarbonizing our supply chain remain. 9  \nBringing new clean energy online for Google and our suppliers is particularly difficult in the Asia-Pacific \nregion, where wind and solar resources aren\u2019t readily accessible in many markets. And though we\u2019ve ",
      "Rs are smaller than conventional nuclear reactors and designed to be manufactured in factories and  \n\nRs are smaller than conventional nuclear reactors and designed to be manufactured in factories and  \nassembled on-site. This modular design allows for faster construction, reduced costs, and greater flexibility \nin siting. SMRs also incorporate advanced safety features, often relying on passive safety systems that shut \ndown the reactor automatically in case of an emergency. \nIn 2024, we took a major step toward supporting this next generation of nuclear technology: we signed  \nthe world\u2019s first corporate agreement to purchase nuclear energy from multiple SMRs,   which will \nbe developed by Kairos Power. This agreement will bring up to 500 MW of clean energy to U.S. grids by \n2035\u2014the first reactor is expected to be operational by 2030, with additional deployments through 2035. \nKairos Power\u2019s SMR design uses a molten salt cooling system and a unique ceramic pebble fuel. This system ",
      " deliver six times more \ncomputing power per unit of electricity than they did just five years ago. \n\n deliver six times more \ncomputing power per unit of electricity than they did just five years ago. \nWe want to use energy in the most efficient way possible\u2014which is good for both our business and the \np\nlanet. Google data centers\u2014which power all of our products including Search, YouTube, Google Cloud, \nGemini, and more\u2014are some of the most efficient in the world. They deliver over six times more computing \np\nower per unit of electricity than they did just five years ago. 7 T his is in part thanks to pioneering hardware \ninnovations. As just one example, Google\u2019s seventh-generation Tensor Processing Unit (TPU), Ironwood, is \nnearly 30 times more power efficient than our first Cloud TPU from 2018.8 \nW\ne pushed the frontiers of advanced energ y development and grid optimization to ensure reliable, \nabundant power for everyone, and to fuel the next wave of innovation and economic growth. ",
      "eliable, \nabundant power for everyone, and to fuel the next wave of innovation and economic growth. \n\neliable, \nabundant power for everyone, and to fuel the next wave of innovation and economic growth. \nGoogle signed a first-of-a-kind partnership to unlock new, clean power from a series of small modular nu clear  \n4",
      "rom renewable sources (%) on an annual basis by dividing the MWhs of renewable electricity procured \n\nrom renewable sources (%) on an annual basis by dividing the MWhs of renewable electricity procured \n(i.e., through contractual instruments, on-site renewable electricity generation, and renewable electricity in the electric grids where \nfacilities are located) by the total MWhs of electricity consumed by Alphabet\u2019s global operations. Contractual instruments may include \n14 Alphabet is the parent holding company of Google. \n15 Flagship consumer devices are products that can provide their main functionality without connection to another product. For example, this \ngenerally doesn\u2019t include accessories such as cases. \n16 Network and end-user devices used to access web-based software are not considered to be direct-use phase emissions and are not within the \nreporting boundary for use of sold products. \n113",
      "nced geothermal plant in Nevada, a f irst-of-its-kind project developed in \npartnership with Google."
    ]
  },
  {
    "question": "What was the average annual power usage effectiveness (PUE) for Google's global fleet of data centers in 2024?",
    "ground_truth": "1.09",
    "answer": "1.09",
    "contexts": [
      "th increasing the energy efficiency of our data centers to help minimize our electricity demand. In \n\nth increasing the energy efficiency of our data centers to help minimize our electricity demand. In \n2024, the average annual PUE for our global fleet of data centers was 1.09, compared with the industry average of 1.56, meaning that Google data centers \nused 84% less overhead energy than the industry average.\n\u2009129  We\u2019ll continue to build on this progress by driving additional energy efficiency and flexibility \nmeasures in our data centers\u2014with a focus on our machine learning fleet. \nAfter efficiency, our next focus is on scaling our clean energy procurement across all regions: In 2024, we signed contracts to purchase over 8 GW of \nadditional clean energy generation130\u2014more than in any prior year. We\u2019re also using Google\u2019s engineering expertise and purchasing demand to  accelerate  \nthe commercialization of advanced CFE technologies and scale their climate impact, and advocating for energy policies that can unlock access to cost-",
      "e consumed from those grids became less  \ncarbon-intensive, helping us further reduce emissions. \n20\n\nEnergy efficiency \nOur long-standing energy efficiency efforts are just as \nimportant as our clean energy procurement. Striving \nto build and operate the world\u2019s most energy-efficient \ndata center infrastructure, as well as continuing to make  \nour offices more energy efficient, is a core strategy for \nminimizing our footprint. This means pursuing ways to  \nsqueeze more out of every watt of power we consume. \nWe outfit each data center with high-performance \nservers that are custom-designed to use as little energy \nas possible compared to the amount of compute they \nprocess. We continuously innovate within our facilities, \nimplementing smart temperature and lighting controls \nand redesigning power distribution systems to eliminate  \nenergy loss. And our sustained efforts have paid off. For  \nthe first time in six years, the average annual power \nusage effectiveness (PUE) for our global fleet of data \ncenters dropped below 1.10 to 1.09  (Figure 4). ",
      "e effectiveness (PUE) for our global fleet of data \ncenters dropped below 1.10 to 1.09  (Figure 4). \n\ne effectiveness (PUE) for our global fleet of data \ncenters dropped below 1.10 to 1.09  (Figure 4). \nWhile a PUE improvement of 0.01 might appear small, \nat the scale of our global data center operations, this \nefficiency gain avoids significant electricity consumption. \nThis means our global computing network requires  \nless electricity and produces fewer emissions than it \notherwise would have, yielding meaningful savings even  \nas our overall computing demands grow. \nO\nur data centers deliver over six times more computing power per unit of electricity than they did \njust five years ago.\u200953  Much of this improvement has come from deploying AI accelerators, such as our \nTPUs, the highly efficient computer chips we designed specifically for AI and machine-learning applications.\nFigure 4. Energy efficiency (PUE) across Google data centers \n2009 2010 2011 2012 2013 2014 2016 2017 2015 2018 2019 2020 2021 2022 2023 2024 \n1.20 \n1.18 \n1.16 \n1.14 \n1.12 \n1.10 \n1.08 \n0 \nPUE \nYe a r ",
      " for grid regions with Google-owned and -operated data  \ncenters64 \n32\n\nEnergy for our \nsupply chain",
      "argest of which is Google. Google comprises two segments: Google Services and Google Cloud, and all \n\nargest of which is Google. Google comprises two segments: Google Services and Google Cloud, and all \nnon-Google businesses are referred to collectively as Other Bets. Supporting these businesses, we have centralized certain AI-related research and \ndevelopment. Google Services\u2019 core products and platforms include ads, Android, Chrome, devices, Gmail, Google Drive, Google Maps, Google Photos, \nGoogle Play, Search, and YouTube. Our devices include Fitbit, Google Nest, and Google Pixel devices. Our Google Cloud products include Google Cloud \nPlatform and Google Workspace. \nOur headquarters are located in Mountain View, California. We own and lease office facilities and data centers around the world, primarily in Asia, Europe, \nand North America. In 2024, Google had offices and data centers on six continents, in over 200 cities, across nearly 60 countries. To learn more, refer to our \ndata center locations and our office  locations. \nAbout this report ",
      " and offices, we increased \nour Google CFE percentage from 64% in 2022 and 2023 to 66% in 2024\n117\u2014 \n\n and offices, we increased \nour Google CFE percentage from 64% in 2022 and 2023 to 66% in 2024\n117\u2014 \ndespite significant growth in electricity demand over this period (which was \ndriven, in part, by AI). This was a result of increases in Contracted CFE and \noverall increases in global Grid CFE, specifically in North America where our \nenergy consumption is highest. \nOverall, we increased our Google CFE in over half of our grid regions that \ncontain Google-owned and -operated data centers, and achieved at least \n80% CFE in nine out of 20 of these grid regions in 2024. \nDetails  \nWe set this ambition in 2020. The load-weighted average of carbon-free \nenergy percentages across Google\u2019s global portfolio of data centers and \noffices is referred to as \u201cGoogle CFE.\u201d This metric is inclusive of third-party \ndata centers, and it represents the clean energy purchased to meet our \nelectricity needs at every hour of every day, and within every grid where we ",
      "Total electricity consumption across our data centers and offices \nGlobal average CFE percentage \n20",
      "leet-wide PUE across  PUE 1.10 1.1 0 1.10 1.10 1.09 Google-owned and -operated data center campuses \n\nleet-wide PUE across  PUE 1.10 1.1 0 1.10 1.10 1.09 Google-owned and -operated data center campuses \nWaste \nWaste generation Unit 2020 2021 2022 2023 2024 \nData centers \nWaste  diverted Metric tons 18,000 34,500 27, 800 35,100 39,100 \nWaste disposed Metric tons 3,700 6,800 6,000 5,900 7,400 \nSubtotal waste generated Metric tons 21,700 41,300 33,800 41,000 46,500 \nWaste diversion rate % 83 83 82 85 84 \nOffices\u2009161 \nWaste  diverted Metric tons 6,900 1,200 4,900 8,600 10,100 \nWaste disposed Metric tons 2,900 700 1,600 2,600 1,900 \nSubtotal waste generated Metric tons 9,800 1,900 6,500 11,200 12,000 \nWaste diversion rate % 71 64 75 77 84 \nTotal \nWast\ne  diverted Metric tons 24,900 35,700 32,700 43,700 49,200 \nWaste disposed Metric tons 6,600 7,500 7,600 8,500 9,300 \nTotal waste generated Metric tons 31,500 43,200 40,300 52,200 58,500 \nTotal waste diversion rate % 79 83 81 84 84 ",
      " deliver six times more \ncomputing power per unit of electricity than they did just five years ago. \n\n deliver six times more \ncomputing power per unit of electricity than they did just five years ago. \nWe want to use energy in the most efficient way possible\u2014which is good for both our business and the \np\nlanet. Google data centers\u2014which power all of our products including Search, YouTube, Google Cloud, \nGemini, and more\u2014are some of the most efficient in the world. They deliver over six times more computing \np\nower per unit of electricity than they did just five years ago. 7 T his is in part thanks to pioneering hardware \ninnovations. As just one example, Google\u2019s seventh-generation Tensor Processing Unit (TPU), Ironwood, is \nnearly 30 times more power efficient than our first Cloud TPU from 2018.8 \nW\ne pushed the frontiers of advanced energ y development and grid optimization to ensure reliable, \nabundant power for everyone, and to fuel the next wave of innovation and economic growth. ",
      "ogle-owned and -operated data centers (refer to the Environmental metrics data tables for details). \n\nogle-owned and -operated data centers (refer to the Environmental metrics data tables for details). \nWhat\u2019s most important is forward progress. \nAnd while we\u2019re making meaningful strides toward this moonshot, progress is uneven across regions. As the table below illustrates, North America, \nEurope, and Latin America are showing improvements, but the Asia-Pacific region largely remains undersupplied with carbon-free energy. \nYear-on-year progress \nRegional average Google CFE across Google data center grid regions Unit 2022 2023 2024 \nNorth America % 69 68 70 \nUnited States % 69 68 70 \n Canada & Mexico \u2009116 % 96 96 88 \nEurope, Middle East, & Africa % 76 83 83 \nEurope % 76 84 84 \nMiddle East & Africa % 3 4 5 \nLatin America % 90 91 92 \nAsia Pacific % 11 12 12 \nGlobal CFE across Google data centers % 64 64 66 \nTrend \nFor our global average across our data centers and offices, we increased \nour Google CFE percentage from 64% in 2022 and 2023 to 66% in 2024\n117\u2014 ",
      "s. To learn more, refer to our \ndata center locations and our office  locations. \nAbout this report \n\ns. To learn more, refer to our \ndata center locations and our office  locations. \nAbout this report \nGoogle\u2019s 2025 Environmental Report highlights how our technologies\u2014including cutting-edge AI and emerging research\u2014are driving progress for both \npeople and the planet. Throughout this report, we use the term \u201csustainability\u201d to refer to environmental sustainability. This report features data from our \n2024 fiscal year (January 1 to December 31, 2024), and mentions some notable achievements from 2025 to date. \nAdditional resources \n\u2022 Explore our 2025 Environmental Report\n\u2022 Sustainability.google\n\u2022 Sustainability reports\n\u2022 Sustainability blog \n\u2022 About Google \n\u2022 Google\u2019s commitments \n\u2022 Alphabet additional information: Environmental \n\u2022 Alphabet SASB and TCFD Index \n77",
      "ity courses, internal newsletters, campaigns, and websites. \nEmployee commuting and business travel \n\nity courses, internal newsletters, campaigns, and websites. \nEmployee commuting and business travel \nOur transportation team supports sustainable commuting options to help Googlers get to work\u2014like offering shuttles and encouraging carpooling, \npublic transit, biking, and walking. We strive to provide electric vehicle charging stations for 10% of the total parking spaces at our San Francisco Bay Area \nheadquarters, and we continue to work toward this design standard for new development projects. As of 2024, we\u2019ve installed more than 6,000 electric \nvehicle charging ports at our offices in the United States and Canada. Google also offers commuter shuttles to many of its campuses to reduce individual \nvehicle commuting. On average, in 2024, electric vehicles comprised 24% of our commuter \u201cGCab\u201d fleet in India. \nWe\u2019re also working to reduce the impact of our employees\u2019 business travel by exploring ways to make air travel less carbon-intensive and supporting ",
      "7 2015 2018 2019 2020 2021 2022 2023 2024 \n1.20 \n1.18 \n1.16 \n1.14 \n1.12 \n1.10 \n1.08 \n0 \nPUE \nYe a r \n\n7 2015 2018 2019 2020 2021 2022 2023 2024 \n1.20 \n1.18 \n1.16 \n1.14 \n1.12 \n1.10 \n1.08 \n0 \nPUE \nYe a r \nFleet-wide trailing 12-month PUE Legend \n21 \nThe server floor in our data center in Hamina, Finland."
    ]
  },
  {
    "question": "What percentage of freshwater withdrawals came from sources at low risk of water depletion or scarcity in 2024?",
    "ground_truth": "72%",
    "answer": "72%",
    "contexts": [
      "he reported \npercentages are based on sources (which can include watersheds) at risk for both water \n\nhe reported \npercentages are based on sources (which can include watersheds) at risk for both water \nscarcity or depletion. The scope of the metric remains unchanged.\n164 Unless otherwise specified, water withdrawals are potable water.\n165 Refer to endnote 66 above.\n166 Air-cooled facility.\n167 For more details, refer to the Google Data Centers Location website.\n168 Refer to endnote 166 above.\n169 Refer to endnote 164 above.\n170 Refer to endnote 66 above.\n171 Refer to endnote 166 above.\n172 Refer to endnote 166 above.\n173 Refer to endnote 166 above.\n174 Refer to endnote 167 above.\n175 Refer to endnote 166 above.\n176 Refer to endnote 166 above.\n177 Refer to endnote 166 above.\n178 We\u2019ll also pursue this for our data center in Hanau, Germany, which became operational in \n2024.\n179 Refer to endnote 178 above.\n180 Refer to endnote 178 above.\nPhoto details\nOn the cover/Introduction: Street View image of Redwood State and National Park, used with permission. \u00a92025 Google",
      "s don\u2019t  \nfall all at once, and the right tools can help stop a chain reaction before it begins. \n73\n\nSurfacing solutions \nSafeguarding the world\u2019s vital freshwater and  \nocean resources \nThe story doesn\u2019t end with forests. The intricate networks of rivers, lakes, wetlands, and oceans are the \nplanet\u2019s circulatory system, and they too are under immense strain. Pollution, overuse, and the impacts of a \nchanging planet are taking a toll. \nThrough partnerships with scientists, governments, and NGOs, we\u2019re building tools that help protect these \nessential systems. Whether it\u2019s monitoring reservoirs in near real time or tracking illegal fishing halfway \nacross the globe, we\u2019re working to bring critical insights to light, so action can follow. \nMapping the world\u2019s freshwater \nFreshwater ecosystems support millions of species and billions of people. But many of them are poorly \nmonitored, especially in regions where data is scarce or outdated. \nGiven this reality, we teamed up with the United Nations Environment Programme and DHI to build the ",
      "n \nliters or 17 million cubic meters) in 2024 alone, \nroughly 64% of our freshwater consumption.\n\u200925\n\nn \nliters or 17 million cubic meters) in 2024 alone, \nroughly 64% of our freshwater consumption.\n\u200925\nMulti --benefit   floodplain   restoration  along  the  \nTuolumne and San Joaquin rivers in California. \nEnabled 26 million tCO2e \nemissions reductions through  \nfive  products \nFive of our products (Nest thermostats,  Google  \nEarth Pro, Solar API, fuel-efficient routing in Google \nMaps, and Green Light, which represent only a \nsubset of our efforts) enabled individuals, cities, \n \nand other partners to collectively reduce an \ne\nstimated 26 million metric tons of GHG emissions. \u200926 \nExpanded fuel-efficient routing \nworldwide \nAs of January 2025, fuel-efficient routing in Google \nMaps is available g lobally. \n-\nFuel-efficient routing in Google Maps.",
      "ta centers \nCapacity of all contracted water replenishment \nprojects once fully implemented \nTrend  \n\nta centers \nCapacity of all contracted water replenishment \nprojects once fully implemented \nTrend  \nOur water stewardship projects replenished approximately 4.5 billion \ngallons of water (17 billion liters or 17 million cubic meters) in 2024 \nalone, increasing replenishment of our freshwater consumption from \n18% in 2023 to 64% in 2024.\n136  This was the result of both the continued \nsuccess of our existing projects and the implementation of new projects \nthat have further expanded our replenishment portfolio. \nDetails  \nWe set this ambition in 2021, and it covers water that\u2019s replenished as \na percentage of the amount of freshwater we consume each year at \nour offices and data centers (i.e., excluding seawater and reclaimed \nwastewater). We count replenishment benefits from projects that are \nactive within the watersheds that our operations rely on and that have \nconfirmed volumetric benefits from the reporting year. \n86",
      "85% 85% 82% \nYe a r \nLegend Percentage of food waste diverted from landfill \nPercentage \n50\n25 \nYear",
      "13 21 29 44 \nComponents resold into the secondary market Million components 8.2 4.9 5.0 7.0 6.7 \n109\n\nWater \nGlobal \noperational Unit 2020 2021 2022 2023 2024 \nwater use \nMillion  Water  withdrawal 5,689 6,297 7,600 8,653 11,011 gallons \n   \n   \nMillion  Water dischar\nge 1,940 1,735 2,035 2,301 2,876 gallons \nWater  Million  3,749 4,562 5,565 6,352 8,135 consumption gallons \nFreshwater withdrawal from sources  \n\u2009163 Unit 2024 at risk of water depletion or scarcity\nLow risk of water depletion or scarcity % 72 \nMedium risk of water depletion or scarcity % 14 \nHigh risk of water depletion or scarcity % 14 \n2024 \nWater use by Water Water  W\nater data centers Unit withdrawal discharge consumption and offices \nMillion  Data centers 9,866 2,079 7,787 gallons \nOffices and Million  1,145 797 348 other facilities gallons \nMillion  Total 11,011 2,876 8,135 gallons \nFreshwater replenishment Unit 2022 2023 2024 \nFreshwater consumption Million gallons 4,770 5,601 7, 210 \nWater replenished Million gallons 271 1,036 4,590 \nWater replenished % 6 18 64 ",
      " by the Intergovernmental Panel on Climate Change (IPCC) and the Network for Greening the Financial \n\n by the Intergovernmental Panel on Climate Change (IPCC) and the Network for Greening the Financial \nSystem (NGFS). We considered acute and chronic physical risks (e.g., heat stress, water stress, and extreme weather events), as well as risks associated \nwith transitioning to a low-carbon economy (e.g., energy costs, future regulations, and technology). We also assessed climate-related opportunities (e.g., \ndeveloping low-carbon products and services, improving energy efficiency, and advancing energy technologies). For more details, refer to our CDP Climate \nChange Response. \nWater-related risks \nTo identify and assess water-related risks in our direct operations, Google annually undertakes a water risk assessment of our data centers and offices to \nidentify potential water-related risks and opportunities for water stewardship action and risk mitigation. Indicators from available risk assessment tools, ",
      "Environmental \nReport \n2025",
      "ee to five years to evaluate water risks that may require mitigation. We also use this framework to \n\nee to five years to evaluate water risks that may require mitigation. We also use this framework to \ninform our water replenishment efforts, by prioritizing replenishment in locations with higher risk. \nTo identify and assess water-related risks in our supply chain, we\u2019ve conducted a supply chain water use analysis and a supplier risk assessment using WRI\u2019s \nAqueduct Water Risk Atlas, WWF\u2019s Water Risk Filter, and WULCA AWARE. The key risks identified included baseline water stress, flood risk, access to safe \ndrinking water, and the level of sanitation and hygiene services. \n89",
      " regions where water resources are abundant:  in 2024, 72% of our freshwater withdrawals came from  \n\n regions where water resources are abundant:  in 2024, 72% of our freshwater withdrawals came from  \nsources at low risk of water depletion or scarcity.\u200967 \nEnter Google\u2019s  climate-conscious cooling strategy, our multidimensional methodology for choosing cooling  \nsystems for our data center campuses. This approach recognizes that water is the most efficient means of  \ncooling in many places and, when used responsibly, water cooling can play an important role in reducing  \nemissions. So, at each data center campus, we look at balancing the availability of carbon-free energy and  \nresponsibly sourced water to minimize the net climate impact both today and in the future. \nClimate-conscious cooling in the United Kingdom \nThe area surrounding our new data center location in Waltham Cross in the United Kingdom receives water  \nfrom sources along the Lea and Thames valleys, which are under stress from recent severe drought events. \n40"
    ]
  },
  {
    "question": "Which metric quantifies an AI accelerator chip's carbon emissions per unit of computation?",
    "ground_truth": "Compute Carbon Intensity (CCI)",
    "answer": "Compute Carbon Intensity (CCI)",
    "contexts": [
      "e training an \nAI model. CCI includes both estimates of lifetime embodied and operational emissions \n\ne training an \nAI model. CCI includes both estimates of lifetime embodied and operational emissions \nin order to understand the impact of improved chip design on our TPUs. In this study, we \nhold the impact of carbon-free energy on carbon intensity constant across generations, \nby using Google's 2023 average fleetwide carbon intensity. We did this purposefully to \nremove the impact of deployment location on the results.\n44 A February 2025 Google case study quantified the full lifecycle emissions of TPU \nhardware as a point-in-time snapshot across Google\u2019s generations of TPUs. To estimate \noperational emissions from electricity consumption of running workloads, we used a \none month sample of observed machine power data from our entire TPU fleet, applying \n116",
      " January 2024 to \nDecember 2024 in this analysis. These findings are a point-in-time measurement of \n\n January 2024 to \nDecember 2024 in this analysis. These findings are a point-in-time measurement of \nthe annual emissions of the Solar API, and may vary as the Solar API model continues \ndeployment. This analysis has not been third-party verified or validated.\n35 This estimate is based on our internal analysis comparing the BFLOAT16 / INT8 model step \ntime ratio measured on the MLPerf 3.1 GPT-3 175B model. The results (11,798ms / 8,431ms \n= 139%) can be interpreted as a 39% speed improvement and, in turn, training efficiency.\n36 \u201c Gemini 1.5: Unlocking Multimodal Understanding Across Millions of Tokens of Context,\u201d \nGoogle, 2024.\n37 Refer to endnote 8 above.\n38 This calculation is based on internal data, as of May 2024.\n39 Refer to endnote 8 above.\n40 This calculation is based on internal data, as of April 2025.\n41 According to \u201cWhat NVIDIA\u2019s New Blackwell Chip Says About AI\u2019s Carbon Footprint \nProblem,\u201d NVIDIA compared the total power needed to train the latest ultra-large AI ",
      " we used a \none month sample of observed machine power data from our entire TPU fleet, applying \n116\n\nGoogle\u2019s 2023 average fleetwide carbon intensity. To estimate embodied emissions from \nmanufacturing, transportation, and retirement, we performed a life-cycle assessment \nof the hardware. Data center construction emissions were estimated based on Google\u2019s \ndisclosed 2023 carbon footprint. These findings do not represent model-level emissions, \nnor are they a complete quantification of Google\u2019s AI emissions. Based on the TPU \nlocation of a specific workload, Compute Carbon Intensity (CCI) results of specific \nworkloads may vary.\n45 The figure represents the average percentage of Google\u2019s global compute resources that \nwere identified as recoverable and reallocated for more efficient use over this period as a \nresult of using AlphaEvolve.\n46 We estimated the expected annual generation based on our contracted clean energy, \napplying an average capacity factor. Actual generation may vary from the signed amounts \nbased on changes during construction or project terminations.",
      "ntial, reducing aviation\u2019s overall climate impact. \n63\n\nAI for extreme events \nand disaster response",
      "rbon Footprint \nProblem,\u201d NVIDIA compared the total power needed to train the latest ultra-large AI \n\nrbon Footprint \nProblem,\u201d NVIDIA compared the total power needed to train the latest ultra-large AI \nmodels using the new Blackwell GPUs (4 megawatts) to the power required with older \nGPUs (15 megawatts) and found the new GPUs use roughly 25% of the power (or 75% \nless) of the older ones.\n42 \u201cNVIDIA Blackwell Platform Arrives to Power a New Era of Computing,\u201d NVIDIA, March \n2024.\n43 To measure emissions relative to computational performance and enable apples-to-\napples comparisons between chips, we developed a new metric\u2014Compute Carbon \nIntensity (CCI)\u2014that we believe can enable greater transparency and innovation across \nthe industry. CCI quantifies an AI accelerator chip\u2019s carbon emissions per unit of \ncomputation (measured in grams of CO2e per Exa-FLOP). Lower CCI scores mean lower \nemissions from the AI hardware platform for a given AI workload\u2014for example training an \nAI model. CCI includes both estimates of lifetime embodied and operational emissions ",
      "Environmental \nReport \n2025\n\nContents \n4 Introduction \n4 Foreword \n7 2024 highlights \n9 G\nlobal challenges and dependencies \n10 Age of AI \n12 Powering prosperity: The economic upside of AI and the energy required   \nto power it \n13 Optimal scenario: AI\u2019s net-positive potential \n14 AI efficiency gains: Improvements across models, TPUs, and infrastructure \n16 Piece of the puzzle: Situating AI in our overall electricity growth \n17 Energy for our data centers \n19 Scaling smarter: Successfully reducing our data center energy emissions \n22 Powering today: Our record year for clean energy \n24 Powering tomorrow: Accelerating advanced energy sources \n27 Flexible future: Demand response to enable smarter electricity grids \n29 Ambitious vision, complex reality: Our efforts to decarbonize global grids \n33 Energy for our supply chain \n35 Supplier synergy: Shared tools, partnerships, and clean energy agreements \n36 APAC\u2019s brighter future: A solar solution in Taiwan ",
      "to \ncomplete the same task\n\u200941 and are 25 times as energy efficient compared to NVIDIA H100. \u200942 \n14\n\nIn 2025, we published a first-of-its-kind  study on the lifetime emissions of our TPU hardware \u2014from raw \nmaterial extraction and manufacturing to energy consumption during operation. The results?  A threefold  \nimprovement in the Compute Carbon Intensity \u200943  of our TPU chips over four years, from TPU v4 to \nTrillium\u200944  (Figure 1). Newer generations of TPUs like Trillium provide cutting-edge performance while \ngenerating fewer carbon emissions for the same AI workload. \nFigure 1. Generational trends of AI hardware life-cycle emissions intensity show a threefold  \nimprovement over four years \nv4i v4 v5e v5p Trillium \n2020 2022 2023 2024 \n500 \n400 \n300 \n200 \n100 \n0 \nCompute carbon intensity (g CO2 /EFLOP) \n3x \nimprovement \nIndirect emissions from manufacturing \nIndirect emissions from energy use \nIndirect emissions from transportation Indirect emissions from data center construction \nDirect emissions from energy use Legend \nInfrastructure "
    ]
  },
  {
    "question": "What is the name of Google's first fully hybrid reasoning AI model?",
    "ground_truth": "Gemini 2.5 Flash",
    "answer": "Gemini 2.5 Flash",
    "contexts": [
      "urky signals into clear, actionable tools\u2014and helping communities \nprotect the planet. \n75\n\nAppendix\n\nAppendix \nContents \n77 About Google \n77 About this report \n78 Ambitions \n78 Climate moonshots \n86 Water and waste \n89 Governance and risk management \n90 Stakeholder engagement and partnership \n98 Environmental data \n115 Certifications and recognitions \n116 Endnotes \nAbout Google \nAs our founders explained in their first letter to shareholders, Google\u2019s goal is to \u201cdevelop services that significantly improve the lives of as many people  \nas possible.\u201d \nWe believe in the potential of technology to have a positive impact on the world. That unconventional spirit has been a driving force throughout our history, \ninspiring us to tackle big problems and invest in moonshots, such as our long-term opportunities in AI. We continue this work under the leadership of \nAlphabet and Google CEO Sundar Pichai. \nAlphabet is a collection of businesses\u2014the largest of which is Google. Google comprises two segments: Google Services and Google Cloud, and all ",
      " at scale. \n72 \n\u2019\nGoogle\u2019s AI models identify animal sp ecies by analyzing photos from camera traps.",
      "ficiency by 39% on Cloud TPU v5e .\n\u200935 Gemini 2.5 Flash is our first fully hybrid reasoning model , \n\nficiency by 39% on Cloud TPU v5e .\n\u200935 Gemini 2.5 Flash is our first fully hybrid reasoning model , \ngiving developers the ability to turn thinking on or off. The model also allows developers to set thinking \nbudgets to find the right tradeoff between quality, cost, and latency. \nFor model deployment and usage, we\u2019ve improved underlying ML efficiency through pioneering \ntechniques like blockwise parallel decoding , improved  confidence-based  deferral, and speculative  \ndecoding that reduce the inference times of LLMs, allowing them to generate responses more quickly. \nThese improvements are used across Google products and set a standard throughout the industry. \nInitiatives like these have led to generational model efficiency gains. For example, Google\u2019s Gemini 1.5 Pro  \ndelivers  dramatic improvements and achieves comparable quality to Gemini 1.0 Ultra while using less compute.\u200936 \nTPUs ",
      " that use technology and data, especially AI and machine learning, to support the creation of free, \n\n that use technology and data, especially AI and machine learning, to support the creation of free, \nopen-sourced tools and datasets for the global community. As of the end of 2024, we\u2019ve provided more than $75 million to social impact organizations \nfor projects that use AI to build a more sustainable world, primarily through the Google.org Impact Challenge on Climate Innovation, AI for the Global  \nGoals, and the Google.org Accelerator: Generative AI, as well as through other funding initiatives and opportunities. We\u2019re also supporting AI for scientific \nbreakthroughs through the Google.org AI and Science Fund, which will provide $20 million in funding to support academic and nonprofit organizations \naround the world using AI to address complex problems at the intersections of different disciplines of science. \nCollaborating with others ",
      "apable and energy efficient TPU yet, designed to power thinking, inferential AI models at scale. \n37",
      "analytical and predictive capabilities of AI could help untangle  \nthese complexities. \n9\n\nAge of AI",
      "ier, faster, and smarter\u2014and it\u2019s working. \n13 \nVisual of potential solar capacity in the Solar API.\n\nAI efficiency gains \nImprovements across models, TPUs, and infrastructure \nAs a company, we consider it an imperative to pursue AI responsibly\u2014to innovate and deliver widely \naccessible benefits to people and society, while mitigating environmental impacts. We\u2019ll continue to \noptimize our models and hardware, pursue infrastructure efficiencies, and procure clean energy to minimize \nthe overall impact and resource demands of AI. \nModels \nGoogle has long been at the forefront of AI and machine learning, evolving years of deep learning research \ninto techniques that make training faster and more efficient\u2014enabling models that are higher quality, faster, \nand less compute-intensive to serve. \nWe\u2019ve sped up AI model training through techniques like quantization, boosting large-language model  \ntraining efficiency by 39% on Cloud TPU v5e .\n\u200935 Gemini 2.5 Flash is our first fully hybrid reasoning model , "
    ]
  },
  {
    "question": "How many days in advance can Google's Flood Hub predict riverine floods?",
    "ground_truth": "Up to seven days",
    "answer": "up to seven days in advance",
    "contexts": [
      "el and is crucial for anticipatory action . \nFigure 12. Flood Hub view showing extended coverage \n69\n\nFlood forecasting \nA visual showcase of Google Flood Hub. \nMaking an impact on the ground \nIn 2024, we generated more than 1,100 crisis alerts that shared critical flood information,  including  \nmappings of estimated flooded areas, which were viewed by more than 33 million users. These alerts \ngive people the vital information they need to act before a crisis hits. \nTake Brazil, for instance. Aid organizations including World Vision Brazil and its local partners used our \nflood forecasts to predict the regions that would be affected by floods and quickly deliver child protection \nservices, distribute direct assistance, and provide essentials\u2014such as drinking water, food baskets, and \nbedding kits\u2014in less than two days. \nAnd in countries like Nigeria and Bangladesh, Google.org supported nonprofits like GiveDirectly and the \nInternational Rescue Committee to distribute pre-emptive cash assistance , helping families prepare, \nboosting their resilience, and shortening recovery time. ",
      "sh assistance , helping families prepare, \nboosting their resilience, and shortening recovery time. \n\nsh assistance , helping families prepare, \nboosting their resilience, and shortening recovery time. \nNew tools for a global problem \nFor most of history, accurate flood forecasting at scale wasn\u2019t possible due to the complexity of the \nproblem and lack of resources and data. Given that only a small percentage of the world\u2019s rivers are \nequipped with streamflow gauges, this provided an extra barrier to safety for people in developing \ncountries as well as in underserved and vulnerable communities. \nTo fill the gaps in data, we\u2019ve introduced \u201cvirtual gauges\u201d\u2014AI-driven estimates of water levels in regions \nwithout physical flood sensors. This means we\u2019re able to use AI-based forecasting to improve forecasts in \nregions in Africa and Asia to a similar quality as those currently available in Europe. \nAs the effects of climate change become more severe, floods could strike in increasingly unexpected ",
      "ow we predict weather \n69 Seven-day lead time: How AI is giving flood-prone communities time to act \n\now we predict weather \n69 Seven-day lead time: How AI is giving flood-prone communities time to act \n71 Protecting the planet with our AI products \n73 Forests in focus: Empowering the fight against deforestation \n74 Surfacing solutions: Safeguarding the world\u2019s vital freshwater and   \nocean resources \n76 Appendix \n77 About Google \n77 About this report \n78 Ambitions \n78 Climate moonshots \n86 Water and waste \n89 Governance and risk management \n90 Stakeholder engagement and partnership \n98 Environmental data \n115 Certifications and recognitions \n116 Endnotes \n3",
      "ar real-time insights on wildfires, enabling faster detection and giving first responders a better  \n\nar real-time insights on wildfires, enabling faster detection and giving first responders a better  \nunderstanding of a situation as it unfolds. \nFlood Hub predicts riverine floods up to seven days in advance. \nGoogle\u2019s  Flood Hub displays forecasts for riverine floods around the world based on a breakthrough global  \nhydrological AI model. It predicts floods up to seven days in advance in over 100 countries, covering territories  \nwhere more than 700 million people live.\u200921 \nWeatherNext Graph provides single, precise predictions 10 days in advance. \nThe WeatherNext family of AI models from Google DeepMind and Google Research produces state-of-the-art  \nweather forecasts, learning directly from vast amounts of historical weather data to generate affordable, fast,  \nand accurate weather prediction\u2014often 10 to 15 days in advance. \nTools like Google Earth Engine, Global Fishing Watch , and Environmental Insights Explorer  also provide  ",
      "dfire boundary mapping Flood forecasting \nA visual showcase of various Google Research projects. \n55",
      "change brings more extreme weather, that foundation for  \nresilience will matter more than ever. \n68\n\nSeven-day lead time \nHow AI is giving flood-prone communities time to act \nFloods are one of the most common types of natural disaster, and roughly 19% of the global population \nis directly exposed to substantial risks from severe flood events worldwide. \u2009112 When a flood approaches, \nthe difference between chaos and preparedness often comes down to timing: a few extra days can mean \nsandbags in place, supplies distributed, and people evacuated. That\u2019s why Google\u2019s  fl ood forecasting  \ninitiative,  launched in 2018, has focused on giving people more time. \nThe real-time operational system\u2014visualized on Google Flood Hub \u2014provides alerts via Google Search, \nGoogle Maps, and Android notifications and also displays flood forecasts to help governments, aid \norganizations, and at-risk communities take timely action.  As of the end of 2024, Flood Hub\u2019s  \nAI-powered riverine flood forecasting system covered over 100 countries and over 700 million \npeople globally\n\u2009113 (Figure 12). "
    ]
  },
  {
    "question": "What tool helps supplier facility managers identify energy efficiency opportunities across their operations without needing deep technical expertise?",
    "ground_truth": "Energy Assessment tool",
    "answer": "Energy Assessment tool",
    "contexts": [
      "s, partnerships, and clean energy agreements \n36 APAC\u2019s brighter future: A solar solution in Taiwan \n\ns, partnerships, and clean energy agreements \n36 APAC\u2019s brighter future: A solar solution in Taiwan \n37 C onducting change: Focusing on high-impact semiconductor suppliers \n38 Supply chain transformation: Why it\u2019s slow, why it\u2019s messy, and why it   \nreally matters \n39 Resource efficiency \nWater stewardship \n40 Advancing responsible water use: Our approach to climate-conscious data  \ncenter cooling \n42 Replenishing water: A local approach to water stewardship \nWaste reduction  \n44 Reverse supply chain: Giving hardware a second life \n46 Food waste: Resourceful recipes and smarter services \nNature on our campuses \n47 Restoring habitat: Cultivating nature on our campuses \n49 Ripple effects: How our water efforts bloom into biodiversity gains \n2",
      "th increasing the energy efficiency of our data centers to help minimize our electricity demand. In \n\nth increasing the energy efficiency of our data centers to help minimize our electricity demand. In \n2024, the average annual PUE for our global fleet of data centers was 1.09, compared with the industry average of 1.56, meaning that Google data centers \nused 84% less overhead energy than the industry average.\n\u2009129  We\u2019ll continue to build on this progress by driving additional energy efficiency and flexibility \nmeasures in our data centers\u2014with a focus on our machine learning fleet. \nAfter efficiency, our next focus is on scaling our clean energy procurement across all regions: In 2024, we signed contracts to purchase over 8 GW of \nadditional clean energy generation130\u2014more than in any prior year. We\u2019re also using Google\u2019s engineering expertise and purchasing demand to  accelerate  \nthe commercialization of advanced CFE technologies and scale their climate impact, and advocating for energy policies that can unlock access to cost-",
      "ier, faster, and smarter\u2014and it\u2019s working. \n13 \nVisual of potential solar capacity in the Solar API.",
      " for grid regions with Google-owned and -operated data  \ncenters64 \n32\n\nEnergy for our \nsupply chain\n\nEnergy for our supply chain \nContents \n35 Supplier synergy: Shared tools, partnerships, and clean energy agreements \n36 APAC\u2019s brighter future: A solar solution in Taiwan \n37 Conducting change: Focusing on high-impact semiconductor suppliers \n38 Supply chain transformation: Why it\u2019s slow, why it\u2019s messy, and why it   \nreally matters \nWhen people think about reducing environmental impacts, they might picture electric vehicles, rooftop \nsolar panels\u2014maybe even plastic alternatives. But there\u2019s a part of the climate story that doesn\u2019t get as \nmuch attention: the supply chain behind your phone, thermostat, or smart speaker, and the data center \nhardware they rely on. And it\u2019s one of the trickiest parts of the puzzle; the further you zoom out\u2014from the \ndevice in your hand to the global network that made it\u2014the more complex the system becomes. \nFor Google, much of that challenge starts in Asia Pacific, where our suppliers manufacture many of ",
      " for grid regions with Google-owned and -operated data  \ncenters64 \n32\n\nEnergy for our \nsupply chain",
      " we used a \none month sample of observed machine power data from our entire TPU fleet, applying \n116\n\nGoogle\u2019s 2023 average fleetwide carbon intensity. To estimate embodied emissions from \nmanufacturing, transportation, and retirement, we performed a life-cycle assessment \nof the hardware. Data center construction emissions were estimated based on Google\u2019s \ndisclosed 2023 carbon footprint. These findings do not represent model-level emissions, \nnor are they a complete quantification of Google\u2019s AI emissions. Based on the TPU \nlocation of a specific workload, Compute Carbon Intensity (CCI) results of specific \nworkloads may vary.\n45 The figure represents the average percentage of Google\u2019s global compute resources that \nwere identified as recoverable and reallocated for more efficient use over this period as a \nresult of using AlphaEvolve.\n46 We estimated the expected annual generation based on our contracted clean energy, \napplying an average capacity factor. Actual generation may vary from the signed amounts \nbased on changes during construction or project terminations.",
      "mitigating extreme heat ( supported  by  Google.org ), and educating stakeholders on 24/7 CFE. \n \n96",
      "ssions from our \nmachine hardware efficiency improvements, we compare the actual emissions from our \n\nssions from our \nmachine hardware efficiency improvements, we compare the actual emissions from our \nservers in 2019 to 2024 and other hardware to a hypothetical scenario where we didn't \nimplement any efficiency measures and continued to deploy older, less efficient hardware \nwhich could have resulted in increased machines deployed and increased energy \nconsumption. By comparing the actual energy consumption to this hypothetical baseline, \nwhich is defined by the machines deployed in 2019, we estimate the energy savings \nand associated scope 2 emissions avoided through our machine hardware efficiency \ninitiatives. Similarly, we estimate the scope 3 emissions avoided by comparing actual \nhardware manufacturing and logistics emissions to the same hypothetical baseline. For \nboth PUE and machine hardware efficiency, we assume additional energy consumption \nin the avoided baseline scenario would not have been matched with additional clean ",
      "itive supply chain for the future. \nA logistics program manager at our data center in Singapore. \n38\n\nResource efficiency",
      "apable and energy efficient TPU yet, designed to power thinking, inferential AI models at scale. \n37\n\nSupply chain transformation \nWhy it\u2019s slow, why it\u2019s messy, and why it really matters \nTransforming a global supply chain is never quick or easy. It\u2019s a long game filled with logistical hurdles, \neconomic trade offs, regional challenges, and infrastructure constraints. Our efforts go beyond our own \noperations\u2014we\u2019re working to influence the broader systems and structures that shape how our industry \nuses energy. \nThat\u2019s why progress can often look like a patchwork of small wins\u2014from suppliers upgrading their facilities  \nand sharing decarbonization roadmaps to signing our CEA and committing to clean energy procurement.  \nTaken together, we believe these moves have great collective impact, and when they happen at scale, they  \ncan shift market demand, create new norms, and accelerate broader change. These steps also bolster supply  \nchain resilience and help companies stay ahead of potential regulatory requirements or reporting needs. ",
      "Environmental \nReport \n2025\n\nContents \n4 Introduction \n4 Foreword \n7 2024 highlights \n9 G\nlobal challenges and dependencies \n10 Age of AI \n12 Powering prosperity: The economic upside of AI and the energy required   \nto power it \n13 Optimal scenario: AI\u2019s net-positive potential \n14 AI efficiency gains: Improvements across models, TPUs, and infrastructure \n16 Piece of the puzzle: Situating AI in our overall electricity growth \n17 Energy for our data centers \n19 Scaling smarter: Successfully reducing our data center energy emissions \n22 Powering today: Our record year for clean energy \n24 Powering tomorrow: Accelerating advanced energy sources \n27 Flexible future: Demand response to enable smarter electricity grids \n29 Ambitious vision, complex reality: Our efforts to decarbonize global grids \n33 Energy for our supply chain \n35 Supplier synergy: Shared tools, partnerships, and clean energy agreements \n36 APAC\u2019s brighter future: A solar solution in Taiwan ",
      "were avoided \nbecause of actions taken either as part of normal operations or in service of climate \n\nwere avoided \nbecause of actions taken either as part of normal operations or in service of climate \nambitions. We calculate avoided emissions by comparing our actual emissions to a \nscenario where we didn't take action. To calculate avoided emissions from our power \nusage effectiveness (PUE) improvements, we compare our fleet-wide trailing 12-month \n(TTM) PUE in each year from 2019 to 2024 to a baseline from our earliest fleet-wide TTM \nPUE (which was 1.21 in 2008). This baseline assumes that our PUE would have remained \nthe same without our efficiency improvements. We translate this efficiency improvement \ninto avoided energy consumption, and then calculate avoided emissions using an annual \nemissions rate (emissions/GWh) derived from reported scope 2 electricity data in our \ncorporate GHG inventory for the relevant year. To calculate avoided emissions from our \nmachine hardware efficiency improvements, we compare the actual emissions from our ",
      "apable and energy efficient TPU yet, designed to power thinking, inferential AI models at scale. \n37",
      "age energy costs and prepare for evolving regulations. \nRows of machinery on a production floor. \n34\n\nSupplier synergy \nShared tools, partnerships, and clean energy agreements \nWe\u2019re working to tackle our supply chain emissions with a mix of technical tools, direct supplier \npartnerships, and clean energy agreements and investments. \nOne practical resource we developed is an Energy Assessment tool. This is a free tool designed to be \nused without deep technical expertise that helps supplier facility managers identify energy efficiency \nopportunities across their operations. These managers can get a snapshot of where energy is being lost\u2014 \nwhether it\u2019s outdated chillers, inefficient motors, or poor lighting\u2014and get guidance on which upgrades \ncould yield the biggest energy consumption improvements and cost reductions. But efficiency alone isn\u2019t \nenough. That\u2019s where carbon-free energy comes in. \nIn 2023, we began rolling out the Google Clean Energy Addendum (CEA) \u2014an  agreement  asking  "
    ]
  },
  {
    "question": "By what year does the Google Clean Energy Addendum ask suppliers to commit to achieving a 100% clean electricity match?",
    "ground_truth": "By the end of 2029",
    "answer": "2029",
    "contexts": [
      "er energy emissions by  \n12%, even with growing energy demands. \n  \n \n \n \n \n \n \n \n \n \n \n \n \n \n  \n \n \n\ner energy emissions by  \n12%, even with growing energy demands. \n  \n \n \n \n \n \n \n \n \n \n \n \n \n \n  \n \n \nReliable and abundant energy can help power global prosperity and expand economic opportunity. This \nrequires bringing more energy online, optimizing how we use it, advancing new energy solutions, and partnering \nwith suppliers as they make progress toward clean energy. At Google, through a combination of these efforts, \nwe\n reduced our data center energy emissions 1 by 12% in 2024\u2014even in the face of increased energy demands\u2014 \nw\nhile building fo r t he fu ture t hrough new  advanced energy innovations and dee per s u pplier e ngagement. \nWe added new clean energy generation by signing contracts for 8 GW and bringing 2.5 GW online in \n2024 alone. \nGoogle\u2019s work to accelerate clean energy began in 2010 when we signed our first power purchase agreement \n(PPA). Since then, from 2010 to 2024, we\u2019ve signed more than 170 agreements to purchase over 22 GW of clean \nen",
      "s came from electricity use across our value chain, so our largest opportunity for reducing scope 3 \n\ns came from electricity use across our value chain, so our largest opportunity for reducing scope 3 \nemissions is in enabling our value chain\u2019s adoption of clean electricity. \nOur approach to this key reduction area is to engage our suppliers to commit to directly procuring clean electricity\u2014or matching their energy use with \nclean energy\u2014for our most carbon-intensive components. The Google Clean Energy Addendum (CEA) asks suppliers to commit to achieving a 100% clean \nelectricity match by the end of 2029 for the electricity they use to manufacture Google products.\n132 By the end of 2024, many key suppliers signed our \nCEA, and we plan to continue driving clean energy progress within our supply chain through our CEA, clean energy investments, and other initiatives. \nWhile our primary focus will remain on engaging our suppliers to reduce their emissions through clean energy procurement, we\u2019ll also continue to explore ",
      "verified by an \nindependent third-party.\n87 Refer to endnote 33 above.\n88 Refer to endnote 16 above.\n\nverified by an \nindependent third-party.\n87 Refer to endnote 33 above.\n88 Refer to endnote 16 above.\n89 To estimate the annual enabled emissions reductions in 2024, Google first interviewed \npartners that use Google Earth Pro to understand the significance it played in their \nprocess (from siting to construction) and considered all the solar and onshore wind \npower plants built by the developers. For solar plants, we estimated the capacity factor \nvia an EIA published dataset, then estimated the per-hour-of-the-year generation profile \nvia NREL PVWatts. For wind plants, we leveraged Berkeley Lab\u2019s Land-Based Wind Market \nReport to estimate a capacity factor and assume that the wind generation profile is \nsteady throughout the year. For both solar and wind, we used the NREL Cambium model \nto estimate the amount of emissions reduced due to the clean energy generated in \n2024. The estimated annual emissions reduction takes into account projects enabled by ",
      "f AI-driven growth of electricity demand. Additionally, ECA formally submitted comments  advocating \n\nf AI-driven growth of electricity demand. Additionally, ECA formally submitted comments  advocating \nfor the implementation of grid-enhancing technologies at FERC and  collaborated with other organizations \u2014including Clean Energy Buyers Association (CEBA),  \nData Center Coalition (DCC), and Electricity Consumers Resource Council (ELCON)\u2014to advocate for colocation approach consistent with Google\u2019s position. \nU.S. state engagement \nClean Transition Tariff (utility rate): Google announced a  new, first-of-its kind clean energy partnership with NV Energy called a \u201cClean Transition Tariff\u201d \n(CTT) that enables Google and other energy users to meet growing power demand cleanly and reliably. The CTT brings utilities and customers together into a  \nlong-term energy agreement that can facilitate investments into new projects that deliver clean firm energy to the grid. ",
      "\nregion, where wind and solar resources aren\u2019t readily accessible in many markets. And though we\u2019ve \n\n\nregion, where wind and solar resources aren\u2019t readily accessible in many markets. And though we\u2019ve \nannounced long-term agreements for new clean energy in the region for our own operations, our suppliers  \nface similar hurdles in obtaining these resources.  \nTo help address these challenges, the Google Clean Energy Addendum (CEA) has become central to our \nwork with suppliers. This agreement asks them to commit to a 100% clean electricity match for the electricity  \nthey use to manufacture Google products.\n\u200910 Many key suppliers have signed our CEA as of the end of  \n2024. Building on this progress, in 2025 we collaborated directly with a major hardware supplier in Japan to  \ntransition its Google product production to be matched with 100% clean electricity. We\u2019re continuing to invest \nto accelerate clean energy in Asia Pacific and working to offer clean energy from our BlackRock partnership to  \nsemiconductor suppliers and manufacturers in the region. ",
      " the last eight years, since 2017, we\u2019ve matched 100% of our global electricity use with renewable  \n\n the last eight years, since 2017, we\u2019ve matched 100% of our global electricity use with renewable  \nenergy purchases\u200960\u2014a pursuit that seemed almost impossible when we set out on it back in 2012 (Figure 5). \nThis milestone was an important step\u2014but annual matching only tells part of the story. The reality is that \nmost grids today still rely on fossil fuels for portions of the day, especially during evenings or times when \nrenewable sources aren\u2019t producing electricity. Even if a company buys clean energy in bulk and applies \nit to match its total usage over the course of the year, its real-time energy mix likely includes electricity \ngenerated from fossil fuels. \nFigure 5. Clean energy purchases compared to total electricity use \n35 \n30 \n25 \n20 \n15 \n10 \n5 \n0 \nTerawatt-hours \n2011 2010 \nGoogle \nannounced pursuit \nof 100% renewable \nenergy match \nGoogle \nsigned \nour first \nPPA \n2012 2013 2014 2015 2016 \nGoogle \nfirst achieved \n100% renewable \nenergy match ",
      "s in. \nIn 2023, we began rolling out the Google Clean Energy Addendum (CEA) \u2014an  agreement  asking  \n\ns in. \nIn 2023, we began rolling out the Google Clean Energy Addendum (CEA) \u2014an  agreement  asking  \nsuppliers to commit to achieving a 100% clean electricity match by the end of 2029 for the electricity \nthey use to manufacture Google products.\n\u200965 We see this as a cornerstone of our strategy\u2014not just a \nrecommendation, but a shared agreement to market change. It\u2019s already become a central part of how we \nwork with our key suppliers\u2014especially those with the highest energy use. By the end of 2024, many key \nsuppliers signed our CEA, and we plan to continue driving clean energy progress within our supply chain \nthrough our CEA, clean energy investments, and other initiatives. \nWe know this takes time, which is why we\u2019re working directly with suppliers to identify practical next steps, \noffer hands-on support, and share tools that make the transition more manageable\u2014from navigating  \nclean energy procurement to tracking progress\u2014all of which ultimately strengthen the resilience of our ",
      "tion with AI: Accelerating Climate Action with AI \n\u2022  Device repairability:  Google & Repairability \n\ntion with AI: Accelerating Climate Action with AI \n\u2022  Device repairability:  Google & Repairability \nThe following table includes a detailed list of our sustainability policy engagements in 2024: \nGlobal and cross-cutting initiatives \nAdvanced   clean  electricity   technologies:  In 2023, Google published a  paper outlining how corporate clean energy buyers can accelerate clean energy  \ntechnologies by supporting favorable policies, signing long-term purchase agreements, and providing early-stage project funding. In 2024, we published an \nupdated version of this paper to include our detailed procurement criteria for carbon-free energy technologies. \nUnited Nations Framework Convention on Climate Change (UNFCCC) 29th Conference of the Parties (COP-29): Google participated in COP-29, in \nBaku, Azerbaijan, in over 150 engagements with officials and sustainability industry leaders, partners, and priority stakeholders. ",
      "age energy costs and prepare for evolving regulations. \nRows of machinery on a production floor. \n34\n\nSupplier synergy \nShared tools, partnerships, and clean energy agreements \nWe\u2019re working to tackle our supply chain emissions with a mix of technical tools, direct supplier \npartnerships, and clean energy agreements and investments. \nOne practical resource we developed is an Energy Assessment tool. This is a free tool designed to be \nused without deep technical expertise that helps supplier facility managers identify energy efficiency \nopportunities across their operations. These managers can get a snapshot of where energy is being lost\u2014 \nwhether it\u2019s outdated chillers, inefficient motors, or poor lighting\u2014and get guidance on which upgrades \ncould yield the biggest energy consumption improvements and cost reductions. But efficiency alone isn\u2019t \nenough. That\u2019s where carbon-free energy comes in. \nIn 2023, we began rolling out the Google Clean Energy Addendum (CEA) \u2014an  agreement  asking  "
    ]
  },
  {
    "question": "In what year did Google first achieve a 100% renewable energy match for its global electricity use?",
    "ground_truth": "2017",
    "answer": "2017",
    "contexts": [
      "er energy emissions by  \n12%, even with growing energy demands. \n  \n \n \n \n \n \n \n \n \n \n \n \n \n \n  \n \n \n\ner energy emissions by  \n12%, even with growing energy demands. \n  \n \n \n \n \n \n \n \n \n \n \n \n \n \n  \n \n \nReliable and abundant energy can help power global prosperity and expand economic opportunity. This \nrequires bringing more energy online, optimizing how we use it, advancing new energy solutions, and partnering \nwith suppliers as they make progress toward clean energy. At Google, through a combination of these efforts, \nwe\n reduced our data center energy emissions 1 by 12% in 2024\u2014even in the face of increased energy demands\u2014 \nw\nhile building fo r t he fu ture t hrough new  advanced energy innovations and dee per s u pplier e ngagement. \nWe added new clean energy generation by signing contracts for 8 GW and bringing 2.5 GW online in \n2024 alone. \nGoogle\u2019s work to accelerate clean energy began in 2010 when we signed our first power purchase agreement \n(PPA). Since then, from 2010 to 2024, we\u2019ve signed more than 170 agreements to purchase over 22 GW of clean \nen",
      "e then, from 2010 to 2024, we\u2019ve signed more than 170 agreements to purchase over 22 GW of clean \nen\n\ne then, from 2010 to 2024, we\u2019ve signed more than 170 agreements to purchase over 22 GW of clean \nen\nergy generation,2 similar to Portugal\u2019s total renewable energy in 2024.3 In 2024 alone, Google signed \ncontracts to purchase over 8 GW of additional clean energy generation 4\u2014the largest annual total in our history \nand twice the volume we contracted for the prior year. We\u2019ve maintained a 100% renewable energy match on a \nglobal basis every year since 2017, 5 and are going even further by pursuing our 24/7 carbon-free energy (CFE) \nambition (one of our climate moonshots). In 2024, we increased our 24/7 CFE percentage from 64% to 66%, 6 \na\nnd nine out of 20 grid regions with Google-owned and -operated data centers achieved at least 80% CFE. \nW\ne innovated across hardware and software to enable our data centers to deliver six times more \ncomputing power per unit of electricity than they did just five years ago. ",
      " January 2024 to \nDecember 2024 in this analysis. These findings are a point-in-time measurement of \n\n January 2024 to \nDecember 2024 in this analysis. These findings are a point-in-time measurement of \nthe annual emissions of the Solar API, and may vary as the Solar API model continues \ndeployment. This analysis has not been third-party verified or validated.\n35 This estimate is based on our internal analysis comparing the BFLOAT16 / INT8 model step \ntime ratio measured on the MLPerf 3.1 GPT-3 175B model. The results (11,798ms / 8,431ms \n= 139%) can be interpreted as a 39% speed improvement and, in turn, training efficiency.\n36 \u201c Gemini 1.5: Unlocking Multimodal Understanding Across Millions of Tokens of Context,\u201d \nGoogle, 2024.\n37 Refer to endnote 8 above.\n38 This calculation is based on internal data, as of May 2024.\n39 Refer to endnote 8 above.\n40 This calculation is based on internal data, as of April 2025.\n41 According to \u201cWhat NVIDIA\u2019s New Blackwell Chip Says About AI\u2019s Carbon Footprint \nProblem,\u201d NVIDIA compared the total power needed to train the latest ultra-large AI ",
      "of new solar energy in Taiwan, advancing clean \nenergy for both the local electricity grid and our  \n\nof new solar energy in Taiwan, advancing clean \nenergy for both the local electricity grid and our  \nown operations. \nEliminated plastic from our \nproduct packaging \nPackaging for new Google products launched and  \nmanufactured in 2024 was 100% plastic-free .\u200922 \nTo help other companies create more sustainable  \npackaging, we published our  Plastic-Free Packaging  \nDesign Guide . \n7 \n -    \nA fiber-based unglued packaging set.  \nReached 1 billion users to inform \nmore sustainable choices \nFor the past three years, we\u2019ve provided information  \nto over 1 billion users to help them make more \nsustainable choices annually through our products. \u200924",
      "verified by an \nindependent third-party.\n87 Refer to endnote 33 above.\n88 Refer to endnote 16 above.\n\nverified by an \nindependent third-party.\n87 Refer to endnote 33 above.\n88 Refer to endnote 16 above.\n89 To estimate the annual enabled emissions reductions in 2024, Google first interviewed \npartners that use Google Earth Pro to understand the significance it played in their \nprocess (from siting to construction) and considered all the solar and onshore wind \npower plants built by the developers. For solar plants, we estimated the capacity factor \nvia an EIA published dataset, then estimated the per-hour-of-the-year generation profile \nvia NREL PVWatts. For wind plants, we leveraged Berkeley Lab\u2019s Land-Based Wind Market \nReport to estimate a capacity factor and assume that the wind generation profile is \nsteady throughout the year. For both solar and wind, we used the NREL Cambium model \nto estimate the amount of emissions reduced due to the clean energy generated in \n2024. The estimated annual emissions reduction takes into account projects enabled by ",
      "ned \nour first \nPPA \n2012 2013 2014 2015 2016 \nGoogle \nfirst achieved \n100% renewable \nenergy match \n\nned \nour first \nPPA \n2012 2013 2014 2015 2016 \nGoogle \nfirst achieved \n100% renewable \nenergy match \n2017 2018 2019 2020 2021 2022 2023 2024 \nYe a r \nTotal electricity consumption Global renewable energy matching Legend \n29",
      "2024 \nSolar API \nFuel-efficient routing \nGoogle Earth Pro \nNest thermostats Green Light \nLegend \n56 \n\n2024 \nSolar API \nFuel-efficient routing \nGoogle Earth Pro \nNest thermostats Green Light \nLegend \n56 \nRead more about the role each of these products  \nplayed in 2024 below: \n\u2022 Fuel-efficient routing: In 2024, we\nestimate that fuel-efficient routing enabled\nmore than 2.7 million metric tons of GHG\nemissions reductions\n\u200984\u2014equivalent to taking\napproximately 630,000 gasoline-powered  \ncars off the road for a year.\u200985 Want to dive\ndeeper into how this product feature is making\na tangible difference for drivers and the\nplanet? Explore the full story in  Fuel-efficient \nrouting: Driving smarter while saving more .\n-\nFuel-efficient routing",
      "direct-use phase emissions and are not within the \nreporting boundary for use of sold products. \n113\n\n,\nl\n,\nPPAs, tax equity investments, PPA-linked Renewable Energy Certificates (RECs) / guarantee of origin (GO) agreements, and utility \nrenewable energy tariffs, which may result in RECs or GOs. The numerator includes all renewable electricity procured, regardless of the \nmarket in which Alphabet consumed the renewable electricity. To achieve Alphabet\u2019s 100% renewable energy match, Alphabet first \nconsiders both on-site renewable electricity generation and the renewable electricity already in the electric grids where the facilities are \nlocated (using the residual mix where data is available). Alphabet then procures renewable electricity through contractual instruments. \nAlphabet has a few facilities located in geographies where it is not currently able to source large volumes of renewable electricity, so \nAlphabet procures surplus renewable electricity in regions where it\u2019s abundant. Refer to  \u201c Achieving Our 100% Renewable Energy ",
      " the last eight years, since 2017, we\u2019ve matched 100% of our global electricity use with renewable  \n\n the last eight years, since 2017, we\u2019ve matched 100% of our global electricity use with renewable  \nenergy purchases\u200960\u2014a pursuit that seemed almost impossible when we set out on it back in 2012 (Figure 5). \nThis milestone was an important step\u2014but annual matching only tells part of the story. The reality is that \nmost grids today still rely on fossil fuels for portions of the day, especially during evenings or times when \nrenewable sources aren\u2019t producing electricity. Even if a company buys clean energy in bulk and applies \nit to match its total usage over the course of the year, its real-time energy mix likely includes electricity \ngenerated from fossil fuels. \nFigure 5. Clean energy purchases compared to total electricity use \n35 \n30 \n25 \n20 \n15 \n10 \n5 \n0 \nTerawatt-hours \n2011 2010 \nGoogle \nannounced pursuit \nof 100% renewable \nenergy match \nGoogle \nsigned \nour first \nPPA \n2012 2013 2014 2015 2016 \nGoogle \nfirst achieved \n100% renewable \nenergy match ",
      "rom renewable sources (%) on an annual basis by dividing the MWhs of renewable electricity procured \n\nrom renewable sources (%) on an annual basis by dividing the MWhs of renewable electricity procured \n(i.e., through contractual instruments, on-site renewable electricity generation, and renewable electricity in the electric grids where \nfacilities are located) by the total MWhs of electricity consumed by Alphabet\u2019s global operations. Contractual instruments may include \n14 Alphabet is the parent holding company of Google. \n15 Flagship consumer devices are products that can provide their main functionality without connection to another product. For example, this \ngenerally doesn\u2019t include accessories such as cases. \n16 Network and end-user devices used to access web-based software are not considered to be direct-use phase emissions and are not within the \nreporting boundary for use of sold products. \n113",
      "ating potential sites and streamlining site design and construction estimates. And, on an annual  \n5\n\naccounting basis, we estimate that 0.6 million metric tons of GHG emissions reductions were enabled by \nsolar panels installed by our partners using the Solar API  in the United States in 2024.\u200916 \nIn transportation, two products enabled others to reduce over 2 million tCO 2e emissions. \nWe estimate that our AI-powered  fuel-efficient routing in Google Maps saved users fuel and cumulatively \nenabled more than 2.7 million metric tons of GHG emissions reductions in 2024 alone\u200917\u2014that\u2019s equivalent to  \ntaking approximately 630,000 gasoline-powered cars off the road for a year.\u200918 Google researchers also built \nGreen Light, an AI-based tool that helps city traffic engineers optimize the timing of traffic lights, which has  \nshown the potential to reduce stops at intersections by up to 30% and reduce emissions at intersections by an  \naverage of over 10%.\u200919 \nResilience \nOur innovative research is bolstering resilience  \nto protect communities, save lives, and reduce  ",
      "gy more  \naccurately, enabling the matching of energy production to consumption on an hourly basis. \n\ngy more  \naccurately, enabling the matching of energy production to consumption on an hourly basis. \nWind power action plan: We worked with other clean energy buyers and developers within RE-Source on input  to the European Commission\u2019s consultation  \non design elements of renewable energy auctions\u2019 to ensure a level playing field between contracts for difference and corporate PPAs. \nEngagement with coalitions and sustainability initiatives \nRE-Source   Platform:  In 2024, Google continued supporting and working with RE-Source to advocate for a stronger role for corporate clean energy buyers \nwithin European energy markets. We informed RE-Source\u2019s input to the European Commission\u2019s consultation on design elements of renewable energy  \nauctions to advocate for policy changes that help unlock the ability of large customers to purchase renewable energy. "
    ]
  },
  {
    "question": "What is the capacity of the enhanced geothermal project Google contracted with Fervo Energy in 2024?",
    "ground_truth": "115 MW",
    "answer": "115 MW",
    "contexts": [
      "ished and scale. \n23 \nSolar panels line up side-by-side at our data center in St. Ghislain, Belgium.\n\nPowering tomorrow \nAccelerating advanced energy sources \nClean energy sources that we can count on anytime and can turn on or off as needed play an important role in  \ncreating a reliable, affordable, and clean energy system that can power economic and scientific opportunity. \nWe\u2019re accelerating the development and deployment of  next-generation energy sources\u2014from enhanced \ngeothermal to advanced nuclear and innovative biomass solutions\u2014expanding energy opportunities \nthrough innovation and pushing the boundaries of what\u2019s possible. \nEnhanced geothermal \nImagine tapping into the Earth\u2019s core, a virtually limitless source of heat. That\u2019s the power of geothermal \nenergy. Traditional geothermal plants utilize naturally occurring underground reservoirs of steam or hot  \nwater, but these resources are limited to specific geological locations. Enhanced geothermal energy takes a \ndifferent approach, expanding the reach of this clean power source. ",
      "e then, from 2010 to 2024, we\u2019ve signed more than 170 agreements to purchase over 22 GW of clean \nen\n\ne then, from 2010 to 2024, we\u2019ve signed more than 170 agreements to purchase over 22 GW of clean \nen\nergy generation,2 similar to Portugal\u2019s total renewable energy in 2024.3 In 2024 alone, Google signed \ncontracts to purchase over 8 GW of additional clean energy generation 4\u2014the largest annual total in our history \nand twice the volume we contracted for the prior year. We\u2019ve maintained a 100% renewable energy match on a \nglobal basis every year since 2017, 5 and are going even further by pursuing our 24/7 carbon-free energy (CFE) \nambition (one of our climate moonshots). In 2024, we increased our 24/7 CFE percentage from 64% to 66%, 6 \na\nnd nine out of 20 grid regions with Google-owned and -operated data centers achieved at least 80% CFE. \nW\ne innovated across hardware and software to enable our data centers to deliver six times more \ncomputing power per unit of electricity than they did just five years ago. ",
      " for grid regions with Google-owned and -operated data  \ncenters64 \n32\n\nEnergy for our \nsupply chain",
      "iled \ninformation on our operations, our products, and our progress. We invite you to learn more. \n6\n\n2024 highlights \nThis section provides a snapshot of our highlights as of the end of 2024 and select highlights from the first \nhalf of 2025. \nReduced data center energy  \nemissions by 12% \nWe reduced our data center energy emissions by  \n12%, compared to 2023. We achieved this important \naccomplishment despite a 27% increase in our  \nelectricity consumption, demonstrating that our  \noperational decarbonization efforts are bearing fruit. \nThe Google solar field at our data center \nin St. Ghislain, Belgium. \nProcured over 8 GW of clean \nenergy \nWe signed contracts to purchase over 8 gigawatts \n(GW) of additional clean energy generation \u200923\u2014more \nthan in any prior year. \nDelfzijl wind farm in the Netherlands \n(63 MW for Google). \nPartnered to enable 1 GW of solar \nin Taiwan \nWe announced a partnership  with BlackRock\u2019s \nClimate Infrastructure business that will enable 1 GW  \nof new solar energy in Taiwan, advancing clean \nenergy for both the local electricity grid and our  ",
      "troduction: Street View image of Redwood State and National Park, used with permission. \u00a92025 Google\n\ntroduction: Street View image of Redwood State and National Park, used with permission. \u00a92025 Google\nAge of AI: Street View image of the International Space Station, used with permission. \u00a92025 Google\nEnergy for our data centers: El Romero solar farm in Chile (80 MW for Google).\nEnergy for our supply chain: A technician scans hardware components, a critical step for tracking parts through every stage of the production process.\nResource efficiency: Clear waters reflect the beauty of our data center in Eemshaven, Netherlands.\nNew AI research solutions: The Solar API generates detailed rooftop data based on Google\u2019s extensive geospatial data and computing resources in order to evaluate rooftop solar energy potential.\nAI for extreme events and disaster response: A wide river basin during low water levels illustrates the type of flood-prone environment where flood forecasting is critical.",
      "ned the world\u2019s first corporate agree ment to develop a n ext-generation geotherm al \npower project.\n\nFirst-of-its-kind geothermal project in Nevada \nWe recognized the potential of enhanced geothermal early on.  In 2021, we signed the first corporate \nagreement to develop a next-generation geothermal  power project with Fervo Energy in Nevada.  \nThis wasn\u2019t just a theoretical exercise; it was a real-world collaboration to prove that enhanced geothermal \ncould deliver reliable, carbon-free energy. That project  became operational  in 2023, and carbon-free energy \nstarted flowing onto the local grid that serves our data centers in Nevada. \nSince then, Fervo has achieved remarkable reductions in the time and cost of its drilling process, \ndemonstrating the power of early customer demand to help drive rapid improvements to early-stage  \ntechnologies. Building upon the success of our commercial pilot, in 2024, we scaled up our partnership with \nFervo Energy, contracting for a larger 115 MW project through a new utility rate structure with NV Energy\u2014 ",
      "nced geothermal energy takes a \ndifferent approach, expanding the reach of this clean power source. \n\nnced geothermal energy takes a \ndifferent approach, expanding the reach of this clean power source. \nEnhanced geothermal involves either engineering underground reservoirs where none existed before or  \nenhancing production from existing ones. It\u2019s similar to creating a custom-designed plumbing system deep  \nbeneath the surface. Using advanced drilling techniques adapted from the oil and gas industry to access \nhot, dry rock formations, water is then injected into these formations, heated by the Earth\u2019s intense thermal \nenergy, and circulated back to the surface to drive turbines and generate electricity. This process produces \nclean, consistent power with only a small land footprint and without burning fossil fuels. \n24 \n- \u2019 -Google and clean-energy s tartup Fervo signed the world\u2019s first corporate agree ment to develop a n ext-generation geotherm al \npower project.",
      "om 2019\u20132024.\n8 These calculations are based on internal data, as of March 2025. Google\u2019s TPU power \n\nom 2019\u20132024.\n8 These calculations are based on internal data, as of March 2025. Google\u2019s TPU power \nefficiency relative to the earliest generation Cloud TPU v2 is measured by peak FP8 flops \ndelivered per watt of thermal design power per chip package.\n9 When we use the term \u201csupply chain\u201d or \u201csupply chain emissions,\u201d we're referring to \nthe indirect emissions that happen outside of our direct operations. This includes both \nupstream and downstream emissions, also referred to as \u201cvalue chain emissions.\u201d\n10 The Google Clean Energy Addendum applies to the electricity consumed by suppliers in \nthe manufacturing of Google technical infrastructure and consumer hardware products. \n11 To estimate aggregate enabled emissions reductions, we first estimated annual \nreductions for five products individually (Google Earth Pro, Solar API, Nest thermostats, \nfuel-efficient routing, and Green Light) and then combined the totals. For details ",
      "nced geothermal plant in Nevada, a f irst-of-its-kind project developed in \npartnership with Google.",
      "nergy, contracting for a larger 115 MW project through a new utility rate structure with NV Energy\u2014 \n\nnergy, contracting for a larger 115 MW project through a new utility rate structure with NV Energy\u2014 \nthe Clean Transition Tariff. This expansion signifies a shift from pilot-scale to commercial deployment and \nwill increase the amount of enhanced geothermal generation enabled by Google by almost 25 times. \nGeothermal\u2019s global potential \nWe\u2019re also exploring the global potential of geothermal energy. In 2024, we announced a partnership   \nwith the University of Newcastle and its research institute Newcastle Institute for Energy and Resources \n(NIER) to further de-risk and develop geothermal energy resources in Australia. We\u2019re also working with \nProject Innerspace on GeoMap , a free online tool that provides essential subsurface data and analytics for \nassessing geothermal potential worldwide. Think of it as providing a detailed map to help others explore this \nhidden energy resource. ",
      "ructure design and load shaping that makes 24/7 CFE more feasible. We\u2019re even partnering with other \n\nructure design and load shaping that makes 24/7 CFE more feasible. We\u2019re even partnering with other \ncompanies to capitalize on our combined demand  for advanced clean energy solutions, such as enhanced  \ngeothermal, advanced nuclear, clean hydrogen, and long-duration energy storage. \n31 \n\u2019 - - -An interconnection substation a t Fervo Energy\u2019s enhanced geothermal plant in Nevada, a f irst-of-its-kind project developed in \npartnership with Google.",
      "generated in \n2024. The estimated annual emissions reduction takes into account projects enabled by \n\ngenerated in \n2024. The estimated annual emissions reduction takes into account projects enabled by \nGoogle Earth prior to 2024 (dating back to 2020) to calculate the total impact in 2024 \nalone. Enabled emissions reductions estimates include inherent uncertainty due to factors \nthat include the lack of primary data and precise information about real-world actions \nand their effects to date, as well as forward-looking projections. Google is relying on \nits own substantiation of the enabled emissions-reduction impact, in consultation with \nmultiple third-party partners that have reviewed and support the methodology discussed \nherein. The data and claims have not been verified by an independent third-party. We will \ncontinue to work to refine our methodologies and inputs for these estimates.\n90 Estimated energy savings are calculated based on the average percentages for heating \nand cooling savings found in real-world studies of the Nest Learning Thermostat in the "
    ]
  },
  {
    "question": "How much did Google's data center electricity consumption grow in 2024 compared to its growth in 2023?",
    "ground_truth": "It grew by 27% in 2024, compared to 17% growth in 2023.",
    "answer": "In 2024, Google's data center electricity consumption increased by 27%, compared to 17% growth in the prior year.",
    "contexts": [
      "th increasing the energy efficiency of our data centers to help minimize our electricity demand. In \n\nth increasing the energy efficiency of our data centers to help minimize our electricity demand. In \n2024, the average annual PUE for our global fleet of data centers was 1.09, compared with the industry average of 1.56, meaning that Google data centers \nused 84% less overhead energy than the industry average.\n\u2009129  We\u2019ll continue to build on this progress by driving additional energy efficiency and flexibility \nmeasures in our data centers\u2014with a focus on our machine learning fleet. \nAfter efficiency, our next focus is on scaling our clean energy procurement across all regions: In 2024, we signed contracts to purchase over 8 GW of \nadditional clean energy generation130\u2014more than in any prior year. We\u2019re also using Google\u2019s engineering expertise and purchasing demand to  accelerate  \nthe commercialization of advanced CFE technologies and scale their climate impact, and advocating for energy policies that can unlock access to cost-",
      " we used a \none month sample of observed machine power data from our entire TPU fleet, applying \n116\n\nGoogle\u2019s 2023 average fleetwide carbon intensity. To estimate embodied emissions from \nmanufacturing, transportation, and retirement, we performed a life-cycle assessment \nof the hardware. Data center construction emissions were estimated based on Google\u2019s \ndisclosed 2023 carbon footprint. These findings do not represent model-level emissions, \nnor are they a complete quantification of Google\u2019s AI emissions. Based on the TPU \nlocation of a specific workload, Compute Carbon Intensity (CCI) results of specific \nworkloads may vary.\n45 The figure represents the average percentage of Google\u2019s global compute resources that \nwere identified as recoverable and reallocated for more efficient use over this period as a \nresult of using AlphaEvolve.\n46 We estimated the expected annual generation based on our contracted clean energy, \napplying an average capacity factor. Actual generation may vary from the signed amounts \nbased on changes during construction or project terminations.",
      " for grid regions with Google-owned and -operated data  \ncenters64 \n32\n\nEnergy for our \nsupply chain",
      "agement and partnership \n98 Environmental data \n115 Certifications and recognitions \n116 Endnotes \n3\n\nIntroduction \nForeword \nAt Google, we\u2019re applying AI to transform how people engage with information across our core products and  \nplatforms, to enhance business and economic growth, to enable  scientific  breakthroughs, and to drive sustainable  \ninnovation for society. We\u2019re proud to release our tenth annual Environmental Report, which details how we\u2019re  \nworking to address the increased energy demands of AI to enable this positive impact, while also showcasing  \nhow AI can be used to build a more energy-efficient and resilient world. These three topics\u2014energy, AI, and  \nresilience\u2014are the key themes of this year\u2019s report. Within these pages, we detail our 2024 progress, offering  \nour perspective and insights from a year marked by unprecedented global change driven by AI, energy  \ndemand, policy, and more. \nEnergy \nWe reduced our data center energy emissions by  \n12%, even with growing energy demands. \n  \n \n \n \n \n \n \n \n \n \n \n \n \n \n  \n \n ",
      " and offices, we increased \nour Google CFE percentage from 64% in 2022 and 2023 to 66% in 2024\n117\u2014 \n\n and offices, we increased \nour Google CFE percentage from 64% in 2022 and 2023 to 66% in 2024\n117\u2014 \ndespite significant growth in electricity demand over this period (which was \ndriven, in part, by AI). This was a result of increases in Contracted CFE and \noverall increases in global Grid CFE, specifically in North America where our \nenergy consumption is highest. \nOverall, we increased our Google CFE in over half of our grid regions that \ncontain Google-owned and -operated data centers, and achieved at least \n80% CFE in nine out of 20 of these grid regions in 2024. \nDetails  \nWe set this ambition in 2020. The load-weighted average of carbon-free \nenergy percentages across Google\u2019s global portfolio of data centers and \noffices is referred to as \u201cGoogle CFE.\u201d This metric is inclusive of third-party \ndata centers, and it represents the clean energy purchased to meet our \nelectricity needs at every hour of every day, and within every grid where we ",
      "by 27% in 2024, compared to 17% growth in the prior year. However, it\u2019s important to note that our  \n\nby 27% in 2024, compared to 17% growth in the prior year. However, it\u2019s important to note that our  \ngrowing electricity needs aren\u2019t solely driven by AI. The accelerating growth of Google Cloud, continued \ninvestments in Search, the expanding reach of YouTube, and more, have also contributed to this overall growth. \nWe remain committed to maximizing AI\u2019s potential to advance scientific discovery, accelerate human  \nprogress, and improve lives for people everywhere. To achieve this responsibly, we\u2019ll continue to pursue model  \noptimization, efficient infrastructure, and clean energy procurement to further drive efficiencies across AI and  \nminimize its overall resource demands. \nWind turbines spin near our data center in Eemshaven, Netherlands. \n16\n\nEnergy for  \nour data centers",
      "iled \ninformation on our operations, our products, and our progress. We invite you to learn more. \n6\n\n2024 highlights \nThis section provides a snapshot of our highlights as of the end of 2024 and select highlights from the first \nhalf of 2025. \nReduced data center energy  \nemissions by 12% \nWe reduced our data center energy emissions by  \n12%, compared to 2023. We achieved this important \naccomplishment despite a 27% increase in our  \nelectricity consumption, demonstrating that our  \noperational decarbonization efforts are bearing fruit. \nThe Google solar field at our data center \nin St. Ghislain, Belgium. \nProcured over 8 GW of clean \nenergy \nWe signed contracts to purchase over 8 gigawatts \n(GW) of additional clean energy generation \u200923\u2014more \nthan in any prior year. \nDelfzijl wind farm in the Netherlands \n(63 MW for Google). \nPartnered to enable 1 GW of solar \nin Taiwan \nWe announced a partnership  with BlackRock\u2019s \nClimate Infrastructure business that will enable 1 GW  \nof new solar energy in Taiwan, advancing clean \nenergy for both the local electricity grid and our  ",
      "Total electricity consumption across our data centers and offices \nGlobal average CFE percentage \n20",
      "shore wind farm in Belgium (92 MW for Google). \n R\u00f8dby solar farm in Denmark (55 MW for Google). \n18\n\nScaling smarter \nSuccessfully reducing our data center energy emissions \nIn 2024, the world\u2019s appetite for energy grew substantially faster than the average growth from the previous \ndecade.\u200947 This surge highlights the increasing energy demands of our modern infrastructure, from powering  \nhomes and industries to supporting the expanding digital world and emerging technologies. \nIn 2024, we reduced our data center energy emissions by 12% compared to 2023 (Figure 2). We \nachieved this reduction despite our data center electricity consumption increasing 27% year-on-year due to  \nthe growth of our business and increasing product adoption, including AI. \nThat may sound counterintuitive, but we\u2019ve long known that reducing the emissions from our data center \nenergy use is about scaling smarter. For us, it\u2019s the result of more than a decade of work\u2014and a strategy \nthat continues to deliver real-world results. "
    ]
  },
  {
    "question": "What was the scope 1 emissions in 2024 and how did it change from 2023?",
    "ground_truth": "Scope 1 emissions were 73,100 tCO2e in 2024, a decrease from 79,400 tCO2e in 2023.",
    "answer": "In 2024, scope 1 emissions were approximately 73,100 tCO2e, and they were reduced by 8% compared to 2023.",
    "contexts": [
      "nt that are within the boundaries we\u2019ve set for our climate ambitions. The boundary of our ambition-\n\nnt that are within the boundaries we\u2019ve set for our climate ambitions. The boundary of our ambition-\nbased emissions, and how we measure and report progress, doesn\u2019t affect the completeness of our total emissions inventory, which is presented in our \nEnvironmental metrics data table. \nIn 2024, our total ambition-based emissions were approximately 11.5 million tCO\n2e, which represent our scope 1, scope 2 (market-based), and \nscope 3 (ambition-based) emissions. \nFigure 13. Our 2024 ambition-based carbon footprint \n \nScope \nLegend \nScope 1 \nScope 2 (market-based) \nScope 3 (Category 1: Purchased goods and services) \nScope 3 (Category 2: Capital goods) and \n(Category 11: Use of sold products) \nScope 3 (Category 3: Fuel- and energy-related activities) \nScope 3 (Category 4: Upstream transportation \nand distribution) \nScope 3 (Category 5: Waste generated in operations) \nScope 3 (Category 6: Business travel) \nScope 3 (Category 7: Employee commuting) \nTotal ambition-based emissions \n73,100 ",
      " our scope 1 emissions were approximately 73,100 tCO2e, representing less than 1% of our total 2024 \n\n our scope 1 emissions were approximately 73,100 tCO2e, representing less than 1% of our total 2024 \nambition-based carbon footprint. \nCompared to 2023, we reduced our scope 1 emissions by 8% , primarily due to building efficiencies and warmer weather conditions that resulted in \ndecreases in natural gas, changes to generator utilization that resulted in decreases in diesel and other fuel usage, and improvements to refrigerant data \nquality. Our scope 1 emissions reduction efforts to date have focused on electrification, refrigerant mitigation, and renewable fuel use. \nScope 2 \nThe primary source of our scope 2 emissions is purchased electricity for our data centers and offices. In 2024, our scope 2 (market-based) emissions were \napproximately 3.1 million tCO\n2e, representing 26% of our total 2024 ambition-based carbon footprint. \nCompared to 2023, we reduced our scope 2 (market-based) emissions by 11% , primarily due to clean energy procurement. For scope 2 emissions ",
      "upply chain (i.e., scope 3)\u2014which are further removed from our direct control\u2014are still increasing: \n\nupply chain (i.e., scope 3)\u2014which are further removed from our direct control\u2014are still increasing: \n\u2022  Scope 3: Our ambition-based scope 3 emissions increased by 22% year-on-year in 2024. \nOverall, total emissions have grown in recent years alongside the growth of our business and growing product adoption by users around the world (Figure 15).  \nThe majority of these emissions are indirect, coming from our supply chain. We\u2019re actively working to bend our emissions curve toward our net-zero ambition. \nFigure 15. Our path forward\u2009127 \nReported ambition-based emissions Net emissions \nIllustrative business-as-usual emissions \nIllustrative ambition-based emissions \n2019 2020 2021 2022 2023 2024 2030 \nYear \nIllustrative emissions \nLegend \n12 \n9 \n6 \n3 \n0 \nMillion tCO2 e \n83",
      "se compared to 2019. \nGraph \nTotal operational emissions \nTotal scope 3 (ambition-based) \nemissions \n\nse compared to 2019. \nGraph \nTotal operational emissions \nTotal scope 3 (ambition-based) \nemissions \nScope 2 (market-based) \nScope 1 \nScope 3 (ambition-based) \nLegend \nOur operational emissions \nSupply chain emissions \nMillion tCO2 e \n7. 5 \n5 \n2.5 \n0 \n2019 2020 2021 2022 2023 2024 \nYear \n81",
      " goods) and (Category 11: Use of sold products) \nScope 3 (Category 1: Purchased goods and services) \n\n goods) and (Category 11: Use of sold products) \nScope 3 (Category 1: Purchased goods and services) \nScope 2 (market-based) \nScope 1 \ntCO2e \n292,000 \n1,914,000 \n203,000 \n461,000 \n14,000 \n476,000 \n425,000 \n4,292,000 \n873,000 \n835,900 \n81,900 \nTotal 2019 ambition-based emissions 7,661,800 \nTrend \nIn 2024, our total ambition-based emissions were 11.5 million tCO2e, representing an 11% year-on-year increase and a 51% increase compared to our 2019 \nbase year\u2014primarily driven by increases in supply chain emissions. \nThe year-on-year increase was slightly offset in that we reduced our scope 1 and scope 2 (market-based) emissions by 8% and 11%, respectively\u2014 \ndemonstrating that our operational decarbonization efforts are bearing fruit. This achievement is particularly significant given the 27% increase in our \nelectricity consumption compared to 2023. \nDetails \nScience Based Targets initiative (SBTi) validation: ",
      "0 2021 2022 2023 2024 2030 \nYear \nIllustrative emissions \nLegend \n12 \n9 \n6 \n3 \n0 \nMillion tCO2 e \n83",
      "date. Any future update will be provided only through a public disclosure indicating that fact. \n104\n\nEnvironmental metrics data tables \nGreenhouse gas emissions \nGreenhouse gas emissions inventory Unit 2019 2020 2021 2022 2023 2024 \nScope 1 tCO e 81,900 55,800 64,100 91,200 79,400 73,100 2\nScope 2 \nScope 2 (location-based) tCO2e 5,116,900 5,865,100 6,576,200 8,045,400 9,252,900 11,283,200 \nScope 2 (market-based) tCO e 835,900 911,600 1,823,500 2,492,100 3,423,400 3,059,100 2\nTotal operational (scope 1 +  \nmarket-based scope 2) emissions tCO2e 917,800 967,400 1,887,600 2,583,300 3,502,800 3,132,200 \nScope 3 \nScope 3 (Category 1: Purchased goods and services) tCO2e 2,787,000 2,404,000 2,886,000 3,504,000 3,951,000 3,601,000 \n2\n2\n105 \nScope 3 (Category 2: Capital goods) and  \n(Category 11: Use of sold products) \u2009148  tCO2e 4,584,000 4,176,000 4,462,000 3,886,000 4,583,000 6,337,000 \nScope 3 (Category 3: Fuel- and energy-related activities   \n[not included in scope 1 or scope 2] ) t CO2e 425,000 512,000 753,000 1,004,000 1,295,000 714,000 ",
      "31  2024 \n(metric tons per gas type \nGHG emissions by type \nCH4 \nScope 1 \n5 \nScope 2 (market-based) \n\n31  2024 \n(metric tons per gas type \nGHG emissions by type \nCH4 \nScope 1 \n5 \nScope 2 (market-based) \n100 \nScope 2 (location-based) \n800 \nN2O \nHFCs \n1 \n14 \n32 \n13 \n100 \n13 \nScope 3 GHG emissions \n\u201cScope 3 GHG emissions\u201d are indirect emissions from other sources in Alphabet\u2019s value chain. Alphabet calculates the reported values \nin the Schedule of Select Environmental Metrics using methodologies from the Scope 3 Technical Guidance for the following categories \nidentified as relevant: \n\u25cf Category 1: Purchased goods and services \n\u25cf Category 2: Capital goods \n\u25cf Category 3: Fuel- and energy-related activities (not included in scope 1 or scope 2) \n\u25cf Category 4: Upstream transportation and distribution \n\u25cf Category 5: Waste generated in operations \n\u25cf Category 6: Business travel \n\u25cf Category 7: Employee commuting \n\u25cf Category 11: Use of sold products \nAlphabet evaluated the remaining categories using the Scope 3 Standard\u2019s relevance criteria and determined the following categories to ",
      "s\u2014including our 2019 base year for our emissions reduction ambition. Updates may include structural \n\ns\u2014including our 2019 base year for our emissions reduction ambition. Updates may include structural \nchanges, changes in calculation methodologies, improvements in data accuracy, changes in the categories or activities included in the scope 3 inventory, \nand the correction of errors. We continually review emissions calculation methodologies and are committed to implementing best practices. \nIn line with our recalculation policy, in 2024 we recalculated the following previously-reported metrics, due to the following primary drivers: \n\u2022  We recalculated 2019\u20132023 scope 3 emissions metrics\u2014including all reported scope 3 categories, \u201cscope 3 (total),\u201d and \u201ctotal emissions: \nscope 1, 2 (market-based), and 3\u201d\u2014due to the following: \n\u2022  For emissions associated with manufacturing equipment used in our technical infrastructure, we transitioned from a spend-based to  \na primarily LCA-based calculation methodology, and we improved the spend data accuracy for our remaining spend-based emissions  "
    ]
  },
  {
    "question": "How much power efficiency improvement did the Ironwood TPU achieve compared to the first Cloud TPU from 2018?",
    "ground_truth": "Ironwood is nearly 30 times more power efficient than the first Cloud TPU from 2018.",
    "answer": "nearly 30 times more power efficient",
    "contexts": [
      "cally for inference, Ironwood performance per watt is double that of Trillium, our sixth-generation \n\ncally for inference, Ironwood performance per watt is double that of Trillium, our sixth-generation \nTPU announced last year. In fact,  Ironwood is nearly 30 times more power efficient than our first Cloud \nTPU from 2018.\n\u200937 \nTrillium already delivers impressive performance\u201467% more energy efficient than the previous TPU v5e, \u200938  \nand it delivers 14 times more compute per watt of power compared to the first generation of Cloud TPUs. \u200939  \nAnd Google Axion Processors , our first custom Central Processing Unit (CPU) designed for the data \ncenter, are up to 60% more energy efficient than comparable current-generation x86-based instances. \u200940  \nAdditionally, we now offer NVIDIA\u2019s next-generation Blackwell Graphics Processing Unit  (GPU) to Cloud \ncustomers, which NVIDIA estimates will train large models using 75% less power than older GPUs to \ncomplete the same task\n\u200941 and are 25 times as energy efficient compared to NVIDIA H100. \u200942 \n14",
      "improvements and achieves comparable quality to Gemini 1.0 Ultra while using less compute.\u200936 \nTPUs \n\nimprovements and achieves comparable quality to Gemini 1.0 Ultra while using less compute.\u200936 \nTPUs \nFor a decade, Google\u2019s AI innovations have been powered by a range of AI accelerator options, including \nour own custom-built TPUs (Tensor Processing Units). They\u2019ve come a long way since their first generation \nin 2015, evolving each generation to deliver better performance while improving their carbon compute \nefficiency. In early 2025, we continued this trend by building even more powerful TPUs, ensuring that our AI \nsystems keep pushing forward\u2014faster, smarter, and more efficient. \nWhen it comes to powering AI, efficiency isn\u2019t just about performance\u2014it\u2019s about using less energy to \ndo more. Announced in April 2025, Ironwood, our seventh-generation TPU, is a game-changer. Built \nspecifically for inference, Ironwood performance per watt is double that of Trillium, our sixth-generation ",
      " deliver six times more \ncomputing power per unit of electricity than they did just five years ago. \n\n deliver six times more \ncomputing power per unit of electricity than they did just five years ago. \nWe want to use energy in the most efficient way possible\u2014which is good for both our business and the \np\nlanet. Google data centers\u2014which power all of our products including Search, YouTube, Google Cloud, \nGemini, and more\u2014are some of the most efficient in the world. They deliver over six times more computing \np\nower per unit of electricity than they did just five years ago. 7 T his is in part thanks to pioneering hardware \ninnovations. As just one example, Google\u2019s seventh-generation Tensor Processing Unit (TPU), Ironwood, is \nnearly 30 times more power efficient than our first Cloud TPU from 2018.8 \nW\ne pushed the frontiers of advanced energ y development and grid optimization to ensure reliable, \nabundant power for everyone, and to fuel the next wave of innovation and economic growth. ",
      "om 2019\u20132024.\n8 These calculations are based on internal data, as of March 2025. Google\u2019s TPU power \n\nom 2019\u20132024.\n8 These calculations are based on internal data, as of March 2025. Google\u2019s TPU power \nefficiency relative to the earliest generation Cloud TPU v2 is measured by peak FP8 flops \ndelivered per watt of thermal design power per chip package.\n9 When we use the term \u201csupply chain\u201d or \u201csupply chain emissions,\u201d we're referring to \nthe indirect emissions that happen outside of our direct operations. This includes both \nupstream and downstream emissions, also referred to as \u201cvalue chain emissions.\u201d\n10 The Google Clean Energy Addendum applies to the electricity consumed by suppliers in \nthe manufacturing of Google technical infrastructure and consumer hardware products. \n11 To estimate aggregate enabled emissions reductions, we first estimated annual \nreductions for five products individually (Google Earth Pro, Solar API, Nest thermostats, \nfuel-efficient routing, and Green Light) and then combined the totals. For details ",
      ", which delivers tailored trainings to help our suppliers make high-impact clean energy purchases.  \n\n, which delivers tailored trainings to help our suppliers make high-impact clean energy purchases.  \nThese partnerships are about more than just advocacy: they also help drive shared research and \ndevelopment, advance manufacturing processes, and create standards that ripple across the industry. \nCollaborating creates real momentum\u2014especially when the work is shared and sustained across the supply \nchain. When we pull in the same direction, things move faster. \nIronwood is our most powerful, capable and energy efficient TPU yet, designed to power thinking, inferential AI models at scale. \n37",
      "to \ncomplete the same task\n\u200941 and are 25 times as energy efficient compared to NVIDIA H100. \u200942 \n14\n\nIn 2025, we published a first-of-its-kind  study on the lifetime emissions of our TPU hardware \u2014from raw \nmaterial extraction and manufacturing to energy consumption during operation. The results?  A threefold  \nimprovement in the Compute Carbon Intensity \u200943  of our TPU chips over four years, from TPU v4 to \nTrillium\u200944  (Figure 1). Newer generations of TPUs like Trillium provide cutting-edge performance while \ngenerating fewer carbon emissions for the same AI workload. \nFigure 1. Generational trends of AI hardware life-cycle emissions intensity show a threefold  \nimprovement over four years \nv4i v4 v5e v5p Trillium \n2020 2022 2023 2024 \n500 \n400 \n300 \n200 \n100 \n0 \nCompute carbon intensity (g CO2 /EFLOP) \n3x \nimprovement \nIndirect emissions from manufacturing \nIndirect emissions from energy use \nIndirect emissions from transportation Indirect emissions from data center construction \nDirect emissions from energy use Legend \nInfrastructure ",
      " over 1 billion users to help them make more \nsustainable choices annually through our products. \u200924\n\nLaunched the first FireSat \nsatellite to detect wildfires \nThe first satellite for the FireSat constellation  launched  \nand officially made contact with Earth. This satellite is  \none of more than 50 in a first-of-its-kind constellation  \ndesigned to use AI to detect and track wildfires as \nsmall as a garage (roughly 5x5 meters). \n8 \nThe launch of the first satellite for the \nFireSat constellation. \nImproved TPU power efficiency \nby 30x from 2018 \nIronwood\u2014the first Google TPU designed to power \nthinking, inferential AI models at scale\u2014is nearly 30 \ntimes more power efficient than our first Cloud TPU \nfrom 2018.\n\u200927 \nIronwood: The first Google TPU for the \nage of inference. \nReplenished 64% of our  \nfreshwater consumption,   \nup from 18% \nOur water stewardship projects replenished  \napproximately 4.5 billion gallons of water (17 billion \nliters or 17 million cubic meters) in 2024 alone, \nroughly 64% of our freshwater consumption.\n\u200925"
    ]
  },
  {
    "question": "How many metric tons of avoided emissions were attributed to clean energy purchases in 2023 compared to 2024?",
    "ground_truth": "5.9 million tCO2e were avoided in 2023, and 8.2 million tCO2e were avoided in 2024.",
    "answer": "I do not know.",
    "contexts": [
      "umulatively avoided more than 44 million tCO 2e\u200950\u2014more than the emissions from the combined annual \n\numulatively avoided more than 44 million tCO 2e\u200950\u2014more than the emissions from the combined annual \nelectricity use of every home in New York State.\u200951 \nFigure 3. Avoided emissions from clean energy purchases \n1 2 \n10 \n8 \n6 \n4 \n2 \n0 \nMillion tCO2 e \n2019 20 20 2021 2022 20 23 20 24 \nYear \n0.8 0.9 \n1.8 \n2.5 \n3.4 3.1 \n5.9 \n6.6 \n8.0 \n9.3 \n11.3 \n8.2 \n5.9 \n5.5 \n4.8 \n5.0 \n4.3 \nAvoided emissions from \nclean energy purchases \nEmissions from energy use \nwithout clean energy purchases \nEmissions from energy use \nwith clean energy purchases \nLegend \nThere are additional clean energy factors that led to our 2024 decrease in data center energy emissions. \nFor example, in North America\u2014a region that accounts for the majority of our electricity consumption\u2014we \nmade progress sourcing clean energy from within the same regions as our data centers, helping reduce our \nemissions. We also benefited slightly from broader grid decarbonization: across much of the United States, ",
      " renewable energy purchases via contractual \ninstruments, such as power purchase agreements (PPAs). \n\n renewable energy purchases via contractual \ninstruments, such as power purchase agreements (PPAs). \nWe use actual data (such as third-party invoices, monthly utility bills, or meter readings) to calculate scope 2 emissions. Where actual data isn\u2019t available, we \nestimate electricity consumption, natural gas consumption, and activity from district energy systems using the square footage of our data centers, offices, \nand other assets and internally developed intensity factors by office type, based on data from the reporting period. \nThe emission factors used to calculate scope 2 (location-based) emissions include the 2024 WRI/WBCSD GHG Protocol Emission Factors from Cross Sector \nTools, the 2025 EPA Emission Factors for Greenhouse Gas Inventories, the 2024 DEFRA UK Government GHG Conversion Factors, the 2024 International \nEnergy Agency (IEA) Emission Factors, the 2025 EPA eGRID Emission Factors, and the 2024 Climate Registry Default Emission Factors. ",
      "ssions from our \nmachine hardware efficiency improvements, we compare the actual emissions from our \n\nssions from our \nmachine hardware efficiency improvements, we compare the actual emissions from our \nservers in 2019 to 2024 and other hardware to a hypothetical scenario where we didn't \nimplement any efficiency measures and continued to deploy older, less efficient hardware \nwhich could have resulted in increased machines deployed and increased energy \nconsumption. By comparing the actual energy consumption to this hypothetical baseline, \nwhich is defined by the machines deployed in 2019, we estimate the energy savings \nand associated scope 2 emissions avoided through our machine hardware efficiency \ninitiatives. Similarly, we estimate the scope 3 emissions avoided by comparing actual \nhardware manufacturing and logistics emissions to the same hypothetical baseline. For \nboth PUE and machine hardware efficiency, we assume additional energy consumption \nin the avoided baseline scenario would not have been matched with additional clean ",
      "0 2021 2022 2023 2024 2030 \nYear \nIllustrative emissions \nLegend \n12 \n9 \n6 \n3 \n0 \nMillion tCO2 e \n83",
      " 2024, we continued to navigate a complex global energy landscape. We achieved significant progress \n\n 2024, we continued to navigate a complex global energy landscape. We achieved significant progress \nby increasing our global  carbon-free energy percentage across our data centers and offices to 66% . \n\u200961  \nThis 2% increase compared to last year is particularly noteworthy given the 27% increase in our electricity \nconsumption to support our growing business, including AI. While this global average reflects strong \nprogress, our journey varied by region. In Asia Pacific, for instance, our regional average Google CFE was \n12%\u2014well below that of other regions, like 70% in North America and 92% in Latin America.\n\u200962 In response, \nwe\u2019re  advancing new paths for clean energy in Asia Pacific specifically, like solar aggregation and piloting \ninvestments in new clean energy projects. \nThis regional variability is a reminder of what makes 24/7 CFE so powerful, and so complex: it doesn\u2019t hide \nthe gaps. It shines a light on them. \nAccelerating new tools like T-EACs ",
      "21 2022 2023 2024 \nYe a r \nTotal electricity consumption Global renewable energy matching Legend \n29",
      "0 2021 2022 2023 2024 2030 \nYear \nIllustrative emissions \nLegend \n12 \n9 \n6 \n3 \n0 \nMillion tCO2 e \n83\n\nKey reduction areas \nBuilding on the lessons and achievements from our first two decades of climate action, we developed a company-wide approach to guide our progress. \nOur net-zero approach includes carbon reduction initiatives across scopes 1, 2, and 3. We\u2019re prioritizing three key areas of emissions reductions, which we \nestimate will collectively contribute to the majority\n\u2009128 of our projected 2030 emissions reductions: clean electricity for our data centers, clean electricity for \nour supply chain, and low-carbon data center construction (Figure 16). \nFigure 16. Expected carbon reductions from key reduction areas and additional carbon reduction initiatives in 2030 \nExpected 2030\nambition-based emissions \nIllustrative business- Clean electricity Clean electricity Low-carbon data Additional carbon Remaining \nas-usual emissions for our data centers for our supply chain center construction reduction initiatives emissions \nKey reduction areas \nLegend ",
      "were avoided \nbecause of actions taken either as part of normal operations or in service of climate \n\nwere avoided \nbecause of actions taken either as part of normal operations or in service of climate \nambitions. We calculate avoided emissions by comparing our actual emissions to a \nscenario where we didn't take action. To calculate avoided emissions from our power \nusage effectiveness (PUE) improvements, we compare our fleet-wide trailing 12-month \n(TTM) PUE in each year from 2019 to 2024 to a baseline from our earliest fleet-wide TTM \nPUE (which was 1.21 in 2008). This baseline assumes that our PUE would have remained \nthe same without our efficiency improvements. We translate this efficiency improvement \ninto avoided energy consumption, and then calculate avoided emissions using an annual \nemissions rate (emissions/GWh) derived from reported scope 2 electricity data in our \ncorporate GHG inventory for the relevant year. To calculate avoided emissions from our \nmachine hardware efficiency improvements, we compare the actual emissions from our ",
      "nline. Together, they added 2.5 GW of new clean energy to the grids that serve  \nour operations. \n19\n\nBringing a clean energy project online requires years of planning, permitting, contracting, and construction. \nWhen a project reaches commercial operation, it\u2019s not just a milestone\u2014it\u2019s the realization of hard work \ndone years ago finally delivering clean electricity where it\u2019s needed. \nWe also continue to make progress in bringing more clean energy to our office operations. In 2024, from \nacross 14 agreements, we allocated over 140 megawatts (MW) of clean energy generation in the electricity \ngrids where our offices operate.\n\u200948 \nBy working to provide clean energy for our data centers and other operations, we\u2019re also avoiding a \nsubstantial amount of emissions. In 2024 alone, we estimate our clean energy purchases avoided more  \nthan 8.2 million tCO e\n\u200949\n2  (Figure 3). And from 2011 to 2024, we estimate our clean energy purchasing \ncumulatively avoided more than 44 million tCO 2e\u200950\u2014more than the emissions from the combined annual ",
      "ased emissions were 66% lower \nthan they would have been without \nclean energy procurement, machine \n\nased emissions were 66% lower \nthan they would have been without \nclean energy procurement, machine \nhardware efficiencies, and PUE \nimprovements\n119 (Figure 14). \nFigure 14. Avoided emissions \n \n \nTotal reported (ambition-based) emissions Scope 2 (market-based) \nScope 1 Scope 3 (ambition-based) \nEmissions \nLegend \nPUE improvements \nClean energy procurement \nMachine hardware efficiencies \nAvoided emissions \nMillion tCO2 e \n2019 2020 2021 2022 2023 2024 \n30 \n20 \n10 \n0 \nYear \n66% \nlower \nCarbon reduction progress \nIn 2024, our total ambition-based emissions were 11.5 million tCO2e, representing a 51% increase compared to 2019. \n\u2022  Operations: Combined scope 1 and scope 2 (market-based) emissions were 3.1 million tCO 2e, representing a 241% increase compared to 2019. \n\u2022  Supply chain: Scope 3 (ambition-based) emissions were 8.4 million tCO 2e, representing a 25% increase compared to 2019. \nGraph \nTotal operational emissions \nTotal scope 3 (ambition-based) \nemissions ",
      " (market-based) emissions by 11% , primarily due to clean energy procurement. For scope 2 emissions \n\n (market-based) emissions by 11% , primarily due to clean energy procurement. For scope 2 emissions \naccounting, clean energy purchases must be matched following GHG Protocol regional market boundaries. In 2024, we were successful in sourcing more \nclean energy from within the same regions as our data centers, specifically in North America. \nAs we have more control over our data centers and offices than many other parts of our value chain, scope 2 emissions are a key focus of our \ndecarbonization efforts. Our scope 2 emissions reduction efforts to date include energy management and clean energy procurement. Our path forward  \ndetails our forward-looking strategy for clean electricity for our data centers to further reduce scope 2 emissions. \n80",
      "ns. We also benefited slightly from broader grid decarbonization: across much of the United States, \n\nns. We also benefited slightly from broader grid decarbonization: across much of the United States, \nthe electricity on the grid became cleaner, with associated carbon emissions dropping\u2014some by as much \nas 10%\u2014between 2023 and 2024.\n\u200952 That means the electricity we consumed from those grids became less  \ncarbon-intensive, helping us further reduce emissions. \n20",
      " year. Instead, we selected 2019\u2014the most \nrecent year with representative data\u2014as the base year. 82\n\nOur path forward \nIn 2021, we set out an ambition to reach net-zero emissions across all of our operations and value chain by 2030. To meet this ambition, we aim to reduce \nover time our absolute, combined scope 1, 2 (market-based), and 3 emissions by 50% from a 2019 base year, and we plan to invest in a range of carbon \nremoval solutions to neutralize our remaining emissions.\n\u2009124  This year, we\u2019re sharing more details about our approach to this moonshot.\u2009125 \nWe outline how we\u2019re working toward net-zero emissions over the next five years. Our path forward is guided by science, grounded in robust measurement \nand reporting, and designed to deliver real-world results. It outlines our expected carbon reductions in the coming years, which are based on a multi-year \nprocess we\u2019ve followed to identify and prioritize carbon reduction initiatives,\n\u2009126 resulting in three key areas that help drive reductions across our operations \nand supply chain. "
    ]
  },
  {
    "question": "Which two companies partnered with Google for a waste wood-to-energy plant in Singapore?",
    "ground_truth": "PacificLight Energy and Rexus Bioenergy.",
    "answer": "PacificLight Energy and Rexus Bioenergy",
    "contexts": [
      "s, partnerships, and clean energy agreements \n36 APAC\u2019s brighter future: A solar solution in Taiwan \n\ns, partnerships, and clean energy agreements \n36 APAC\u2019s brighter future: A solar solution in Taiwan \n37 C onducting change: Focusing on high-impact semiconductor suppliers \n38 Supply chain transformation: Why it\u2019s slow, why it\u2019s messy, and why it   \nreally matters \n39 Resource efficiency \nWater stewardship \n40 Advancing responsible water use: Our approach to climate-conscious data  \ncenter cooling \n42 Replenishing water: A local approach to water stewardship \nWaste reduction  \n44 Reverse supply chain: Giving hardware a second life \n46 Food waste: Resourceful recipes and smarter services \nNature on our campuses \n47 Restoring habitat: Cultivating nature on our campuses \n49 Ripple effects: How our water efforts bloom into biodiversity gains \n2",
      "ped in partnership with GCoM through a shared vision to support city climate action with useful and \n\nped in partnership with GCoM through a shared vision to support city climate action with useful and \nClimate & Energy (GCoM) accessible data and insights. GCoM is a strategic partner, sharing EIE data with its alliance of cities and local governments to accelerate climate action. \nGlobal Renewables Alliance  (GRA) Google is a supporter of GRA\u2019s campaign to triple renewable energy globally by 2030 and has supported efforts to encourage high-impact corporate clean \nenergy purchasing as a key strategy to accelerate progress toward this ambition. \nICLEI Africa, ICLEI Europe , ICLEI USA Google is a partner of the regional secretariats of ICLEI\u2014Local Governments for Sustainability\u2014in Africa, Europe, and the United States. Through these \npartnerships, ICLEI regional teams support sustainable development projects in cities, using data and insights from EIE. ",
      "ngthen the resilience of our \nsupply chain. \nMinco II wind farm in Oklahoma (102 MW for Google). \n35\n\nAPAC\u2019s brighter future \nA solar solution in Taiwan \nOf course, even the most motivated suppliers can\u2019t switch to clean energy if it\u2019s not available. That\u2019s why \nGoogle isn\u2019t just supporting clean energy procurement\u2014we\u2019re helping create it. \nIn 2024, we announced an investment  to support the development of a 1 GW pipeline of new solar \nenergy in Taiwan, an investment that focuses on a region that plays a prominent role in global technology \nsupply chains. We expect to procure solar energy from these projects, and we may offer a portion of this \nclean energy to our semiconductor suppliers and manufacturers in the region so they can advance their \nown sustainability ambitions while helping reduce emissions in our shared supply chain. It\u2019s a model that \ngoes beyond carbon accounting to enable broader action\u2014removing barriers so others in our supply chain \ncan make better and cleaner choices too. ",
      "odule to train supply chain facility personnel on waste stream tracking, reporting, and management. \n\nodule to train supply chain facility personnel on waste stream tracking, reporting, and management. \nSymbiosis In 2024, Google co-founded  Symbiosis, a new coalition of corporate buyers committed to following the latest science to scale high-quality, nature-based \ncarbon removal. \nThe Nature Conservancy  (TNC) Google has supported TNC on watershed projects in Chile and the United States, and separately, Google.org has provided support to TNC for nature-\nrelated projects, including the restoration of giant kelp forest ecosystems across south-eastern Australia. \n United Nations Food and Agriculture Since 2015, Google and the UN FAO have partnered  on forest monitoring, natural resources, livelihoods, and the environment. \n Organization (UN FAO) \n United Nations Environment  In collaboration with UNEP and the European Commission Joint Research Centre, Google launched  the Freshwater Ecosystems Explorer . This platform ",
      "an transform waste into a valuable energy source. \nOur data center in Singapore lit up at night. \n26",
      " for grid regions with Google-owned and -operated data  \ncenters64 \n32\n\nEnergy for our \nsupply chain",
      "a first-of-a-kind partnership to unlock new, clean power from a series of small modular nu clear  \n4\n\nreactors, which will be developed by Kairos Power. We also partnered with a clean energy startup to develop  \na geothermal power project in Nevada that\u2019s now contributing carbon-free energy to the electric grid. And a  \ncollaboration between Google,  Tapestry, and grid operator PJM aims to develop AI-driven data capabilities  \nfor a smarter, more reliable electricity system. It\u2019ll also speed up grid interconnection\u2014with the goal of making  \nelectricity more reliable and affordable for the 67 million people PJM serves in the United States. \nWe worked with our suppliers to accelerate their path to 100% clean electricity. \nWhile we\u2019re encouraged by our operational progress, obstacles to decarbonizing our supply chain remain. 9  \nBringing new clean energy online for Google and our suppliers is particularly difficult in the Asia-Pacific \nregion, where wind and solar resources aren\u2019t readily accessible in many markets. And though we\u2019ve ",
      " innovation also involves finding resourceful ways to utilize existing resources. Our partnership   \n\n innovation also involves finding resourceful ways to utilize existing resources. Our partnership   \nwith PacificLight Energy and Rexus Bioenergy demonstrates this approach. Together, we\u2019re supporting a \n\u201cwaste  wood-to-energy\u201d  plant  in  Singapore. \nThis facility will convert waste wood, such as horticultural waste and wood from the logistics industry, into \na renewable energy source. The plant is designed with advanced technology and is expected to be more  \nefficient than traditional waste-to-energy facilities in Singapore. \nExpected to begin commercial operations in 2026, the plant will operate continuously. It\u2019ll also include a  \npilot-scale carbon capture system, exploring ways to further reduce its environmental impact. This project \nshowcases how innovative engineering can transform waste into a valuable energy source. \nOur data center in Singapore lit up at night. \n26",
      "nced geothermal plant in Nevada, a f irst-of-its-kind project developed in \npartnership with Google.",
      "tion with AI: Accelerating Climate Action with AI \n\u2022  Device repairability:  Google & Repairability \n\ntion with AI: Accelerating Climate Action with AI \n\u2022  Device repairability:  Google & Repairability \nThe following table includes a detailed list of our sustainability policy engagements in 2024: \nGlobal and cross-cutting initiatives \nAdvanced   clean  electricity   technologies:  In 2023, Google published a  paper outlining how corporate clean energy buyers can accelerate clean energy  \ntechnologies by supporting favorable policies, signing long-term purchase agreements, and providing early-stage project funding. In 2024, we published an \nupdated version of this paper to include our detailed procurement criteria for carbon-free energy technologies. \nUnited Nations Framework Convention on Climate Change (UNFCCC) 29th Conference of the Parties (COP-29): Google participated in COP-29, in \nBaku, Azerbaijan, in over 150 engagements with officials and sustainability industry leaders, partners, and priority stakeholders. "
    ]
  },
  {
    "question": "What is the difference in regional average Google CFE between North America and Asia Pacific in 2024?",
    "ground_truth": "North America's regional average CFE was 70%, while Asia Pacific's was 12%.",
    "answer": "58%",
    "contexts": [
      "th increasing the energy efficiency of our data centers to help minimize our electricity demand. In \n\nth increasing the energy efficiency of our data centers to help minimize our electricity demand. In \n2024, the average annual PUE for our global fleet of data centers was 1.09, compared with the industry average of 1.56, meaning that Google data centers \nused 84% less overhead energy than the industry average.\n\u2009129  We\u2019ll continue to build on this progress by driving additional energy efficiency and flexibility \nmeasures in our data centers\u2014with a focus on our machine learning fleet. \nAfter efficiency, our next focus is on scaling our clean energy procurement across all regions: In 2024, we signed contracts to purchase over 8 GW of \nadditional clean energy generation130\u2014more than in any prior year. We\u2019re also using Google\u2019s engineering expertise and purchasing demand to  accelerate  \nthe commercialization of advanced CFE technologies and scale their climate impact, and advocating for energy policies that can unlock access to cost-",
      "-owned and \n-operated data centers in 2024. In previous reports, we included Google CFE percentages \n\n-owned and \n-operated data centers in 2024. In previous reports, we included Google CFE percentages \nfor all grid regions where we had data center operations, including third-party-operated \nfacilities. All our data center operations, including third-party-operated facilities, are still \nincluded in our global and regional Google CFE metrics.\n65 Refer to endnote 10 above.\n66 Based on the average annual irrigation of golf courses in the southwest U.S. of 459 acre-ft  \nor around 150 million gallons. Source: \u201cHow Much Water Does Golf Use and Where Does It \nCome From?\u201d U.S. Golf Association, November 2012.\n67 Refer to endnote 5 above.\n68 Refer to endnote 5 above.\n69 \u201cCalifornia\u2019s Central Valley,\u201d U.S. Geological Survey, accessed March 2025.\n70 For Google-managed server assembly and maintenance, there was a year-on-year \nincrease in the quantity of reused components in 2024 compared to 2023. This \npercentage excludes components used to build servers through original equipment ",
      " and offices, we increased \nour Google CFE percentage from 64% in 2022 and 2023 to 66% in 2024\n117\u2014 \n\n and offices, we increased \nour Google CFE percentage from 64% in 2022 and 2023 to 66% in 2024\n117\u2014 \ndespite significant growth in electricity demand over this period (which was \ndriven, in part, by AI). This was a result of increases in Contracted CFE and \noverall increases in global Grid CFE, specifically in North America where our \nenergy consumption is highest. \nOverall, we increased our Google CFE in over half of our grid regions that \ncontain Google-owned and -operated data centers, and achieved at least \n80% CFE in nine out of 20 of these grid regions in 2024. \nDetails  \nWe set this ambition in 2020. The load-weighted average of carbon-free \nenergy percentages across Google\u2019s global portfolio of data centers and \noffices is referred to as \u201cGoogle CFE.\u201d This metric is inclusive of third-party \ndata centers, and it represents the clean energy purchased to meet our \nelectricity needs at every hour of every day, and within every grid where we ",
      " 2024, we continued to navigate a complex global energy landscape. We achieved significant progress \n\n 2024, we continued to navigate a complex global energy landscape. We achieved significant progress \nby increasing our global  carbon-free energy percentage across our data centers and offices to 66% . \n\u200961  \nThis 2% increase compared to last year is particularly noteworthy given the 27% increase in our electricity \nconsumption to support our growing business, including AI. While this global average reflects strong \nprogress, our journey varied by region. In Asia Pacific, for instance, our regional average Google CFE was \n12%\u2014well below that of other regions, like 70% in North America and 92% in Latin America.\n\u200962 In response, \nwe\u2019re  advancing new paths for clean energy in Asia Pacific specifically, like solar aggregation and piloting \ninvestments in new clean energy projects. \nThis regional variability is a reminder of what makes 24/7 CFE so powerful, and so complex: it doesn\u2019t hide \nthe gaps. It shines a light on them. \nAccelerating new tools like T-EACs ",
      " on the grid that\u2019s supplied by carbon-free energy sources (e.g., wind or solar) at that particular \n\n on the grid that\u2019s supplied by carbon-free energy sources (e.g., wind or solar) at that particular \nhour. Grid CFE is applied to Google\u2019s electricity consumption for any hour where Google\u2019s Contracted CFE is less than the electricity consumption. Grid \nCFE values are calculated by a third party, Electricity Maps. \nRegional average Google CFE across Google data center grid regions  refers to the percentage of carbon-free energy sources consumed by \nGoogle\u2019s data centers within a given global region per the previously-defined methodology. \n\u2022  The eastern North America regional CFE percentage includes the following grid regions: Duke Energy Carolinas (DUKE), Independent \nElectricity System Operator (IESO), Hydro-Qu\u00e9bec, Pennsylvania-New Jersey-Maryland Interconnection (PJM), South Carolina Regional Grid  \n(SC), Southern Company (SOCO), and Tennessee Valley Authority (TVA). ",
      "ogle-owned and -operated data centers (refer to the Environmental metrics data tables for details). \n\nogle-owned and -operated data centers (refer to the Environmental metrics data tables for details). \nWhat\u2019s most important is forward progress. \nAnd while we\u2019re making meaningful strides toward this moonshot, progress is uneven across regions. As the table below illustrates, North America, \nEurope, and Latin America are showing improvements, but the Asia-Pacific region largely remains undersupplied with carbon-free energy. \nYear-on-year progress \nRegional average Google CFE across Google data center grid regions Unit 2022 2023 2024 \nNorth America % 69 68 70 \nUnited States % 69 68 70 \n Canada & Mexico \u2009116 % 96 96 88 \nEurope, Middle East, & Africa % 76 83 83 \nEurope % 76 84 84 \nMiddle East & Africa % 3 4 5 \nLatin America % 90 91 92 \nAsia Pacific % 11 12 12 \nGlobal CFE across Google data centers % 64 64 66 \nTrend \nFor our global average across our data centers and offices, we increased \nour Google CFE percentage from 64% in 2022 and 2023 to 66% in 2024\n117\u2014 ",
      "or more details, refer to the  Recalculation of previous environmental metrics  section. \n25,307,000\n\nRegional average Google CFE across Google data center grid regions Unit 2022 2023 2024 \nNorth America % 69 68 70 \nUnited States % 69 68 70 \nCanada & Mexico \u2009158 % 96 96 88 \nEurope, Middle East, & Africa % 76 83 83 \nEurope % 76 84 84 \nMiddle East & Africa % 3 4 5 \nLatin America % 90 91 92 \nAsia Pacific % 11 12 12 \nGlobal CFE across Google data centers % 64 64 66 \nData center grid region CFE\u2009159  2024 \nConsumed Country Regional grid Unit Google CFE Contracted CFE Grid CFE Grid CFE \nEurope, Middle East, & Africa \nBelgium Elia % 84 32 52 78 \nDe\nnmark Energinet % 91 35 56 88 \nFinland Fingrid % 98 73 25 94 \nGermany Germany % 68 8 60 66 \nIreland EirGr id % 47 5 42 44 \nNetherlands Tennet % 83 70 13 56 \nAsia Pacific \nJapan TEPCO Power Grid (TEPCO) % 17 17 17 \nSingapore Energy Market Authority of Singapore % 4 0 4 4 \nTaiwan Taiwan Power Company % 17 1 16 16 \nLatin America \nChile Sistema Interconectado Central % 92 79 13 67\nNorth America "
    ]
  },
  {
    "question": "How many metric tons of GHG emissions reductions did fuel-efficient routing in Google Maps enable in 2024, and what is its car-equivalent?",
    "ground_truth": "It enabled more than 2.7 million metric tons of reductions, equivalent to taking approximately 630,000 gasoline-powered cars off the road for a year.",
    "answer": "over 2.7 million metric tons of GHG emissions reductions, equivalent to taking approximately 630,000 gasoline-powered cars off the road for a year",
    "contexts": [
      "e progressively greater efficiency in stop-and-go city driving and hilly driving where they benefit \n\ne progressively greater efficiency in stop-and-go city driving and hilly driving where they benefit \nfrom regenerative braking. The result? A more fuel-efficient drive, regardless of your vehicle type, without \nsacrificing time or convenience. \nIn 2024, we estimate that fuel-efficient routing enabled over 2.7 million metric tons of GHG \nemissions reductions\n\u200994\u2014equivalent to taking approximately 630,000 gasoline-powered cars off the \nroad for a year.\u200995 And it\u2019s not just for cars. In places like Southeast Asia, where motorcycles and scooters \nrule the road, we\u2019ve expanded the model to include two-wheelers as well. \nAs of January 2025, fuel-efficient routing is available globally, helping people all over the world cut down \non fuel or energy use, reduce their impact, and help their wallet. It\u2019s a seemingly simple approach that \nunderscores the power of technology to facilitate more sustainable choices in everyone\u2019s daily lives. \n58 \n-\nFuel-efficient routing in Google Maps.",
      "n \nliters or 17 million cubic meters) in 2024 alone, \nroughly 64% of our freshwater consumption.\n\u200925\n\nn \nliters or 17 million cubic meters) in 2024 alone, \nroughly 64% of our freshwater consumption.\n\u200925\nMulti --benefit   floodplain   restoration  along  the  \nTuolumne and San Joaquin rivers in California. \nEnabled 26 million tCO2e \nemissions reductions through  \nfive  products \nFive of our products (Nest thermostats,  Google  \nEarth Pro, Solar API, fuel-efficient routing in Google \nMaps, and Green Light, which represent only a \nsubset of our efforts) enabled individuals, cities, \n \nand other partners to collectively reduce an \ne\nstimated 26 million metric tons of GHG emissions. \u200926 \nExpanded fuel-efficient routing \nworldwide \nAs of January 2025, fuel-efficient routing in Google \nMaps is available g lobally. \n-\nFuel-efficient routing in Google Maps.",
      "2024 \nSolar API \nFuel-efficient routing \nGoogle Earth Pro \nNest thermostats Green Light \nLegend \n56 \n\n2024 \nSolar API \nFuel-efficient routing \nGoogle Earth Pro \nNest thermostats Green Light \nLegend \n56 \nRead more about the role each of these products  \nplayed in 2024 below: \n\u2022 Fuel-efficient routing: In 2024, we\nestimate that fuel-efficient routing enabled\nmore than 2.7 million metric tons of GHG\nemissions reductions\n\u200984\u2014equivalent to taking\napproximately 630,000 gasoline-powered  \ncars off the road for a year.\u200985 Want to dive\ndeeper into how this product feature is making\na tangible difference for drivers and the\nplanet? Explore the full story in  Fuel-efficient \nrouting: Driving smarter while saving more .\n-\nFuel-efficient routing",
      "-efficient routing in Google \nMaps is available g lobally. \n-\nFuel-efficient routing in Google Maps.",
      "full story in  Fuel-efficient \nrouting: Driving smarter while saving more .\n-\nFuel-efficient routing\n\n\u2022 G reen Light:  In 2024, we estimate that Green Light\nenabled over 3,000 metric tons of GHG emissions\nreductions\u200986\u2014and we expect even greater impact as\nwe continue to expand Green Light from 20 cities to\nhundreds of cities over the next few years. Continue\nreading for more details on this innovative traffic\nmanagement tool in  Green Light: AI for more efficient \ncity streets.\nGreen Light \n\u2022 Sola r   API: In 2024, we estimate that around 6 million\nmetric tons of lifetime GHG emissions reductions\nwere enabled by solar panels installed by our partners\nusing the Solar API in the United States.\n\u200987 And using \nthe annual accounting basis, we estimate that in 2024,\n0.6 million metric tons of GHG emissions reductions\nwere enabled by solar panels installed by our partners\nin the United States alone.\n\u200988  This  partnership-driven  \napproach not only enables emissions reductions,  \nbut it also helps companies scale their businesses\nand create new jobs, and it directly contributes to a",
      "-efficient routing in Google \nMaps is available g lobally. \n-\nFuel-efficient routing in Google Maps.\n\nGlobal challenges and dependencies \nProgress toward environmental ambitions requires navigating a web of interconnected challenges. Many external  \nfactors shape the pace and impact of these efforts, each demanding collaboration. Understanding these global \ncomplexities provides crucial context for our strategic approach, highlighting both where we\u2019re making progress \nand where significant work remains. \nGrowing demand for digital services \nAs AI and other technologies expand to unlock new economic and social benefits, the demand for digital \nservices has grown rapidly, which in turn creates demand for data centers that require increased energy \nfor operations and water for cooling. As a result, meeting corporate environmental ambitions isn\u2019t simply a  \nmatter of reducing today\u2019s footprint\u2014it requires working to reduce emissions while simultaneously scaling \ninfrastructure to meet growing demand and realize the opportunity of AI. This greatly increases the scale \nof the challenge. ",
      "te more sustainable choices in everyone\u2019s daily lives. \n58 \n-\nFuel-efficient routing in Google Maps.",
      "ating potential sites and streamlining site design and construction estimates. And, on an annual  \n5\n\naccounting basis, we estimate that 0.6 million metric tons of GHG emissions reductions were enabled by \nsolar panels installed by our partners using the Solar API  in the United States in 2024.\u200916 \nIn transportation, two products enabled others to reduce over 2 million tCO 2e emissions. \nWe estimate that our AI-powered  fuel-efficient routing in Google Maps saved users fuel and cumulatively \nenabled more than 2.7 million metric tons of GHG emissions reductions in 2024 alone\u200917\u2014that\u2019s equivalent to  \ntaking approximately 630,000 gasoline-powered cars off the road for a year.\u200918 Google researchers also built \nGreen Light, an AI-based tool that helps city traffic engineers optimize the timing of traffic lights, which has  \nshown the potential to reduce stops at intersections by up to 30% and reduce emissions at intersections by an  \naverage of over 10%.\u200919 \nResilience \nOur innovative research is bolstering resilience  \nto protect communities, save lives, and reduce  "
    ]
  },
  {
    "question": "What was the total waste generated in 2024 and how much of it was diverted?",
    "ground_truth": "Total waste generated was 58,500 metric tons, and 49,200 metric tons were diverted.",
    "answer": "In 2024, the total waste generated was 58,500 metric tons and 49,200 metric tons was diverted.",
    "contexts": [
      "nerated Metric tons 31,500 43,200 40,300 52,200 58,500 \nTotal waste diversion rate % 79 83 81 84 84 \n\nnerated Metric tons 31,500 43,200 40,300 52,200 58,500 \nTotal waste diversion rate % 79 83 81 84 84 \nNote: In 2024, we recalculated certain previously reported waste metrics in accordance with our internal recalculation policy for improved accuracy. For more details, refer to the Recalculation of  \nprevious environmental metrics  section. \nData center hardware circularity Unit 2020 2021 2022 2023 2024 \nReused inventory used for Google-managed server builds, maintenance, and upgrades \u2009162 % 10 13 21 29 44 \nComponents resold into the secondary market Million components 8.2 4.9 5.0 7.0 6.7 \n109",
      "hat our operations rely on and that have \nconfirmed volumetric benefits from the reporting year. \n86\n\nData center Zero Waste to Landfill \nWe aim to achieve Zero Waste to Landfill for our global data center operations. \nIn 2024, 35% of Google-owned and -operated data center campuses achieved Zero Waste to Landfill. \nTrend \n35% of Google-owned and -operated data center campuses  \nmet our Zero Waste to Landfill ambition, up from 33% in 2023.137  \nWhile two additional data center campuses achieved this  \nmilestone in 2024, four data center campuses that came into the  \nscope for our ambition did not achieve greater than 90% landfill  \ndiversion, impacting our overall progress toward this ambition. \nDetails \nWe set this ambition in 2016. With regard to annual operational \nwaste for all Google-owned and -operated data center \ncampuses globally, we consider \u201cZero Waste to Landfill\u201d for \nour data center operations to mean that more than 90% of \nwaste is diverted from landfill and incineration, in line with \nindustry standards. Our waste diversion methodology considers ",
      "\u2014 \ncombining operational changes with behavioral  \nnudges\u2014are yielding results. In 2024, we reduced \n\n\u2014 \ncombining operational changes with behavioral  \nnudges\u2014are yielding results. In 2024, we reduced \nfood waste per Googler by approximately 39% \ncompared to 2019.\n\u200971 For the waste that does occur,  \nour focus shifts to responsible diversion. In 2024, we \ndiverted 85% of food waste from landfill through \ncomposting, donations, or other recovery efforts. \nThis work isn\u2019t isolated to one campus; these \nprinciples are applied across our global operations,  \nbecause every bite counts. And surprisingly, the  \ndifficult part is actually repeating the easy stuff\u2014 \nensuring sustained efforts in every cafe and kitchen \nacross our global operations every day. In 2025, we\u2019re \ndoubling down on reducing preventable food waste,  \nsuch as overproduction and expired products, and  \nfocusing on specific regions and offices where we \nhave larger gaps to close. \n46 \n\u2019\nIn our kitchen and cafe operations, we\u2019re focused on ways to \nstop food waste before it starts.",
      "0 2021 2022 2023 2024 2030 \nYear \nIllustrative emissions \nLegend \n12 \n9 \n6 \n3 \n0 \nMillion tCO2 e \n83",
      "chen and cafe operations. \nDetails  \nWe set this ambition in 2022, and it covers annual food waste  \n\nchen and cafe operations. \nDetails  \nWe set this ambition in 2022, and it covers annual food waste  \nthat\u2019s diverted from landfills and incinerators in kitchens  \nand cafes at Google\u2019s offices globally. We consider sending  \n\u201czero food waste to landfill\u201d as 99% diversion via composting,  \nanaerobic digestion, donations, or other on-site processing  \nmethods\u2014which goes further than the 90% industry standard  \nfor Zero Waste to Landfill. \n87 \nGraph \n100\n75 \n0 \n2022 2023 2024 \n85% 85% 82% \nYe a r \nLegend Percentage of food waste diverted from landfill \nPercentage \n50\n25 \nYear",
      "dfill and incineration, in line with \nindustry standards. Our waste diversion methodology considers \n\ndfill and incineration, in line with \nindustry standards. Our waste diversion methodology considers \nthermally processed waste (i.e., incineration), with or without \nenergy recovery, as waste disposal. \nGraph \n40 \n30 \n20 \n10 \n33% \n35% \n23%\nData center campuses \n0\n2022 2023 2024 \nLe\ngend Data center campuses yet to achieve our Zero Waste to Landfill ambition\nData center campuses that have achieved our Zero Waste to Landfill \nambition\nFood waste \nWe aim to divert all food waste from landfill by 2025. \nIn 2024, we diverted 85% of food waste from landfill. \nTrend \nOur food waste diversion rate increased from 82% in 2023 to \n85% in 2024 due, in part, to our focus on improving waste bin \nsorting guidance and signage. Challenges remain amid limited \ncomposting infrastructure in certain regions\u2014including Asia \nPacific\u2014which continues to impact our ability to divert food \nwaste from our kitchen and cafe operations. \nDetails  \nWe set this ambition in 2022, and it covers annual food waste  ",
      "2024 Early 2030\u2019s Removal Bilateral \n280 Earth 13,301 United States 2024 2026\u20132030 Removal Frontier \n\n2024 Early 2030\u2019s Removal Bilateral \n280 Earth 13,301 United States 2024 2026\u20132030 Removal Frontier \nEnhanced rock w\nea\nthering (ERW) \nTerradot 200,000 Brazil 2024 2029 \u20132030 Removal Bilateral \nLithos Carbon 31,514 United States 2023 2025\u20132029 Removal Frontier \nTerradot 17, 324 Brazil 2024 2025\u20132029 Removal Frontier \nCREW 12,851 United S tates 2024 2025\u20132030 Removal Frontier \nAlt Carbon 185 India 2024 2028 R emoval Frontier \nFlux 114 Kenya 2024 2026 Removal Frontier \nSilica 127 Mexico 2024 2030 Removal Frontier \nRestoring natural carbon sinks \nMombak 50,000 Brazi l 2024 2029\u20132030 Removal Bilateral \nCarbonRun 12,695 Canada 2024 2025\u20132029 Removal Frontier \nTotal 782,472 \nLegend Subject to third-party limited assurance procedures. For more details, refer to our 2025 (FY2024) Independent Accountants\u2019 Review Report. \n106 \n50,700 3,027,400 11,207,600 \n5 100 800 \n1 32 100 \n14 13 13",
      "85% 85% 82% \nYe a r \nLegend Percentage of food waste diverted from landfill \nPercentage \n50\n25 \nYear",
      "leet-wide PUE across  PUE 1.10 1.1 0 1.10 1.10 1.09 Google-owned and -operated data center campuses \n\nleet-wide PUE across  PUE 1.10 1.1 0 1.10 1.10 1.09 Google-owned and -operated data center campuses \nWaste \nWaste generation Unit 2020 2021 2022 2023 2024 \nData centers \nWaste  diverted Metric tons 18,000 34,500 27, 800 35,100 39,100 \nWaste disposed Metric tons 3,700 6,800 6,000 5,900 7,400 \nSubtotal waste generated Metric tons 21,700 41,300 33,800 41,000 46,500 \nWaste diversion rate % 83 83 82 85 84 \nOffices\u2009161 \nWaste  diverted Metric tons 6,900 1,200 4,900 8,600 10,100 \nWaste disposed Metric tons 2,900 700 1,600 2,600 1,900 \nSubtotal waste generated Metric tons 9,800 1,900 6,500 11,200 12,000 \nWaste diversion rate % 71 64 75 77 84 \nTotal \nWast\ne  diverted Metric tons 24,900 35,700 32,700 43,700 49,200 \nWaste disposed Metric tons 6,600 7,500 7,600 8,500 9,300 \nTotal waste generated Metric tons 31,500 43,200 40,300 52,200 58,500 \nTotal waste diversion rate % 79 83 81 84 84 ",
      "21 2022 2023 2024 \nYe a r \nTotal electricity consumption Global renewable energy matching Legend \n29",
      "85% 85% 82% \nYe a r \nLegend Percentage of food waste diverted from landfill \nPercentage \n50\n25 \nYear\n\nRecycled plastic \nWe aim to use recycled or renewable material in at least 50% of plastic used across our consumer hardware \nproduct portfolio by 2025. \n40% of the plastic Google used in products manufactured in 2024 was recycled content. 138 \nTrend  \nThe percentage of plastic used in our manufactured consumer \nhardware products that was recycled content increased from \n34% 139 in 2023 to 40%140 in 2024, due to changes in our product \nmix, primarily driven by a decrease in the manufacturing of \nGoogle products with low recycled content in 2024. \nDetails  \nWe set this ambition in 2020, and it includes the minimum \npercentage of recycled or renewable plastic content calculated \nas a percentage of total plastic (by weight) in Google\u2019s \nconsumer hardware portfolio for products manufactured in a \ngiven year. The following may be excluded from the calculation \nof percentage: printed circuit boards, labels, cables, connectors, \nelectronic components and modules, optical components, ",
      "ta centers (that are owned and operated), offices, and other assets under our \noperational control. \n\nta centers (that are owned and operated), offices, and other assets under our \noperational control. \nWe calculate waste generated by quantifying solid waste generated that\u2019s either composted, recycled, landfilled, or incinerated (with or without energy \nrecovery). The waste generation data comes from a combination of data from invoices and on-site measurements. Where actual waste data isn\u2019t available \nfor a specific facility, we estimate waste tonnage using waste container size and pickup frequency, actual waste data from similar facilities, or historical \nwaste data from the same facility. We round reported waste generation metrics to the nearest hundred. \nWe calculate waste  diversion by quantifying the percentage of total waste generated that is diverted from disposal (defined as diversion of waste from \nlandfills or incinerators, with or without energy recovery). Our approach to data center waste accounting tracks operational waste and integrates data ",
      ".\n137 We recalculated data center waste diversion metrics. For additional details, refer to the \n118",
      "Environmental \nReport \n2025"
    ]
  },
  {
    "question": "What was the percentage of food waste diverted from landfill in 2023 versus 2024?",
    "ground_truth": "The diversion rate was 82% in 2023 and increased to 85% in 2024.",
    "answer": "In 2023, the food waste diversion rate was 82%, and in 2024, it was 85%.",
    "contexts": [
      "nerated Metric tons 31,500 43,200 40,300 52,200 58,500 \nTotal waste diversion rate % 79 83 81 84 84 \n\nnerated Metric tons 31,500 43,200 40,300 52,200 58,500 \nTotal waste diversion rate % 79 83 81 84 84 \nNote: In 2024, we recalculated certain previously reported waste metrics in accordance with our internal recalculation policy for improved accuracy. For more details, refer to the Recalculation of  \nprevious environmental metrics  section. \nData center hardware circularity Unit 2020 2021 2022 2023 2024 \nReused inventory used for Google-managed server builds, maintenance, and upgrades \u2009162 % 10 13 21 29 44 \nComponents resold into the secondary market Million components 8.2 4.9 5.0 7.0 6.7 \n109",
      "hat our operations rely on and that have \nconfirmed volumetric benefits from the reporting year. \n86\n\nData center Zero Waste to Landfill \nWe aim to achieve Zero Waste to Landfill for our global data center operations. \nIn 2024, 35% of Google-owned and -operated data center campuses achieved Zero Waste to Landfill. \nTrend \n35% of Google-owned and -operated data center campuses  \nmet our Zero Waste to Landfill ambition, up from 33% in 2023.137  \nWhile two additional data center campuses achieved this  \nmilestone in 2024, four data center campuses that came into the  \nscope for our ambition did not achieve greater than 90% landfill  \ndiversion, impacting our overall progress toward this ambition. \nDetails \nWe set this ambition in 2016. With regard to annual operational \nwaste for all Google-owned and -operated data center \ncampuses globally, we consider \u201cZero Waste to Landfill\u201d for \nour data center operations to mean that more than 90% of \nwaste is diverted from landfill and incineration, in line with \nindustry standards. Our waste diversion methodology considers ",
      "a second life. \n45 \n \n \nA Googler swaps out a motherboard at our data center in \nThe Dalles, Oregon.\n\nFood waste \nResourceful recipes and smarter services \nTackling operational waste extends beyond our data center hardware to another critical area: food. The \njourney from farm to fork is fraught with potential food loss and waste\u2014along with the water, energy, and \nother resources that went into producing it. Addressing this complex food waste challenge requires a  \ncomprehensive strategy focused on both waste reduction and diversion. \nPrevention is paramount. We\u2019re enhancing strategies across the entire food life cycle\u2014from responsible \nsourcing and procurement to optimizing kitchen operations and finding innovative uses for surplus food. \nThis focus on reduction minimizes the amount of waste that needs subsequent diversion from landfills. \nConsider our  Bay View campus in Mountain View, California, which exemplifies this multipronged approach. \nWe\u2019re tackling food waste by creatively incorporating ingredients that might otherwise be discarded. This ",
      "\u2014 \ncombining operational changes with behavioral  \nnudges\u2014are yielding results. In 2024, we reduced \n\n\u2014 \ncombining operational changes with behavioral  \nnudges\u2014are yielding results. In 2024, we reduced \nfood waste per Googler by approximately 39% \ncompared to 2019.\n\u200971 For the waste that does occur,  \nour focus shifts to responsible diversion. In 2024, we \ndiverted 85% of food waste from landfill through \ncomposting, donations, or other recovery efforts. \nThis work isn\u2019t isolated to one campus; these \nprinciples are applied across our global operations,  \nbecause every bite counts. And surprisingly, the  \ndifficult part is actually repeating the easy stuff\u2014 \nensuring sustained efforts in every cafe and kitchen \nacross our global operations every day. In 2025, we\u2019re \ndoubling down on reducing preventable food waste,  \nsuch as overproduction and expired products, and  \nfocusing on specific regions and offices where we \nhave larger gaps to close. \n46 \n\u2019\nIn our kitchen and cafe operations, we\u2019re focused on ways to \nstop food waste before it starts.",
      "chen and cafe operations. \nDetails  \nWe set this ambition in 2022, and it covers annual food waste  \n\nchen and cafe operations. \nDetails  \nWe set this ambition in 2022, and it covers annual food waste  \nthat\u2019s diverted from landfills and incinerators in kitchens  \nand cafes at Google\u2019s offices globally. We consider sending  \n\u201czero food waste to landfill\u201d as 99% diversion via composting,  \nanaerobic digestion, donations, or other on-site processing  \nmethods\u2014which goes further than the 90% industry standard  \nfor Zero Waste to Landfill. \n87 \nGraph \n100\n75 \n0 \n2022 2023 2024 \n85% 85% 82% \nYe a r \nLegend Percentage of food waste diverted from landfill \nPercentage \n50\n25 \nYear",
      "dfill and incineration, in line with \nindustry standards. Our waste diversion methodology considers \n\ndfill and incineration, in line with \nindustry standards. Our waste diversion methodology considers \nthermally processed waste (i.e., incineration), with or without \nenergy recovery, as waste disposal. \nGraph \n40 \n30 \n20 \n10 \n33% \n35% \n23%\nData center campuses \n0\n2022 2023 2024 \nLe\ngend Data center campuses yet to achieve our Zero Waste to Landfill ambition\nData center campuses that have achieved our Zero Waste to Landfill \nambition\nFood waste \nWe aim to divert all food waste from landfill by 2025. \nIn 2024, we diverted 85% of food waste from landfill. \nTrend \nOur food waste diversion rate increased from 82% in 2023 to \n85% in 2024 due, in part, to our focus on improving waste bin \nsorting guidance and signage. Challenges remain amid limited \ncomposting infrastructure in certain regions\u2014including Asia \nPacific\u2014which continues to impact our ability to divert food \nwaste from our kitchen and cafe operations. \nDetails  \nWe set this ambition in 2022, and it covers annual food waste  ",
      "85% 85% 82% \nYe a r \nLegend Percentage of food waste diverted from landfill \nPercentage \n50\n25 \nYear",
      "85% 85% 82% \nYe a r \nLegend Percentage of food waste diverted from landfill \nPercentage \n50\n25 \nYear\n\nRecycled plastic \nWe aim to use recycled or renewable material in at least 50% of plastic used across our consumer hardware \nproduct portfolio by 2025. \n40% of the plastic Google used in products manufactured in 2024 was recycled content. 138 \nTrend  \nThe percentage of plastic used in our manufactured consumer \nhardware products that was recycled content increased from \n34% 139 in 2023 to 40%140 in 2024, due to changes in our product \nmix, primarily driven by a decrease in the manufacturing of \nGoogle products with low recycled content in 2024. \nDetails  \nWe set this ambition in 2020, and it includes the minimum \npercentage of recycled or renewable plastic content calculated \nas a percentage of total plastic (by weight) in Google\u2019s \nconsumer hardware portfolio for products manufactured in a \ngiven year. The following may be excluded from the calculation \nof percentage: printed circuit boards, labels, cables, connectors, \nelectronic components and modules, optical components, "
    ]
  },
  {
    "question": "Which two rivers in California's Central Valley were part of Google's multi-benefit floodplain restoration efforts?",
    "ground_truth": "The Tuolumne and San Joaquin rivers.",
    "answer": "the Tuolumne and San Joaquin rivers",
    "contexts": [
      "n of the San \nJoaquin River more critical than ever for sustaining this food production powerhouse. \n\nn of the San \nJoaquin River more critical than ever for sustaining this food production powerhouse. \nAddressing this critical need for water resilience requires innovative approaches and collaboration with local  \nactors. Recognizing this, Google stepped in, partnering with the North Fork Mono Tribe, the Sierra National \nForest, and Trout Unlimited. We worked together to restore eight degraded wet meadows\u2014key areas that \nact like natural sponges when healthy. They soak up melting snowpack and rainfall, storing water near the \nsurface and slowly releasing it over time. \nThe restoration involved techniques tailored to bring back the meadows\u2019 natural water-holding function,  \nwhich in turn can unlock multiple benefits: reduced downstream flooding, improved wildlife habitats, and \ncrucially, increased groundwater recharge. This type of intervention is vital for replenishing the underground  ",
      "fort to design and build our offices with local \nenvironments, ecology, and animal habitats in mind.\n\nRipple effects \nHow our water efforts bloom into biodiversity gains \nWe know the loss of nature isn\u2019t limited to cities, which is why our restoration efforts extend far beyond our \ncampuses. In fact, our water   replenishment  portfolio intentionally includes projects that have co-benefits \nfor nature and biodiversity. \n\u2022  In California, we\u2019ve partnered with the Bonneville Environmental Foundation and American Rivers to \nhelp project partners restore wetland meadows  in Yosemite National Park that provide habitat for \nspecies like the northwestern pond turtle. These ecosystems don\u2019t just support wildlife\u2014they help \nregulate water, reduce fire risk, and make the landscape more climate resilient. \n\u2022  In Tennessee, we\u2019re supporting the Cumberland River Compact\u2019s efforts to reforest previously mined  \nland\u2014bringing back native species and building healthier local ecosystems. \n\u2022  In Arizona, we\u2019re supporting the Cocopah Indian Tribe and National Audubon Society to restore  ",
      "ncreased groundwater recharge. This type of intervention is vital for replenishing the underground  \n\nncreased groundwater recharge. This type of intervention is vital for replenishing the underground  \nsupplies that the communities and farms of the Central Valley depend on, helping to secure a healthier \nwater future for the region. \nJust upstream, we worked on another water  \nstewa\nrdship effort that brought together \npublic and private partners to tackle \ngroundwater depletion directly within the  \nCentral Valley. Using insights from state \nstudies, we planned on-the-ground recharge  \nprojects and conducted feasibility studies on  \nfour additional San Joaquin River tributary \nwatersheds with Sustainable Conservation.  \nThis work will also improve groundwater \nresilience, helping local farmers adapt to \nchanging water availability. \nThrough partnerships spanning headwaters \nto floodplains, these San Joaquin River \nprojects embody our approach to water \nstewardship: actively replenishing water  \nand enhancing ecosystem health in a region \ncritical to both California and the nation. ",
      "n \nliters or 17 million cubic meters) in 2024 alone, \nroughly 64% of our freshwater consumption.\n\u200925\n\nn \nliters or 17 million cubic meters) in 2024 alone, \nroughly 64% of our freshwater consumption.\n\u200925\nMulti --benefit   floodplain   restoration  along  the  \nTuolumne and San Joaquin rivers in California. \nEnabled 26 million tCO2e \nemissions reductions through  \nfive  products \nFive of our products (Nest thermostats,  Google  \nEarth Pro, Solar API, fuel-efficient routing in Google \nMaps, and Green Light, which represent only a \nsubset of our efforts) enabled individuals, cities, \n \nand other partners to collectively reduce an \ne\nstimated 26 million metric tons of GHG emissions. \u200926 \nExpanded fuel-efficient routing \nworldwide \nAs of January 2025, fuel-efficient routing in Google \nMaps is available g lobally. \n-\nFuel-efficient routing in Google Maps.",
      "ing water  \nand enhancing ecosystem health in a region \ncritical to both California and the nation. \n\ning water  \nand enhancing ecosystem health in a region \ncritical to both California and the nation. \nFor more details on all the water stewardship \nprojects we\u2019ve supported as of the end \nof 2024, refer to the 2025 Google Water  \nStewardship Project Portfolio. \n43 \n\u2019\nA farm in California\u2019s Central Valley. (Photo credit: Paolo Vescia)",
      "rdship Project Portfolio. \n43 \n\u2019\nA farm in California\u2019s Central Valley. (Photo credit: Paolo Vescia)",
      " \n\u2022  In Arizona, we\u2019re supporting the Cocopah Indian Tribe and National Audubon Society to restore  \n\n \n\u2022  In Arizona, we\u2019re supporting the Cocopah Indian Tribe and National Audubon Society to restore  \nhabitat along the lower Colorado River floodplain. \n\u2022  In Israel, we\u2019re supporting the restoration of former fish farms that are being converted back to \nwetland habitat, which will provide a stopover for migratory birds. \nThe thread through all of it: bring nature back where it\u2019s been pushed out. Make it count for biodiversity. \nMake it meaningful for people. And make it part of how we design and build\u2014not just something we try to \nprotect at the edges. \nIt\u2019s about rethinking how we live with nature in the present\u2014and what we want our future to look like. \nBecause in a world shaped by concrete, asphalt, and glass, choosing to build for biodiversity is one of the \nmost hopeful decisions we can make. \nOriental storks in a flooded rice paddy. \n49",
      "sanitation, & hygiene (WASH) 9 \nAquatic habitat restoration 24 \nWater quality 16 \nTotal projects 112\n\nGroundwater recharge in California\u2019s Central Valley \nLocal water issues are often complex and contextual. That\u2019s why Google\u2019s approach to water stewardship is \nrooted in partnerships with local communities and organizations. We focus on projects that have a tangible \nimpact\u2014such as restoring ecosystems, improving irrigation efficiency, and supporting communities\u2019 water \nsupply reliability. \nTake the San Joaquin River, which winds through California\u2019s Central Valley, a region that acts as an \nagricultural engine for the nation. Think fruits, vegetables, nuts\u2014a staggering share of the U.S. supply \noriginates here,\n\u200969 all cultivated through reliance on irrigation. But this vital production faces a challenge \nsimmering beneath the surface: groundwater depletion, making the health and restoration of the San \nJoaquin River more critical than ever for sustaining this food production powerhouse. ",
      "dfire boundary mapping Flood forecasting \nA visual showcase of various Google Research projects. \n55"
    ]
  },
  {
    "question": "How much energy did Nest thermostats save cumulatively from 2011 to 2024, and what country's 2023 total electricity consumption is this comparable to?",
    "ground_truth": "They saved more than 162 billion kWh, which is more than the total annual electricity consumption of Poland in 2023.",
    "answer": "Nest thermostats helped customers cumulatively save more than 162 billion kWh of energy from 2011 to 2024, which is more than the total annual electricity consumption of Poland in 2023.",
    "contexts": [
      " precision  \nhelps them develop projects more efficiently and  \ncost-effectively.\n Google Earth Pro \n\n precision  \nhelps them develop projects more efficiently and  \ncost-effectively.\n Google Earth Pro \n\u2022 N est thermostats: In 2024, we estimate that our  \nNest thermostats helped customers save more than  \n25 billion kWh of energy,\u200990 enabling approximately   \n8.4 million metric tons of GHG emissions reductions. \u200991  \nFor over a decade, our Nest Thermostats have\nused machine learning to help people save energy  \nand money at home by automatically adjusting  \ntemperatures based on habits and preferences. In  \nfact, we estimate that our Nest thermostats helped\ncustomers cumulatively save more than 162 billion  \nkWh of energy from 2011 to 2024,\n\u200992 which is more  \nthan the total annual electricity consumption of\nPoland in 2023.\n\u200993 \n Nest thermostat \n57",
      "3 \n2 \nIn energy, three products enabled others to reduce approximately 24 million tCO 2e emissions. \n\n3 \n2 \nIn energy, three products enabled others to reduce approximately 24 million tCO 2e emissions. \nWe estimate that our Nest thermostats helped customers cumulatively save more than 162 billion kWh  \nof energy from 2011 to 2024,\u200914 which is more than the total annual electricity consumption of Poland in \n2023.\u200915  Google Earth Pro helps solar and wind developers accelerate clean energy project development  \nby evaluating potential sites and streamlining site design and construction estimates. And, on an annual  \n5",
      "for heating \nand cooling savings found in real-world studies of the Nest Learning Thermostat in the \n\nfor heating \nand cooling savings found in real-world studies of the Nest Learning Thermostat in the \nU.S. and U.K., and generalized for Nest thermostat usage worldwide, assuming user opt-in \nfor available energy-saving features. To calculate the total Nest savings, we applied the \nsavings percentages to the actual heating and cooling hours of all Nest thermostats in \nuse in 2024.\n91 The enabled emissions reductions are calculated based on these energy savings, applying \nstandard emission factors for fossil fuels, and using U.S. EPA AVERT marginal emissions \nfor the 95% of electricity savings that occur in the U.S., with an adjusted value for the 5% \nof electricity savings outside the U.S. The data and claims have not been verified by an \nindependent third-party.\n92 Refer to endnote 14 above.\n93 According to the IEA\u2019s Energy Statistics Data Browser, Poland\u2019s total electricity \nconsumption was approximately 160 TWh in 2023.\n94 Refer to endnote 17 above.\n95 Refer to endnote 12 above.\n117",
      "we applied the \nsavings percentages to the actual heating and cooling hours of all Nest thermostats \n\nwe applied the \nsavings percentages to the actual heating and cooling hours of all Nest thermostats \nin use since 2011. As of January 2023, we use an updated energy savings calculation \nmethodology to account for changes in common HVAC sizes and efficiencies, applying \nthe respective energy savings percentages to Nest thermostats in North America and in \nEuropean countries.\n15 According to the IEA\u2019s Energy Statistics Data Browser, Poland\u2019s total electricity \nconsumption was approximately 160 TWh in 2023.\n16 The data used is the same used in the lifetime accounting basis\u2014refer to endnote 33. For \nboth annual and lifetime methods, we use a 25-year estimated lifespan. The difference \nis that the estimated annual enabled emissions reduction takes into account solar \ninstallations enabled by Solar API prior to 2024 (dating back to 2022) to calculate the total \nimpact in 2024 alone. It estimates a single year\u2019s worth of emission reductions each year \nof a solar panel\u2019s 25-year lifespan. ",
      "2024 \nSolar API \nFuel-efficient routing \nGoogle Earth Pro \nNest thermostats Green Light \nLegend \n56 \n\n2024 \nSolar API \nFuel-efficient routing \nGoogle Earth Pro \nNest thermostats Green Light \nLegend \n56 \nRead more about the role each of these products  \nplayed in 2024 below: \n\u2022 Fuel-efficient routing: In 2024, we\nestimate that fuel-efficient routing enabled\nmore than 2.7 million metric tons of GHG\nemissions reductions\n\u200984\u2014equivalent to taking\napproximately 630,000 gasoline-powered  \ncars off the road for a year.\u200985 Want to dive\ndeeper into how this product feature is making\na tangible difference for drivers and the\nplanet? Explore the full story in  Fuel-efficient \nrouting: Driving smarter while saving more .\n-\nFuel-efficient routing",
      "21 2022 2023 2024 \nYe a r \nTotal electricity consumption Global renewable energy matching Legend \n29",
      "is more  \nthan the total annual electricity consumption of\nPoland in 2023.\n\u200993 \n Nest thermostat \n57",
      "generated in \n2024. The estimated annual emissions reduction takes into account projects enabled by \n\ngenerated in \n2024. The estimated annual emissions reduction takes into account projects enabled by \nGoogle Earth prior to 2024 (dating back to 2020) to calculate the total impact in 2024 \nalone. Enabled emissions reductions estimates include inherent uncertainty due to factors \nthat include the lack of primary data and precise information about real-world actions \nand their effects to date, as well as forward-looking projections. Google is relying on \nits own substantiation of the enabled emissions-reduction impact, in consultation with \nmultiple third-party partners that have reviewed and support the methodology discussed \nherein. The data and claims have not been verified by an independent third-party. We will \ncontinue to work to refine our methodologies and inputs for these estimates.\n90 Estimated energy savings are calculated based on the average percentages for heating \nand cooling savings found in real-world studies of the Nest Learning Thermostat in the "
    ]
  },
  {
    "question": "What was the reduction in Scope 2 market-based emissions from 2023 to 2024?",
    "ground_truth": "Emissions decreased from 3,423,400 tCO2e in 2023 to 3,059,100 tCO2e in 2024.",
    "answer": "11%",
    "contexts": [
      "Factors for Greenhouse Gas Inventories, the 2024 Climate Registry Default Emission Factors, and the \n\nFactors for Greenhouse Gas Inventories, the 2024 Climate Registry Default Emission Factors, and the \n2024 Department for Environment, Food and Rural Affairs (DEFRA) UK Government GHG Conversion Factors. \nScope 2 emissions \nScope 2 emissions are indirect emissions from purchased electricity; natural gas use and refrigerant leakage in our leased offices; and purchased steam, \nhot water, and chilled water from district energy systems. We report scope 2 emissions using both location-based and market-based methods. The \nlocation-based method  reflects the average carbon intensity of the electric grids where our operations are located and thus where our electricity \nconsumption occurs. The market-based method  incorporates our procurement choices, primarily our renewable energy purchases via contractual \ninstruments, such as power purchase agreements (PPAs). ",
      "ns \nSupply chain emissions \nMillion tCO2 e \n7. 5 \n5 \n2.5 \n0 \n2019 2020 2021 2022 2023 2024 \nYear \n81\n\nYear-on-year progress \nUnit 2022 2023 2024 \nOperations: Scope 1 + scope 2 (market-based) Year-on-year % change 37% increase 36% increase 11% reduction \nSupply chain: Scope 3 (ambition-based) Year-on-year % change 4% increase 7% increase 22% increase \nTotal ambition-based emissions Year-on-year % change 12% increase 15% increase 11% increase \n2019 base year \n10 \n7. 5 \n5 \n2.5 \n0 \n2019 \nYear \nMillion tCO2e \nLegend \nExclusions from scope 3 (Category 2: Capital goods) and (Category 11: Use of sold products) \nExclusions from scope 3 (Category 1: Purchased goods and services) \nScope 3 (Category 7: Employee commuting) \nScope 3 (Category 6: Business travel) \nScope 3 (Category 5: Waste generated in operations) \nScope 3 (Category 4: Upstream transportation and distribution) \nScope 3 (Category 3: Fuel- and energy-related activities [not included in scope 1 or scope 2]) \nScope 3 (Category 2: Capital goods) and (Category 11: Use of sold products) \nScope 3 (Category 1: Purchased goods and services) ",
      " our scope 1 emissions were approximately 73,100 tCO2e, representing less than 1% of our total 2024 \n\n our scope 1 emissions were approximately 73,100 tCO2e, representing less than 1% of our total 2024 \nambition-based carbon footprint. \nCompared to 2023, we reduced our scope 1 emissions by 8% , primarily due to building efficiencies and warmer weather conditions that resulted in \ndecreases in natural gas, changes to generator utilization that resulted in decreases in diesel and other fuel usage, and improvements to refrigerant data \nquality. Our scope 1 emissions reduction efforts to date have focused on electrification, refrigerant mitigation, and renewable fuel use. \nScope 2 \nThe primary source of our scope 2 emissions is purchased electricity for our data centers and offices. In 2024, our scope 2 (market-based) emissions were \napproximately 3.1 million tCO\n2e, representing 26% of our total 2024 ambition-based carbon footprint. \nCompared to 2023, we reduced our scope 2 (market-based) emissions by 11% , primarily due to clean energy procurement. For scope 2 emissions ",
      "se compared to 2019. \nGraph \nTotal operational emissions \nTotal scope 3 (ambition-based) \nemissions \n\nse compared to 2019. \nGraph \nTotal operational emissions \nTotal scope 3 (ambition-based) \nemissions \nScope 2 (market-based) \nScope 1 \nScope 3 (ambition-based) \nLegend \nOur operational emissions \nSupply chain emissions \nMillion tCO2 e \n7. 5 \n5 \n2.5 \n0 \n2019 2020 2021 2022 2023 2024 \nYear \n81",
      " goods) and (Category 11: Use of sold products) \nScope 3 (Category 1: Purchased goods and services) \n\n goods) and (Category 11: Use of sold products) \nScope 3 (Category 1: Purchased goods and services) \nScope 2 (market-based) \nScope 1 \ntCO2e \n292,000 \n1,914,000 \n203,000 \n461,000 \n14,000 \n476,000 \n425,000 \n4,292,000 \n873,000 \n835,900 \n81,900 \nTotal 2019 ambition-based emissions 7,661,800 \nTrend \nIn 2024, our total ambition-based emissions were 11.5 million tCO2e, representing an 11% year-on-year increase and a 51% increase compared to our 2019 \nbase year\u2014primarily driven by increases in supply chain emissions. \nThe year-on-year increase was slightly offset in that we reduced our scope 1 and scope 2 (market-based) emissions by 8% and 11%, respectively\u2014 \ndemonstrating that our operational decarbonization efforts are bearing fruit. This achievement is particularly significant given the 27% increase in our \nelectricity consumption compared to 2023. \nDetails \nScience Based Targets initiative (SBTi) validation: ",
      "date. Any future update will be provided only through a public disclosure indicating that fact. \n104\n\nEnvironmental metrics data tables \nGreenhouse gas emissions \nGreenhouse gas emissions inventory Unit 2019 2020 2021 2022 2023 2024 \nScope 1 tCO e 81,900 55,800 64,100 91,200 79,400 73,100 2\nScope 2 \nScope 2 (location-based) tCO2e 5,116,900 5,865,100 6,576,200 8,045,400 9,252,900 11,283,200 \nScope 2 (market-based) tCO e 835,900 911,600 1,823,500 2,492,100 3,423,400 3,059,100 2\nTotal operational (scope 1 +  \nmarket-based scope 2) emissions tCO2e 917,800 967,400 1,887,600 2,583,300 3,502,800 3,132,200 \nScope 3 \nScope 3 (Category 1: Purchased goods and services) tCO2e 2,787,000 2,404,000 2,886,000 3,504,000 3,951,000 3,601,000 \n2\n2\n105 \nScope 3 (Category 2: Capital goods) and  \n(Category 11: Use of sold products) \u2009148  tCO2e 4,584,000 4,176,000 4,462,000 3,886,000 4,583,000 6,337,000 \nScope 3 (Category 3: Fuel- and energy-related activities   \n[not included in scope 1 or scope 2] ) t CO2e 425,000 512,000 753,000 1,004,000 1,295,000 714,000 ",
      "31  2024 \n(metric tons per gas type \nGHG emissions by type \nCH4 \nScope 1 \n5 \nScope 2 (market-based) \n\n31  2024 \n(metric tons per gas type \nGHG emissions by type \nCH4 \nScope 1 \n5 \nScope 2 (market-based) \n100 \nScope 2 (location-based) \n800 \nN2O \nHFCs \n1 \n14 \n32 \n13 \n100 \n13 \nScope 3 GHG emissions \n\u201cScope 3 GHG emissions\u201d are indirect emissions from other sources in Alphabet\u2019s value chain. Alphabet calculates the reported values \nin the Schedule of Select Environmental Metrics using methodologies from the Scope 3 Technical Guidance for the following categories \nidentified as relevant: \n\u25cf Category 1: Purchased goods and services \n\u25cf Category 2: Capital goods \n\u25cf Category 3: Fuel- and energy-related activities (not included in scope 1 or scope 2) \n\u25cf Category 4: Upstream transportation and distribution \n\u25cf Category 5: Waste generated in operations \n\u25cf Category 6: Business travel \n\u25cf Category 7: Employee commuting \n\u25cf Category 11: Use of sold products \nAlphabet evaluated the remaining categories using the Scope 3 Standard\u2019s relevance criteria and determined the following categories to ",
      "s\u2014including our 2019 base year for our emissions reduction ambition. Updates may include structural \n\ns\u2014including our 2019 base year for our emissions reduction ambition. Updates may include structural \nchanges, changes in calculation methodologies, improvements in data accuracy, changes in the categories or activities included in the scope 3 inventory, \nand the correction of errors. We continually review emissions calculation methodologies and are committed to implementing best practices. \nIn line with our recalculation policy, in 2024 we recalculated the following previously-reported metrics, due to the following primary drivers: \n\u2022  We recalculated 2019\u20132023 scope 3 emissions metrics\u2014including all reported scope 3 categories, \u201cscope 3 (total),\u201d and \u201ctotal emissions: \nscope 1, 2 (market-based), and 3\u201d\u2014due to the following: \n\u2022  For emissions associated with manufacturing equipment used in our technical infrastructure, we transitioned from a spend-based to  \na primarily LCA-based calculation methodology, and we improved the spend data accuracy for our remaining spend-based emissions  ",
      " (market-based) emissions by 11% , primarily due to clean energy procurement. For scope 2 emissions \n\n (market-based) emissions by 11% , primarily due to clean energy procurement. For scope 2 emissions \naccounting, clean energy purchases must be matched following GHG Protocol regional market boundaries. In 2024, we were successful in sourcing more \nclean energy from within the same regions as our data centers, specifically in North America. \nAs we have more control over our data centers and offices than many other parts of our value chain, scope 2 emissions are a key focus of our \ndecarbonization efforts. Our scope 2 emissions reduction efforts to date include energy management and clean energy procurement. Our path forward  \ndetails our forward-looking strategy for clean electricity for our data centers to further reduce scope 2 emissions. \n80"
    ]
  },
  {
    "question": "How many gigawatts of clean energy has Google contracted from 2010 to 2024, across how many agreements?",
    "ground_truth": "Over 22 GW across more than 170 agreements.",
    "answer": "more than 170 agreements to purchase over 22 GW of clean energy generation",
    "contexts": [
      "the grids that support our operations. \nGolden Hills wind farm in California (43 MW for Google). \n22\n\n- -\nInnovative purchasing models \nPart of what made 2024 stand out wasn\u2019t just the volume of clean energy we contracted\u2014it was the \nstrategy behind it. \nWe piloted new contract structures like the Clean Transition Tariff, a utility-rate mechanism that provides \nfor long-term investment in clean power whenever it\u2019s needed. We upscaled a  new request for proposal  \nmodel to reduce procurement time and accelerate PPA execution. We also entered into a front-of-meter \nco-location  partnership in the United States where data centers and grid-connected renewable energy  \ninfrastructure are developed side by side, easing strain on transmission networks. \nThese moves are signals of what clean energy procurement will increasingly look like in the years ahead: \nmore flexible, more collaborative, and more integrated with the needs of the grid. And we\u2019re doing it \nin ways that try to account for the real-world constraints facing today\u2019s energy markets\u2014addressing ",
      "deployment, and model new ways of doing business that others can follow. \n22 gigawatts and counting \n\ndeployment, and model new ways of doing business that others can follow. \n22 gigawatts and counting \nGoogle is one of the largest corporate purchasers of clean energy, and from 2010 to 2024, we signed \nmore than 170 agreements to purchase over 22 GW of clean energy generation,\n\u200955 similar to Portugal\u2019s \ntotal renewable energy in 2024.\u200956 These purchases include agreements for over 17.3 GW in North America, \nover 4.5 GW in Europe, over 400 MW in Latin America, and over 300 MW in Asia Pacific. \nIn the United States, we signed new deals in Arizona, Nebraska, and across the PJM grid region in the Mid-\nAtlantic. In Europe, we expanded our offshore wind portfolio in the Netherlands, signed new PPAs in Italy,  \nPoland, and Belgium, and are helping bring new onshore wind farms online across the region. In Asia Pacific,  \nwe advanced clean energy projects in Taiwan, Japan, Singapore, and India\u2014with  contract  structures  tailored  ",
      "e then, from 2010 to 2024, we\u2019ve signed more than 170 agreements to purchase over 22 GW of clean \nen\n\ne then, from 2010 to 2024, we\u2019ve signed more than 170 agreements to purchase over 22 GW of clean \nen\nergy generation,2 similar to Portugal\u2019s total renewable energy in 2024.3 In 2024 alone, Google signed \ncontracts to purchase over 8 GW of additional clean energy generation 4\u2014the largest annual total in our history \nand twice the volume we contracted for the prior year. We\u2019ve maintained a 100% renewable energy match on a \nglobal basis every year since 2017, 5 and are going even further by pursuing our 24/7 carbon-free energy (CFE) \nambition (one of our climate moonshots). In 2024, we increased our 24/7 CFE percentage from 64% to 66%, 6 \na\nnd nine out of 20 grid regions with Google-owned and -operated data centers achieved at least 80% CFE. \nW\ne innovated across hardware and software to enable our data centers to deliver six times more \ncomputing power per unit of electricity than they did just five years ago. ",
      "Fleet-wide trailing 12-month PUE Legend \n21 \nThe server floor in our data center in Hamina, Finland.\n\nPowering today \nOur record year for clean energy \nElectricity is a key input for nearly everything we do\u2014from training AI models to providing Search results to  \nsharing YouTube videos and more. And as our energy demands grow, in part due to the expansion of AI, so  \ndoes our responsibility to meet that demand in a way that\u2019s cleaner, smarter, more reliable, and more resilient. \nIn 2024, we set a new record for ourselves for clean energy procurement: we signed contracts to \npurchase over 8 GW of additional clean energy generation in 2024 alone \u200954\u2014the largest annual total \nin our history and twice the volume we contracted for the prior year. That isn\u2019t just an achievement, it\u2019s a \nturning point\u2014one that\u2019s putting us on a path toward reaching our environmental ambitions. These new \nenergy deals will help bring new clean energy to the grids where we operate, support advanced technology \ndeployment, and model new ways of doing business that others can follow. \n22 gigawatts and counting ",
      "iled \ninformation on our operations, our products, and our progress. We invite you to learn more. \n6\n\n2024 highlights \nThis section provides a snapshot of our highlights as of the end of 2024 and select highlights from the first \nhalf of 2025. \nReduced data center energy  \nemissions by 12% \nWe reduced our data center energy emissions by  \n12%, compared to 2023. We achieved this important \naccomplishment despite a 27% increase in our  \nelectricity consumption, demonstrating that our  \noperational decarbonization efforts are bearing fruit. \nThe Google solar field at our data center \nin St. Ghislain, Belgium. \nProcured over 8 GW of clean \nenergy \nWe signed contracts to purchase over 8 gigawatts \n(GW) of additional clean energy generation \u200923\u2014more \nthan in any prior year. \nDelfzijl wind farm in the Netherlands \n(63 MW for Google). \nPartnered to enable 1 GW of solar \nin Taiwan \nWe announced a partnership  with BlackRock\u2019s \nClimate Infrastructure business that will enable 1 GW  \nof new solar energy in Taiwan, advancing clean \nenergy for both the local electricity grid and our  ",
      " and offices, we increased \nour Google CFE percentage from 64% in 2022 and 2023 to 66% in 2024\n117\u2014 \n\n and offices, we increased \nour Google CFE percentage from 64% in 2022 and 2023 to 66% in 2024\n117\u2014 \ndespite significant growth in electricity demand over this period (which was \ndriven, in part, by AI). This was a result of increases in Contracted CFE and \noverall increases in global Grid CFE, specifically in North America where our \nenergy consumption is highest. \nOverall, we increased our Google CFE in over half of our grid regions that \ncontain Google-owned and -operated data centers, and achieved at least \n80% CFE in nine out of 20 of these grid regions in 2024. \nDetails  \nWe set this ambition in 2020. The load-weighted average of carbon-free \nenergy percentages across Google\u2019s global portfolio of data centers and \noffices is referred to as \u201cGoogle CFE.\u201d This metric is inclusive of third-party \ndata centers, and it represents the clean energy purchased to meet our \nelectricity needs at every hour of every day, and within every grid where we ",
      "ned \nour first \nPPA \n2012 2013 2014 2015 2016 \nGoogle \nfirst achieved \n100% renewable \nenergy match \n\nned \nour first \nPPA \n2012 2013 2014 2015 2016 \nGoogle \nfirst achieved \n100% renewable \nenergy match \n2017 2018 2019 2020 2021 2022 2023 2024 \nYe a r \nTotal electricity consumption Global renewable energy matching Legend \n29",
      "en Building &  \nCommunity Award \nHonored \nin Health and Wellbeing category for \nGradient Canopy \n115\n\nEndnotes\n1 We use the term data center energy emissions to describe scope 1 and 2 (market-based) \nemissions that result from our Google data center operations.\n2 The total GW figure represents primarily PPAs, and includes some generation from \ntargeted clean energy investments where we also receive EACs. Actual generation \nmay vary from the signed amounts based on changes during construction or project \nterminations.\n3 The comparison is based on data from Portugal\u2019s Directorate-General for Energy and \nGeology from December 2024: Total renewable energy installed in 2024 was 20,777 MW.\n4 Refer to endnote 2 above.\n5 For details about the calculation, refer to the Methodology section in the Appendix.\n6 Refer to endnote 5 above.\n7 According to Google\u2019s platform-neutral measurement analyzed over a five-year period \nfrom 2019\u20132024.\n8 These calculations are based on internal data, as of March 2025. Google\u2019s TPU power ",
      "nline. Together, they added 2.5 GW of new clean energy to the grids that serve  \nour operations. \n19\n\nBringing a clean energy project online requires years of planning, permitting, contracting, and construction. \nWhen a project reaches commercial operation, it\u2019s not just a milestone\u2014it\u2019s the realization of hard work \ndone years ago finally delivering clean electricity where it\u2019s needed. \nWe also continue to make progress in bringing more clean energy to our office operations. In 2024, from \nacross 14 agreements, we allocated over 140 megawatts (MW) of clean energy generation in the electricity \ngrids where our offices operate.\n\u200948 \nBy working to provide clean energy for our data centers and other operations, we\u2019re also avoiding a \nsubstantial amount of emissions. In 2024 alone, we estimate our clean energy purchases avoided more  \nthan 8.2 million tCO e\n\u200949\n2  (Figure 3). And from 2011 to 2024, we estimate our clean energy purchasing \ncumulatively avoided more than 44 million tCO 2e\u200950\u2014more than the emissions from the combined annual ",
      "n 2024, more than 25 clean energy projects we\u2019d contracted over the past several years\u2014some as far  \n\nn 2024, more than 25 clean energy projects we\u2019d contracted over the past several years\u2014some as far  \nback as 2019\u2014came online. Together, they added 2.5 GW of new clean energy to the grids that serve  \nour operations. \n19",
      " the last eight years, since 2017, we\u2019ve matched 100% of our global electricity use with renewable  \n\n the last eight years, since 2017, we\u2019ve matched 100% of our global electricity use with renewable  \nenergy purchases\u200960\u2014a pursuit that seemed almost impossible when we set out on it back in 2012 (Figure 5). \nThis milestone was an important step\u2014but annual matching only tells part of the story. The reality is that \nmost grids today still rely on fossil fuels for portions of the day, especially during evenings or times when \nrenewable sources aren\u2019t producing electricity. Even if a company buys clean energy in bulk and applies \nit to match its total usage over the course of the year, its real-time energy mix likely includes electricity \ngenerated from fossil fuels. \nFigure 5. Clean energy purchases compared to total electricity use \n35 \n30 \n25 \n20 \n15 \n10 \n5 \n0 \nTerawatt-hours \n2011 2010 \nGoogle \nannounced pursuit \nof 100% renewable \nenergy match \nGoogle \nsigned \nour first \nPPA \n2012 2013 2014 2015 2016 \nGoogle \nfirst achieved \n100% renewable \nenergy match ",
      "s in. \nIn 2023, we began rolling out the Google Clean Energy Addendum (CEA) \u2014an  agreement  asking  \n\ns in. \nIn 2023, we began rolling out the Google Clean Energy Addendum (CEA) \u2014an  agreement  asking  \nsuppliers to commit to achieving a 100% clean electricity match by the end of 2029 for the electricity \nthey use to manufacture Google products.\n\u200965 We see this as a cornerstone of our strategy\u2014not just a \nrecommendation, but a shared agreement to market change. It\u2019s already become a central part of how we \nwork with our key suppliers\u2014especially those with the highest energy use. By the end of 2024, many key \nsuppliers signed our CEA, and we plan to continue driving clean energy progress within our supply chain \nthrough our CEA, clean energy investments, and other initiatives. \nWe know this takes time, which is why we\u2019re working directly with suppliers to identify practical next steps, \noffer hands-on support, and share tools that make the transition more manageable\u2014from navigating  \nclean energy procurement to tracking progress\u2014all of which ultimately strengthen the resilience of our ",
      "tion with AI: Accelerating Climate Action with AI \n\u2022  Device repairability:  Google & Repairability \n\ntion with AI: Accelerating Climate Action with AI \n\u2022  Device repairability:  Google & Repairability \nThe following table includes a detailed list of our sustainability policy engagements in 2024: \nGlobal and cross-cutting initiatives \nAdvanced   clean  electricity   technologies:  In 2023, Google published a  paper outlining how corporate clean energy buyers can accelerate clean energy  \ntechnologies by supporting favorable policies, signing long-term purchase agreements, and providing early-stage project funding. In 2024, we published an \nupdated version of this paper to include our detailed procurement criteria for carbon-free energy technologies. \nUnited Nations Framework Convention on Climate Change (UNFCCC) 29th Conference of the Parties (COP-29): Google participated in COP-29, in \nBaku, Azerbaijan, in over 150 engagements with officials and sustainability industry leaders, partners, and priority stakeholders. "
    ]
  },
  {
    "question": "Which company is Google partnering with to develop 1 GW of new solar energy in Taiwan, and what region is this located in?",
    "ground_truth": "BlackRock's Climate Infrastructure business, located in the Asia Pacific region.",
    "answer": "Google is partnering with BlackRock\u2019s Climate Infrastructure business to develop 1 GW of new solar energy in Taiwan.",
    "contexts": [
      "ngthen the resilience of our \nsupply chain. \nMinco II wind farm in Oklahoma (102 MW for Google). \n35\n\nAPAC\u2019s brighter future \nA solar solution in Taiwan \nOf course, even the most motivated suppliers can\u2019t switch to clean energy if it\u2019s not available. That\u2019s why \nGoogle isn\u2019t just supporting clean energy procurement\u2014we\u2019re helping create it. \nIn 2024, we announced an investment  to support the development of a 1 GW pipeline of new solar \nenergy in Taiwan, an investment that focuses on a region that plays a prominent role in global technology \nsupply chains. We expect to procure solar energy from these projects, and we may offer a portion of this \nclean energy to our semiconductor suppliers and manufacturers in the region so they can advance their \nown sustainability ambitions while helping reduce emissions in our shared supply chain. It\u2019s a model that \ngoes beyond carbon accounting to enable broader action\u2014removing barriers so others in our supply chain \ncan make better and cleaner choices too. ",
      " for grid regions with Google-owned and -operated data  \ncenters64 \n32\n\nEnergy for our \nsupply chain",
      "iled \ninformation on our operations, our products, and our progress. We invite you to learn more. \n6\n\n2024 highlights \nThis section provides a snapshot of our highlights as of the end of 2024 and select highlights from the first \nhalf of 2025. \nReduced data center energy  \nemissions by 12% \nWe reduced our data center energy emissions by  \n12%, compared to 2023. We achieved this important \naccomplishment despite a 27% increase in our  \nelectricity consumption, demonstrating that our  \noperational decarbonization efforts are bearing fruit. \nThe Google solar field at our data center \nin St. Ghislain, Belgium. \nProcured over 8 GW of clean \nenergy \nWe signed contracts to purchase over 8 gigawatts \n(GW) of additional clean energy generation \u200923\u2014more \nthan in any prior year. \nDelfzijl wind farm in the Netherlands \n(63 MW for Google). \nPartnered to enable 1 GW of solar \nin Taiwan \nWe announced a partnership  with BlackRock\u2019s \nClimate Infrastructure business that will enable 1 GW  \nof new solar energy in Taiwan, advancing clean \nenergy for both the local electricity grid and our  ",
      "troduction: Street View image of Redwood State and National Park, used with permission. \u00a92025 Google\n\ntroduction: Street View image of Redwood State and National Park, used with permission. \u00a92025 Google\nAge of AI: Street View image of the International Space Station, used with permission. \u00a92025 Google\nEnergy for our data centers: El Romero solar farm in Chile (80 MW for Google).\nEnergy for our supply chain: A technician scans hardware components, a critical step for tracking parts through every stage of the production process.\nResource efficiency: Clear waters reflect the beauty of our data center in Eemshaven, Netherlands.\nNew AI research solutions: The Solar API generates detailed rooftop data based on Google\u2019s extensive geospatial data and computing resources in order to evaluate rooftop solar energy potential.\nAI for extreme events and disaster response: A wide river basin during low water levels illustrates the type of flood-prone environment where flood forecasting is critical.",
      "e our demand response capability at our local data center in conjunction with the data center\u2019s  \n27\n\nbattery storage system. As a next step, we\u2019re joining the country\u2019s capacity remuneration mechanism, \nhelping stabilize the grid by reducing power consumption at critical times. In Asia Pacific, Taiwan Power \nCompany expressed its appreciation for our continued participation in its summer load management \nprogram, which has helped grid operators manage the power system by reducing peak electricity loads  \nduring strained summer months. \nThese strategies and demand response initiatives are making our computing system smarter, cleaner, and \nmore flexible\u2014helping to optimize how we allocate compute tasks across our infrastructure. \nOur data center in Council Bluffs, Iowa, makes the best out of every inch, so you can use services like Search and YouTube in the most \nefficient way possible. \nCollaborating for the future \nWe\u2019re not doing this alone. Through our partnership , Carrier plans to leverage Google Cloud\u2019s WeatherNext ",
      "a first-of-a-kind partnership to unlock new, clean power from a series of small modular nu clear  \n4\n\nreactors, which will be developed by Kairos Power. We also partnered with a clean energy startup to develop  \na geothermal power project in Nevada that\u2019s now contributing carbon-free energy to the electric grid. And a  \ncollaboration between Google,  Tapestry, and grid operator PJM aims to develop AI-driven data capabilities  \nfor a smarter, more reliable electricity system. It\u2019ll also speed up grid interconnection\u2014with the goal of making  \nelectricity more reliable and affordable for the 67 million people PJM serves in the United States. \nWe worked with our suppliers to accelerate their path to 100% clean electricity. \nWhile we\u2019re encouraged by our operational progress, obstacles to decarbonizing our supply chain remain. 9  \nBringing new clean energy online for Google and our suppliers is particularly difficult in the Asia-Pacific \nregion, where wind and solar resources aren\u2019t readily accessible in many markets. And though we\u2019ve ",
      " clean energy projects in Taiwan, Japan, Singapore, and India\u2014with  contract  structures  tailored  \n\n clean energy projects in Taiwan, Japan, Singapore, and India\u2014with  contract  structures  tailored  \nto the unique energy and market conditions in each country. When these projects come online, they don\u2019t just  \nhelp reduce our environmental impact\u2014they also add clean power to the grids that support our operations. \nGolden Hills wind farm in California (43 MW for Google). \n22",
      "ned \nour first \nPPA \n2012 2013 2014 2015 2016 \nGoogle \nfirst achieved \n100% renewable \nenergy match \n\nned \nour first \nPPA \n2012 2013 2014 2015 2016 \nGoogle \nfirst achieved \n100% renewable \nenergy match \n2017 2018 2019 2020 2021 2022 2023 2024 \nYe a r \nTotal electricity consumption Global renewable energy matching Legend \n29",
      ". \nOur data center in Changhua County, Taiwan, is a center of community building and innovation. \n36\n\nConducting change \nFocusing on high-impact semiconductor suppliers \nNot every part of a supply chain has the same level of impact. Some processes are far more carbon-\nintensive than others, and the semiconductor industry is among the most emissions-intensive for Google.  \nMaking chips requires not only lots of electricity but also the use of extremely potent greenhouse gases. \nWe\u2019re actively focusing on this \u201chotspot\u201d\u2014a specific part of our supply chain where emissions are \ndisproportionately high. We\u2019re a founding member of Catalyze , a group working to decarbonize \nsemiconductor manufacturing, and we partner with industry-wide efforts like the Sustainable  \nSemiconductor Technologies and Systems  program and SEMI\u2019s Semiconductor   Climate  Consortium. We\u2019re \nalso a steering  committee  member of the Clean Energy Buyers Association\u2019s Clean Energy Procurement \nAcademy, which delivers tailored trainings to help our suppliers make high-impact clean energy purchases.  "
    ]
  },
  {
    "question": "What was the total water consumed by data centers in 2024, and how much of it was potable water?",
    "ground_truth": "Data centers consumed a total of 7,787 million gallons, of which 7,699 million gallons was potable water.",
    "answer": "The total water consumed by data centers in 2024 was 7,787 million gallons, and 7,699 million gallons was potable water.",
    "contexts": [
      "s, partnerships, and clean energy agreements \n36 APAC\u2019s brighter future: A solar solution in Taiwan \n\ns, partnerships, and clean energy agreements \n36 APAC\u2019s brighter future: A solar solution in Taiwan \n37 C onducting change: Focusing on high-impact semiconductor suppliers \n38 Supply chain transformation: Why it\u2019s slow, why it\u2019s messy, and why it   \nreally matters \n39 Resource efficiency \nWater stewardship \n40 Advancing responsible water use: Our approach to climate-conscious data  \ncenter cooling \n42 Replenishing water: A local approach to water stewardship \nWaste reduction  \n44 Reverse supply chain: Giving hardware a second life \n46 Food waste: Resourceful recipes and smarter services \nNature on our campuses \n47 Restoring habitat: Cultivating nature on our campuses \n49 Ripple effects: How our water efforts bloom into biodiversity gains \n2",
      "-owned and \n-operated data centers in 2024. In previous reports, we included Google CFE percentages \n\n-owned and \n-operated data centers in 2024. In previous reports, we included Google CFE percentages \nfor all grid regions where we had data center operations, including third-party-operated \nfacilities. All our data center operations, including third-party-operated facilities, are still \nincluded in our global and regional Google CFE metrics.\n65 Refer to endnote 10 above.\n66 Based on the average annual irrigation of golf courses in the southwest U.S. of 459 acre-ft  \nor around 150 million gallons. Source: \u201cHow Much Water Does Golf Use and Where Does It \nCome From?\u201d U.S. Golf Association, November 2012.\n67 Refer to endnote 5 above.\n68 Refer to endnote 5 above.\n69 \u201cCalifornia\u2019s Central Valley,\u201d U.S. Geological Survey, accessed March 2025.\n70 For Google-managed server assembly and maintenance, there was a year-on-year \nincrease in the quantity of reused components in 2024 compared to 2023. This \npercentage excludes components used to build servers through original equipment ",
      "Total electricity consumption across our data centers and offices \nGlobal average CFE percentage \n20",
      "lion gallons 1.9 1.7 0.2 <1 \nOther data center locations  M illion gallons 828.9  60.0  768.9  5.1  \n\nlion gallons 1.9 1.7 0.2 <1 \nOther data center locations  M illion gallons 828.9  60.0  768.9  5.1  \nPotable water  10.7  \nNon-potable water  377.9  \nReclaimed wastewater 440.3 \nData centers total  Million  gallons 9,866  2,079  7,787  51  \nPotable water  7,699  \nNon-potable water  1,289  \nReclaimed wastewater 877 \n111",
      "54,300 \nTotal electricity consumption 17 32,179,900 \nAlphabet\u2019s Schedule of Electricity Consump ion \n\n54,300 \nTotal electricity consumption 17 32,179,900 \nAlphabet\u2019s Schedule of Electricity Consump ion \nFor the Year Ended December 31  2024 \n(MWh \nAlphabet \u2019s Schedule of Electricity Procured from Renewable Sources \nFor the Year Ended December 31  2024 \n(MWh \nRenewable electricity procured (PPAs and other renewable energy agreements) 24,504,500 \nRenewable electricity procured (on-site) 20,500 \nRenewable electricity (grid) 7,654,900 \nTotal electricity procured from renewable sources 32,179,900 \nWater \nRelevant operations for water metrics include owned and fully leased data centers and owned and leased offices and other assets. Water \nwithdrawal data is based on actual metered or invoiced data when it is available. At offices where actual metered or invoiced data is not \navailable, water withdrawal is estimated using facility square footage and internally developed water withdrawal intensity factors by office ",
      "r the future. \nA logistics program manager at our data center in Singapore. \n38\n\nResource efficiency\n\nWater stewardship \nContents \n40 Advancing responsible water use: Our approach to climate-conscious data center cooling \n42 Replenishing water: A local approach to water stewardship \nWater is one of the most essential resources on Earth. And though water risk varies by location and isn\u2019t \npresent everywhere, growing concerns in many regions mean managing this precious resource is no longer  \njust a responsibility, but a necessity. We\u2019re working to do just that through a strategy centered on advancing  \nresponsible water use at Google, benefiting watersheds and communities, and supporting water security \nwith technology. \nAdvancing responsible water use \nOur approach to climate-conscious data center cooling \nGoogle\u2019s data centers are the engine of our company, powering products like Google Workspace (which \nincludes Gmail, Drive, Docs, and more), Google Cloud, Search, and YouTube for billions of people around the  ",
      "ta centers \nCapacity of all contracted water replenishment \nprojects once fully implemented \nTrend  \n\nta centers \nCapacity of all contracted water replenishment \nprojects once fully implemented \nTrend  \nOur water stewardship projects replenished approximately 4.5 billion \ngallons of water (17 billion liters or 17 million cubic meters) in 2024 \nalone, increasing replenishment of our freshwater consumption from \n18% in 2023 to 64% in 2024.\n136  This was the result of both the continued \nsuccess of our existing projects and the implementation of new projects \nthat have further expanded our replenishment portfolio. \nDetails  \nWe set this ambition in 2021, and it covers water that\u2019s replenished as \na percentage of the amount of freshwater we consume each year at \nour offices and data centers (i.e., excluding seawater and reclaimed \nwastewater). We count replenishment benefits from projects that are \nactive within the watersheds that our operations rely on and that have \nconfirmed volumetric benefits from the reporting year. \n86",
      "13 21 29 44 \nComponents resold into the secondary market Million components 8.2 4.9 5.0 7.0 6.7 \n109\n\nWater \nGlobal \noperational Unit 2020 2021 2022 2023 2024 \nwater use \nMillion  Water  withdrawal 5,689 6,297 7,600 8,653 11,011 gallons \n   \n   \nMillion  Water dischar\nge 1,940 1,735 2,035 2,301 2,876 gallons \nWater  Million  3,749 4,562 5,565 6,352 8,135 consumption gallons \nFreshwater withdrawal from sources  \n\u2009163 Unit 2024 at risk of water depletion or scarcity\nLow risk of water depletion or scarcity % 72 \nMedium risk of water depletion or scarcity % 14 \nHigh risk of water depletion or scarcity % 14 \n2024 \nWater use by Water Water  W\nater data centers Unit withdrawal discharge consumption and offices \nMillion  Data centers 9,866 2,079 7,787 gallons \nOffices and Million  1,145 797 348 other facilities gallons \nMillion  Total 11,011 2,876 8,135 gallons \nFreshwater replenishment Unit 2022 2023 2024 \nFreshwater consumption Million gallons 4,770 5,601 7, 210 \nWater replenished Million gallons 271 1,036 4,590 \nWater replenished % 6 18 64 ",
      " \nExcess and \nobsolete \nhardware Recycled hardware  \n44 \nReused hardware \nResold hardware \nInventory\n\nWhy does a reverse supply chain matter so much? \nAs we continue to scale our data centers to meet the growing demand for our products and services, \nincluding AI, reducing waste is essential:  in 2024, we diverted 84% of our operational waste from \ndisposal across our global Google-owned and -operated data centers.  A large part of that success \ncomes from our Reverse Supply Chain program, which enables us to reclaim components from  \ndecommissioned hardware and repurpose them, cutting down on material consumption and emissions. \nWe\u2019re not just recycling\u2014we\u2019re giving our data center hardware a second life. In 2024, we harvested \napproximately 8.8 million components from our decommissioned hardware for reuse or resale  \nthrough our Reverse Supply Chain program \u2014including over 3 million hard drives that were securely \nwiped and reused or resold. That\u2019s millions of parts kept in circulation instead of being newly made. As an ",
      "pact by rigorously assessing factors like additionality, leakage, permanence, and verifiability. \n85\n\nWater and waste \nBeyond climate, we\u2019ve also set ambitions across other operational areas like water and waste. Many of the challenges and uncertainties described above \nalso relate to these ambitions, particularly for water replenishment and data center Zero Waste to Landfill, which are both connected to our data center \ncapacity delivery. \nWater replenishment \nWe aim to replenish 120% of the freshwater volume we consume, on average, across our offices and data \ncenters by 2030. \nIn 2024, our water stewardship projects replenished approximately 4.5 billion gallons of water (17 billion liters or 17 million cubic meters), or \nroughly 64% of our freshwater consumption. 135 \nGraph \nMillion gallons \n7 ,500 \n5,000 \n2,500 \n0 \n6% \n18% \n64% \n2022 2023 2024 \nLegend \nYear \nEstimated water replenished Total freshwater consumption for offices and \nGoogle-owned and -operated data centers \nCapacity of all contracted water replenishment \nprojects once fully implemented \nTrend  ",
      "Gmail, Drive, Docs, and more), Google Cloud, Search, and YouTube for billions of people around the  \n\nGmail, Drive, Docs, and more), Google Cloud, Search, and YouTube for billions of people around the  \nworld. And as we grow to serve more users globally, building new data center infrastructure is essential. \nTo operate smoothly, these facilities rely on cooling systems that frequently use water due to its energy  \nefficiency. This dependency highlights a critical balance between technological needs and responsible  \nenvironmental stewardship. In 2024, we consumed a total of approximately 8.1 billion gallons (31 billion liters \nor 31 million cubic meters) of water across our data centers (excluding those operated by third parties)  \nand offices. To put that consumption into perspective, that\u2019s about what it takes to irrigate 54 golf courses  \nannually, on average, in the southwestern United States.\n\u200966 Crucially, the majority of this consumption occurred \nin regions where water resources are abundant:  in 2024, 72% of our freshwater withdrawals came from  "
    ]
  },
  {
    "question": "How did Google's fleet-wide PUE in 2024 compare to its baseline PUE from 2008?",
    "ground_truth": "It improved to 1.09 in 2024, compared to the 1.21 baseline in 2008.",
    "answer": "In 2024, the average annual PUE for Google's global fleet of data centers was 1.09, compared to a baseline fleet-wide TTM PUE of 1.21 in 2008.",
    "contexts": [
      "th increasing the energy efficiency of our data centers to help minimize our electricity demand. In \n\nth increasing the energy efficiency of our data centers to help minimize our electricity demand. In \n2024, the average annual PUE for our global fleet of data centers was 1.09, compared with the industry average of 1.56, meaning that Google data centers \nused 84% less overhead energy than the industry average.\n\u2009129  We\u2019ll continue to build on this progress by driving additional energy efficiency and flexibility \nmeasures in our data centers\u2014with a focus on our machine learning fleet. \nAfter efficiency, our next focus is on scaling our clean energy procurement across all regions: In 2024, we signed contracts to purchase over 8 GW of \nadditional clean energy generation130\u2014more than in any prior year. We\u2019re also using Google\u2019s engineering expertise and purchasing demand to  accelerate  \nthe commercialization of advanced CFE technologies and scale their climate impact, and advocating for energy policies that can unlock access to cost-",
      "e effectiveness (PUE) for our global fleet of data \ncenters dropped below 1.10 to 1.09  (Figure 4). \n\ne effectiveness (PUE) for our global fleet of data \ncenters dropped below 1.10 to 1.09  (Figure 4). \nWhile a PUE improvement of 0.01 might appear small, \nat the scale of our global data center operations, this \nefficiency gain avoids significant electricity consumption. \nThis means our global computing network requires  \nless electricity and produces fewer emissions than it \notherwise would have, yielding meaningful savings even  \nas our overall computing demands grow. \nO\nur data centers deliver over six times more computing power per unit of electricity than they did \njust five years ago.\u200953  Much of this improvement has come from deploying AI accelerators, such as our \nTPUs, the highly efficient computer chips we designed specifically for AI and machine-learning applications.\nFigure 4. Energy efficiency (PUE) across Google data centers \n2009 2010 2011 2012 2013 2014 2016 2017 2015 2018 2019 2020 2021 2022 2023 2024 \n1.20 \n1.18 \n1.16 \n1.14 \n1.12 \n1.10 \n1.08 \n0 \nPUE \nYe a r ",
      " we used a \none month sample of observed machine power data from our entire TPU fleet, applying \n116\n\nGoogle\u2019s 2023 average fleetwide carbon intensity. To estimate embodied emissions from \nmanufacturing, transportation, and retirement, we performed a life-cycle assessment \nof the hardware. Data center construction emissions were estimated based on Google\u2019s \ndisclosed 2023 carbon footprint. These findings do not represent model-level emissions, \nnor are they a complete quantification of Google\u2019s AI emissions. Based on the TPU \nlocation of a specific workload, Compute Carbon Intensity (CCI) results of specific \nworkloads may vary.\n45 The figure represents the average percentage of Google\u2019s global compute resources that \nwere identified as recoverable and reallocated for more efficient use over this period as a \nresult of using AlphaEvolve.\n46 We estimated the expected annual generation based on our contracted clean energy, \napplying an average capacity factor. Actual generation may vary from the signed amounts \nbased on changes during construction or project terminations.",
      "ssions from our \nmachine hardware efficiency improvements, we compare the actual emissions from our \n\nssions from our \nmachine hardware efficiency improvements, we compare the actual emissions from our \nservers in 2019 to 2024 and other hardware to a hypothetical scenario where we didn't \nimplement any efficiency measures and continued to deploy older, less efficient hardware \nwhich could have resulted in increased machines deployed and increased energy \nconsumption. By comparing the actual energy consumption to this hypothetical baseline, \nwhich is defined by the machines deployed in 2019, we estimate the energy savings \nand associated scope 2 emissions avoided through our machine hardware efficiency \ninitiatives. Similarly, we estimate the scope 3 emissions avoided by comparing actual \nhardware manufacturing and logistics emissions to the same hypothetical baseline. For \nboth PUE and machine hardware efficiency, we assume additional energy consumption \nin the avoided baseline scenario would not have been matched with additional clean ",
      " and offices, we increased \nour Google CFE percentage from 64% in 2022 and 2023 to 66% in 2024\n117\u2014 \n\n and offices, we increased \nour Google CFE percentage from 64% in 2022 and 2023 to 66% in 2024\n117\u2014 \ndespite significant growth in electricity demand over this period (which was \ndriven, in part, by AI). This was a result of increases in Contracted CFE and \noverall increases in global Grid CFE, specifically in North America where our \nenergy consumption is highest. \nOverall, we increased our Google CFE in over half of our grid regions that \ncontain Google-owned and -operated data centers, and achieved at least \n80% CFE in nine out of 20 of these grid regions in 2024. \nDetails  \nWe set this ambition in 2020. The load-weighted average of carbon-free \nenergy percentages across Google\u2019s global portfolio of data centers and \noffices is referred to as \u201cGoogle CFE.\u201d This metric is inclusive of third-party \ndata centers, and it represents the clean energy purchased to meet our \nelectricity needs at every hour of every day, and within every grid where we ",
      "leet-wide PUE across  PUE 1.10 1.1 0 1.10 1.10 1.09 Google-owned and -operated data center campuses \n\nleet-wide PUE across  PUE 1.10 1.1 0 1.10 1.10 1.09 Google-owned and -operated data center campuses \nWaste \nWaste generation Unit 2020 2021 2022 2023 2024 \nData centers \nWaste  diverted Metric tons 18,000 34,500 27, 800 35,100 39,100 \nWaste disposed Metric tons 3,700 6,800 6,000 5,900 7,400 \nSubtotal waste generated Metric tons 21,700 41,300 33,800 41,000 46,500 \nWaste diversion rate % 83 83 82 85 84 \nOffices\u2009161 \nWaste  diverted Metric tons 6,900 1,200 4,900 8,600 10,100 \nWaste disposed Metric tons 2,900 700 1,600 2,600 1,900 \nSubtotal waste generated Metric tons 9,800 1,900 6,500 11,200 12,000 \nWaste diversion rate % 71 64 75 77 84 \nTotal \nWast\ne  diverted Metric tons 24,900 35,700 32,700 43,700 49,200 \nWaste disposed Metric tons 6,600 7,500 7,600 8,500 9,300 \nTotal waste generated Metric tons 31,500 43,200 40,300 52,200 58,500 \nTotal waste diversion rate % 79 83 81 84 84 ",
      "were avoided \nbecause of actions taken either as part of normal operations or in service of climate \n\nwere avoided \nbecause of actions taken either as part of normal operations or in service of climate \nambitions. We calculate avoided emissions by comparing our actual emissions to a \nscenario where we didn't take action. To calculate avoided emissions from our power \nusage effectiveness (PUE) improvements, we compare our fleet-wide trailing 12-month \n(TTM) PUE in each year from 2019 to 2024 to a baseline from our earliest fleet-wide TTM \nPUE (which was 1.21 in 2008). This baseline assumes that our PUE would have remained \nthe same without our efficiency improvements. We translate this efficiency improvement \ninto avoided energy consumption, and then calculate avoided emissions using an annual \nemissions rate (emissions/GWh) derived from reported scope 2 electricity data in our \ncorporate GHG inventory for the relevant year. To calculate avoided emissions from our \nmachine hardware efficiency improvements, we compare the actual emissions from our ",
      "ogle-owned and -operated data centers (refer to the Environmental metrics data tables for details). \n\nogle-owned and -operated data centers (refer to the Environmental metrics data tables for details). \nWhat\u2019s most important is forward progress. \nAnd while we\u2019re making meaningful strides toward this moonshot, progress is uneven across regions. As the table below illustrates, North America, \nEurope, and Latin America are showing improvements, but the Asia-Pacific region largely remains undersupplied with carbon-free energy. \nYear-on-year progress \nRegional average Google CFE across Google data center grid regions Unit 2022 2023 2024 \nNorth America % 69 68 70 \nUnited States % 69 68 70 \n Canada & Mexico \u2009116 % 96 96 88 \nEurope, Middle East, & Africa % 76 83 83 \nEurope % 76 84 84 \nMiddle East & Africa % 3 4 5 \nLatin America % 90 91 92 \nAsia Pacific % 11 12 12 \nGlobal CFE across Google data centers % 64 64 66 \nTrend \nFor our global average across our data centers and offices, we increased \nour Google CFE percentage from 64% in 2022 and 2023 to 66% in 2024\n117\u2014 ",
      " deliver six times more \ncomputing power per unit of electricity than they did just five years ago. \n\n deliver six times more \ncomputing power per unit of electricity than they did just five years ago. \nWe want to use energy in the most efficient way possible\u2014which is good for both our business and the \np\nlanet. Google data centers\u2014which power all of our products including Search, YouTube, Google Cloud, \nGemini, and more\u2014are some of the most efficient in the world. They deliver over six times more computing \np\nower per unit of electricity than they did just five years ago. 7 T his is in part thanks to pioneering hardware \ninnovations. As just one example, Google\u2019s seventh-generation Tensor Processing Unit (TPU), Ironwood, is \nnearly 30 times more power efficient than our first Cloud TPU from 2018.8 \nW\ne pushed the frontiers of advanced energ y development and grid optimization to ensure reliable, \nabundant power for everyone, and to fuel the next wave of innovation and economic growth. ",
      "7 2015 2018 2019 2020 2021 2022 2023 2024 \n1.20 \n1.18 \n1.16 \n1.14 \n1.12 \n1.10 \n1.08 \n0 \nPUE \nYe a r \n\n7 2015 2018 2019 2020 2021 2022 2023 2024 \n1.20 \n1.18 \n1.16 \n1.14 \n1.12 \n1.10 \n1.08 \n0 \nPUE \nYe a r \nFleet-wide trailing 12-month PUE Legend \n21 \nThe server floor in our data center in Hamina, Finland."
    ]
  },
  {
    "question": "What are the two types of emission factors used to calculate transportation emissions using the distance-based method in Category 7?",
    "ground_truth": "Well-to-tank (WTT) emission factors and tank-to-wheel (TTW) emission factors.",
    "answer": "mode-specific WTT emission factors and TTW emission factors",
    "contexts": [
      " the data centers, offices, and other assets and internally developed natural gas intensity factors \n\n the data centers, offices, and other assets and internally developed natural gas intensity factors \nby office type, based on data from the reporting period. Where actual refrigerant leakage data isn\u2019t available, Alphabet estimates \nrefrigerant leakage by taking an average of GWP values from known refrigerants within the portfolio and a 20% leakage rate at data \ncenters, offices, and other assets. The emission factors used to calculate scope 1 GHG emissions include the 2024 WRI/WBCSD GHG \nProtocol Emission Factors from Cross Sector Tools, the 2025 U.S. Environmental Protection Agency (EPA) Emission Factors for \n10 Total energy consumption includes all fuel and natural gas consumption; purchased electricity, steam, heating, cooling; and all electricity generated \non-site from renewable sources. \n11 Metric is reported in MWh, using a conversion factor of 3600 MJ/MWh. \n12 Significant contextual information necessary to understand how the data has been compiled has been disclosed. ",
      "n of the distance-, fuel-, and spend-based calculation methods, as defined by the Scope 3 Technical \n\nn of the distance-, fuel-, and spend-based calculation methods, as defined by the Scope 3 Technical \nGuidance. We collect all travel data through either our online booking system or a third-party travel agency. To calculate emissions from the majority of our \nair travel, we use the Travel Impact Model, an emissions estimation model developed by Google that\u2019s built from public and licensable external datasets. \nWe calculate total plane WTW emissions and allocate an amount to the employee passenger based on the plane\u2019s percentage of occupied seats (i.e., the \npassenger load factor) and the mass of cargo being carried. For all other modes of transport\u2014including rail, taxi, rideshare, non-U.S. personal vehicles, \nnon-U.S. shuttle travel, and a minority of air travel modes\u2014we use the WTW emission factors from the 2024 DEFRA UK Government GHG Conversion ",
      " program, we use LCA emission factors from WRI\u2019s Cool Food Pledge Calculator and annual procurement \n\n program, we use LCA emission factors from WRI\u2019s Cool Food Pledge Calculator and annual procurement \nvolumes from our San Francisco Bay Area offices. Where procurement volume data isn\u2019t available for the remaining offices, we estimate remaining \nemissions by scaling the San Francisco Bay Area emissions based on global building admittance data. Where emission factors from WRI aren\u2019t available, we \nestimate remaining emissions using spend data and the EPA\u2019s U.S. Environmentally-Extended Input-Output (\u201cUSEEIO\u201d) Supply Chain GHG Emission Factors \n(2024 v1.3), which are then adjusted for inflation using the U.S. Bureau of Labor Statistics\u2019 Consumer Price Index Inflation Calculator (\u201cUSEEIO supply chain \nemission factors\u201d). To calculate emissions generated from the remaining goods and services purchased for our operations, we estimate supplier emissions ",
      "re reported in alignment with the criteria outlined in the Schedule of Select Environmental Metrics \n\nre reported in alignment with the criteria outlined in the Schedule of Select Environmental Metrics \nabove. The reporting boundary for the GHG emissions, energy, and water metrics included in the Schedule of Select Environmental \nMetrics is Alphabet, globally. Alphabet utilizes the operational control approach, as defined by the GHG Protocol, to establish the relevant \noperations for the emissions, energy, and water metrics at Alphabet\u2019s owned and leased data centers, offices, and other assets (Global \nFacilities). Where possible, based on Alphabet\u2019s reporting timeline and requirements, Alphabet uses the most up-to-date emission factors \navailable at the time of their emissions inventory calculation and calculates emissions by multiplying relevant activity data by the applicable \nemission factors, and global warming potentials (GWPs) (if applicable). Many of the emission factor sources provide emission factors in \nCO",
      "ity (The Influence of \nDemand-Side Data Granularity on the Efficacy of 24/7 Carbon-Free Electricity \n\nity (The Influence of \nDemand-Side Data Granularity on the Efficacy of 24/7 Carbon-Free Electricity \nProcurement, 2024), and Technical University of Berlin (System-Level Impacts of 24/7 \nCarbon-Free Electricity Procurement in Europe, 2024).\n116 For 2022 and 2023, the Canada & Mexico regional average Google CFE metric includes \nonly Canadian grid regions where we had data center operations. We didn\u2019t have data \ncenter operations in Mexico prior to 2024.\n117 Refer to endnote 5 above.\n118 Our carbon reduction ambition was validated using the SBTi Corporate Near-Term Criteria \nVersion 5.2 and following the cross-sector absolute reduction method. This approach \naligns with a 1.5\u00b0C scenario and utilizes the standard validation route for target setting.\n119 Avoided emissions are emissions that would have otherwise occurred but were avoided \nbecause of actions taken either as part of normal operations or in service of climate ",
      "-based and distance-based methods, as defined by the Scope 3 Technical Guidance. For transportation \n\n-based and distance-based methods, as defined by the Scope 3 Technical Guidance. For transportation \nemissions, we collect well-to-wheel (WTW) emissions data, calculated based on fuel use or weight-distance data, and routing associated with a shipment \nfrom logistics providers. Logistics providers determine Alphabet\u2019s share of a shipment\u2019s transportation emissions via physical allocation (i.e., based on how \nmuch of the total shipment\u2019s weight is from Alphabet\u2019s goods). Where actual logistics provider emissions data isn\u2019t available, we calculate WTW emissions \nusing weight and distance data by shipment collected from our logistics providers, using emission factors from the 2024 Global Logistics Emissions \nCouncil (GLEC) Framework v3.1 or EPA SmartWay carrier performance data. Where logistics provider weight and distance data isn\u2019t available, we estimate ",
      "ulates emissions from car rental, U.S. personal vehicle, and U.S. shuttle travel using well-to-tank \n\nulates emissions from car rental, U.S. personal vehicle, and U.S. shuttle travel using well-to-tank \n(WTT) emission factors from the 2024 DEFRA UK Government GHG Conversion Factors (WTT) and tank-to-wheel (TTW) emission \nfactors from the 2025 EPA Emission Factors for Greenhouse Gas Inventories. Data obtained from value chain partners is used to calculate \napproximately 6% of emissions. \n\u201cCategory 7: Employee commuting \u201d includes emissions from the transport of full-time employees between their homes and their \nworksites by passenger car (i.e., carpool, dropoff, taxi, rideshare, or single-occupied vehicle), rail, bus, motorcycle and gas-powered \nscooter. Report Values also include the optional activity of upstream emissions of employee commuting. Alphabet uses the distance-\nbased method, as defined by the Scope 3 Technical Guidance. Alphabet surveys its employees to determine typical commuting patterns ",
      "f air travel modes\u2014we use the WTW emission factors from the 2024 DEFRA UK Government GHG Conversion \n\nf air travel modes\u2014we use the WTW emission factors from the 2024 DEFRA UK Government GHG Conversion \nFactors. We calculate emissions from car rental, U.S. personal vehicle, and U.S. shuttle travel using well-to-tank (WTT) emission factors from the 2024 DEFRA \nUK Government GHG Conversion Factors and tank-to-wheel (TTW) emission factors from the 2025 EPA Emission Factors for Greenhouse Gas Inventories. \nApproximately 6% of the data we use to calculate Category 6 emissions are obtained from value chain partners. \n\u201cCategory   7:  Employee  commuting\u201d  includes emissions from the transport of our full-time employees between their homes and their worksites by \npassenger car (i.e., carpool, dropoff, taxi, rideshare, or single-occupied vehicle), rail, bus, motorcycle, and gas-powered scooter. We also include the \noptional activity of upstream emissions of employee commuting. We use the distance-based method, as defined by the Scope 3 Technical Guidance. We ",
      "loyee commuting. We use the distance-based method, as defined by the Scope 3 Technical Guidance. We \n\nloyee commuting. We use the distance-based method, as defined by the Scope 3 Technical Guidance. We \nsurvey our employees to determine typical commuting patterns and apply these patterns to our global employee population. We use a mode-specific \ncommuting distance obtained from the American Public Transportation Association\u2019s 2023 Fact Book and the U.S. Department of Transportation\u2019s 2022 \nNational Household Travel Survey. We calculate employee commuting emissions using mode-specific WTT emission factors from the 2024 DEFRA UK \nGovernment GHG Conversion Factors and TTW emission factors from the 2025 EPA Emission Factors for Greenhouse Gas Inventories. We use passenger \ndistance-based emission factors for shared vehicles (i.e., carpool, taxi, rideshare, rail, bus) in order to allocate the total vehicle emissions to the employee \npassenger. In 2024, we removed home energy emissions generated by our full-time employees working remotely (i.e., teleworking) from our inventory ",
      "nt GHG Conversion Factors for non-U.S. activity. Alphabet excludes from this category the emissions \n\nnt GHG Conversion Factors for non-U.S. activity. Alphabet excludes from this category the emissions \nfrom wastewater treatment. Although category 5 emissions are insignificant, Alphabet determined that waste generated in operations is \nrelevant based on other criteria for relevance such as influence, risk, and stakeholders. \n\u201cCategory 6: Business travel\u201d includes emissions from business-related air, rail, bus, personal vehicle (when the employee\u2019s car is used \nfor business purposes), taxi, rideshare, shuttle, and rental car travel, including emissions from relocation travel. Report Values also include \nthe optional activity of upstream emissions of business travel. Alphabet uses a combination of the distance-, fuel-, and spend-based \ncalculation methods, as defined by the Scope 3 Technical Guidance. Alphabet collects all travel data through an online booking system "
    ]
  },
  {
    "question": "How much did emissions from data center construction increase year-on-year in 2024, and what percentage of total 2024 ambition-based scope 3 emissions did it represent?",
    "ground_truth": "It increased 54% year-on-year, representing 19% of total 2024 ambition-based scope 3 emissions.",
    "answer": "In 2024, emissions from data center construction increased 54% year-on-year and represented 19% of total 2024 ambition-based scope 3 emissions.",
    "contexts": [
      "h has the potential to reduce embodied carbon emissions from \ndata center construction by up to 40%.\n\nh has the potential to reduce embodied carbon emissions from \ndata center construction by up to 40%.\n134  The electrification of on-site construction activities, supported by clean electricity procurement for data center \nconstruction, is another way we\u2019re addressing data center construction emissions. Additionally, we\u2019re maximizing the utilization of our data center capacity, \nensuring fully utilized infrastructure and greater space efficiency. \nManaging remaining emissions \nWhile our primary focus is on decarbonizing our operations and value chain, we\u2019re also committed to neutralizing our remaining emissions by 2030 through \na portfolio of carbon credits that serve as high-impact climate solutions, with an eye toward maximizing positive impact on the atmosphere. We\u2019re focusing \non accelerating a range of projects and forging strategic partnerships that will help us achieve our net-zero ambition. ",
      "upply chain (i.e., scope 3)\u2014which are further removed from our direct control\u2014are still increasing: \n\nupply chain (i.e., scope 3)\u2014which are further removed from our direct control\u2014are still increasing: \n\u2022  Scope 3: Our ambition-based scope 3 emissions increased by 22% year-on-year in 2024. \nOverall, total emissions have grown in recent years alongside the growth of our business and growing product adoption by users around the world (Figure 15).  \nThe majority of these emissions are indirect, coming from our supply chain. We\u2019re actively working to bend our emissions curve toward our net-zero ambition. \nFigure 15. Our path forward\u2009127 \nReported ambition-based emissions Net emissions \nIllustrative business-as-usual emissions \nIllustrative ambition-based emissions \n2019 2020 2021 2022 2023 2024 2030 \nYear \nIllustrative emissions \nLegend \n12 \n9 \n6 \n3 \n0 \nMillion tCO2 e \n83",
      " we used a \none month sample of observed machine power data from our entire TPU fleet, applying \n116\n\nGoogle\u2019s 2023 average fleetwide carbon intensity. To estimate embodied emissions from \nmanufacturing, transportation, and retirement, we performed a life-cycle assessment \nof the hardware. Data center construction emissions were estimated based on Google\u2019s \ndisclosed 2023 carbon footprint. These findings do not represent model-level emissions, \nnor are they a complete quantification of Google\u2019s AI emissions. Based on the TPU \nlocation of a specific workload, Compute Carbon Intensity (CCI) results of specific \nworkloads may vary.\n45 The figure represents the average percentage of Google\u2019s global compute resources that \nwere identified as recoverable and reallocated for more efficient use over this period as a \nresult of using AlphaEvolve.\n46 We estimated the expected annual generation based on our contracted clean energy, \napplying an average capacity factor. Actual generation may vary from the signed amounts \nbased on changes during construction or project terminations.",
      " goods) and (Category 11: Use of sold products) \nScope 3 (Category 1: Purchased goods and services) \n\n goods) and (Category 11: Use of sold products) \nScope 3 (Category 1: Purchased goods and services) \nScope 2 (market-based) \nScope 1 \ntCO2e \n292,000 \n1,914,000 \n203,000 \n461,000 \n14,000 \n476,000 \n425,000 \n4,292,000 \n873,000 \n835,900 \n81,900 \nTotal 2019 ambition-based emissions 7,661,800 \nTrend \nIn 2024, our total ambition-based emissions were 11.5 million tCO2e, representing an 11% year-on-year increase and a 51% increase compared to our 2019 \nbase year\u2014primarily driven by increases in supply chain emissions. \nThe year-on-year increase was slightly offset in that we reduced our scope 1 and scope 2 (market-based) emissions by 8% and 11%, respectively\u2014 \ndemonstrating that our operational decarbonization efforts are bearing fruit. This achievement is particularly significant given the 27% increase in our \nelectricity consumption compared to 2023. \nDetails \nScience Based Targets initiative (SBTi) validation: ",
      "an electricity \nreduction activities are the drivers of reductions in this scope 3 category because \n\nan electricity \nreduction activities are the drivers of reductions in this scope 3 category because \nany reduction in fossil fuel-based electricity use will translate into a reduction in these \nupstream electricity emissions.\n132 Refer to endnote 10 above.\n133 We calculated the reduction in embodied carbon emissions intensity by comparing \nGoogle\u2019s 2019 baseline standard data center design to our revised standardized data \ncenter designs which incorporate design updates to server hall hot air containment \nsystems, electrical distribution systems, and cooling tower units.\n134 Based on an internal life cycle assessment of Google\u2019s 2019 standard data center design.\n135 Refer to endnote 5 above.\n136 Refer to endnote 5 above.\n137 We recalculated data center waste diversion metrics. For additional details, refer to the \n118",
      " in our technical infrastructure\u2014including servers, network equipment, and data centers\u2014to support  \n\n in our technical infrastructure\u2014including servers, network equipment, and data centers\u2014to support  \nthe growth of our business and our long-term initiatives, in particular in support of AI products and services. We\u2019re focused on decoupling this growth from a  \nproportional increase in emissions, and Our path forward outlines two key areas where we\u2019re helping our suppliers to reduce their emissions: clean electricity  \nfor our supply chain and low-carbon data center construction. \nAvoided emissions \nFor over two decades, we\u2019ve \nbeen implementing initiatives \nand technological improvements \nthat have helped decarbonize our \noperations and supply chain. \nWhile our total reported emissions \nhave increased in recent years,  \nthese initiatives continue to make  \na meaningful impact\u2014without them, \nour emissions would have  \nbeen higher. \nIn 2024, we estimate our ambition-\nbased emissions were 66% lower \nthan they would have been without \nclean energy procurement, machine ",
      "arbon-aware data center design. We design our data centers with standardization and optimization as \n\narbon-aware data center design. We design our data centers with standardization and optimization as \ncore principles, focusing on efficiency and modular scalability to meet our computing needs. The standardized nature of Google\u2019s data center designs allow \nus to reduce the materials required for construction. Our data center design teams have already optimized several core elements of Google\u2019s standard \ndata center design\u2014which collectively have the potential to reduce the embodied carbon emissions intensity of a data center building by around 9%.\n133 \nThe use of low-carbon construction materials is another important part of our work in this area. We plan to scale the use of low-carbon concrete across \nour data center construction projects, as well as expand the use of low-carbon steel\u2014which has the potential to reduce embodied carbon emissions from \ndata center construction by up to 40%.",
      "shore wind farm in Belgium (92 MW for Google). \n R\u00f8dby solar farm in Denmark (55 MW for Google). \n18\n\nScaling smarter \nSuccessfully reducing our data center energy emissions \nIn 2024, the world\u2019s appetite for energy grew substantially faster than the average growth from the previous \ndecade.\u200947 This surge highlights the increasing energy demands of our modern infrastructure, from powering  \nhomes and industries to supporting the expanding digital world and emerging technologies. \nIn 2024, we reduced our data center energy emissions by 12% compared to 2023 (Figure 2). We \nachieved this reduction despite our data center electricity consumption increasing 27% year-on-year due to  \nthe growth of our business and increasing product adoption, including AI. \nThat may sound counterintuitive, but we\u2019ve long known that reducing the emissions from our data center \nenergy use is about scaling smarter. For us, it\u2019s the result of more than a decade of work\u2014and a strategy \nthat continues to deliver real-world results. ",
      "looking strategy for clean electricity for our data centers to further reduce scope 2 emissions. \n80\n\nScope 3 (ambition-based) \nScope 3 emissions are indirect emissions that occur across the supply chain, making them further removed from our direct control and therefore requiring a  \nlonger runway to make significant progress. In 2024, our total scope 3 (ambition-based) emissions were approximately 8.4 million tCO2e, representing 73% of  \nour total 2024 ambition-based carbon footprint. \nCompared to 2023, our total scope 3 (ambition-based) emissions increased by 22% , primarily due to increases in data center capacity delivery (i.e.,  \nemissions generated from the manufacturing and assembly of technical infrastructure hardware\u2014including for AI\u2014and their logistics, as well as from data  \ncenter construction). \nWe expect to increase, relative to 2024, our investment in our technical infrastructure\u2014including servers, network equipment, and data centers\u2014to support  ",
      "dvocate for policy and market intervention efforts that \nexpand supplier access to clean energy. \n84\n\nLow-carbon data center construction \nOur data center construction projects are generally multi-year projects with multiple phases. Emissions primarily come from the embodied carbon of \nconstruction materials, such as steel and concrete, as well as from vehicles and generators used during construction. \nIn 2024, emissions from data center construction increased 54% year-on-year, reaching approximately 1.6 million tCO2e and representing 19% of our total \n2024 ambition-based scope 3 emissions. Our data center construction emissions\u2014which are already meaningful and expected to increase in the near term \nas we build more data centers to meet demand\u2014therefore represent a key area for decarbonization. \nOur approach to this key reduction area begins with carbon-aware data center design. We design our data centers with standardization and optimization as ",
      " result of more than a decade of work\u2014and a strategy \nthat continues to deliver real-world results. \n\n result of more than a decade of work\u2014and a strategy \nthat continues to deliver real-world results. \nFigure 2. Trajectory of data center electricity consumption and data center energy emissions \n2019 20 20 2021 2022 20 23 2024 \nYear \n5 \n4 \n3 \n2 \n1 \n0 \nData center \nenergy emissions \ndeclined in 2024 \nMillion tCO2e \n40 \n30 \n20 \n10 \n0 \nMillion MWh \nLegend Total data center electricity consumption Total data center energy emissions \nClean energy procurement \nWe\u2019ve been at this for a while: our first clean energy PPA dates back to 2010. Since then, we\u2019ve scaled \nprocurement efforts to continue to meet the demands of our growing infrastructure\u2014and to help shift the \nenergy systems that power it. As electricity needs have surged, particularly with the rise of AI, these long-\nterm efforts have delivered results. \nIn 2024, more than 25 clean energy projects we\u2019d contracted over the past several years\u2014some as far  "
    ]
  },
  {
    "question": "Which two organizations collaborated with Google to launch the Freshwater Ecosystems Explorer?",
    "ground_truth": "The United Nations Environment Programme (UNEP) and the European Commission Joint Research Centre.",
    "answer": "UNEP and the European Commission Joint Research Centre",
    "contexts": [
      "odule to train supply chain facility personnel on waste stream tracking, reporting, and management. \n\nodule to train supply chain facility personnel on waste stream tracking, reporting, and management. \nSymbiosis In 2024, Google co-founded  Symbiosis, a new coalition of corporate buyers committed to following the latest science to scale high-quality, nature-based \ncarbon removal. \nThe Nature Conservancy  (TNC) Google has supported TNC on watershed projects in Chile and the United States, and separately, Google.org has provided support to TNC for nature-\nrelated projects, including the restoration of giant kelp forest ecosystems across south-eastern Australia. \n United Nations Food and Agriculture Since 2015, Google and the UN FAO have partnered  on forest monitoring, natural resources, livelihoods, and the environment. \n Organization (UN FAO) \n United Nations Environment  In collaboration with UNEP and the European Commission Joint Research Centre, Google launched  the Freshwater Ecosystems Explorer . This platform ",
      "Given this reality, we teamed up with the United Nations Environment Programme and DHI to build the \n\nGiven this reality, we teamed up with the United Nations Environment Programme and DHI to build the \nFreshwater Ecosystems Explorer\u2014a free platform that brings together satellite data, AI, and hydrological \nmodels. The easy-to-use geospatial platform helps policymakers and scientists see how freshwater systems \nare changing across countries, river basins, and watersheds. The Freshwater Ecosystems Explorer helps  \ntrack water levels in reservoirs and spot changes in wetlands\u2014offering a clearer picture of how these \nsystems are shifting over time. \nWe\u2019ve also supported other tools aimed at making \nwater data more actionable: \n\u2022  LeadOut Map, a tool launched by \nBlueConduit in 2024, uses AI to help cities \nlocate lead pipes for removal in the  \nUnited States. \n\u2022  Global Wetland Watch is mapping global \nwetlands with satellite imagery and AI. \n\u2022  Global Water Watch offers near-real-time \nupdates on reservoir levels. \nAnd with $2.5 million in funding from Google.org, ",
      "s don\u2019t  \nfall all at once, and the right tools can help stop a chain reaction before it begins. \n73\n\nSurfacing solutions \nSafeguarding the world\u2019s vital freshwater and  \nocean resources \nThe story doesn\u2019t end with forests. The intricate networks of rivers, lakes, wetlands, and oceans are the \nplanet\u2019s circulatory system, and they too are under immense strain. Pollution, overuse, and the impacts of a \nchanging planet are taking a toll. \nThrough partnerships with scientists, governments, and NGOs, we\u2019re building tools that help protect these \nessential systems. Whether it\u2019s monitoring reservoirs in near real time or tracking illegal fishing halfway \nacross the globe, we\u2019re working to bring critical insights to light, so action can follow. \nMapping the world\u2019s freshwater \nFreshwater ecosystems support millions of species and billions of people. But many of them are poorly \nmonitored, especially in regions where data is scarce or outdated. \nGiven this reality, we teamed up with the United Nations Environment Programme and DHI to build the ",
      "ng nature on our campuses \n49 Ripple effects: How our water efforts bloom into biodiversity gains \n2",
      "mmission Joint Research Centre, Google launched  the Freshwater Ecosystems Explorer . This platform \n\nmmission Joint Research Centre, Google launched  the Freshwater Ecosystems Explorer . This platform \n Programme (UNEP)  enables all countries to freely measure and monitor freshwater resources (toward Sustainable Development Goal 6.6.1 ) as well as learn when and where \nsurface water is changing. In 2023, Google.org supported the UNEP International Methane Emissions Observatory  in developing a new AI-based automated \nmethane emission detection, alerting, and notification system. \n World Business Council for A member of the WBCSD since 2019, Google actively participates in initiatives related to improving well-being for both people and the planet\u2014including \n Sustainable Development (WBCSD) shifting diets, accelerating climate change standards and policy progress, and supporting regenerative agriculture. \nWorld Economic Forum  (WEF)  Google partners with WEF on various initiatives, including: the First Movers Coalition , the Chief Sustainability Leaders Community , Tech for Climate ",
      "like Google Earth Engine, Global Fishing Watch , and Environmental Insights Explorer  also provide  \n\nlike Google Earth Engine, Global Fishing Watch , and Environmental Insights Explorer  also provide  \nvaluable  information  for  conservation,  restoration,  and  environmental  management  efforts.  These  \ntechnologies aren\u2019t just scientific innovations\u2014they can save lives and enable communities to recover faster \nin the face of disaster. \nLooking ahead \nWe\u2019re proud of the solutions we\u2019re building, the progress we\u2019re making, and the impact we\u2019re achieving \nwith our products and partners. We believe that by continuing to push AI innovation forward, we can \nhelp address the significant challenges facing people and the planet. This report provides more detailed \ninformation on our operations, our products, and our progress. We invite you to learn more. \n6",
      "ill In \n\u2022  Clean Grid Alliance \n\u2022  Nuclear Innovation Alliance \u2022  WindEurope \n\u2022  Corporate Eco Forum\n\nInternational and nonprofit organizations \nGoogle engages in many international partnerships and with many nonprofit organizations to accelerate progress toward shared sustainability ambitions. \nSome of our key partnerships include: \nOrganization Details \n24/7 Carbon-Free Energy Compact  In 2021, Google helped launch  the 24/7 Carbon-Free Energy Compact in partnership with Sustainable Energy for All and UN-Energy to help grow the \nmovement to enable zero-carbon electricity. \nAd Net Zero Google is a founding supporter of and active participant in Ad Net Zero\u2014a global initiative to help the advertising industry tackle the climate crisis. \n  Bonneville Environmental Google has partnered closely with BEF since 2019 on the implementation of our water strategy, including identifying and facilitating impactful water \nFoundation  (BEF) replenishment and watershed health projects globally, with a variety of local organizations and partners. "
    ]
  },
  {
    "question": "In what year did Google and Fervo Energy sign the first corporate agreement to develop a next-generation geothermal power project, and what year did it become operational?",
    "ground_truth": "The agreement was signed in 2021, and the project became operational in 2023.",
    "answer": "Google and Fervo Energy signed the first corporate agreement in 2021, and the project became operational in 2023.",
    "contexts": [
      "ned the world\u2019s first corporate agree ment to develop a n ext-generation geotherm al \npower project.",
      "Fleet-wide trailing 12-month PUE Legend \n21 \nThe server floor in our data center in Hamina, Finland.\n\nPowering today \nOur record year for clean energy \nElectricity is a key input for nearly everything we do\u2014from training AI models to providing Search results to  \nsharing YouTube videos and more. And as our energy demands grow, in part due to the expansion of AI, so  \ndoes our responsibility to meet that demand in a way that\u2019s cleaner, smarter, more reliable, and more resilient. \nIn 2024, we set a new record for ourselves for clean energy procurement: we signed contracts to \npurchase over 8 GW of additional clean energy generation in 2024 alone \u200954\u2014the largest annual total \nin our history and twice the volume we contracted for the prior year. That isn\u2019t just an achievement, it\u2019s a \nturning point\u2014one that\u2019s putting us on a path toward reaching our environmental ambitions. These new \nenergy deals will help bring new clean energy to the grids where we operate, support advanced technology \ndeployment, and model new ways of doing business that others can follow. \n22 gigawatts and counting ",
      "nced geothermal energy takes a \ndifferent approach, expanding the reach of this clean power source. \n\nnced geothermal energy takes a \ndifferent approach, expanding the reach of this clean power source. \nEnhanced geothermal involves either engineering underground reservoirs where none existed before or  \nenhancing production from existing ones. It\u2019s similar to creating a custom-designed plumbing system deep  \nbeneath the surface. Using advanced drilling techniques adapted from the oil and gas industry to access \nhot, dry rock formations, water is then injected into these formations, heated by the Earth\u2019s intense thermal \nenergy, and circulated back to the surface to drive turbines and generate electricity. This process produces \nclean, consistent power with only a small land footprint and without burning fossil fuels. \n24 \n- \u2019 -Google and clean-energy s tartup Fervo signed the world\u2019s first corporate agree ment to develop a n ext-generation geotherm al \npower project.",
      "ned the world\u2019s first corporate agree ment to develop a n ext-generation geotherm al \npower project.\n\nFirst-of-its-kind geothermal project in Nevada \nWe recognized the potential of enhanced geothermal early on.  In 2021, we signed the first corporate \nagreement to develop a next-generation geothermal  power project with Fervo Energy in Nevada.  \nThis wasn\u2019t just a theoretical exercise; it was a real-world collaboration to prove that enhanced geothermal \ncould deliver reliable, carbon-free energy. That project  became operational  in 2023, and carbon-free energy \nstarted flowing onto the local grid that serves our data centers in Nevada. \nSince then, Fervo has achieved remarkable reductions in the time and cost of its drilling process, \ndemonstrating the power of early customer demand to help drive rapid improvements to early-stage  \ntechnologies. Building upon the success of our commercial pilot, in 2024, we scaled up our partnership with \nFervo Energy, contracting for a larger 115 MW project through a new utility rate structure with NV Energy\u2014 ",
      "troduction: Street View image of Redwood State and National Park, used with permission. \u00a92025 Google\n\ntroduction: Street View image of Redwood State and National Park, used with permission. \u00a92025 Google\nAge of AI: Street View image of the International Space Station, used with permission. \u00a92025 Google\nEnergy for our data centers: El Romero solar farm in Chile (80 MW for Google).\nEnergy for our supply chain: A technician scans hardware components, a critical step for tracking parts through every stage of the production process.\nResource efficiency: Clear waters reflect the beauty of our data center in Eemshaven, Netherlands.\nNew AI research solutions: The Solar API generates detailed rooftop data based on Google\u2019s extensive geospatial data and computing resources in order to evaluate rooftop solar energy potential.\nAI for extreme events and disaster response: A wide river basin during low water levels illustrates the type of flood-prone environment where flood forecasting is critical.",
      "date. Any future update will be provided only through a public disclosure indicating that fact. \n104\n\nEnvironmental metrics data tables \nGreenhouse gas emissions \nGreenhouse gas emissions inventory Unit 2019 2020 2021 2022 2023 2024 \nScope 1 tCO e 81,900 55,800 64,100 91,200 79,400 73,100 2\nScope 2 \nScope 2 (location-based) tCO2e 5,116,900 5,865,100 6,576,200 8,045,400 9,252,900 11,283,200 \nScope 2 (market-based) tCO e 835,900 911,600 1,823,500 2,492,100 3,423,400 3,059,100 2\nTotal operational (scope 1 +  \nmarket-based scope 2) emissions tCO2e 917,800 967,400 1,887,600 2,583,300 3,502,800 3,132,200 \nScope 3 \nScope 3 (Category 1: Purchased goods and services) tCO2e 2,787,000 2,404,000 2,886,000 3,504,000 3,951,000 3,601,000 \n2\n2\n105 \nScope 3 (Category 2: Capital goods) and  \n(Category 11: Use of sold products) \u2009148  tCO2e 4,584,000 4,176,000 4,462,000 3,886,000 4,583,000 6,337,000 \nScope 3 (Category 3: Fuel- and energy-related activities   \n[not included in scope 1 or scope 2] ) t CO2e 425,000 512,000 753,000 1,004,000 1,295,000 714,000 ",
      "a first-of-a-kind partnership to unlock new, clean power from a series of small modular nu clear  \n4\n\nreactors, which will be developed by Kairos Power. We also partnered with a clean energy startup to develop  \na geothermal power project in Nevada that\u2019s now contributing carbon-free energy to the electric grid. And a  \ncollaboration between Google,  Tapestry, and grid operator PJM aims to develop AI-driven data capabilities  \nfor a smarter, more reliable electricity system. It\u2019ll also speed up grid interconnection\u2014with the goal of making  \nelectricity more reliable and affordable for the 67 million people PJM serves in the United States. \nWe worked with our suppliers to accelerate their path to 100% clean electricity. \nWhile we\u2019re encouraged by our operational progress, obstacles to decarbonizing our supply chain remain. 9  \nBringing new clean energy online for Google and our suppliers is particularly difficult in the Asia-Pacific \nregion, where wind and solar resources aren\u2019t readily accessible in many markets. And though we\u2019ve ",
      "f AI-driven growth of electricity demand. Additionally, ECA formally submitted comments  advocating \n\nf AI-driven growth of electricity demand. Additionally, ECA formally submitted comments  advocating \nfor the implementation of grid-enhancing technologies at FERC and  collaborated with other organizations \u2014including Clean Energy Buyers Association (CEBA),  \nData Center Coalition (DCC), and Electricity Consumers Resource Council (ELCON)\u2014to advocate for colocation approach consistent with Google\u2019s position. \nU.S. state engagement \nClean Transition Tariff (utility rate): Google announced a  new, first-of-its kind clean energy partnership with NV Energy called a \u201cClean Transition Tariff\u201d \n(CTT) that enables Google and other energy users to meet growing power demand cleanly and reliably. The CTT brings utilities and customers together into a  \nlong-term energy agreement that can facilitate investments into new projects that deliver clean firm energy to the grid. ",
      "om 2019\u20132024.\n8 These calculations are based on internal data, as of March 2025. Google\u2019s TPU power \n\nom 2019\u20132024.\n8 These calculations are based on internal data, as of March 2025. Google\u2019s TPU power \nefficiency relative to the earliest generation Cloud TPU v2 is measured by peak FP8 flops \ndelivered per watt of thermal design power per chip package.\n9 When we use the term \u201csupply chain\u201d or \u201csupply chain emissions,\u201d we're referring to \nthe indirect emissions that happen outside of our direct operations. This includes both \nupstream and downstream emissions, also referred to as \u201cvalue chain emissions.\u201d\n10 The Google Clean Energy Addendum applies to the electricity consumed by suppliers in \nthe manufacturing of Google technical infrastructure and consumer hardware products. \n11 To estimate aggregate enabled emissions reductions, we first estimated annual \nreductions for five products individually (Google Earth Pro, Solar API, Nest thermostats, \nfuel-efficient routing, and Green Light) and then combined the totals. For details ",
      "nced geothermal plant in Nevada, a f irst-of-its-kind project developed in \npartnership with Google.",
      " over 1 billion users to help them make more \nsustainable choices annually through our products. \u200924\n\nLaunched the first FireSat \nsatellite to detect wildfires \nThe first satellite for the FireSat constellation  launched  \nand officially made contact with Earth. This satellite is  \none of more than 50 in a first-of-its-kind constellation  \ndesigned to use AI to detect and track wildfires as \nsmall as a garage (roughly 5x5 meters). \n8 \nThe launch of the first satellite for the \nFireSat constellation. \nImproved TPU power efficiency \nby 30x from 2018 \nIronwood\u2014the first Google TPU designed to power \nthinking, inferential AI models at scale\u2014is nearly 30 \ntimes more power efficient than our first Cloud TPU \nfrom 2018.\n\u200927 \nIronwood: The first Google TPU for the \nage of inference. \nReplenished 64% of our  \nfreshwater consumption,   \nup from 18% \nOur water stewardship projects replenished  \napproximately 4.5 billion gallons of water (17 billion \nliters or 17 million cubic meters) in 2024 alone, \nroughly 64% of our freshwater consumption.\n\u200925",
      "nergy, contracting for a larger 115 MW project through a new utility rate structure with NV Energy\u2014 \n\nnergy, contracting for a larger 115 MW project through a new utility rate structure with NV Energy\u2014 \nthe Clean Transition Tariff. This expansion signifies a shift from pilot-scale to commercial deployment and \nwill increase the amount of enhanced geothermal generation enabled by Google by almost 25 times. \nGeothermal\u2019s global potential \nWe\u2019re also exploring the global potential of geothermal energy. In 2024, we announced a partnership   \nwith the University of Newcastle and its research institute Newcastle Institute for Energy and Resources \n(NIER) to further de-risk and develop geothermal energy resources in Australia. We\u2019re also working with \nProject Innerspace on GeoMap , a free online tool that provides essential subsurface data and analytics for \nassessing geothermal potential worldwide. Think of it as providing a detailed map to help others explore this \nhidden energy resource. "
    ]
  },
  {
    "question": "In the detailed emissions data table, what was the exact amount of biogenic emissions in tCO2 for 2024?",
    "ground_truth": "17,200 metric tons of carbon dioxide (tCO2).",
    "answer": "17,200",
    "contexts": [
      "ns \nSupply chain emissions \nMillion tCO2 e \n7. 5 \n5 \n2.5 \n0 \n2019 2020 2021 2022 2023 2024 \nYear \n81",
      "ions using emission factors from \nthe 2025 EPA Emission Factors for Greenhouse Gas Inventories. \n100",
      " & \nAfrica \nLatin tCO\n2e 1,900 13,900 147,100 America \nAsia Pacific tCO2e 8,800 1,801,300 1,809,100 \n\n & \nAfrica \nLatin tCO\n2e 1,900 13,900 147,100 America \nAsia Pacific tCO2e 8,800 1,801,300 1,809,100 \nGlobal  tCO2e 73,100 3,059,100 11,283,200 total \nCarbon removal credits\u2009150 \nProject type Company \nEstimated \ncontracted  \ncredits (tCO2e)\nProject   \nlocation \nYear deal  \nwas signed \nExpected \ntimeframe  \nfor delivery \nCredit type Market  \nc\nommitment \nBiomass carbon removal   \nand storage (BiCRS) \nVaraha 100,000 India 2024 2026\u20132030  Removal Bilateral \nCharm Industrial 100,000 United States 2024 2026\u20132030 Removal Bilateral \nCO280 61,226 United Sta\ntes 2 024 2028\u20132030 Removal Frontier \nStockholm Exergi 41,636 Sweden 2024 2028\u20132030 Removal Frontier \nCharm Industrial 22,635 United Stat es 2023 2025\u20132030 Removal Frontier \nVaulted Deep 18,786 United States 2024 2024\u20132027 Removal Frontier \nNULIFE 78 Canada 2024 2025 Removal Frontier \nDirect air capture (DAC) \nHolocene 100,000 United St\nates 2024 Early 2030\u2019s Removal Bilateral \n280 Earth 13,301 United States 2024 2026\u20132030 Removal Frontier ",
      " \u201cScalable   Learning  of  Segment-Level  Traffic  Congestion   Functions ,\u201d arXiv, September 2024. \n\n \u201cScalable   Learning  of  Segment-Level  Traffic  Congestion   Functions ,\u201d arXiv, September 2024. \n\u2022  \u201cOn the Relationship of Speed Limit and CO 2 Emissions in Urban Traffic,\u201d SSRN, March 2024. \nNature \u2022  \u201cPatterns in Bird and Pollinator Occupancy and Richness in a Mosaic of Urban Office Parks Across Scales and Seasons ,\u201d  \nEcology and Evolution, March 2024.  \n\u2022  \u201cTo Crop or Not to Crop: Comparing Whole-Image and Cropped Classification on a Large Dataset of Camera Trap Images ,\u201d   \nThe Institution of Engineering and Technology, November 2024. \nPolicymakers \nPublic policy and advocacy \nPolicy measures and corporate commitments will continue to play an important role in driving emissions reductions in the next decade. \nWe\u2019ve shared sustainability policy positions on the following topics: \n\u2022  Carbon-free energy:  A Policy Roadmap for 24/7 Carbon-Free Energy \n\u2022  Climate action with AI: Accelerating Climate Action with AI \n\u2022  Device repairability:  Google & Repairability ",
      "sure 302-1 (e.g., 302-1d: electricity, heating, cooling, and steam consumed sold) are excluded. \n112\n\n,\nGreenhouse Gas Inventories, the 2024 Climate Registry Default Emission Factors, and the 2024 Department for Environment, Food and \nRural Affairs (DEFRA) UK Government GHG Conversion Factors. \nBiogenic emissions \n\u201cBiogenic emissions\u201d represent direct CO2 emissions from Alphabet \u2019s operated vehicles and generators that consume biogenic fuels. \nIn accordance with the Corporate Standard, biogenic CO2 emissions are reported separately from other scope 1 GHG emissions. The \nemission factors used to calculate biogenic emissions come from the 2025 EPA Emission Factors for Greenhouse Gas Inventories. \nScope 2 location-based and Scope 2 market-based \n\u201cScope 2 location-based\u201d and \u201c Scope 2 market-based \u201d represent indirect emissions from natural gas, fugitive emissions from \nrefrigerant leaks at leased Global Facilities, purchased steam, hot water, and chilled water from district energy systems, and purchased ",
      "0 2021 2022 2023 2024 2030 \nYear \nIllustrative emissions \nLegend \n12 \n9 \n6 \n3 \n0 \nMillion tCO2 e \n83",
      "date. Any future update will be provided only through a public disclosure indicating that fact. \n104\n\nEnvironmental metrics data tables \nGreenhouse gas emissions \nGreenhouse gas emissions inventory Unit 2019 2020 2021 2022 2023 2024 \nScope 1 tCO e 81,900 55,800 64,100 91,200 79,400 73,100 2\nScope 2 \nScope 2 (location-based) tCO2e 5,116,900 5,865,100 6,576,200 8,045,400 9,252,900 11,283,200 \nScope 2 (market-based) tCO e 835,900 911,600 1,823,500 2,492,100 3,423,400 3,059,100 2\nTotal operational (scope 1 +  \nmarket-based scope 2) emissions tCO2e 917,800 967,400 1,887,600 2,583,300 3,502,800 3,132,200 \nScope 3 \nScope 3 (Category 1: Purchased goods and services) tCO2e 2,787,000 2,404,000 2,886,000 3,504,000 3,951,000 3,601,000 \n2\n2\n105 \nScope 3 (Category 2: Capital goods) and  \n(Category 11: Use of sold products) \u2009148  tCO2e 4,584,000 4,176,000 4,462,000 3,886,000 4,583,000 6,337,000 \nScope 3 (Category 3: Fuel- and energy-related activities   \n[not included in scope 1 or scope 2] ) t CO2e 425,000 512,000 753,000 1,004,000 1,295,000 714,000 ",
      "d by the Kyoto Protocol, where relevant: carbon dioxide (CO\n2), methane (CH4), nitrous oxide (N2O), \n\nd by the Kyoto Protocol, where relevant: carbon dioxide (CO\n2), methane (CH4), nitrous oxide (N2O), \nhydrofluorocarbons (HFCs), perfluorocarbons (PFCs), sulfur hexafluoride (SF6), and nitrogen trifluoride (NF3). However, perfluorocarbons (PFCs), sulfur \nhexafluoride (SF6), and nitrogen trifluoride (NF3) aren\u2019t emitted as a result of our operations and are therefore appropriately excluded from our \u201cGHG \nemissions by type\u201d data table. We report emissions both in the unit of metric tons per gas (e.g., tCO2, tCH4, etc.) and in the standardized unit of metric tons \nof carbon dioxide equivalent (tCO2e), with the exception of biogenic emissions which are reported as tCO2 only. \nWe source the global warming potentials (GWP) for each GHG from the Intergovernmental Panel on Climate Change (IPCC) Fourth Assessment Report \n(AR4), IPCC Fifth Assessment Report (AR5), and IPCC Sixth Assessment Report (AR6), and we use the most up-to-date emission factors available when ",
      "Environmental \nReport \n2025",
      "duct Environmental Reports on Google\u2019s Sustainability Reports webpage. We use laboratory power draw \n\nduct Environmental Reports on Google\u2019s Sustainability Reports webpage. We use laboratory power draw \nmeasurements, data on use patterns, common industry assumptions on product lifetimes, and LCA electricity emission factors from the 2024 Sphera LCA \nfor Experts database. \nBiogenic emissions \nIn accordance with the Greenhouse Gas Protocol, we report biogenic emissions separately from other scope 1 emissions. Our biogenic carbon dioxide \nemissions are generated from our operated vehicles and generators that consume biofuels. We calculate biogenic emissions using emission factors from \nthe 2025 EPA Emission Factors for Greenhouse Gas Inventories. \n100",
      " \n[not included in scope 1 or scope 2] ) t CO2e 425,000 512,000 753,000 1,004,000 1,295,000 714,000 \n\n \n[not included in scope 1 or scope 2] ) t CO2e 425,000 512,000 753,000 1,004,000 1,295,000 714,000 \nScope 3 (Category 4: Upstream transportation and distribution) tCO2e 476,000 440,000 460,000 533,000 570,000 853,000 \nScope 3 (Category 5: Waste generated in operations) tCO2e 14,000 7,000 7,000 7,000 8,000 12,000 \nScope 3 (Category 6: Business travel) tCO2e 461,000 179,000 36,000 268,000 291,000 399,000 \nScope 3 (Category 7: E m\nploy\nee commuting) tCO2e 203,000 52,000 29,000 115,000 96,000 137,000 \nScope 3 (total) tCO2e 8,950,000 7,770,000 8,633,000 9,317,000 10,794,000 12,053,000 \nTotal emission s\n: Sco\npe 1, 2 (market-based), and 3 (total) tCO2e 9,867,800 8,737,400 10,520,600 11,900,300 14,296,800 15,185,200 \nBiogenic emissions tCO e 21,900 5,400 3,800 17,900  18,700 17, 200 \nNote: In 2024, we recalculated certain previously reported GHG emissions metrics in accordance with our internal recalculation policy for improved accuracy. For more details, refer to the  "
    ]
  },
  {
    "question": "What percentage of the plastic used in Google products manufactured in 2024 was recycled content, and what was this percentage in 2023?",
    "ground_truth": "40% in 2024, up from 34% in 2023.",
    "answer": "In 2024, 40% of the plastic Google used in products manufactured was recycled content, and in 2023, this percentage was 34%.",
    "contexts": [
      "nerated Metric tons 31,500 43,200 40,300 52,200 58,500 \nTotal waste diversion rate % 79 83 81 84 84 \n\nnerated Metric tons 31,500 43,200 40,300 52,200 58,500 \nTotal waste diversion rate % 79 83 81 84 84 \nNote: In 2024, we recalculated certain previously reported waste metrics in accordance with our internal recalculation policy for improved accuracy. For more details, refer to the Recalculation of  \nprevious environmental metrics  section. \nData center hardware circularity Unit 2020 2021 2022 2023 2024 \nReused inventory used for Google-managed server builds, maintenance, and upgrades \u2009162 % 10 13 21 29 44 \nComponents resold into the secondary market Million components 8.2 4.9 5.0 7.0 6.7 \n109",
      "t of the aluminum portion of the \nenclosures by at least 35% compared to 100% primary aluminum.\n\u200975 \n\nt of the aluminum portion of the \nenclosures by at least 35% compared to 100% primary aluminum.\n\u200975 \n\u2022  We\u2019re also using recycled or renewable material in plastic used across our consumer hardware product \nportfolio: 40% of the plastic Google used in products manufactured in 2024 was recycled content.\n\u200976 \nChoosing recycled content helps reduce the environmental impact of extraction, supports more sustainable \nsupply chains, and enables designing products differently from the start. This kind of design thinking helps \nreduce the impact of our consumer hardware\u2014without compromising performance or quality. We\u2019re also \nsharing what we\u2019ve learned, for example in our Consumer Hardware Carbon Reduction Guide . \n50",
      "of new solar energy in Taiwan, advancing clean \nenergy for both the local electricity grid and our  \n\nof new solar energy in Taiwan, advancing clean \nenergy for both the local electricity grid and our  \nown operations. \nEliminated plastic from our \nproduct packaging \nPackaging for new Google products launched and  \nmanufactured in 2024 was 100% plastic-free .\u200922 \nTo help other companies create more sustainable  \npackaging, we published our  Plastic-Free Packaging  \nDesign Guide . \n7 \n -    \nA fiber-based unglued packaging set.  \nReached 1 billion users to inform \nmore sustainable choices \nFor the past three years, we\u2019ve provided information  \nto over 1 billion users to help them make more \nsustainable choices annually through our products. \u200924",
      "ared to 2023. This \npercentage excludes components used to build servers through original equipment \n\nared to 2023. This \npercentage excludes components used to build servers through original equipment \nmanufacturers (OEM), which experienced increased deployment in 2024.\n71 Percent reduction in food waste per Googler was calculated as food waste generated in \nkitchens and cafes at Google\u2019s global offices per unique building badge swipes, against a \n2019 base year.\n72 Based on total weight of new Google Pixel and Fitbit products launched and \nmanufactured in 2024.\n73 For Pixel 9 and Pixel 9 Pro phones, the recycled rare earth elements are a minimum of 27% \nof the magnet total weight. Pixel Watch 3 docking, speaker, and haptic magnets contain \n100% recycled rare earth elements, but the majority of the magnet weight consists of \nother materials.\n74 Solder paste is made with multiple materials and contains at least 80% tin. The tin in the \nsolder paste is made with 100% recycled content.\n75 Carbon footprint reduction claim based on third-party-verified life cycle assessment. ",
      "85% 85% 82% \nYe a r \nLegend Percentage of food waste diverted from landfill \nPercentage \n50\n25 \nYear\n\nRecycled plastic \nWe aim to use recycled or renewable material in at least 50% of plastic used across our consumer hardware \nproduct portfolio by 2025. \n40% of the plastic Google used in products manufactured in 2024 was recycled content. 138 \nTrend  \nThe percentage of plastic used in our manufactured consumer \nhardware products that was recycled content increased from \n34% 139 in 2023 to 40%140 in 2024, due to changes in our product \nmix, primarily driven by a decrease in the manufacturing of \nGoogle products with low recycled content in 2024. \nDetails  \nWe set this ambition in 2020, and it includes the minimum \npercentage of recycled or renewable plastic content calculated \nas a percentage of total plastic (by weight) in Google\u2019s \nconsumer hardware portfolio for products manufactured in a \ngiven year. The following may be excluded from the calculation \nof percentage: printed circuit boards, labels, cables, connectors, \nelectronic components and modules, optical components, ",
      "s. To learn more, refer to our \ndata center locations and our office  locations. \nAbout this report \n\ns. To learn more, refer to our \ndata center locations and our office  locations. \nAbout this report \nGoogle\u2019s 2025 Environmental Report highlights how our technologies\u2014including cutting-edge AI and emerging research\u2014are driving progress for both \npeople and the planet. Throughout this report, we use the term \u201csustainability\u201d to refer to environmental sustainability. This report features data from our \n2024 fiscal year (January 1 to December 31, 2024), and mentions some notable achievements from 2025 to date. \nAdditional resources \n\u2022 Explore our 2025 Environmental Report\n\u2022 Sustainability.google\n\u2022 Sustainability reports\n\u2022 Sustainability blog \n\u2022 About Google \n\u2022 Google\u2019s commitments \n\u2022 Alphabet additional information: Environmental \n\u2022 Alphabet SASB and TCFD Index \n77",
      " \nExcess and \nobsolete \nhardware Recycled hardware  \n44 \nReused hardware \nResold hardware \nInventory\n\nWhy does a reverse supply chain matter so much? \nAs we continue to scale our data centers to meet the growing demand for our products and services, \nincluding AI, reducing waste is essential:  in 2024, we diverted 84% of our operational waste from \ndisposal across our global Google-owned and -operated data centers.  A large part of that success \ncomes from our Reverse Supply Chain program, which enables us to reclaim components from  \ndecommissioned hardware and repurpose them, cutting down on material consumption and emissions. \nWe\u2019re not just recycling\u2014we\u2019re giving our data center hardware a second life. In 2024, we harvested \napproximately 8.8 million components from our decommissioned hardware for reuse or resale  \nthrough our Reverse Supply Chain program \u2014including over 3 million hard drives that were securely \nwiped and reused or resold. That\u2019s millions of parts kept in circulation instead of being newly made. As an ",
      "em as such, so we redesigned packaging structures and ditched glossy coatings in favor of uncoated, \n\nem as such, so we redesigned packaging structures and ditched glossy coatings in favor of uncoated, \nspeckled textures that looked\u2014and felt\u2014recyclable for consumers. \nThe result: the packaging for new Google products launched and manufactured in 2024 was   \n100% plastic free.\n\u200978 Packaging isn\u2019t just what holds the product, it\u2019s part of the product experience. And \nrethinking how it\u2019s made can make sustainability feel more tangible from the start. Our Plastic-Free  \nPackaging Design Guide  shares design, engineering, and operational insights from our new packaging  \ndesign and encourages other companies to share their innovations too. \nGoogle consumer hardware devices in their product packaging. \n51",
      "hat was plastic-free for \nnew Google products launched and manufactured each year \n75\nPercentage \n50",
      "Environmental \nReport \n2025",
      "d content.\n75 Carbon footprint reduction claim based on third-party-verified life cycle assessment. \n\nd content.\n75 Carbon footprint reduction claim based on third-party-verified life cycle assessment. \nRecycled aluminum in the enclosures is at least 9% of applicable product based on \nweight.\n76 Based on total plastic weight of Google Pixel, Nest, Chromecast, and Fitbit products \nmanufactured in 2024. This does not include plastics in printed circuit boards, labels, \ncables, connectors, electronic components and modules, optical components, \nelectrostatic discharge (ESD) components, electromagnetic interference (EMI) \ncomponents, films, coatings, and adhesives.\n77 Refer to endnote 22 above.\n78 Refer to endnote 22 above.\n79 This includes all final assembly manufacturing sites globally for Google consumer \nhardware products with at least one year of data and which have had up to 4 months to \nobtain the UL 2799 validation.\n80 \u201cJapan\u2019s Greenhouse Gas Emissions Fall 2.5% in FY22/23 to Record Low,\u201d Reuters, April \n2024.\n81 Refer to endnote 11 above.\n82 Refer to endnote 12 above.",
      " \nExcess and \nobsolete \nhardware Recycled hardware  \n44 \nReused hardware \nResold hardware \nInventory"
    ]
  },
  {
    "question": "In the 2024 audit conformance data, what percentage of supplier facilities had no findings for \"Hazardous substances\" before the corrective action plan (CAP), and what was it after CAP?",
    "ground_truth": "90.1% before CAP, and 94.2% after CAP.",
    "answer": "Before the corrective action plan (CAP), 93.4% of supplier facilities had no findings for \"Hazardous substances,\" and after CAP, it was 96.7%.",
    "contexts": [
      "Management Systems \nPercentage in conformance before CAP Percentage in conformance after CAP Legend \n\nManagement Systems \nPercentage in conformance before CAP Percentage in conformance after CAP Legend \nReporting environmental data \nWe work directly with some of our suppliers to collect data. We also encourage suppliers to participate in CDP\u2019s corporate questionnaire by asking them \nto disclose climate- and water-related data via the CDP supply chain platform. In 2024, we invited 227 suppliers to participate, and 96% responded. Of the \nsuppliers that we invited to respond in 2024, 76% reported having GHG emissions reduction targets. \nTo support these efforts, we work with our suppliers to improve their environmental data collection and accounting, including for their scope 1, 2, and 3 \nemissions. For example, we provide training on CDP reporting, as well as on setting carbon reduction and renewable electricity targets. In 2024, we hosted \na summit for our consumer hardware device suppliers where we discussed Google\u2019s ambitions. \nRestricted substances ",
      "5: Waste generated in operations \n\u2022  Category 6: Business travel \n\u2022  Category 7: Employee commuting \n\n5: Waste generated in operations \n\u2022  Category 6: Business travel \n\u2022  Category 7: Employee commuting \n\u2022  Category 11: Use of sold products \nWe\u2019ve determined that the remaining scope 3 categories were either not relevant or not applicable based on the Scope 3 Standard\u2019s relevance criteria, \nwhich is described further in our 2025 (FY2024) Independent Accountants\u2019 Review Report. The emissions associated with categories deemed not relevant \nare not significant to scope 3 emissions individually or in the aggregate. \nFor each relevant scope 3 category, we report emissions according to their minimum boundaries listed by the Scope 3 Standard. For certain categories, \nwe\u2019ve also included activities which the Scope 3 Standard deems optional. None of the scope 3 categories have associated biogenic carbon dioxide \nemissions. \nIn 2024, we stopped reporting a scope 3 (Other categories) metric\u2014a previously aggregated total that included certain emissions from category 2 (Capital ",
      "along the way. \n52 \n\u2019\nWe\u2019ve extended the life of devices like the Pixel 8 through accessible repair.\n\nPartnering for impact \nCollaborating on manufacturing, safer chemistry, and \nproduct shipping \n \n \n       \n \n  \n \nWe\u2019re also rethinking the upstream and downstream processes\u2014working with suppliers and partners to \nmake our manufacturing systems more circular from the inside out. \nIn 2024, 82% of final assembly manufacturing sites for our consumer hardware products achieved \nUL 2799 validation for waste diversion\u200979\u2014with 89% of those sites achieving Zero Waste to Landfill Gold or \nPlatinum classification. \nThrough our consumer hardware product Restricted Substances Specification and Manufacturer Restricted \nSubstances List, we restrict many hazardous substances and ensure our suppliers have processes in place \nto detect and prevent them from entering our products or the manufacturing process. \nWe\u2019re collaborating to improve materials too. In partnership with ChemFORWARD, we commissioned ",
      "ndscape is constantly evolving, creating uncertainty around future regulations, tax considerations, \n\nndscape is constantly evolving, creating uncertainty around future regulations, tax considerations, \nand other government programs that could impact our business and emissions trajectories. \n\u2022  New opportunities and risks: The development of AI could create both new business opportunities and unforeseen risks that may alter our plans. \nWhile based on current estimates, the expectations in this section should be considered in light of these factors. \nEmissions trajectories \nWe made meaningful progress in 2024, particularly across our operational emissions (i.e., scope 1 and scope 2): \n\u2022  Scope 1: Our scope 1 emissions decreased by 8% year-on-year in 2024, following a 13% year-on-year reduction in 2023. \n\u2022  Scope 2: Our scope 2 (market-based) emissions decreased by 11% year-on-year in 2024. \nHowever, the emissions from our supply chain (i.e., scope 3)\u2014which are further removed from our direct control\u2014are still increasing: ",
      "Environmental \nReport \n2025",
      "date. Any future update will be provided only through a public disclosure indicating that fact. \n104\n\nEnvironmental metrics data tables \nGreenhouse gas emissions \nGreenhouse gas emissions inventory Unit 2019 2020 2021 2022 2023 2024 \nScope 1 tCO e 81,900 55,800 64,100 91,200 79,400 73,100 2\nScope 2 \nScope 2 (location-based) tCO2e 5,116,900 5,865,100 6,576,200 8,045,400 9,252,900 11,283,200 \nScope 2 (market-based) tCO e 835,900 911,600 1,823,500 2,492,100 3,423,400 3,059,100 2\nTotal operational (scope 1 +  \nmarket-based scope 2) emissions tCO2e 917,800 967,400 1,887,600 2,583,300 3,502,800 3,132,200 \nScope 3 \nScope 3 (Category 1: Purchased goods and services) tCO2e 2,787,000 2,404,000 2,886,000 3,504,000 3,951,000 3,601,000 \n2\n2\n105 \nScope 3 (Category 2: Capital goods) and  \n(Category 11: Use of sold products) \u2009148  tCO2e 4,584,000 4,176,000 4,462,000 3,886,000 4,583,000 6,337,000 \nScope 3 (Category 3: Fuel- and energy-related activities   \n[not included in scope 1 or scope 2] ) t CO2e 425,000 512,000 753,000 1,004,000 1,295,000 714,000 ",
      "y, Alphabet). \n2 All metrics are reported for the period January 1, 2024 through December 31, 2024. \n\ny, Alphabet). \n2 All metrics are reported for the period January 1, 2024 through December 31, 2024. \n3 The ambitions and progress against related ambitions are not included in this presentation of the Subject Matter. \n4 Non-financial information is subject to measurement uncertainties resulting from limitations inherent in the nature and the methods used for \ndetermining such data. The selection of different but acceptable standards and frameworks provide acceptable measurement techniques, which may \nresult in materially different measurements. The precision of different measurement techniques may also vary. \n5 All reported values are rounded to the nearest hundred unless otherwise noted. \n6 All reported scope 3 GHG emissions values are rounded to the nearest thousand. \n7 Reported carbon intensity per unit of revenue and per FTE employee values are rounded to the nearest hundredth. \n8 FTEs are based on the annual average FTEs. ",
      "as Protocol Scope 2 Quality Criteria.\n158 Refer to endnote 116 above.\n159 Refer to endnote 64 above.\n\nas Protocol Scope 2 Quality Criteria.\n158 Refer to endnote 116 above.\n159 Refer to endnote 64 above.\n160 We report individual campus PUE only for campuses with at least twelve months of data. \nAll reported PUE values are rounded to the hundredths place.\n161 In 2023, we adjusted our methodology for calculating waste generated and diversion \nfor our offices, integrating new data sources for reused furniture and recycled e-waste. \nThese changes are reflected in our reported office waste data for 2023 and 2024, but not \nfor prior years.\n162 We\u2019ve adjusted the terminology used for this metric to clarify that the reported \npercentage is applicable to reused inventory for Google-managed server assembly and \nmaintenance. The scope of the metric remains unchanged.\n163 We\u2019ve adjusted the terminology used for this metric to clarify that the reported \npercentages are based on sources (which can include watersheds) at risk for both water ",
      "rements that enable us to ensure that those we partner with are responsible environmental stewards. \n\nrements that enable us to ensure that those we partner with are responsible environmental stewards. \nAlong with having suppliers evaluate their operations, we perform our own ongoing due diligence and audits with select suppliers to verify compliance and \nunderstand our supply chain\u2019s current and potential risks. \nWe investigate any issues identified during an audit, and when we find that a supplier isn\u2019t conforming to our expectations, we expect the supplier to \nprovide a corrective action plan that outlines the root cause of the finding, how and when they will resolve the issue, and what steps will be taken to \nprevent recurrence. We determine whether the plan is acceptable based on our Supplier Code of Conduct requirements. Lastly, we monitor and verify all \ncorrective actions are completed in the agreed-upon time frame, with a process for escalation if necessary to the Supplier Responsibility Steering Team, ",
      "hief Compliance Officer and leaders from our data center, devices, and extended workforce teams. \n90\n\nIn 2024, we audited a subset of our suppliers to verify compliance for various environmental criteria (Figure 17): \nFigure 17. 2024 audit conformance data for environmental criteria \nThe lighter bars show the percentage of unique audited supplier facilities that had no findings for the listed criteria after their audit. The darker bars \nshow the percentage that had no findings after the corrective action plan process was completed. \nEnvironmental permits and reporting \nHazardous substances \nSolid waste \nAir emissions \nWater management \nEnergy consumption and greenhouse gases \nRisk assessment (and risk management) \nEnvironmental control processes \nCommunications \nPerformance review and continuous improvement \n97.5% 99.2% \n93.4% 96.7% \n96.7% 99.2% \n90.1% 94.2% \n98.4% 98.4% \n86.8% 92.6% \n93.4% 95.9% \n86.0% 93.4% \n88.4% 91.7% \n90.1% 94.2% \nEnvironment \nEnvironment Management Systems \nPercentage in conformance before CAP Percentage in conformance after CAP Legend ",
      "e with ISO 14040, ISO 14044, and ISO 14067. To calculate emissions generated from the manufacturing \n\ne with ISO 14040, ISO 14044, and ISO 14067. To calculate emissions generated from the manufacturing \nand assembly of servers and networking equipment used in our technical infrastructure, we transitioned in 2024 to primarily using LCAs as we continue \nto increase the accuracy of our estimates. This improved approach uses configurable LCA models (third-party reviewed) for high-impact components \n(which account for the majority of our total technical infrastructure hardware emissions). This allows us to tailor calculations to our specific mix of data \ncenter hardware and incorporate supplier-specific process-level data. For technical infrastructure components where LCA data is unavailable, we apply \nour previous spend-based method. For these remaining components, we collect supplier emissions data from our contract manufacturers as well as \ncomponent and fabless suppliers through the CDP Supply Chain Program. Alphabet\u2019s share of these suppliers\u2019 emissions is determined via economic ",
      "direct-use phase emissions and are not within the \nreporting boundary for use of sold products. \n113",
      "pendent Accountants\u2019 Review Report. \n106 \n50,700 3,027,400 11,207,600 \n5 100 800 \n1 32 100 \n14 13 13\n\nEnergy \nEnergy consumption by source type Unit 2020 2021 2022 2023 2024 \nFuel MWh 181,800 205,200 374,800 301,200 289,700 \nPurchased electricity \u2009151 MWh 15,125,700 18,238,400 21,685,300 25,252,600 32,106,200 \nPurchased heat \u2009152 MWh 124,900 119,300 219,100 278,500 237,500 \nPurchased steam MWh 22,100 22,600 23,500 14,500 17,100 \nPurchased cooling MWh 38,400 45,600 54,800 53,000 56,800 \nOn-site renewable electricity MWh 7, 200 8,800 9,600 10,700 20,500 \nTotal energy consumption MWh 15,500,100 18,639,900 22 ,367,100 25,910,500 32,727,800 \n2024 \nEnergy consumption by source type Unit Renewable sources Non-renewable sources Total \nFuel MWh 63,200 226,500 289,700 \nPurchased electricity \u2009153 MWh 23,995,800 8,110,400 32,106,200 \nPurchased heat \u2009154 MWh 0 237,500 237,500 \nPurchased steam MWh 0 17,100 17,100 \nPurchased cooling MWh 0 56,800 56,800 \nOn-site renewable electricity MWh 20,500 0 20,500 \nTotal energy consumption MWh 24,079,500 8,648,300 32,727,800 ",
      "ss. \nWe\u2019re collaborating to improve materials too. In partnership with ChemFORWARD, we commissioned \n\nss. \nWe\u2019re collaborating to improve materials too. In partnership with ChemFORWARD, we commissioned \nchemical hazard assessments for more than 190 individual chemicals from 2019 to 2024, to help inform the \nmaterial choices we make for our consumer hardware products. To further accelerate safer chemistry \nacross the industry, in 2024, we co-funded the Safer Chemistry Impact\n Fund\u2014helping researchers and \norganizations find alternatives to hazardous substances. \nWe\u2019re also reducing the emissions tied to how our products move around the world. In 2024, we partnered with \nDHL to use sustainable aviation fuel (SAF) for shipping products across the Americas, Asia, and Europe. And \nwe\u2019re exploring ways to reduce emissions even further\u2014from lighter packaging to smarter shipping routes. \nAssembly in progress in a warehouse. \n53\n\nNew AI research \nsolutions"
    ]
  },
  {
    "question": "What is the name of the AI agent powered by large language models that continuously recovers an average of 0.7% of Google's worldwide compute resources?",
    "ground_truth": "AlphaEvolve.",
    "answer": "AlphaEvolve",
    "contexts": [
      " at scale. \n72 \n\u2019\nGoogle\u2019s AI models identify animal sp ecies by analyzing photos from camera traps.",
      "ficiency by 39% on Cloud TPU v5e .\n\u200935 Gemini 2.5 Flash is our first fully hybrid reasoning model , \n\nficiency by 39% on Cloud TPU v5e .\n\u200935 Gemini 2.5 Flash is our first fully hybrid reasoning model , \ngiving developers the ability to turn thinking on or off. The model also allows developers to set thinking \nbudgets to find the right tradeoff between quality, cost, and latency. \nFor model deployment and usage, we\u2019ve improved underlying ML efficiency through pioneering \ntechniques like blockwise parallel decoding , improved  confidence-based  deferral, and speculative  \ndecoding that reduce the inference times of LLMs, allowing them to generate responses more quickly. \nThese improvements are used across Google products and set a standard throughout the industry. \nInitiatives like these have led to generational model efficiency gains. For example, Google\u2019s Gemini 1.5 Pro  \ndelivers  dramatic improvements and achieves comparable quality to Gemini 1.0 Ultra while using less compute.\u200936 \nTPUs ",
      " we used a \none month sample of observed machine power data from our entire TPU fleet, applying \n116\n\nGoogle\u2019s 2023 average fleetwide carbon intensity. To estimate embodied emissions from \nmanufacturing, transportation, and retirement, we performed a life-cycle assessment \nof the hardware. Data center construction emissions were estimated based on Google\u2019s \ndisclosed 2023 carbon footprint. These findings do not represent model-level emissions, \nnor are they a complete quantification of Google\u2019s AI emissions. Based on the TPU \nlocation of a specific workload, Compute Carbon Intensity (CCI) results of specific \nworkloads may vary.\n45 The figure represents the average percentage of Google\u2019s global compute resources that \nwere identified as recoverable and reallocated for more efficient use over this period as a \nresult of using AlphaEvolve.\n46 We estimated the expected annual generation based on our contracted clean energy, \napplying an average capacity factor. Actual generation may vary from the signed amounts \nbased on changes during construction or project terminations.",
      " for grid regions with Google-owned and -operated data  \ncenters64 \n32\n\nEnergy for our \nsupply chain",
      " that use technology and data, especially AI and machine learning, to support the creation of free, \n\n that use technology and data, especially AI and machine learning, to support the creation of free, \nopen-sourced tools and datasets for the global community. As of the end of 2024, we\u2019ve provided more than $75 million to social impact organizations \nfor projects that use AI to build a more sustainable world, primarily through the Google.org Impact Challenge on Climate Innovation, AI for the Global  \nGoals, and the Google.org Accelerator: Generative AI, as well as through other funding initiatives and opportunities. We\u2019re also supporting AI for scientific \nbreakthroughs through the Google.org AI and Science Fund, which will provide $20 million in funding to support academic and nonprofit organizations \naround the world using AI to address complex problems at the intersections of different disciplines of science. \nCollaborating with others ",
      "ng to smarter shipping routes. \nAssembly in progress in a warehouse. \n53\n\nNew AI research \nsolutions",
      "improvements and achieves comparable quality to Gemini 1.0 Ultra while using less compute.\u200936 \nTPUs \n\nimprovements and achieves comparable quality to Gemini 1.0 Ultra while using less compute.\u200936 \nTPUs \nFor a decade, Google\u2019s AI innovations have been powered by a range of AI accelerator options, including \nour own custom-built TPUs (Tensor Processing Units). They\u2019ve come a long way since their first generation \nin 2015, evolving each generation to deliver better performance while improving their carbon compute \nefficiency. In early 2025, we continued this trend by building even more powerful TPUs, ensuring that our AI \nsystems keep pushing forward\u2014faster, smarter, and more efficient. \nWhen it comes to powering AI, efficiency isn\u2019t just about performance\u2014it\u2019s about using less energy to \ndo more. Announced in April 2025, Ironwood, our seventh-generation TPU, is a game-changer. Built \nspecifically for inference, Ironwood performance per watt is double that of Trillium, our sixth-generation ",
      "ct emissions from data center construction \nDirect emissions from energy use Legend \nInfrastructure \n\nct emissions from data center construction \nDirect emissions from energy use Legend \nInfrastructure \nTo help minimize our environmental footprint, we\u2019ve built world-leading efficient infrastructure for the AI era. But  \nwe\u2019re taking it a step further by using AI itself to directly enhance the efficiency of our data center infrastructure.  \nFor example, we announced AlphaEvolve, an evolutionary coding agent powered by large language models  \nfor general-purpose algorithm discovery and optimization. AlphaEvolve enhanced the efficiency of our data  \ncenters, chip design, and AI training processes\u2014including training the large language models underlying  \nAlphaEvolve itself. \nIn fact, one of AlphaEvolve\u2019s solutions to help orchestrate Google\u2019s data centers more efficiently \ncontinuously recovers, on average, 0.7% of Google\u2019s worldwide compute resources. \u200945 This sustained  \nefficiency gain means that at any given moment, more tasks can be completed on the same computational \nfootprint. \n15",
      "mate and ESG data , produce  \naudit-ready metrics for reporting, and drive real decarbonization. \n91\n\n\u2022  Optimize: We help organizations work more efficiently by using AI to streamline energy and resource usage across their operations \nand supply chains. For example, Google Cloud, in partnership with NGIS (and their solution TraceMark ), is helping brands gain a deeper  \nunderstanding of  sustainable sourcing practices  across supplier networks . By combining the power of our cloud computing, AI, and \ngeospatial analytics, we\u2019re helping companies get real-time, global, reliable information into operations at a local supplier level. \n\u2022  Grow: We help organizations adapt their business by using AI to uncover new growth opportunities in the low-carbon transition. For example, \nwe launched  SpatiaFi with our Cloud partner Climate Engine\u2014an Earth Finance Company\u2014to help the banking sector harness the power of \ngeospatial analytics to support climate finance. ",
      " devastation and the critical chance to save lives. \n70\n\nProtecting the planet \nwith our AI products",
      "apable and energy efficient TPU yet, designed to power thinking, inferential AI models at scale. \n37",
      "analytical and predictive capabilities of AI could help untangle  \nthese complexities. \n9\n\nAge of AI",
      "ier, faster, and smarter\u2014and it\u2019s working. \n13 \nVisual of potential solar capacity in the Solar API.\n\nAI efficiency gains \nImprovements across models, TPUs, and infrastructure \nAs a company, we consider it an imperative to pursue AI responsibly\u2014to innovate and deliver widely \naccessible benefits to people and society, while mitigating environmental impacts. We\u2019ll continue to \noptimize our models and hardware, pursue infrastructure efficiencies, and procure clean energy to minimize \nthe overall impact and resource demands of AI. \nModels \nGoogle has long been at the forefront of AI and machine learning, evolving years of deep learning research \ninto techniques that make training faster and more efficient\u2014enabling models that are higher quality, faster, \nand less compute-intensive to serve. \nWe\u2019ve sped up AI model training through techniques like quantization, boosting large-language model  \ntraining efficiency by 39% on Cloud TPU v5e .\n\u200935 Gemini 2.5 Flash is our first fully hybrid reasoning model , "
    ]
  },
  {
    "question": "Out of the 112 global water stewardship projects spanning 68 watersheds in 2024, how many were categorized under \"Water supply reliability\"?",
    "ground_truth": "42.",
    "answer": "42",
    "contexts": [
      "sanitation, & hygiene (WASH) 9 \nAquatic habitat restoration 24 \nWater quality 16 \nTotal projects 112",
      "ta centers \nCapacity of all contracted water replenishment \nprojects once fully implemented \nTrend  \n\nta centers \nCapacity of all contracted water replenishment \nprojects once fully implemented \nTrend  \nOur water stewardship projects replenished approximately 4.5 billion \ngallons of water (17 billion liters or 17 million cubic meters) in 2024 \nalone, increasing replenishment of our freshwater consumption from \n18% in 2023 to 64% in 2024.\n136  This was the result of both the continued \nsuccess of our existing projects and the implementation of new projects \nthat have further expanded our replenishment portfolio. \nDetails  \nWe set this ambition in 2021, and it covers water that\u2019s replenished as \na percentage of the amount of freshwater we consume each year at \nour offices and data centers (i.e., excluding seawater and reclaimed \nwastewater). We count replenishment benefits from projects that are \nactive within the watersheds that our operations rely on and that have \nconfirmed volumetric benefits from the reporting year. \n86",
      "13 21 29 44 \nComponents resold into the secondary market Million components 8.2 4.9 5.0 7.0 6.7 \n109\n\nWater \nGlobal \noperational Unit 2020 2021 2022 2023 2024 \nwater use \nMillion  Water  withdrawal 5,689 6,297 7,600 8,653 11,011 gallons \n   \n   \nMillion  Water dischar\nge 1,940 1,735 2,035 2,301 2,876 gallons \nWater  Million  3,749 4,562 5,565 6,352 8,135 consumption gallons \nFreshwater withdrawal from sources  \n\u2009163 Unit 2024 at risk of water depletion or scarcity\nLow risk of water depletion or scarcity % 72 \nMedium risk of water depletion or scarcity % 14 \nHigh risk of water depletion or scarcity % 14 \n2024 \nWater use by Water Water  W\nater data centers Unit withdrawal discharge consumption and offices \nMillion  Data centers 9,866 2,079 7,787 gallons \nOffices and Million  1,145 797 348 other facilities gallons \nMillion  Total 11,011 2,876 8,135 gallons \nFreshwater replenishment Unit 2022 2023 2024 \nFreshwater consumption Million gallons 4,770 5,601 7, 210 \nWater replenished Million gallons 271 1,036 4,590 \nWater replenished % 6 18 64 ",
      "pact by rigorously assessing factors like additionality, leakage, permanence, and verifiability. \n85\n\nWater and waste \nBeyond climate, we\u2019ve also set ambitions across other operational areas like water and waste. Many of the challenges and uncertainties described above \nalso relate to these ambitions, particularly for water replenishment and data center Zero Waste to Landfill, which are both connected to our data center \ncapacity delivery. \nWater replenishment \nWe aim to replenish 120% of the freshwater volume we consume, on average, across our offices and data \ncenters by 2030. \nIn 2024, our water stewardship projects replenished approximately 4.5 billion gallons of water (17 billion liters or 17 million cubic meters), or \nroughly 64% of our freshwater consumption. 135 \nGraph \nMillion gallons \n7 ,500 \n5,000 \n2,500 \n0 \n6% \n18% \n64% \n2022 2023 2024 \nLegend \nYear \nEstimated water replenished Total freshwater consumption for offices and \nGoogle-owned and -operated data centers \nCapacity of all contracted water replenishment \nprojects once fully implemented \nTrend  ",
      "also support watershed health by \nimproving water quality, biodiversity, and community co-benefits. \n\nalso support watershed health by \nimproving water quality, biodiversity, and community co-benefits. \nFigure 7. Global water stewardship project map as of the end of 2024 \n42 \nLegend \nProject category Total \nLand conservation & restoration 21 \nWater supply reliability 42 \nWater, sanitation, & hygiene (WASH) 9 \nAquatic habitat restoration 24 \nWater quality 16 \nTotal projects 112",
      "ee to five years to evaluate water risks that may require mitigation. We also use this framework to \n\nee to five years to evaluate water risks that may require mitigation. We also use this framework to \ninform our water replenishment efforts, by prioritizing replenishment in locations with higher risk. \nTo identify and assess water-related risks in our supply chain, we\u2019ve conducted a supply chain water use analysis and a supplier risk assessment using WRI\u2019s \nAqueduct Water Risk Atlas, WWF\u2019s Water Risk Filter, and WULCA AWARE. The key risks identified included baseline water stress, flood risk, access to safe \ndrinking water, and the level of sanitation and hygiene services. \n89",
      " \nA rainwater retention pond outside one of our data centers in \nthe Lowcountry, South Carolina. \n41\n\nReplenishing water \nA local approach to water stewardship \nWater stewardship isn\u2019t just about managing our consumption. It\u2019s also about ensuring that we give back \nmore than we take\u2014especially in regions that have a higher risk of water scarcity or depletion. That\u2019s why \nour water replenishment strategy focuses not only on replenishing more water than we consume, but also  \non improving water quality and ecosystem health in the communities where we operate. \nIn 2024, our water stewardship projects replenished approximately 4.5 billion gallons of water (17 \nbillion liters or 17 million cubic meters), roughly  64% of our 2024 freshwater consumption.\n\u200968  We added \n38 new water stewardship projects, increasing our total portfolio to 112 projects spanning 68 watersheds in \n2024 (Figure 7). Many of these projects go beyond replenishing water to also support watershed health by \nimproving water quality, biodiversity, and community co-benefits. "
    ]
  },
  {
    "question": "What is the specific carbon intensity metric per megawatt-hour (MWh) of energy consumed by Google in 2024?",
    "ground_truth": "0.0957 tCO2e / MWh.",
    "answer": "0.0957 tCO2e / MWh",
    "contexts": [
      "nce procedures. For more details, refer to our 2025 (FY2024) Independent Accountants\u2019 Review Report.\n\nCarbon intensity Unit 2020 2021 2022 2023 2024 \nCarbon intensity per unit of revenue tCO e/million USD ($) 5.30 7.33 9.13 11.40 8.95 2\nCarbon intensity per full-time employee (FTE) equivalent tCO e/FTE 7.62 13.00 14.76 19.02 17.33 2\nCarbon intensity per megawatt-hour of energy consumed tCO e/MWh 0.0624 0.1012 0.1155 0.1352 0.0957 2\n2024 \nGHG \nemissions \nby type \nUnit Scope 1 \nScope 2 \n(market-\nbased) \nScope 2 \n(locat\nion-\nbased) \nCO tCO e 50,700  3,027,400 11,207,600 2 2\nCH4 tCO2e 100 4,200 22,300 \nN2O tCO2e 200 8,500 34,300 \nHFCs tCO e 22,100 19,000 19,000 2\nTotal tCO2e 73,100 3,059,100 11,283,200 \nCO tCO2 2 \nCH tCH4 4 \nN O tN O 2 2\nHFCs tHFCs \n2024 \nGHG \nemissions \nby region \nUnit Scope 1 \nScope 2 \n(market-\nbased) \nScope 2 \n(location-\nbased) \nNorth tCO2e 53,600 1,161,200 8,293,200 America \nEurope, \nMiddle  tCO2e 8,800 82,700 1,033,800 East, & \nAfrica \nLatin tCO\n2e 1,900 13,900 147,100 America \nAsia Pacific tCO2e 8,800 1,801,300 1,809,100 ",
      " we used a \none month sample of observed machine power data from our entire TPU fleet, applying \n116\n\nGoogle\u2019s 2023 average fleetwide carbon intensity. To estimate embodied emissions from \nmanufacturing, transportation, and retirement, we performed a life-cycle assessment \nof the hardware. Data center construction emissions were estimated based on Google\u2019s \ndisclosed 2023 carbon footprint. These findings do not represent model-level emissions, \nnor are they a complete quantification of Google\u2019s AI emissions. Based on the TPU \nlocation of a specific workload, Compute Carbon Intensity (CCI) results of specific \nworkloads may vary.\n45 The figure represents the average percentage of Google\u2019s global compute resources that \nwere identified as recoverable and reallocated for more efficient use over this period as a \nresult of using AlphaEvolve.\n46 We estimated the expected annual generation based on our contracted clean energy, \napplying an average capacity factor. Actual generation may vary from the signed amounts \nbased on changes during construction or project terminations.",
      "agement and partnership \n98 Environmental data \n115 Certifications and recognitions \n116 Endnotes \n3\n\nIntroduction \nForeword \nAt Google, we\u2019re applying AI to transform how people engage with information across our core products and  \nplatforms, to enhance business and economic growth, to enable  scientific  breakthroughs, and to drive sustainable  \ninnovation for society. We\u2019re proud to release our tenth annual Environmental Report, which details how we\u2019re  \nworking to address the increased energy demands of AI to enable this positive impact, while also showcasing  \nhow AI can be used to build a more energy-efficient and resilient world. These three topics\u2014energy, AI, and  \nresilience\u2014are the key themes of this year\u2019s report. Within these pages, we detail our 2024 progress, offering  \nour perspective and insights from a year marked by unprecedented global change driven by AI, energy  \ndemand, policy, and more. \nEnergy \nWe reduced our data center energy emissions by  \n12%, even with growing energy demands. \n  \n \n \n \n \n \n \n \n \n \n \n \n \n \n  \n \n ",
      "Category 3: Fuel- and \nenergy-related activities [not \nincluded in scope 1 or scope 2]) \n6 \n714,000 \n\nCategory 3: Fuel- and \nenergy-related activities [not \nincluded in scope 1 or scope 2]) \n6 \n714,000 \nScope 3 (Category 4: Upstream \ntransportation and distribution) \n6 853,000 \nScope 3 (Category 5: Waste \ngenerated in operations) \n6 12,000 \nScope 3 (Category 6: Business \ntravel) 6 399,000 \nScope 3 (Category 7: Employee \ncommuting) \n6 137,000 \nScope 3 (total) 12,053,000 \nCarbon Intensity \nCarbon intensity per unit of \nrevenue \n7 8.95 tCO2e / million USD \n($) GRI Disclosure 305-4: GHG emissions intensity \nThese metrics are calculated using Scope 1 and Scope 2 market-\nbased GHG emissions. The GHGs included in these metrics are \nCO2, CH4, N2O, and HFCs. \nCarbon intensity per full-time \nequivalent employee (FTE) 7, 8 17.33 tCO2e / FTE \nCarbon intensity per MWh of \nenergy consumed 9 0.0957 tCO2e / MWh \n1 References to Alphabet Inc. includes its subsidiaries (collectively, Alphabet). \n2 All metrics are reported for the period January 1, 2024 through December 31, 2024. ",
      " and offices, we increased \nour Google CFE percentage from 64% in 2022 and 2023 to 66% in 2024\n117\u2014 \n\n and offices, we increased \nour Google CFE percentage from 64% in 2022 and 2023 to 66% in 2024\n117\u2014 \ndespite significant growth in electricity demand over this period (which was \ndriven, in part, by AI). This was a result of increases in Contracted CFE and \noverall increases in global Grid CFE, specifically in North America where our \nenergy consumption is highest. \nOverall, we increased our Google CFE in over half of our grid regions that \ncontain Google-owned and -operated data centers, and achieved at least \n80% CFE in nine out of 20 of these grid regions in 2024. \nDetails  \nWe set this ambition in 2020. The load-weighted average of carbon-free \nenergy percentages across Google\u2019s global portfolio of data centers and \noffices is referred to as \u201cGoogle CFE.\u201d This metric is inclusive of third-party \ndata centers, and it represents the clean energy purchased to meet our \nelectricity needs at every hour of every day, and within every grid where we ",
      "iled \ninformation on our operations, our products, and our progress. We invite you to learn more. \n6\n\n2024 highlights \nThis section provides a snapshot of our highlights as of the end of 2024 and select highlights from the first \nhalf of 2025. \nReduced data center energy  \nemissions by 12% \nWe reduced our data center energy emissions by  \n12%, compared to 2023. We achieved this important \naccomplishment despite a 27% increase in our  \nelectricity consumption, demonstrating that our  \noperational decarbonization efforts are bearing fruit. \nThe Google solar field at our data center \nin St. Ghislain, Belgium. \nProcured over 8 GW of clean \nenergy \nWe signed contracts to purchase over 8 gigawatts \n(GW) of additional clean energy generation \u200923\u2014more \nthan in any prior year. \nDelfzijl wind farm in the Netherlands \n(63 MW for Google). \nPartnered to enable 1 GW of solar \nin Taiwan \nWe announced a partnership  with BlackRock\u2019s \nClimate Infrastructure business that will enable 1 GW  \nof new solar energy in Taiwan, advancing clean \nenergy for both the local electricity grid and our  ",
      " 2024, we continued to navigate a complex global energy landscape. We achieved significant progress \n\n 2024, we continued to navigate a complex global energy landscape. We achieved significant progress \nby increasing our global  carbon-free energy percentage across our data centers and offices to 66% . \n\u200961  \nThis 2% increase compared to last year is particularly noteworthy given the 27% increase in our electricity \nconsumption to support our growing business, including AI. While this global average reflects strong \nprogress, our journey varied by region. In Asia Pacific, for instance, our regional average Google CFE was \n12%\u2014well below that of other regions, like 70% in North America and 92% in Latin America.\n\u200962 In response, \nwe\u2019re  advancing new paths for clean energy in Asia Pacific specifically, like solar aggregation and piloting \ninvestments in new clean energy projects. \nThis regional variability is a reminder of what makes 24/7 CFE so powerful, and so complex: it doesn\u2019t hide \nthe gaps. It shines a light on them. \nAccelerating new tools like T-EACs ",
      "2024 \nSolar API \nFuel-efficient routing \nGoogle Earth Pro \nNest thermostats Green Light \nLegend \n56 \n\n2024 \nSolar API \nFuel-efficient routing \nGoogle Earth Pro \nNest thermostats Green Light \nLegend \n56 \nRead more about the role each of these products  \nplayed in 2024 below: \n\u2022 Fuel-efficient routing: In 2024, we\nestimate that fuel-efficient routing enabled\nmore than 2.7 million metric tons of GHG\nemissions reductions\n\u200984\u2014equivalent to taking\napproximately 630,000 gasoline-powered  \ncars off the road for a year.\u200985 Want to dive\ndeeper into how this product feature is making\na tangible difference for drivers and the\nplanet? Explore the full story in  Fuel-efficient \nrouting: Driving smarter while saving more .\n-\nFuel-efficient routing",
      "om 2019\u20132024.\n8 These calculations are based on internal data, as of March 2025. Google\u2019s TPU power \n\nom 2019\u20132024.\n8 These calculations are based on internal data, as of March 2025. Google\u2019s TPU power \nefficiency relative to the earliest generation Cloud TPU v2 is measured by peak FP8 flops \ndelivered per watt of thermal design power per chip package.\n9 When we use the term \u201csupply chain\u201d or \u201csupply chain emissions,\u201d we're referring to \nthe indirect emissions that happen outside of our direct operations. This includes both \nupstream and downstream emissions, also referred to as \u201cvalue chain emissions.\u201d\n10 The Google Clean Energy Addendum applies to the electricity consumed by suppliers in \nthe manufacturing of Google technical infrastructure and consumer hardware products. \n11 To estimate aggregate enabled emissions reductions, we first estimated annual \nreductions for five products individually (Google Earth Pro, Solar API, Nest thermostats, \nfuel-efficient routing, and Green Light) and then combined the totals. For details ",
      "ica MWh 500, 400 411,900 \nAsia Pacific MWh 3,494,300 14,300 \nGlobal total MWh 32,179,900 23,995,800 \n\nica MWh 500, 400 411,900 \nAsia Pacific MWh 3,494,300 14,300 \nGlobal total MWh 32,179,900 23,995,800 \nNote: In 2024, we recalculated certain previously reported energy consumption and global average carbon-free energy metrics in accordance with our internal recalculation policy for improved  \naccuracy. For more details, refer to the  Recalculation of previous environmental metrics  section. \n25,307,000",
      "s. To learn more, refer to our \ndata center locations and our office  locations. \nAbout this report \n\ns. To learn more, refer to our \ndata center locations and our office  locations. \nAbout this report \nGoogle\u2019s 2025 Environmental Report highlights how our technologies\u2014including cutting-edge AI and emerging research\u2014are driving progress for both \npeople and the planet. Throughout this report, we use the term \u201csustainability\u201d to refer to environmental sustainability. This report features data from our \n2024 fiscal year (January 1 to December 31, 2024), and mentions some notable achievements from 2025 to date. \nAdditional resources \n\u2022 Explore our 2025 Environmental Report\n\u2022 Sustainability.google\n\u2022 Sustainability reports\n\u2022 Sustainability blog \n\u2022 About Google \n\u2022 Google\u2019s commitments \n\u2022 Alphabet additional information: Environmental \n\u2022 Alphabet SASB and TCFD Index \n77",
      "Environmental \nReport \n2025",
      "nsumption metrics\u2014including purchased steam, purchased cooling, and total energy consumption\u2014due to \n\nnsumption metrics\u2014including purchased steam, purchased cooling, and total energy consumption\u2014due to \nthe correction of a calculation error. \n\u2022  We recalculated our 2020 \u201cTotal electricity consumption\u201d metric to source more accurate energy data. \n\u2022  We recalculated our 2021 \u201cCFE across Google data centers (hourly)\u201d metric to include CFE data from third-party data center consumption. \nCFE data from third-party data centers was already included in our previously reported 2022 and 2023 metrics. \n\u2022  We recalculated 2019\u20132023 waste metrics\u2014including data center waste diversion rate, total waste generated, and total waste diversion rate\u2014 \ndue to data improvements for data center recycled e-waste and packaging and refinement of the metric boundary to exclude low quality data \nfrom warehouses and third-party data centers. \nDefinition of key terms \n\u2022  Business-as-usual (BAU) emissions  represent our projected emissions without new carbon reduction efforts. Our BAU emissions forecast ",
      "sed) emissions. We round reported carbon intensity per unit of revenue and per full-time equivalent \n\nsed) emissions. We round reported carbon intensity per unit of revenue and per full-time equivalent \n(FTE) employee values to the nearest hundredth, and reported carbon intensity per megawatt-hour (MWh) of energy consumed values to the nearest ten \nthousandth. \nCarbon removal credits \nIn 2024, we did not apply any carbon removal credits to our emissions inventory. We plan to begin applying these credits in 2030. When we do, we\u2019ll provide \ndetailed information about our methodology. In the meantime, we\u2019ve reported our total procurement to date for transparency. \nEnergy and electricity \nWe calculate total energy consumption  as defined by GRI Disclosure 302-1e-f. Total energy consumption includes all fuel and natural gas consumption; \npurchased electricity, steam, heating, cooling; and all electricity generated on-site from carbon-free energy technologies. We round reported energy \nconsumption metrics to the nearest hundred. "
    ]
  },
  {
    "question": "According to the \"GHG emissions by region\" table, what were the exact Scope 2 (market-based) emissions for the Asia Pacific region in 2024?",
    "ground_truth": "1,801,300 tCO2e.",
    "answer": "1,801,300",
    "contexts": [
      "Factors for Greenhouse Gas Inventories, the 2024 Climate Registry Default Emission Factors, and the \n\nFactors for Greenhouse Gas Inventories, the 2024 Climate Registry Default Emission Factors, and the \n2024 Department for Environment, Food and Rural Affairs (DEFRA) UK Government GHG Conversion Factors. \nScope 2 emissions \nScope 2 emissions are indirect emissions from purchased electricity; natural gas use and refrigerant leakage in our leased offices; and purchased steam, \nhot water, and chilled water from district energy systems. We report scope 2 emissions using both location-based and market-based methods. The \nlocation-based method  reflects the average carbon intensity of the electric grids where our operations are located and thus where our electricity \nconsumption occurs. The market-based method  incorporates our procurement choices, primarily our renewable energy purchases via contractual \ninstruments, such as power purchase agreements (PPAs). ",
      "nt that are within the boundaries we\u2019ve set for our climate ambitions. The boundary of our ambition-\n\nnt that are within the boundaries we\u2019ve set for our climate ambitions. The boundary of our ambition-\nbased emissions, and how we measure and report progress, doesn\u2019t affect the completeness of our total emissions inventory, which is presented in our \nEnvironmental metrics data table. \nIn 2024, our total ambition-based emissions were approximately 11.5 million tCO\n2e, which represent our scope 1, scope 2 (market-based), and \nscope 3 (ambition-based) emissions. \nFigure 13. Our 2024 ambition-based carbon footprint \n \nScope \nLegend \nScope 1 \nScope 2 (market-based) \nScope 3 (Category 1: Purchased goods and services) \nScope 3 (Category 2: Capital goods) and \n(Category 11: Use of sold products) \nScope 3 (Category 3: Fuel- and energy-related activities) \nScope 3 (Category 4: Upstream transportation \nand distribution) \nScope 3 (Category 5: Waste generated in operations) \nScope 3 (Category 6: Business travel) \nScope 3 (Category 7: Employee commuting) \nTotal ambition-based emissions \n73,100 ",
      " our scope 1 emissions were approximately 73,100 tCO2e, representing less than 1% of our total 2024 \n\n our scope 1 emissions were approximately 73,100 tCO2e, representing less than 1% of our total 2024 \nambition-based carbon footprint. \nCompared to 2023, we reduced our scope 1 emissions by 8% , primarily due to building efficiencies and warmer weather conditions that resulted in \ndecreases in natural gas, changes to generator utilization that resulted in decreases in diesel and other fuel usage, and improvements to refrigerant data \nquality. Our scope 1 emissions reduction efforts to date have focused on electrification, refrigerant mitigation, and renewable fuel use. \nScope 2 \nThe primary source of our scope 2 emissions is purchased electricity for our data centers and offices. In 2024, our scope 2 (market-based) emissions were \napproximately 3.1 million tCO\n2e, representing 26% of our total 2024 ambition-based carbon footprint. \nCompared to 2023, we reduced our scope 2 (market-based) emissions by 11% , primarily due to clean energy procurement. For scope 2 emissions ",
      " in double counting between \nelectricity consumers. \nAlphabet\u2019s Schedule of GHG Emissions by Region \n\n in double counting between \nelectricity consumers. \nAlphabet\u2019s Schedule of GHG Emissions by Region \nFor the Year Ended December 31  2024 \n(tCO2e) \nGHG emissions by region Scope 1 Scope 2 (market-based) Scope 2 (location-based) \nNorth America 53,600 1,161,200 8,293,200 \nEurope, Middle East, & Africa 8,800 82,700 1,033,800 \nLatin America 1,900 13,900 147,100 \nAsia Pacific 8,800 1,801,300 1,809,100 \nGlobal total 73,100 3,059,100 11,283,200 \n \n   \n   \n \n \n \n \n   \n \n  \n  \n    \n        \n \n \n   \n     \n \n  \n \n,\n,\n)\nAlphabet\u2019s Schedule of GHG Emissions by Type \nFor the Year Ended December 31  2024 \n(tCO2e) \nGHG emissions by type Scope 1 Scope 2 (market-based) Scope 2 (location-based) \nCO2 50,700 3,027,400 11,207,600 \nCH4 100 4,200 22,300 \nN2O 200 8,500 34,300 \nHFCs 22,100 19,000 19,000 \nTotal 73,100 3,059,100 11,283,200 \nAlphabet\u2019s Schedule of GHG Emissions by Type \nFor the Year Ended December 31  2024 \n(metric tons per gas type \nGHG emissions by type \nCH4 \nScope 1 \n5 \nScope 2 (market-based) ",
      " goods) and (Category 11: Use of sold products) \nScope 3 (Category 1: Purchased goods and services) \n\n goods) and (Category 11: Use of sold products) \nScope 3 (Category 1: Purchased goods and services) \nScope 2 (market-based) \nScope 1 \ntCO2e \n292,000 \n1,914,000 \n203,000 \n461,000 \n14,000 \n476,000 \n425,000 \n4,292,000 \n873,000 \n835,900 \n81,900 \nTotal 2019 ambition-based emissions 7,661,800 \nTrend \nIn 2024, our total ambition-based emissions were 11.5 million tCO2e, representing an 11% year-on-year increase and a 51% increase compared to our 2019 \nbase year\u2014primarily driven by increases in supply chain emissions. \nThe year-on-year increase was slightly offset in that we reduced our scope 1 and scope 2 (market-based) emissions by 8% and 11%, respectively\u2014 \ndemonstrating that our operational decarbonization efforts are bearing fruit. This achievement is particularly significant given the 27% increase in our \nelectricity consumption compared to 2023. \nDetails \nScience Based Targets initiative (SBTi) validation: ",
      "date. Any future update will be provided only through a public disclosure indicating that fact. \n104\n\nEnvironmental metrics data tables \nGreenhouse gas emissions \nGreenhouse gas emissions inventory Unit 2019 2020 2021 2022 2023 2024 \nScope 1 tCO e 81,900 55,800 64,100 91,200 79,400 73,100 2\nScope 2 \nScope 2 (location-based) tCO2e 5,116,900 5,865,100 6,576,200 8,045,400 9,252,900 11,283,200 \nScope 2 (market-based) tCO e 835,900 911,600 1,823,500 2,492,100 3,423,400 3,059,100 2\nTotal operational (scope 1 +  \nmarket-based scope 2) emissions tCO2e 917,800 967,400 1,887,600 2,583,300 3,502,800 3,132,200 \nScope 3 \nScope 3 (Category 1: Purchased goods and services) tCO2e 2,787,000 2,404,000 2,886,000 3,504,000 3,951,000 3,601,000 \n2\n2\n105 \nScope 3 (Category 2: Capital goods) and  \n(Category 11: Use of sold products) \u2009148  tCO2e 4,584,000 4,176,000 4,462,000 3,886,000 4,583,000 6,337,000 \nScope 3 (Category 3: Fuel- and energy-related activities   \n[not included in scope 1 or scope 2] ) t CO2e 425,000 512,000 753,000 1,004,000 1,295,000 714,000 ",
      " 2024, we continued to navigate a complex global energy landscape. We achieved significant progress \n\n 2024, we continued to navigate a complex global energy landscape. We achieved significant progress \nby increasing our global  carbon-free energy percentage across our data centers and offices to 66% . \n\u200961  \nThis 2% increase compared to last year is particularly noteworthy given the 27% increase in our electricity \nconsumption to support our growing business, including AI. While this global average reflects strong \nprogress, our journey varied by region. In Asia Pacific, for instance, our regional average Google CFE was \n12%\u2014well below that of other regions, like 70% in North America and 92% in Latin America.\n\u200962 In response, \nwe\u2019re  advancing new paths for clean energy in Asia Pacific specifically, like solar aggregation and piloting \ninvestments in new clean energy projects. \nThis regional variability is a reminder of what makes 24/7 CFE so powerful, and so complex: it doesn\u2019t hide \nthe gaps. It shines a light on them. \nAccelerating new tools like T-EACs ",
      "31  2024 \n(metric tons per gas type \nGHG emissions by type \nCH4 \nScope 1 \n5 \nScope 2 (market-based) \n\n31  2024 \n(metric tons per gas type \nGHG emissions by type \nCH4 \nScope 1 \n5 \nScope 2 (market-based) \n100 \nScope 2 (location-based) \n800 \nN2O \nHFCs \n1 \n14 \n32 \n13 \n100 \n13 \nScope 3 GHG emissions \n\u201cScope 3 GHG emissions\u201d are indirect emissions from other sources in Alphabet\u2019s value chain. Alphabet calculates the reported values \nin the Schedule of Select Environmental Metrics using methodologies from the Scope 3 Technical Guidance for the following categories \nidentified as relevant: \n\u25cf Category 1: Purchased goods and services \n\u25cf Category 2: Capital goods \n\u25cf Category 3: Fuel- and energy-related activities (not included in scope 1 or scope 2) \n\u25cf Category 4: Upstream transportation and distribution \n\u25cf Category 5: Waste generated in operations \n\u25cf Category 6: Business travel \n\u25cf Category 7: Employee commuting \n\u25cf Category 11: Use of sold products \nAlphabet evaluated the remaining categories using the Scope 3 Standard\u2019s relevance criteria and determined the following categories to ",
      "ctors, the 2025 EPA eGRID Emission Factors, and the 2024 Climate Registry Default Emission Factors. \n\nctors, the 2025 EPA eGRID Emission Factors, and the 2024 Climate Registry Default Emission Factors. \nThe emission factors used to calculate scope 2 (market-based) emissions are the same as scope 2 (location-based) with the addition of \nemission factors specific to energy attribute certificates (EACs), as well as residual mix emission factors where available. Residual grid \nmix removes the proportion of renewable energy contracted to other parties\u2014that have the rights to claim those clean electricity attributes \nthrough EACs\u2014from the grid electricity mix, and therefore avoids double-counting. Comprehensive residual mix emission factors are \ncurrently only available for Europe (European Residual Mixes 2023, Association of Issuing Bodies). Outside of Europe, residual emission \nfactors aren\u2019t available from third-party sources to account for voluntary purchases, and this may result in double counting between \nelectricity consumers. \nAlphabet\u2019s Schedule of GHG Emissions by Region ",
      " (market-based) emissions by 11% , primarily due to clean energy procurement. For scope 2 emissions \n\n (market-based) emissions by 11% , primarily due to clean energy procurement. For scope 2 emissions \naccounting, clean energy purchases must be matched following GHG Protocol regional market boundaries. In 2024, we were successful in sourcing more \nclean energy from within the same regions as our data centers, specifically in North America. \nAs we have more control over our data centers and offices than many other parts of our value chain, scope 2 emissions are a key focus of our \ndecarbonization efforts. Our scope 2 emissions reduction efforts to date include energy management and clean energy procurement. Our path forward  \ndetails our forward-looking strategy for clean electricity for our data centers to further reduce scope 2 emissions. \n80"
    ]
  },
  {
    "question": "How many metric tons of carbon removal credits did Google purchase in 2024 through its 16 new offtake deals, and what did that bring the cumulative total portfolio to?",
    "ground_truth": "728,300 tCO2e of removal credits, bringing the cumulative total to 782,400 tCO2e.",
    "answer": "Google purchased approximately 728,300 tCO2e of removal credits through its 16 new offtake deals in 2024, bringing its cumulative total portfolio to approximately 782,400 tCO2e.",
    "contexts": [
      "n \nUnion and harnessing the emission-reducing potential of digital solutions for all other sectors. \n\nn \nUnion and harnessing the emission-reducing potential of digital solutions for all other sectors. \nExponential Roadmap Initiative  (ERI) In 2021, Google joined ERI and the UN Race to Zero Campaign , the largest ever alliance committed to halving emissions by 2030 and achieving net-zero \nemissions by no later than 2050. \nFrontier                     In 2022, Google co-founded Frontier, an advance market commitment that will accelerate the development of carbon removal technologies by guaranteeing\nfuture demand. As one of the founding members of this public benefit LLC, we aim to use Frontier as a catalyst for the most effective technologies in long-\nduration carbon removal. \n Global Covenant of Mayors for Google\u2019s Environmental Insights Explorer was developed in partnership with GCoM through a shared vision to support city climate action with useful and ",
      " & \nAfrica \nLatin tCO\n2e 1,900 13,900 147,100 America \nAsia Pacific tCO2e 8,800 1,801,300 1,809,100 \n\n & \nAfrica \nLatin tCO\n2e 1,900 13,900 147,100 America \nAsia Pacific tCO2e 8,800 1,801,300 1,809,100 \nGlobal  tCO2e 73,100 3,059,100 11,283,200 total \nCarbon removal credits\u2009150 \nProject type Company \nEstimated \ncontracted  \ncredits (tCO2e)\nProject   \nlocation \nYear deal  \nwas signed \nExpected \ntimeframe  \nfor delivery \nCredit type Market  \nc\nommitment \nBiomass carbon removal   \nand storage (BiCRS) \nVaraha 100,000 India 2024 2026\u20132030  Removal Bilateral \nCharm Industrial 100,000 United States 2024 2026\u20132030 Removal Bilateral \nCO280 61,226 United Sta\ntes 2 024 2028\u20132030 Removal Frontier \nStockholm Exergi 41,636 Sweden 2024 2028\u20132030 Removal Frontier \nCharm Industrial 22,635 United Stat es 2023 2025\u20132030 Removal Frontier \nVaulted Deep 18,786 United States 2024 2024\u20132027 Removal Frontier \nNULIFE 78 Canada 2024 2025 Removal Frontier \nDirect air capture (DAC) \nHolocene 100,000 United St\nates 2024 Early 2030\u2019s Removal Bilateral \n280 Earth 13,301 United States 2024 2026\u20132030 Removal Frontier ",
      "sed) emissions. We round reported carbon intensity per unit of revenue and per full-time equivalent \n\nsed) emissions. We round reported carbon intensity per unit of revenue and per full-time equivalent \n(FTE) employee values to the nearest hundredth, and reported carbon intensity per megawatt-hour (MWh) of energy consumed values to the nearest ten \nthousandth. \nCarbon removal credits \nIn 2024, we did not apply any carbon removal credits to our emissions inventory. We plan to begin applying these credits in 2030. When we do, we\u2019ll provide \ndetailed information about our methodology. In the meantime, we\u2019ve reported our total procurement to date for transparency. \nEnergy and electricity \nWe calculate total energy consumption  as defined by GRI Disclosure 302-1e-f. Total energy consumption includes all fuel and natural gas consumption; \npurchased electricity, steam, heating, cooling; and all electricity generated on-site from carbon-free energy technologies. We round reported energy \nconsumption metrics to the nearest hundred. ",
      " we used a \none month sample of observed machine power data from our entire TPU fleet, applying \n116\n\nGoogle\u2019s 2023 average fleetwide carbon intensity. To estimate embodied emissions from \nmanufacturing, transportation, and retirement, we performed a life-cycle assessment \nof the hardware. Data center construction emissions were estimated based on Google\u2019s \ndisclosed 2023 carbon footprint. These findings do not represent model-level emissions, \nnor are they a complete quantification of Google\u2019s AI emissions. Based on the TPU \nlocation of a specific workload, Compute Carbon Intensity (CCI) results of specific \nworkloads may vary.\n45 The figure represents the average percentage of Google\u2019s global compute resources that \nwere identified as recoverable and reallocated for more efficient use over this period as a \nresult of using AlphaEvolve.\n46 We estimated the expected annual generation based on our contracted clean energy, \napplying an average capacity factor. Actual generation may vary from the signed amounts \nbased on changes during construction or project terminations.",
      "e then, from 2010 to 2024, we\u2019ve signed more than 170 agreements to purchase over 22 GW of clean \nen\n\ne then, from 2010 to 2024, we\u2019ve signed more than 170 agreements to purchase over 22 GW of clean \nen\nergy generation,2 similar to Portugal\u2019s total renewable energy in 2024.3 In 2024 alone, Google signed \ncontracts to purchase over 8 GW of additional clean energy generation 4\u2014the largest annual total in our history \nand twice the volume we contracted for the prior year. We\u2019ve maintained a 100% renewable energy match on a \nglobal basis every year since 2017, 5 and are going even further by pursuing our 24/7 carbon-free energy (CFE) \nambition (one of our climate moonshots). In 2024, we increased our 24/7 CFE percentage from 64% to 66%, 6 \na\nnd nine out of 20 grid regions with Google-owned and -operated data centers achieved at least 80% CFE. \nW\ne innovated across hardware and software to enable our data centers to deliver six times more \ncomputing power per unit of electricity than they did just five years ago. ",
      " and offices, we increased \nour Google CFE percentage from 64% in 2022 and 2023 to 66% in 2024\n117\u2014 \n\n and offices, we increased \nour Google CFE percentage from 64% in 2022 and 2023 to 66% in 2024\n117\u2014 \ndespite significant growth in electricity demand over this period (which was \ndriven, in part, by AI). This was a result of increases in Contracted CFE and \noverall increases in global Grid CFE, specifically in North America where our \nenergy consumption is highest. \nOverall, we increased our Google CFE in over half of our grid regions that \ncontain Google-owned and -operated data centers, and achieved at least \n80% CFE in nine out of 20 of these grid regions in 2024. \nDetails  \nWe set this ambition in 2020. The load-weighted average of carbon-free \nenergy percentages across Google\u2019s global portfolio of data centers and \noffices is referred to as \u201cGoogle CFE.\u201d This metric is inclusive of third-party \ndata centers, and it represents the clean energy purchased to meet our \nelectricity needs at every hour of every day, and within every grid where we ",
      "e \u201cBase Case\u201d \nand up to 500 million tCO2e in the \u201cLift-Off Case\u201d in 2035. Therefore, the potential \n\ne \u201cBase Case\u201d \nand up to 500 million tCO2e in the \u201cLift-Off Case\u201d in 2035. Therefore, the potential \nemissions reductions from AI applications are approximately 3 times (1,400/500 = 2.8) to \n5 times (1,400/300 = 4.7) larger than the projected emissions from data centers.\n32 Refer to endnote 29 above.\n33 To estimate the lifetime emissions reductions enabled in 2024, Google counted the \nnumber of buildings that used the Solar API and had a solar permit issued shortly \nthereafter (based on publicly available permit data). We then used Berkeley Lab\u2019s Tracking \nthe Sun (open source NREL dataset) to estimate the average installation size per state, \nNREL PVWatts to provide insolation data, and the NREL Cambium model to estimate \nthe amount of emissions reduced by the energy generated due to those panels over a \n25-year estimated lifespan. Enabled emissions reductions estimates include inherent \nuncertainty due to factors that include the lack of primary data and precise information ",
      "ng transparent and comprehensive emissions reporting for our customers. \nCustomer carbon footprints \n\nng transparent and comprehensive emissions reporting for our customers. \nCustomer carbon footprints \nIn addition to equipping Cloud customers, we also provide tools to empower Google Workspace and Google Ads customers to measure, understand, and \nmanage the environmental impact of using our products: \n\u2022  Google  Workspace:  Our Google Workspace  carbon footprint report provides data on total and monthly carbon emissions based on the use \nof various Google Workspace applications. \n\u2022  Google  Ads: To help advertising customers measure their emissions from using Google advertising products, we now offer Carbon Footprint  \nfor Google Ads . This provides comprehensive carbon emissions reporting data aligned with the Greenhouse Gas Protocol and developed in \naccordance with the Global Media Sustainability Framework . The reports provide detailed breakouts  of scope 1, scope 2 (both market- and \nlocation-based), and scope 3 emissions\u2014allocated at the account level. \nResearchers and academics ",
      "2024 Early 2030\u2019s Removal Bilateral \n280 Earth 13,301 United States 2024 2026\u20132030 Removal Frontier \n\n2024 Early 2030\u2019s Removal Bilateral \n280 Earth 13,301 United States 2024 2026\u20132030 Removal Frontier \nEnhanced rock w\nea\nthering (ERW) \nTerradot 200,000 Brazil 2024 2029 \u20132030 Removal Bilateral \nLithos Carbon 31,514 United States 2023 2025\u20132029 Removal Frontier \nTerradot 17, 324 Brazil 2024 2025\u20132029 Removal Frontier \nCREW 12,851 United S tates 2024 2025\u20132030 Removal Frontier \nAlt Carbon 185 India 2024 2028 R emoval Frontier \nFlux 114 Kenya 2024 2026 Removal Frontier \nSilica 127 Mexico 2024 2030 Removal Frontier \nRestoring natural carbon sinks \nMombak 50,000 Brazi l 2024 2029\u20132030 Removal Bilateral \nCarbonRun 12,695 Canada 2024 2025\u20132029 Removal Frontier \nTotal 782,472 \nLegend Subject to third-party limited assurance procedures. For more details, refer to our 2025 (FY2024) Independent Accountants\u2019 Review Report. \n106 \n50,700 3,027,400 11,207,600 \n5 100 800 \n1 32 100 \n14 13 13",
      "epresents  \none of the most consequential environmental  \ncontributions we can make for the planet. \n\nepresents  \none of the most consequential environmental  \ncontributions we can make for the planet. \nWhile we still have a long way to go toward our  \n1 GT aspiration, we\u2019re motivated by our progress  \nto date and the opportunity for real-world \nimpact at scale: In 2024 alone, just five of our \nproducts\u2014Nest thermostats, Google Earth \nPro, Solar API, fuel-efficient routing in Google \nMaps, and Green Light (which represent only \na subset of our efforts)\u2014enabled individuals, \ncities, and other partners to collectively \nreduce an estimated 26 million metric tons of \nGHG emissions\n\u200981 (Figure 9), roughly equivalent to \nthe emissions from the annual energy use of over \n3.5 million U.S. homes.\n\u200982 For context, Google\u2019s  \ntotal emissions in 2024 were 11.5 million tCO e.\u200983 \n2 \nFigure 9. Emissions reductions enabled by  \nfive Google products in 2024 \n30 \n20 \n10 \n0 \nMillion tCO2e \nYear \n2024 \nSolar API \nFuel-efficient routing \nGoogle Earth Pro \nNest thermostats Green Light \nLegend \n56 ",
      "nge of projects and forging strategic partnerships that will help us achieve our net-zero ambition. \n\nnge of projects and forging strategic partnerships that will help us achieve our net-zero ambition. \nIn 2024, we significantly expanded our carbon removal portfolio, signing 16 new offtake deals representing over $100 million for a total of approximately \n728,300 tCO\n2e of removal credits. This brings our cumulative total portfolio to approximately 782,400 tCO2e\u2014a 14-fold increase from our 2023 removal \ncredits portfolio. For more details, refer to the Environmental metrics data tables section. \nA core component of this strategy is to play a meaningful role in advancing the development and deployment of a range of carbon removal solutions, which \nare vital for broader climate change mitigation efforts. \nWe prioritize two fundamental criteria when considering the climate impact of these efforts: scale and certainty. For scale, we consider whether the ",
      "mployees\u2019 business travel by exploring ways to make air travel less carbon-intensive and supporting \n\nmployees\u2019 business travel by exploring ways to make air travel less carbon-intensive and supporting \nthe production of SAF at scale. In 2023, Google joined the Avelia Sustainable Aviation Fuel program, which offers SAF credits to corporate customers. \nAdditionally, in 2024, Google joined the United Airlines Ventures Sustainable Flight Fund, a first-of-its-kind effort to provide catalytic investment to drive \nSAF production. And as a member of the Sustainable Aviation Buyers Alliance, we\u2019re also collaborating with other companies to drive SAF adoption. \nSuppliers \nThrough our Supplier Responsibility Program, we\u2019re working to build an energy-efficient, low-carbon, circular supply chain. We focus on the areas where we \ncan make an immediate and lasting impact, such as helping our suppliers improve their environmental performance. \nGoogle\u2019s Supplier Code of Conduct includes requirements that enable us to ensure that those we partner with are responsible environmental stewards. ",
      "tool\u2014it\u2019s a catalyst. It\u2019s helping people make smarter decisions faster, and its potential to help  \n\ntool\u2014it\u2019s a catalyst. It\u2019s helping people make smarter decisions faster, and its potential to help  \nmanage emissions in key sectors\u2014like transportation and energy\u2014is transformational. With this in mind, we\u2019ve  \nset an aspiration to help individuals, cities, and other partners collectively reduce 1 gigaton (GT) of their carbon  \nequivalent emissions annually by 2030. \nIn 2024 alone, just five of Google\u2019s products\u2014Nest thermostats, Google Earth Pro, Solar API, fuel-efficient \nrouting in Google Maps, and Green Light (which represent only a subset of our efforts)\u2014enabled others to  \ncollectively reduce an estimated 26 million metric tons of greenhouse gas emissions (tCO 2e),\u200911 roughly  \nequivalent to the emissions from the annual energy use of over 3.5 million U.S. homes. \u200912 For context,  \nGoogle\u2019s total emissions in 2024 were 11.5 million tCO e.\u200913 \n2 \nIn energy, three products enabled others to reduce approximately 24 million tCO 2e emissions. ",
      "generated in \n2024. The estimated annual emissions reduction takes into account projects enabled by \n\ngenerated in \n2024. The estimated annual emissions reduction takes into account projects enabled by \nGoogle Earth prior to 2024 (dating back to 2020) to calculate the total impact in 2024 \nalone. Enabled emissions reductions estimates include inherent uncertainty due to factors \nthat include the lack of primary data and precise information about real-world actions \nand their effects to date, as well as forward-looking projections. Google is relying on \nits own substantiation of the enabled emissions-reduction impact, in consultation with \nmultiple third-party partners that have reviewed and support the methodology discussed \nherein. The data and claims have not been verified by an independent third-party. We will \ncontinue to work to refine our methodologies and inputs for these estimates.\n90 Estimated energy savings are calculated based on the average percentages for heating \nand cooling savings found in real-world studies of the Nest Learning Thermostat in the "
    ]
  },
  {
    "question": "In the data center water use table, what was the total water withdrawn and consumed in 2024 for the St. Ghislain, Belgium data center?",
    "ground_truth": "511.7 million gallons were withdrawn, and 393.3 million gallons were consumed.",
    "answer": "511.7 million gallons withdrawn and 393.3 million gallons consumed",
    "contexts": [
      "ished and scale. \n23 \nSolar panels line up side-by-side at our data center in St. Ghislain, Belgium.",
      "center location is less than fifty thousand gallons, we round to the \nnearest ten thousand gallons. \n\ncenter location is less than fifty thousand gallons, we round to the \nnearest ten thousand gallons. \nWe calculate water consumption by subtracting water discharge from water withdrawal. \nWater withdrawal is based on actual metered or invoiced data when it\u2019s available. At offices where actual metered or invoiced data isn\u2019t available, we \nestimate water withdrawal using facility square footage and internally developed water withdrawal intensity factors by office type based on data from the \nreporting period. At data centers where actual data isn\u2019t available, we estimate water withdrawal using engineering principles. \nWater discharge is based on actual metered or invoiced data when it\u2019s available. Where actual domestic wastewater discharge data isn\u2019t available, we \napply an industry-standard 90% discharge flow factor to a facility\u2019s domestic water withdrawal to estimate domestic water discharge and a 0% discharge ",
      "n \nliters or 17 million cubic meters) in 2024 alone, \nroughly 64% of our freshwater consumption.\n\u200925\n\nn \nliters or 17 million cubic meters) in 2024 alone, \nroughly 64% of our freshwater consumption.\n\u200925\nMulti --benefit   floodplain   restoration  along  the  \nTuolumne and San Joaquin rivers in California. \nEnabled 26 million tCO2e \nemissions reductions through  \nfive  products \nFive of our products (Nest thermostats,  Google  \nEarth Pro, Solar API, fuel-efficient routing in Google \nMaps, and Green Light, which represent only a \nsubset of our efforts) enabled individuals, cities, \n \nand other partners to collectively reduce an \ne\nstimated 26 million metric tons of GHG emissions. \u200926 \nExpanded fuel-efficient routing \nworldwide \nAs of January 2025, fuel-efficient routing in Google \nMaps is available g lobally. \n-\nFuel-efficient routing in Google Maps.",
      "ta centers \nCapacity of all contracted water replenishment \nprojects once fully implemented \nTrend  \n\nta centers \nCapacity of all contracted water replenishment \nprojects once fully implemented \nTrend  \nOur water stewardship projects replenished approximately 4.5 billion \ngallons of water (17 billion liters or 17 million cubic meters) in 2024 \nalone, increasing replenishment of our freshwater consumption from \n18% in 2023 to 64% in 2024.\n136  This was the result of both the continued \nsuccess of our existing projects and the implementation of new projects \nthat have further expanded our replenishment portfolio. \nDetails  \nWe set this ambition in 2021, and it covers water that\u2019s replenished as \na percentage of the amount of freshwater we consume each year at \nour offices and data centers (i.e., excluding seawater and reclaimed \nwastewater). We count replenishment benefits from projects that are \nactive within the watersheds that our operations rely on and that have \nconfirmed volumetric benefits from the reporting year. \n86",
      "13 21 29 44 \nComponents resold into the secondary market Million components 8.2 4.9 5.0 7.0 6.7 \n109\n\nWater \nGlobal \noperational Unit 2020 2021 2022 2023 2024 \nwater use \nMillion  Water  withdrawal 5,689 6,297 7,600 8,653 11,011 gallons \n   \n   \nMillion  Water dischar\nge 1,940 1,735 2,035 2,301 2,876 gallons \nWater  Million  3,749 4,562 5,565 6,352 8,135 consumption gallons \nFreshwater withdrawal from sources  \n\u2009163 Unit 2024 at risk of water depletion or scarcity\nLow risk of water depletion or scarcity % 72 \nMedium risk of water depletion or scarcity % 14 \nHigh risk of water depletion or scarcity % 14 \n2024 \nWater use by Water Water  W\nater data centers Unit withdrawal discharge consumption and offices \nMillion  Data centers 9,866 2,079 7,787 gallons \nOffices and Million  1,145 797 348 other facilities gallons \nMillion  Total 11,011 2,876 8,135 gallons \nFreshwater replenishment Unit 2022 2023 2024 \nFreshwater consumption Million gallons 4,770 5,601 7, 210 \nWater replenished Million gallons 271 1,036 4,590 \nWater replenished % 6 18 64 ",
      "or more details, refer to the  Recalculation of previous environmental metrics  section. \n25,307,000\n\nRegional average Google CFE across Google data center grid regions Unit 2022 2023 2024 \nNorth America % 69 68 70 \nUnited States % 69 68 70 \nCanada & Mexico \u2009158 % 96 96 88 \nEurope, Middle East, & Africa % 76 83 83 \nEurope % 76 84 84 \nMiddle East & Africa % 3 4 5 \nLatin America % 90 91 92 \nAsia Pacific % 11 12 12 \nGlobal CFE across Google data centers % 64 64 66 \nData center grid region CFE\u2009159  2024 \nConsumed Country Regional grid Unit Google CFE Contracted CFE Grid CFE Grid CFE \nEurope, Middle East, & Africa \nBelgium Elia % 84 32 52 78 \nDe\nnmark Energinet % 91 35 56 88 \nFinland Fingrid % 98 73 25 94 \nGermany Germany % 68 8 60 66 \nIreland EirGr id % 47 5 42 44 \nNetherlands Tennet % 83 70 13 56 \nAsia Pacific \nJapan TEPCO Power Grid (TEPCO) % 17 17 17 \nSingapore Energy Market Authority of Singapore % 4 0 4 4 \nTaiwan Taiwan Power Company % 17 1 16 16 \nLatin America \nChile Sistema Interconectado Central % 92 79 13 67\nNorth America ",
      "r discharge\u201d from \u201cwater withdrawal.\u201d \nAlphabet\u2019s Schedule of Water Use by Data Centers and Offices \n\nr discharge\u201d from \u201cwater withdrawal.\u201d \nAlphabet\u2019s Schedule of Water Use by Data Centers and Offices \nFor the Year Ended December 31  2024 \n(mil ion gallons \nWater use by data centers and offices Withdrawal Discharge Consumption \nData centers 9,866 2,079 7,787 \nOffice and other facilities 1,145 797 348 \nTotal 11,011 2,876 8,135 \n \n \n   \n,\nl\nAlphabet\u2019s Schedule of Water Use by Data Center Location \nFor the Year Ended December 31  2024 \n(mil ion gallons)18 \nLocation Withdrawal Discharge Consumption \nAshburn, VA 59.5 3.5 56.0 \nBerkeley County, SC 853.8 77.3 776.5 \nBristow, VA 105.7 21.3 84.4 \nCouncil Bluffs, IA 1,410.3 400.1 1,010.2 \nThe Dalles, OR 461.1 99.7 361.4 \nDouglas County, GA 444.1 77.2 366.9 \nDublin, Ireland 0.9 0.8 0.1 \nEemshaven, Netherlands 416.9 86.9 330.0 \nFrankfurt, Germany 2.3 1.8 0.5 \nFredericia, Denmark 48.4 10.6 37.8 \nHamina, Finland 3.0 2.7 0.3 \nHanau, Germany 1.2 0.6 0.6 \nHenderson, NV 359.9 152.5 207.4 \nInzai, Japan 26.0 7.8 18.2 \nJackson County, AL 201.6 18.8 182.8 ",
      "Gmail, Drive, Docs, and more), Google Cloud, Search, and YouTube for billions of people around the  \n\nGmail, Drive, Docs, and more), Google Cloud, Search, and YouTube for billions of people around the  \nworld. And as we grow to serve more users globally, building new data center infrastructure is essential. \nTo operate smoothly, these facilities rely on cooling systems that frequently use water due to its energy  \nefficiency. This dependency highlights a critical balance between technological needs and responsible  \nenvironmental stewardship. In 2024, we consumed a total of approximately 8.1 billion gallons (31 billion liters \nor 31 million cubic meters) of water across our data centers (excluding those operated by third parties)  \nand offices. To put that consumption into perspective, that\u2019s about what it takes to irrigate 54 golf courses  \nannually, on average, in the southwestern United States.\n\u200966 Crucially, the majority of this consumption occurred \nin regions where water resources are abundant:  in 2024, 72% of our freshwater withdrawals came from  ",
      "rocedures. For more details, refer to our 2025 (FY2024) Independent Accountants\u2019 Review Report. \n110\n\nLegend Subject to third-party limited assurance procedures. For more details, refer to our 2025 (FY2024) Independent Accountants\u2019 Review Report. \nWater use by data center location \nLocation Unit \n2024 \nWithdrawal\u2009169 Discharge Consumption \nGolf course  \nequivalents \n(estimated)\u2009170 \nOmaha, NE Million gallons 44.3 12.2 32.1 <1 \nPapillion, NE Million gallons 532.3 115.4 416.9 2.8 \nPflugerville,   TX\u2009171 Million gallons 0.1 0.1 0.01 <1 \nPhoenix, AZ \u2009172 Million gallons 0.2 0.2 0.03 <1 \nQuilicura, Chile Million gallons 219.0 97. 2 121.8 <1 \nSan Bernardo, Chile \u2009173 Million gallons 0.3 0.3 0.03 <1 \nSt. Ghislain, Belgium  Million gallons 511.7  118.4  393.3  2.6  \nPotable water  13.7  \nNon-potable water \u2009174 498.0 \nSterling, VA Million gallons 201.2 43.0 158.2 1.1 \nStorey County, NV\u2009175 Million gallons 14.9 13.4 1.5 <1 \nSydney, Australia \u2009176 Million gallons 1.0 0.9 0.1 <1 \nWilmer, TX\u2009177 Million gallons 1.9 1.7 0.2 <1 \nOther data center locations  M illion gallons 828.9  60.0  768.9  5.1  "
    ]
  },
  {
    "question": "What percentage of Scope 3 ambition-based emissions in 2024 came from electricity use across the value chain, and what was the absolute amount of Scope 3 emissions?",
    "ground_truth": "Approximately 60% of these emissions came from electricity use, out of a total scope 3 footprint of 8.4 million tCO2e.",
    "answer": "Approximately 60% of Scope 3 ambition-based emissions in 2024 came from electricity use across the value chain, and the absolute amount of Scope 3 emissions was approximately 8.4 million tCO2e.",
    "contexts": [
      "s came from electricity use across our value chain, so our largest opportunity for reducing scope 3 \n\ns came from electricity use across our value chain, so our largest opportunity for reducing scope 3 \nemissions is in enabling our value chain\u2019s adoption of clean electricity. \nOur approach to this key reduction area is to engage our suppliers to commit to directly procuring clean electricity\u2014or matching their energy use with \nclean energy\u2014for our most carbon-intensive components. The Google Clean Energy Addendum (CEA) asks suppliers to commit to achieving a 100% clean \nelectricity match by the end of 2029 for the electricity they use to manufacture Google products.\n132 By the end of 2024, many key suppliers signed our \nCEA, and we plan to continue driving clean energy progress within our supply chain through our CEA, clean energy investments, and other initiatives. \nWhile our primary focus will remain on engaging our suppliers to reduce their emissions through clean energy procurement, we\u2019ll also continue to explore ",
      "nt that are within the boundaries we\u2019ve set for our climate ambitions. The boundary of our ambition-\n\nnt that are within the boundaries we\u2019ve set for our climate ambitions. The boundary of our ambition-\nbased emissions, and how we measure and report progress, doesn\u2019t affect the completeness of our total emissions inventory, which is presented in our \nEnvironmental metrics data table. \nIn 2024, our total ambition-based emissions were approximately 11.5 million tCO\n2e, which represent our scope 1, scope 2 (market-based), and \nscope 3 (ambition-based) emissions. \nFigure 13. Our 2024 ambition-based carbon footprint \n \nScope \nLegend \nScope 1 \nScope 2 (market-based) \nScope 3 (Category 1: Purchased goods and services) \nScope 3 (Category 2: Capital goods) and \n(Category 11: Use of sold products) \nScope 3 (Category 3: Fuel- and energy-related activities) \nScope 3 (Category 4: Upstream transportation \nand distribution) \nScope 3 (Category 5: Waste generated in operations) \nScope 3 (Category 6: Business travel) \nScope 3 (Category 7: Employee commuting) \nTotal ambition-based emissions \n73,100 ",
      " our scope 1 emissions were approximately 73,100 tCO2e, representing less than 1% of our total 2024 \n\n our scope 1 emissions were approximately 73,100 tCO2e, representing less than 1% of our total 2024 \nambition-based carbon footprint. \nCompared to 2023, we reduced our scope 1 emissions by 8% , primarily due to building efficiencies and warmer weather conditions that resulted in \ndecreases in natural gas, changes to generator utilization that resulted in decreases in diesel and other fuel usage, and improvements to refrigerant data \nquality. Our scope 1 emissions reduction efforts to date have focused on electrification, refrigerant mitigation, and renewable fuel use. \nScope 2 \nThe primary source of our scope 2 emissions is purchased electricity for our data centers and offices. In 2024, our scope 2 (market-based) emissions were \napproximately 3.1 million tCO\n2e, representing 26% of our total 2024 ambition-based carbon footprint. \nCompared to 2023, we reduced our scope 2 (market-based) emissions by 11% , primarily due to clean energy procurement. For scope 2 emissions ",
      "upply chain (i.e., scope 3)\u2014which are further removed from our direct control\u2014are still increasing: \n\nupply chain (i.e., scope 3)\u2014which are further removed from our direct control\u2014are still increasing: \n\u2022  Scope 3: Our ambition-based scope 3 emissions increased by 22% year-on-year in 2024. \nOverall, total emissions have grown in recent years alongside the growth of our business and growing product adoption by users around the world (Figure 15).  \nThe majority of these emissions are indirect, coming from our supply chain. We\u2019re actively working to bend our emissions curve toward our net-zero ambition. \nFigure 15. Our path forward\u2009127 \nReported ambition-based emissions Net emissions \nIllustrative business-as-usual emissions \nIllustrative ambition-based emissions \n2019 2020 2021 2022 2023 2024 2030 \nYear \nIllustrative emissions \nLegend \n12 \n9 \n6 \n3 \n0 \nMillion tCO2 e \n83",
      "Total electricity consumption across our data centers and offices \nGlobal average CFE percentage \n20\n\nCarbon reduction moonshot \nWe aim to reduce absolute, combined scope 1, 2 (market-based), and 3 emissions by 50% from a 2019 base \nyear by 2030. \nAmbition-based carbon footprint \nIn February 2025, the SBTi (Science Based Targets initiative) validated Alphabet\u2019s near-term science-based emissions reduction ambition based on our \ndata, company structure, and activities at that time, ensuring our ambition meets the most rigorous standards for emissions reductions and contributes to \nlimiting climate change.\n118 \nIn 2025, we adjusted the boundary for our carbon reduction and net-zero ambitions to exclude certain scope 3 emissions activities that are peripheral to \nour core operations or where our ability to influence emissions reductions is limited (Figure 13). Accordingly, we use the term \u201cambition-based\u201d to describe \nthe subset of emissions from our total carbon footprint that are within the boundaries we\u2019ve set for our climate ambitions. The boundary of our ambition-",
      " goods) and (Category 11: Use of sold products) \nScope 3 (Category 1: Purchased goods and services) \n\n goods) and (Category 11: Use of sold products) \nScope 3 (Category 1: Purchased goods and services) \nScope 2 (market-based) \nScope 1 \ntCO2e \n292,000 \n1,914,000 \n203,000 \n461,000 \n14,000 \n476,000 \n425,000 \n4,292,000 \n873,000 \n835,900 \n81,900 \nTotal 2019 ambition-based emissions 7,661,800 \nTrend \nIn 2024, our total ambition-based emissions were 11.5 million tCO2e, representing an 11% year-on-year increase and a 51% increase compared to our 2019 \nbase year\u2014primarily driven by increases in supply chain emissions. \nThe year-on-year increase was slightly offset in that we reduced our scope 1 and scope 2 (market-based) emissions by 8% and 11%, respectively\u2014 \ndemonstrating that our operational decarbonization efforts are bearing fruit. This achievement is particularly significant given the 27% increase in our \nelectricity consumption compared to 2023. \nDetails \nScience Based Targets initiative (SBTi) validation: ",
      "5% of the data we use to calculate category 2 emissions are obtained from value \nchain partners. \n99\n\n\u201cCategory 3: Fuel- and energy-related activities (not included in scope 1 or scope 2)\u201d includes upstream emissions from purchased fuels \n(e.g., natural gas, diesel, and gasoline) and purchased energy (i.e., electricity, steam, heating, and cooling), as well as emissions from transmission and \ndistribution losses from purchased energy. We use the average-data method, as defined by the Scope 3 Technical Guidance. We calculate upstream \nemissions from purchased fuel, steam, heating, and cooling, in addition to emissions from transmission and distribution losses from steam, heating, and \ncooling using 2024 DEFRA UK Government GHG Conversion Factors. We calculate emissions from upstream electricity by country using the 2024 IEA \nEmission Factors. We calculate emissions from electricity transmission and distribution losses using grid loss values and emission factors derived from the ",
      " Business travel) \nScope 3 (Category 7: Employee commuting) \nTotal ambition-based emissions \n73,100 \n\n Business travel) \nScope 3 (Category 7: Employee commuting) \nTotal ambition-based emissions \n73,100 \n3,059,100 \n739,000* \n5,561,000* \n714,000 \n853,000 \n12,000 \n399,000 \n137,000 \n11,547,200 \n1% \n26% \n7% \n48% \n6% \n7% \n0.1% \n4% \n1% \n100%\n tCO2e % \n* These totals reflect our ambition-based boundary and therefore exclude certain scope 3 emissions activities. \nThese exclusions collectively account for 25% of our 2019 scope 3 footprint, well within SBTi\u2019s guidelines to \nexclude no more than 33% of base year scope 3 emissions. \nTotal \nambition-based \nemissions: \n11.5M tCO2e \nScope 2 \n(market-based): \n3.1M tCO\n2e \nScope 3 \n(ambition-based): \n8.4M tCO\n2e \nScope 1: \n73.1K tCO\n2e \nScope 1 \nThe primary sources of our scope 1 emissions are natural gas use for building heating, refrigerant leakage, fuel use from backup generators, and \ntransportation from company vehicles. In 2024, our scope 1 emissions were approximately 73,100 tCO2e, representing less than 1% of our total 2024 ",
      "s and scale their climate impact, and advocating for energy policies that can unlock access to cost-\n\ns and scale their climate impact, and advocating for energy policies that can unlock access to cost-\neffective and reliable clean energy. And while we\u2019re prioritizing clean energy procurement, we\u2019re also purchasing T-EACs when local clean energy options \naren\u2019t available. \nClean electricity for our supply chain \nElectricity-related emissions from activities outside our direct operations come from both supplier and non-supplier sources.\u2009131  We use life cycle \nassessments (LCAs) to determine emissions hotspots, enabling us to focus our efforts on the commodities and suppliers where we can drive the largest \ncarbon reduction. \nIn 2024, our total scope 3 (ambition-based) emissions were approximately 8.4 million tCO\n2e, representing 73% of our total 2024 ambition-based carbon \nfootprint. Approximately 60% of these emissions came from electricity use across our value chain, so our largest opportunity for reducing scope 3 ",
      "ased emissions were 66% lower \nthan they would have been without \nclean energy procurement, machine \n\nased emissions were 66% lower \nthan they would have been without \nclean energy procurement, machine \nhardware efficiencies, and PUE \nimprovements\n119 (Figure 14). \nFigure 14. Avoided emissions \n \n \nTotal reported (ambition-based) emissions Scope 2 (market-based) \nScope 1 Scope 3 (ambition-based) \nEmissions \nLegend \nPUE improvements \nClean energy procurement \nMachine hardware efficiencies \nAvoided emissions \nMillion tCO2 e \n2019 2020 2021 2022 2023 2024 \n30 \n20 \n10 \n0 \nYear \n66% \nlower \nCarbon reduction progress \nIn 2024, our total ambition-based emissions were 11.5 million tCO2e, representing a 51% increase compared to 2019. \n\u2022  Operations: Combined scope 1 and scope 2 (market-based) emissions were 3.1 million tCO 2e, representing a 241% increase compared to 2019. \n\u2022  Supply chain: Scope 3 (ambition-based) emissions were 8.4 million tCO 2e, representing a 25% increase compared to 2019. \nGraph \nTotal operational emissions \nTotal scope 3 (ambition-based) \nemissions ",
